Author,Paper Title,Year,Citations,DOI,PMID,Authors,Journal,Altmetric Score,Twitter Mentions,Reddit Mentions,News Mentions,Blog Mentions,Facebook Mentions,Wikipedia Mentions,Policy Mentions,Media Mentioned,Open Access,OA Status,Preprint,Publication Type,Public Health Impact,Capacity Building,Paper Link
Rudith King,Handbook of Macroeconomics: 1A,1999,329,https://doi.org/10.2307/2554644,,Michael Woodford,N/A,0.0,0,0,0,0,0,0,0,False,True,doaj,False,Open Access,False,False,https://doi.org/10.2307/2554644
Rudith King,Land markets and legal contradictions in the peri-urban area of Accra Ghana: Informant interviews and secondary data investigations,1996,140,https://doi.org/10.1080/00420980020080651,,R Kasim Kasanga and Jeffrey A Cochrane and Rudith King and Michael J Roth,N/A,9.0,0,0,0,0,0,0,0,False,True,doaj,False,Open Access,False,False,https://doi.org/10.1080/00420980020080651
Rudith King,"Street vending and the use of urban public space in Kumasi, Ghana",2011,69,https://doi.org/10.53730/ijhs.v6ns8.9667,,Bettie Emefa Solomon-Ayeh and Rudith Sylvana King and Isaac Decardi-Nelson,N/A,0.0,0,0,0,0,0,0,0,False,True,doaj,False,Open Access,False,False,https://doi.org/10.53730/ijhs.v6ns8.9667
Rudith King,"Fulcrum of the urban economy: Governance and street livelihoods in Kumasi, Ghana",2006,61,https://doi.org/10.3362/9781780444703.006,,Rudith King,"Contested space: Street trading, public space, and livelihoods in developing cities",0.0,0,0,0,0,0,0,0,False,True,doaj,False,Open Access,False,False,https://doi.org/10.3362/9781780444703.006
Rudith King,Perception of small-scale miners on interventions to eradicate illegal small-scale mining in Ghana,2020,52,https://doi.org/10.1177/2158244020963668,,Rejoice Selorm Wireko-Gyebi and Michael Osei Asibey and Owusu Amponsah and Rudith Sylvana King and Imoro Braimah and Godfred Darko and Anne Mette Lykke,Sage Open,0.0,0,0,0,0,0,0,0,False,True,doaj,False,Open Access,True,False,https://doi.org/10.1177/2158244020963668
Rudith King,"Understanding the factors for increased informal electronic waste recycling in Kumasi, Ghana",2022,49,https://doi.org/10.1080/09603123.2020.1755016,32393050,Michael Osei Asibey and Anne Mette Lykke and Rudith Sylvana King,International Journal of Environmental Health Research,0.0,0,0,0,0,0,0,0,False,True,doaj,False,Open Access,False,False,https://doi.org/10.1080/09603123.2020.1755016
Rudith King,Mechanical cassava harvesting as influenced by seedbed preparation and cassava variety,2014,39,https://doi.org/10.13031/aea.30.10495,,J. Sarkodie-Addo S. K. Amponsah and E. Y. H. Bobobee and W. A. Agyare and J. B. Okyere and J. Aveyire and S. R. King,Applied Engineering in Agriculture.,0.0,0,0,0,0,0,0,0,False,True,doaj,False,Open Access,False,False,https://doi.org/10.13031/aea.30.10495
Rudith King,Community-based participatory irrigation management at local government level in Ghana,2014,35,https://doi.org/10.5130/cjlg.v0i0.4067,,Braimah Imoro and R.S. King and and D. M. Sulemana,Commonwealth Journal of Local Governance,0.0,0,0,0,0,0,0,0,False,True,doaj,False,Open Access,False,False,https://doi.org/10.5130/cjlg.v0i0.4067
Rudith King,Community-based participatory irrigation management at local government level in Ghana,2014,35,https://doi.org/10.5130/cjlg.v0i0.4067,,Braimah Imoro and R.S. King and and D. M. Sulemana,Commonwealth Journal of Local Governance,0.0,0,0,0,0,0,0,0,False,True,doaj,False,Open Access,False,False,https://doi.org/10.5130/cjlg.v0i0.4067
Rudith King,The role of city authorities in contributing to the development of urban slums in Ghana,2012,35,https://doi.org/10.1016/j.cities.2021.103284,,Rudith.S. King and Owusu Amponsah,Journal of Construction Project Management and Innovation,1.0,1,0,0,0,0,0,0,False,True,doaj,False,Open Access,False,False,https://doi.org/10.1016/j.cities.2021.103284
Rudith King,Reducing the vulnerability of the youth in terms of employment in Ghana through the ICTsector,2006,34,https://doi.org/10.1007/978-3-030-21092-2_9,,Imoro Braimah and Rudith King,International Journal of Education and Development using ICT,0.0,0,0,0,0,0,0,0,False,True,doaj,False,Open Access,False,False,https://doi.org/10.1007/978-3-030-21092-2_9
Rudith King,Indigenous knowledge indicators in determining climate variability in rural Ghana,2020,33,https://doi.org/10.1080/10371656.2020.1758434,39304265,Cyril Sullo and Rudith S King and Gordon Yenglier Yiridomoh and Kizito Doghle,Rural Society,1075.9199999999996,383,0,114,4,1,0,0,True,True,doaj,False,Open Access,False,False,https://doi.org/10.1080/10371656.2020.1758434
Rudith King,Land markets and legal contradictions in the peri-urban area of Accra,1996,29,https://doi.org/10.1080/00420980020080651,,RK Kasanga and J Cochrane and R King and M Roth,"Ghana: Informant interviews and secondary data investigations, Land Tenure Centre Research Paper",9.0,0,0,0,0,0,0,0,False,True,doaj,False,Open Access,False,False,https://doi.org/10.1080/00420980020080651
Rudith King,Urban planning trends on e-waste management in Ghanaian cities,2021,25,https://doi.org/10.1016/j.cities.2020.102943,,Michael Osei Asibey and Rudith Sylvana King and Anne Mette Lykke and Daniel Kweku Baah Inkoom,Cities,0.0,0,0,0,0,0,0,0,False,True,doaj,False,Open Access,False,False,https://doi.org/10.1016/j.cities.2020.102943
Rudith King,Outside theory: an exploration of the links between education and work for Ghanaian market traders,2003,25,https://doi.org/10.1080/1363908022000032876,,Ma´ ire´ ad Dunne and Rudith King,Journal of Education and Work,0.0,0,0,0,0,0,0,0,False,True,doaj,False,Open Access,False,True,https://doi.org/10.1080/1363908022000032876
Rudith King,Implications of compulsory land acquisition and compensation in Ghana: a case study of land acquisition for the Suame-Buoho road reconstruction in Kumasi,2015,22,https://doi.org/10.4314/just.v35i2.10,,R King and DK Sumbo,Journal of Science and Technology (Ghana),0.0,0,0,0,0,0,0,0,False,True,doaj,False,Open Access,False,False,https://doi.org/10.4314/just.v35i2.10
Rudith King,Local knowledge of risks associated with artisanal small-scale mining in Ghana,2022,21,https://doi.org/10.1080/10803548.2020.1795374,32660370,Rejoice Selorm Wireko-Gyebi and Rudith Sylvana King and Imoro Braimah and Anne Mette Lykke,International Journal of Occupational Safety and Ergonomics,0.0,0,0,0,0,0,0,0,False,True,doaj,False,Open Access,False,False,https://doi.org/10.1080/10803548.2020.1795374
Rudith King,Social accountability for local government in Ghana,2013,21,https://doi.org/10.5130/cjlg.v0i13/14.3724,40409763,Imoro Braimah and Amponsah Owusu Rudith S. King,Commonwealth Journal of Local Governance,2.25,6,0,0,0,0,0,0,False,True,doaj,False,Open Access,False,False,https://doi.org/10.5130/cjlg.v0i13/14.3724
Rudith King,Productive Uses of Energy in Enterprises in Slums in Ghana,2012,19,https://doi.org/10.1596/17497,,Mr. David Ato Quansah Dr. Rudith S. King and Owusu Amponsah,International Journal of Social Science Tomorrow,3.0,0,0,0,0,0,0,0,False,True,doaj,False,Open Access,False,False,https://doi.org/10.1596/17497
Rudith King,"The Gender and Equity Implications of Land–related Investments on Land Access, Labour and Income-Generating Opportunities in Northern Ghana: The Case Study of Integrated Tamale Fruit Company",2013,18,https://doi.org/10.47963/joss.v4i4.578,,Rudith King and John Bugri,The Case Study of Integrated Tamale Fruit Company. FAO,0.0,0,0,0,0,0,0,0,False,True,doaj,False,Open Access,False,False,https://doi.org/10.47963/joss.v4i4.578
Rudith King,Working in a risky environment: coping and risk handling strategies among small-scale miners in Ghana,2022,15,https://doi.org/10.1016/j.shaw.2022.02.004,,Rejoice Selorm Wireko-Gyebi and Albert Abraham Arhin and Imoro Braimah and Rudith Sylvana King and Anne Mette Lykke,Safety and health at work,0.0,0,0,0,0,0,0,0,False,True,doaj,False,Open Access,False,False,https://doi.org/10.1016/j.shaw.2022.02.004
Rudith King,Productive externality and cyclical volatility,1992,15,https://doi.org/10.2139/ssrn.2376794,,M Baxter and R King,W orking paper,0.0,0,0,0,0,0,0,0,False,True,doaj,False,Open Access,False,False,https://doi.org/10.2139/ssrn.2376794
Rudith King,Influencing policy: urban market women and the Kumasi central market,2000,14,https://doi.org/10.15396/eres2017_510,,Rudith King and Aba Oppong,Demanding Our Dignity: Women Confronting Economic Reforms in Africa,3.0,0,0,0,0,0,1,0,True,True,doaj,False,Open Access,False,False,https://doi.org/10.15396/eres2017_510
Rudith King,Next steps for Aboriginal health research: exploring how research can improve the health and wellbeing of Aboriginal people in South Australia,2015,13,https://doi.org/10.1111/j.1753-6405.1992.tb00037.x,,R King and A Brown,Adelaide: Aboriginal Health Council of South Australia,0.0,0,0,0,0,0,0,0,False,True,doaj,False,Open Access,False,False,https://doi.org/10.1111/j.1753-6405.1992.tb00037.x
Rudith King,Baseline study of oil and gas communities in Ghana,2010,12,https://doi.org/10.1111/j.1467-6346.2010.03635.x,24966338,R King,Network for Women’s Rights in Ghana (NETRIGHT),0.0,0,0,0,0,0,0,0,False,True,doaj,False,Open Access,False,False,https://doi.org/10.1111/j.1467-6346.2010.03635.x
Rudith King,Additional knowledge of livelihoods in the Kumasi Peri-urban interface (KPUI),2005,12,https://doi.org/10.1016/j.cities.2022.103570,,E Aberra and R King,Ashanti Region,3.0,0,0,0,0,0,0,0,False,True,doaj,False,Open Access,False,False,https://doi.org/10.1016/j.cities.2022.103570
Rudith King,Legal establishments and gendered access to land in patriarchal societies of north-western Ghana,2018,11,https://doi.org/10.1177/23210249241237033,,Kizito Doghle and Rudith Sylvana King and Paul Bniface Akaabre,African Journal of Land Policy and Geospatial Sciences,0.0,0,0,0,0,0,0,0,False,True,doaj,False,Open Access,False,False,https://doi.org/10.1177/23210249241237033
Rudith King,Assessment and awareness of health risks posed by mercury in artisanal gold mining in the Ashanti Region of Ghana,2022,10,https://doi.org/10.1007/s42250-022-00453-x,,Opoku Gyamfi and Rejoice Selorm Wireko-Gyebi and Eugene Ansah and Peter Borgen Sorenson and Rudith Sylvana King and Marian Asantewah Nkansah and Jesper Leth Bak and Godfred Darko,Chemistry Africa,0.0,0,0,0,0,0,0,0,False,True,doaj,False,Open Access,True,False,https://doi.org/10.1007/s42250-022-00453-x
Rudith King,"Additional knowledge of livelihoods in the Kumasi peri-urban interface, Ashanti Region, Ghana",2005,10,https://doi.org/10.47175/rielsj.v4i4.854,,E Aberra and R King,"A project report (Boafo Ye Na project) for Development Planning Unit (DPU), University College London, UK",0.0,0,0,0,0,0,0,0,False,True,doaj,False,Open Access,False,False,https://doi.org/10.47175/rielsj.v4i4.854
Rudith King,Effects of cyclic steroid hormone replacement on prolactin and luteinizing hormone surges in female rats,2004,10,https://doi.org/10.1530/rep.1.00017,19421890,AM Brown and JM Janik and ES Murphree and R King and P Callahan,Reproduction,0.0,0,0,0,0,0,0,0,False,True,doaj,False,Open Access,False,False,https://doi.org/10.1530/rep.1.00017
Rudith King,Urban governance in Kumasi: poverty and exclusion,2001,10,https://doi.org/10.1177/095624780001200109,,Rudith S King and Dan Inkoom and Kodjo Mensah Abrampah,N/A,6.0,0,0,0,0,0,2,0,True,True,doaj,False,Open Access,False,False,https://doi.org/10.1177/095624780001200109
Rudith King,"Additional knowledge of livelihoods in the Kumasi peri-urban interface (KPUI), Ashanti Region, Ghana, Development Planning Unit, and University College London",2005,9,https://doi.org/10.47175/rielsj.v4i4.854,,E Aberra and R King,Accra: Yamens Press Limited,0.0,0,0,0,0,0,0,0,False,True,doaj,False,Open Access,False,False,https://doi.org/10.47175/rielsj.v4i4.854
Rudith King,"Policy, technology adoption, and growth (No. w4681)",1994,9,https://doi.org/10.3386/w4681,40450091,W Easterly and R King and R Levine and S Rebelo,N/A,0.0,0,0,0,0,0,0,0,False,True,doaj,False,Open Access,False,False,https://doi.org/10.3386/w4681
Rudith King,ʺNew classical macroeconomicsʺ,1993,9,https://doi.org/10.2307/j.ctv80c9p7.19,36264463,Robert King,The concise encyclopedia of economics,0.0,0,0,0,0,0,0,0,False,True,doaj,False,Open Access,False,False,https://doi.org/10.2307/j.ctv80c9p7.19
Rudith King,Workers perception of and coping with the health risks of informal electronic waste recycling in Ghana,2023,8,https://doi.org/10.1080/13549839.2022.2145601,,Michael Osei Asibey and Rudith Sylvana King and Anne Mette Lykke and Daniel KB Inkoom and Godfred Darko,Local Environment,0.0,0,0,0,0,0,0,0,False,True,doaj,False,Open Access,False,False,https://doi.org/10.1080/13549839.2022.2145601
Rudith King,"Additional knowledge of livelihoods in the Kumasi peri-urban interface (KPUI), Ashanti Region, Ghana",2005,8,https://doi.org/10.47175/rielsj.v4i4.854,,E Aberra and R King,Development Planning Unit,0.0,0,0,0,0,0,0,0,False,True,doaj,False,Open Access,False,False,https://doi.org/10.47175/rielsj.v4i4.854
Rudith King,Performance evaluation of prototype mechanical cassava harvester in three agro-ecological zones in Ghana,2014,7,https://doi.org/10.1101/2024.06.05.597564,,EYH Bobobee and JB Okyere and WA Agyare and SK Amponsah and SR King and J Aveyire and J Sarkodie_Addo,Ghana Journal of Agricultural Science,0.75,3,0,0,0,0,0,0,False,True,doaj,False,Open Access,False,False,https://doi.org/10.1101/2024.06.05.597564
Rudith King,Who can help the peri-urban poor,2005,7,https://doi.org/10.3362/0957-1329.2004.021,35647569,K Ashong and BF Adjei and EO Ansah and R Naaso and RS King and E Kunfa and JS Quashie Sam and D Simon,N/A,0.5,1,0,0,0,0,0,0,False,True,doaj,False,Open Access,False,False,https://doi.org/10.3362/0957-1329.2004.021
Rudith King,Tracking of the district assemblies common fund: A pilot study of four district assemblies,2003,7,https://doi.org/10.1080/13597569508420940,,Rudith King and Vitus A Azeem and Charles Abbey and Samuel Kwaku Boateng and Donkris Mevuta,Retrieved March,0.0,0,0,0,0,0,0,0,False,True,doaj,False,Open Access,False,False,https://doi.org/10.1080/13597569508420940
Rudith King,"Street vending and the use of urban public space in Kumasi, Ghana",2011,6,https://doi.org/10.53730/ijhs.v6ns8.9667,,Bettie Emefa Ayeh Solomon and Rudith Sylvana King and Isaac Decardi Nelson,The Ghana Surveyor (Journal of the Ghana Institution of Surveyors),0.0,0,0,0,0,0,0,0,False,True,doaj,False,Open Access,False,False,https://doi.org/10.53730/ijhs.v6ns8.9667
Rudith King,"Resuscitating Real Business Cycle, Handbook of Macroeconomics,(Woodford, M., and Taylor, J., Eds.), Vol. IB",2000,6,https://doi.org/10.3386/w7534,,R King and S Rebelo,N/A,1.0,1,0,0,0,0,0,0,False,True,doaj,False,Open Access,False,False,https://doi.org/10.3386/w7534
Rudith King,Political Economy Analysis of how Corruption affects Climate Change Adaptation and Mitigation. A Case Study of the Forest and Land Use Sectors of Ghana,2022,5,https://doi.org/10.3390/land7040158,,Patrick Opoku and Henry Mensah and Dorcas Peggy Somuah and Dorothy Asabea Opoku and Rudith King,African Journal of Land Policy and Geospatial Sciences,0.25,1,0,0,0,0,0,0,False,True,doaj,False,Open Access,False,False,https://doi.org/10.3390/land7040158
Rudith King,Formalising the informal sector through association: The case of Kumasi informal Baker's association,2015,5,https://doi.org/10.5539/jsd.v8n2p46,,Imoro Braimah2 & Alison Brown3 Rudith S. King1,Journal of Sustainable Development,0.0,0,0,0,0,0,0,0,False,True,doaj,False,Open Access,False,False,https://doi.org/10.5539/jsd.v8n2p46
Rudith King,Financing Decentralized Development: How Well Does District Assemblies Common Fund Work,2003,5,https://doi.org/10.1080/13597569508420940,,SK Boateng and R King and V Azeem and C Abbey and D Mevuta,"ISODEC, Accra Ghana",0.0,0,0,0,0,0,0,0,False,True,doaj,False,Open Access,False,False,https://doi.org/10.1080/13597569508420940
Rudith King,"Financing decentralized development, how well does the DACF work? A pilot tracking of the DACF in four districts",2003,5,https://doi.org/10.1145/3538637.3538849,,R King and VA Azeem and C Abbey and SK Boateng and D Mevuta,"DC: World Bank, Washington",0.0,0,0,0,0,0,0,0,False,True,doaj,False,Open Access,False,False,https://doi.org/10.1145/3538637.3538849
Rudith King,"Urban governance, partnerships and poverty: Case study of Kumasi",2001,5,https://doi.org/10.1177/095624780001200109,,R King and D Inkoom and KM Abrampah,"Unpublished Report. Department of Planning, KNUST",6.0,0,0,0,0,0,2,0,True,True,doaj,False,Open Access,False,False,https://doi.org/10.1177/095624780001200109
Rudith King,"The new neoclassical synthesis and the role of monetary policy, in ‘NBER Macroeconomics Annual 1997, Volume 12’",1997,5,https://doi.org/10.1086/654318,,M Goodfriend and R King,N/A,3.0,0,0,0,0,0,0,0,False,True,doaj,False,Open Access,False,False,https://doi.org/10.1086/654318
Rudith King,"Handbook of Macroeconomics, Volume 1B, chapter 14",1999,4,https://doi.org/10.1111/b.9780631215585.1999.00002.x,,R King and S Rebelo,North0Holland: Amsterdam,0.0,0,0,0,0,0,0,0,False,True,doaj,False,Open Access,False,False,https://doi.org/10.1111/b.9780631215585.1999.00002.x
Rudith King,"Factors influencing the weaving and use of kente cloth: the case of Bonwire, Ghana",2024,3,https://doi.org/10.1108/rjta-02-2022-0014,,Rudith Sylvan King and Eric Kwame Simpeh and Henry Mensah and Elfreda Nerquaye-Tetteh,Research Journal of Textile and Apparel,0.0,0,0,0,0,0,0,0,False,True,doaj,False,Open Access,False,False,https://doi.org/10.1108/rjta-02-2022-0014
Rudith King,Findings of Street Vendors Study in Kumasi and Policy Implications,2005,3,https://doi.org/10.2991/icas-17.2017.59,,Rudith King,"Kwame Nkrumah University of Science and Technology, Kumasi, Ghana",0.0,0,0,0,0,0,0,0,False,True,doaj,False,Open Access,False,False,https://doi.org/10.2991/icas-17.2017.59
Rudith King,Youth and employment in Ghana,2005,3,https://doi.org/10.1596/26046,40448195,R King and I Braimah,"A study commissioned by World Bank, Accra, Ghana",0.0,0,0,0,0,0,0,0,False,True,doaj,False,Open Access,False,False,https://doi.org/10.1596/26046
Rudith King,"Women, children, water/sanitation development.",1994,3,https://doi.org/10.1080/02508069108686111,40018254,Rudith S King and Romanus Dinye,N/A,3.0,0,0,0,0,0,0,0,False,True,doaj,False,Open Access,False,False,https://doi.org/10.1080/02508069108686111
Rudith King,Informal electronic waste recycling in Ghanaian cities: Environmental risks awareness and attitudes,2022,2,https://doi.org/10.1007/s43545-022-00419-3,,Michael Osei Asibey and Rudith Sylvana King and Anne Mette Lykke and Daniel KB Inkoom and Rejoice Selorm Wireko-Gyebi,SN Social Sciences,0.0,0,0,0,0,0,0,0,False,True,doaj,False,Open Access,True,False,https://doi.org/10.1007/s43545-022-00419-3
Rudith King,"Weathering the storm: Reflections on a community-based approach to flood-risk management in Kumasi, Ghana",2020,2,https://doi.org/10.2495/safe-v6-n3-538-549/009,,Divine Ahadzie and Irene-Nora Dinye and Rudith Sylvana King,N/A,0.0,0,0,0,0,0,0,0,False,True,doaj,False,Open Access,False,False,https://doi.org/10.2495/safe-v6-n3-538-549/009
Rudith King,The contribution of slums to commercial electricity transmission losses in Ghana,2012,2,https://doi.org/10.37745/ijdee.13/vol11n37289,,R King and O Amponsah and A Nyamekye,1st Applied Research Conference in Africa (ARCA) Conference,0.0,0,0,0,0,0,0,0,False,True,doaj,False,Open Access,False,False,https://doi.org/10.37745/ijdee.13/vol11n37289
Rudith King,Energy Access and Productive Uses for thr Urban Poor,2011,2,https://doi.org/10.1596/17497,,A Brew-Hammond and FO Akuffo and R King and A Quansah and SO Dapaah and O Amponsah and D Eshun and A Antobere,"Energy Sector Management Assistance Program (ESMAP), The World Bank",3.0,0,0,0,0,0,0,0,False,True,doaj,False,Open Access,False,False,https://doi.org/10.1596/17497
Rudith King,Operational and locational characteristics of street vending in Kumasi Metropolis (Ghana),2010,2,https://doi.org/10.4314/jast.v15i1-2.54846,,BE Solomon-Ayeh and RS King and I Decardi-Nelson,Journal of Applied Science and Technology,0.0,0,0,0,0,0,0,0,False,True,doaj,False,Open Access,False,False,https://doi.org/10.4314/jast.v15i1-2.54846
Rudith King,Building resilience through community-based flood risk management: pathway and reflections,2023,1,https://doi.org/10.1201/9781003315247-14,,Irene-Nora Dinye and Henry Mensah and Eric Kwame Simpeh and Rudith Sylvana King,N/A,0.0,0,0,0,0,0,0,0,False,True,doaj,False,Open Access,False,False,https://doi.org/10.1201/9781003315247-14
Rudith King,THE EVOLVING PARADIGM OF COMMUNITY MINING SCHEMES IN GHANA: PROSPECTS AND LESSONS FOR OTHER MINING JURISDICTIONS IN AFRICA,2025,0,https://doi.org/10.1017/9781108349031.008,,Simon Victory Quarcson Hamenoo and Theresa Y Baah-Ennumh and Rudith S King,African Journal on Land Policy and Geospatial Sciences,0.0,0,0,0,0,0,0,0,False,True,doaj,False,Open Access,False,False,https://doi.org/10.1017/9781108349031.008
Rudith King,Technology-mediated flood risk management tools: A review of smart and mobile applications,2023,0,https://doi.org/10.1201/9781003315247-19,,Eric K Simpeh and Henry Mensah and Rudith S King and John J Smallwood and Athenkosi Sogaxa,N/A,0.0,0,0,0,0,0,0,0,False,True,doaj,False,Open Access,False,False,https://doi.org/10.1201/9781003315247-19
Rudith King,Technology-mediated flood risk management tools,2023,0,https://doi.org/10.1201/9781003315247-19,,Eric K Simpeh and Henry Mensah and Rudith S King and John J Smallwood and Athenkosi Sogaxa,Handbook of Flood Risk Management and Community Action: An International Perspective,0.0,0,0,0,0,0,0,0,False,True,doaj,False,Open Access,False,False,https://doi.org/10.1201/9781003315247-19
Rudith King,Exploring Kente weaving industry to drive smart community development in Ghana,2023,0,https://doi.org/10.1007/s43545-023-00793-6,,Rudith Sylvan King and Henry Mensah and Eric Kwame Simpeh and Elfreda Nerquaye-Tetteh,SN Social Sciences,0.0,0,0,0,0,0,0,0,False,True,doaj,False,Open Access,False,False,https://doi.org/10.1007/s43545-023-00793-6
Rudith King,PROJECT TEAM,2023,0,https://doi.org/10.2307/j.ctv1zcm2kk.6,37850534,Abeeku Brew Hammond and Fred Ohene Akuffo and Rudith King and Mr Ato Quansah and Seth Ohemeng Dapaah and Mr Owusu Amponsah and Mr Dominic Eshun and Mr Alex Antobere,N/A,2.35,4,0,0,0,0,0,0,False,True,doaj,False,Open Access,False,False,https://doi.org/10.2307/j.ctv1zcm2kk.6
Rudith King,The effect of agricultural research fund availability on agriculture: the case of savanna agricultural research institute (sari).,2023,0,https://doi.org/10.1126/science.116.3003.3.s,,Asana Amadu,N/A,0.0,0,0,0,0,0,0,0,False,True,doaj,False,Open Access,False,False,https://doi.org/10.1126/science.116.3003.3.s
Rudith King,POLITICAL ECONOMY ANALYSIS OF HOW CORRPTION AFFECTS CLIMATE CHANGE ADAP1AHUN AND MUIGAUUN: A Case Study of the Forest and Land Governance Sectors of Ghana.,2022,0,https://doi.org/10.4324/9781315621579-11,,Patrick Opoku and Henry Mensah and Dorcas Peggy Somuah and Dorothy Opoku and Rudith King,African Journal on Land Policy & Geospatial Sciences,0.0,0,0,0,0,0,0,0,False,True,doaj,False,Open Access,False,False,https://doi.org/10.4324/9781315621579-11
Rudith King,Adaptation as a Means to an End: Conceptual Underpinnings and Empirical Affirmations,2022,0,https://doi.org/10.1093/law/9780198748434.003.0011,,Winfred Abdulai Nelson and Clifford Amoako and Rudith King and Philip Antwi-Agyei and Samuel Kwofie,American Journal of Environmental Science and Engineering,0.0,0,0,0,0,0,0,0,False,True,doaj,False,Open Access,False,False,https://doi.org/10.1093/law/9780198748434.003.0011
Rudith King,Reading Difficulty Dynamics and Interventions Within Community Schools in Ghana; Evidence From Banka Community Senior High School Using the OARP Protocol,2021,0,https://doi.org/10.21203/rs.3.rs-1106757/v1,,Simon Victory Quarcson Hamenoo and Rudith King and Theresa Yaaba Baah-Ennumh and Jennifer Dokbila Mengba and Stephen Boadi Gyamfi,N/A,0.0,0,0,0,0,0,0,0,False,True,doaj,False,Open Access,True,False,https://doi.org/10.21203/rs.3.rs-1106757/v1
Rudith King,Legal establishment and gendered access to Land in patriarchal societies of north-western Ghana,2018,0,https://doi.org/10.1177/23210249241237033,,Kizito Kizito Doghle and Rudith Sylvana King and Paul Bniface Akaabre,N/A,0.0,0,0,0,0,0,0,0,False,True,doaj,False,Open Access,False,False,https://doi.org/10.1177/23210249241237033
Rudith King,Towards developing a community based resilience conceptual framework for flood risk management in Ghana.,2017,0,https://doi.org/10.4337/9781800887909.00017,,RD Dinye and I Dinye and RS King and DK Ahadzie,N/A,0.0,0,0,0,0,0,0,0,False,True,doaj,False,Open Access,False,False,https://doi.org/10.4337/9781800887909.00017
Rudith King,Community-Based Approach in Managing Artisanal Small Scale Gold Mining in Developing Countries.,2017,0,https://doi.org/10.1016/0148-9062(92)92065-k,,DK Ahadzie and RS King and RS Wireko-Gyebia,N/A,0.0,0,0,0,0,0,0,0,False,True,doaj,False,Open Access,False,False,https://doi.org/10.1016/0148-9062(92)92065-k
Rudith King,Local knowledge and response to the risks of heavy metal and xenobiotic pollution at informal e-waste sites in Ghana–A theoretical evaluation.,2017,0,https://doi.org/10.5772/intechopen.112397,,DK Ahadzie and RS King and MO Asibey,N/A,0.0,0,0,0,0,0,0,0,False,True,doaj,False,Open Access,False,False,https://doi.org/10.5772/intechopen.112397
Rudith King,Implication of compulsory land acquisition and compensation in Ghana: A case study of land acquisition for the Suame-Buoho road reconstruction in Kumasi,2015,0,https://doi.org/10.4314/just.v35i2.10,,Rudith King and Dennis Kamaanaa Sumbo,"Journal of Science and Technology, KNUST-Kumasi,",0.0,0,0,0,0,0,0,0,False,True,doaj,False,Open Access,False,False,https://doi.org/10.4314/just.v35i2.10
