Author,Paper Title,Year,Citations,DOI,PMID,Authors,Journal,Altmetric Score,Twitter Mentions,Reddit Mentions,News Mentions,Blog Mentions,Facebook Mentions,Wikipedia Mentions,Policy Mentions,Media Mentioned,Open Access,OA Status,Preprint,Publication Type,Public Health Impact,Capacity Building,Paper Link
Rudith King,Formalising the Informal Sector through Association: The Case of Kumasi Informal Bakers’ Association,2014,0,https://doi.org/10.5539/jsd.v8n2p46,,Rudith Sylvana King and Alison Brown Imoro Braimah,N/A,0.0,0,0,0,0,0,0,0,False,True,doaj,False,Open Access,False,False,https://doi.org/10.5539/jsd.v8n2p46
Rudith King,Productive Uses of Energy in Enterprises in Slums in Ghana,2012,0,https://doi.org/10.1596/17497,,Rudith Sylvana King and Owusu Amponsah and David Ato Quansah,N/A,3.0,0,0,0,0,0,0,0,False,True,doaj,False,Open Access,False,False,https://doi.org/10.1596/17497
Rudith King,Capacity building in science technology and innovation (STI) policy for sustainable development in West Africa-the role of women engineers and scientists,2011,0,https://doi.org/10.1007/978-3-319-71057-0_59-1,,Peggy Oti-Boateng and Rudith King and George Essegbey,N/A,0.0,0,0,0,0,0,0,0,False,True,doaj,False,Open Access,False,True,https://doi.org/10.1007/978-3-319-71057-0_59-1
Rudith King,Contribution of New Entrants in the Middle and Upper Income Groups to Community Development in the Kumasi Peri-Urban Interface,2005,0,https://doi.org/10.1016/j.cities.2022.103570,,SJ Quashie-Sam and JA Awudza and Rudith Sylvana King and E Kunfaa,N/A,3.0,0,0,0,0,0,0,0,False,True,doaj,False,Open Access,False,False,https://doi.org/10.1016/j.cities.2022.103570
Rudith King,Tracking study of R7515 and R7516 products-Use of Knowledge in the forest agriculture interface in Ghana,2004,0,https://doi.org/10.2993/0278-0771-38.2.205,,Rudith Sylvana King and Emma Crewe,N/A,1.0,2,0,0,0,0,0,0,False,True,doaj,False,Open Access,False,False,https://doi.org/10.2993/0278-0771-38.2.205
Rudith King,Tracking the use of project research products: R7515 and R7516-Use of Knowledge in the forest agriculture interface in Ghana.,2004,0,https://doi.org/10.2307/212600,,E Crewe and R King,N/A,0.0,0,0,0,0,0,0,0,False,True,doaj,False,Open Access,False,False,https://doi.org/10.2307/212600
Rudith King,Role of Community Level Facilitators and other Stakeholders in the Formulation and Implementation of Natural Resource Management Plans,2004,0,https://doi.org/10.1002/9781118506196.ch4,,JAM Awudza and JS Quashie-Sam and Rudith Sylvana King,N/A,0.0,0,0,0,0,0,0,0,False,True,doaj,False,Open Access,False,False,https://doi.org/10.1002/9781118506196.ch4
Rudith King,"Play It Again: Reusing software code isn't a new idea, but asset-management tools from vendors such as Flashline and Logic Library may help companies respond more quickly to opportunities",2002,0,https://doi.org/10.1016/j.jen.2009.06.009,,R King,INFORMATION WEEK-MANHASSET-,0.0,0,0,0,0,0,0,0,False,True,doaj,False,Open Access,False,False,https://doi.org/10.1016/j.jen.2009.06.009
Rudith King,Poverty: The Case Of Kumasi,2002,0,https://doi.org/10.1177/095624780001200109,34972184,Rudith S King,Poverty Reduction Through Good Governance: The Experience of Ghana,6.0,0,0,0,0,0,2,0,True,True,doaj,False,Open Access,False,False,https://doi.org/10.1177/095624780001200109
Rudith King,Utility deregulation spurs competition,1996,0,https://doi.org/10.4135/cqresrre20000114,,R King,Plastics News(Detroit)(USA),0.0,0,0,0,0,0,0,0,False,True,doaj,False,Open Access,False,False,https://doi.org/10.4135/cqresrre20000114
Rudith King,An appraisal of resettlement schemes south of the Afram Plains: case studies of Amate and Mpaem,1988,0,https://doi.org/10.5897/ajest2019.2781,,Sylvana Rudith King,N/A,0.0,0,0,0,0,0,0,0,False,True,doaj,False,Open Access,False,False,https://doi.org/10.5897/ajest2019.2781
Rudith King,Resource Development Handbook for Kumasi District Council Area,1987,0,https://doi.org/10.1177/0019556119660323,,Romanus D Dinye and Joseph Edusei and Rudith S King,N/A,0.0,0,0,0,0,0,0,0,False,True,doaj,False,Open Access,False,False,https://doi.org/10.1177/0019556119660323
Rudith King,FABRICATION OF WCAP-4 IN-PILE LOOP IRRADIATION TEST ASSEMBLIES,1959,0,https://doi.org/10.1016/j.anucene.2021.108925,,R Schettig and R King,N/A,0.0,0,0,0,0,0,0,0,False,True,doaj,False,Open Access,False,False,https://doi.org/10.1016/j.anucene.2021.108925
Rudith King,"Baldwin, R., and P. Krugman,"" Persistent Trade Effects of Large Exchange Rate Shocks"", Working Paper No. 2167, National Bureau of Economic Research, Cambridge, Ma.(1986). Barrell, R., and S. Wren-Lewis,"" Equilibrium Exchange Rates for the G7,"" Discussion Paper No. 323, Centre for Economic Policy Research, London",N/A,0,https://doi.org/10.2307/2937860,,R King and S Rebelo,N/A,30.0,0,0,0,0,0,0,0,False,True,doaj,False,Open Access,False,False,https://doi.org/10.2307/2937860
Rudith King,"6 th International Conference on Infrastructure Development in Africa (ICIDA, 2017) Community-Based Approach in Managing Artisanal Small Scale Gold Mining in Developing Countries",N/A,0,https://doi.org/10.1002/9781394230013.ch8,,RS Wireko-Gyebi and RS King and DK Ahadzie,N/A,0.0,0,0,0,0,0,0,0,False,True,doaj,False,Open Access,False,False,https://doi.org/10.1002/9781394230013.ch8
Rudith King,Influer sur les politiques: les marchandes urbaines et le marché central de Kumasi,N/A,0,https://doi.org/10.3917/aprp.003.0032,,Rudith King and Aba Oppong,N/A,0.0,0,0,0,0,0,0,0,False,True,doaj,False,Open Access,False,False,https://doi.org/10.3917/aprp.003.0032
