Author,Paper Title,Year,Citations,DOI,PMID,Authors,Journal,Altmetric Score,Twitter Mentions,Reddit Mentions,News Mentions,Blog Mentions,Facebook Mentions,Wikipedia Mentions,Policy Mentions,Media Mentioned,Open Access,OA Status,Preprint,Publication Type,Public Health Impact,Capacity Building,Paper Link
Tseren-Onolt Ishdorj,Spiking neural P systems with extended rules: universality and languages,2008,166,https://doi.org/10.1007/s11047-006-9024-6,,Haiming Chen and Mihai Ionescu and Tseren-Onolt Ishdorj and Andrei Păun and Gheorghe Păun and Mario J Pérez-Jiménez,Natural Computing,0.0,0,0,0,0,0,0,0,False,True,doaj,False,Open Access,False,False,https://doi.org/10.1007/s11047-006-9024-6
Tseren-Onolt Ishdorj,Deterministic solutions to QSAT and Q3SAT by spiking neural P systems with pre-computed resources,2010,161,https://doi.org/10.1016/j.tcs.2010.01.019,,Tseren-Onolt Ishdorj and Alberto Leporati and Linqiang Pan and Xiangxiang Zeng and Xingyi Zhang,Theoretical Computer Science,3.0,0,0,0,0,0,0,0,False,True,doaj,False,Open Access,False,False,https://doi.org/10.1016/j.tcs.2010.01.019
Tseren-Onolt Ishdorj,P Systems with Active Membranes and Separation Rules.,2004,123,https://doi.org/10.1007/s00500-004-0399-y,40321947,Linqiang Pan and Tseren-Onolt Ishdorj,J. Univers. Comput. Sci.,0.0,0,0,0,0,0,0,0,False,True,doaj,False,Open Access,False,False,https://doi.org/10.1007/s00500-004-0399-y
Tseren-Onolt Ishdorj,Membrane operations in P systems with active membranes,2004,55,https://doi.org/10.17345/triangle6.19-28,,Artiom Alhazov and Tseren-Onolt Ishdorj,Proc. Second Brainstorming Week on Membrane Computing. TR,0.0,0,0,0,0,0,0,0,False,True,doaj,False,Open Access,False,False,https://doi.org/10.17345/triangle6.19-28
Tseren-Onolt Ishdorj,Uniform solutions to SAT and 3-SAT by spiking neural P systems with pre-computed resources,2008,51,https://doi.org/10.1007/s11047-008-9081-0,,Tseren-Onolt Ishdorj and Alberto Leporati,Natural Computing,0.0,0,0,0,0,0,0,0,False,True,doaj,False,Open Access,False,False,https://doi.org/10.1007/s11047-008-9081-0
Tseren-Onolt Ishdorj,Development of surface-enhanced Raman scattering (SERS)-based surface-corrugated nanopillars for biomolecular detection of colorectal cancer,2020,44,https://doi.org/10.3390/bios10110163,33142781,Kuan-Hung Chen and Meng-Ju Pan and Zoljargal Jargalsaikhan and Tseren-Onolt Ishdorj and Fan-Gang Tseng,Biosensors,2.45,4,0,0,0,0,0,0,False,True,doaj,False,Open Access,False,False,https://doi.org/10.3390/bios10110163
Tseren-Onolt Ishdorj,Computing along the axon,2006,33,https://doi.org/10.1080/10020070708541018,40438624,Haiming Chen and Tseren-Onolt Ishdorj and Gheorghe Paun,BIC-TA 2006,0.0,0,0,0,0,0,0,0,False,True,doaj,False,Open Access,False,False,https://doi.org/10.1080/10020070708541018
Tseren-Onolt Ishdorj,"Membrane Computing: 21st International Conference, CMC 2020, Virtual Event, September 14–18, 2020, Revised Selected Papers",2021,30,https://doi.org/10.1097/01.olq.0000697396.10544.2e,,Rudolf Freund and Tseren-Onolt Ishdorj and Grzegorz Rozenberg and Arto Salomaa and Claudio Zandron,N/A,0.0,0,0,0,0,0,0,0,False,True,doaj,False,Open Access,False,False,https://doi.org/10.1097/01.olq.0000697396.10544.2e
Tseren-Onolt Ishdorj,Implementation of RSA cryptographic algorithm using SN P systems based on HP/LP neurons,2021,28,https://doi.org/10.1007/s41965-021-00073-3,,Ganbat Ganbaatar and Dugar Nyamdorj and Gordon Cichon and Tseren-Onolt Ishdorj,N/A,0.0,0,0,0,0,0,0,0,False,True,doaj,False,Open Access,False,False,https://doi.org/10.1007/s41965-021-00073-3
Tseren-Onolt Ishdorj,An error-tolerant serial binary full-adder via a spiking neural P system using HP/LP basic neurons,2020,25,https://doi.org/10.1007/s41965-020-00033-3,,Otgonnaran Ochirbat and Tseren-Onolt Ishdorj and Gordon Cichon,Journal of Membrane Computing,0.0,0,0,0,0,0,0,0,False,True,doaj,False,Open Access,False,False,https://doi.org/10.1007/s41965-020-00033-3
Tseren-Onolt Ishdorj,A 3D-ACEK/SERS system for highly efficient and selectable electrokinetic bacteria concentration/detection/antibiotic-susceptibility-test on whole blood,2022,24,https://doi.org/10.1016/j.bios.2021.113740,34785491,Kuan-Hung Chen and Shih-Han Lee and Li-Ching Kok and Tseren-Onolt Ishdorj and Hwan-You Chang and Fan-Gang Tseng,Biosensors and Bioelectronics,3.0,0,0,0,0,0,0,0,False,True,doaj,False,Open Access,False,False,https://doi.org/10.1016/j.bios.2021.113740
Tseren-Onolt Ishdorj,Handling languages with spiking neural P systems with extended rules,2006,24,https://doi.org/10.1007/s11047-006-9024-6,,Haiming Chen and Tseren-Onolt Ishdorj and Gheorghe Paun and Mario J Pérez-Jiménez,Romanian J. Information Sci. and Technology,0.0,0,0,0,0,0,0,0,False,True,doaj,False,Open Access,False,False,https://doi.org/10.1007/s11047-006-9024-6
Tseren-Onolt Ishdorj,Replicative–distribution rules in P systems with active membranes,2004,19,https://doi.org/10.1007/978-3-540-31862-0_7,,Tseren-Onolt Ishdorj and Mihai Ionescu,N/A,0.0,0,0,0,0,0,0,0,False,True,doaj,False,Open Access,False,False,https://doi.org/10.1007/978-3-540-31862-0_7
Tseren-Onolt Ishdorj,Inhibiting/de-inhibiting rules in P systems,2004,19,https://doi.org/10.1007/978-3-540-31837-8_13,,Matteo Cavaliere and Mihai Ionescu and Tseren-Onolt Ishdorj,N/A,0.0,0,0,0,0,0,0,0,False,True,doaj,False,Open Access,False,False,https://doi.org/10.1007/978-3-540-31837-8_13
Tseren-Onolt Ishdorj,Solving NP-complete problems by spiking neural P systems with budding rules,2009,16,https://doi.org/10.1007/978-3-642-11467-0_24,,Tseren-Onolt Ishdorj and Alberto Leporati and Linqiang Pan and Jun Wang,N/A,0.0,0,0,0,0,0,0,0,False,True,doaj,False,Open Access,False,False,https://doi.org/10.1007/978-3-642-11467-0_24
Tseren-Onolt Ishdorj,A μ-fluidic Biochip Design for Spiking Neural P Systems.,2020,15,https://doi.org/10.1007/978-981-97-9282-5_5,,Tseren-Onolt Ishdorj and Otgonnaran Ochirbat and Chuluunbandi Naimannaran,International Journal of Unconventional Computing,0.0,0,0,0,0,0,0,0,False,True,doaj,False,Open Access,False,False,https://doi.org/10.1007/978-981-97-9282-5_5
Tseren-Onolt Ishdorj,Computational power of intramolecular gene assembly,2007,15,https://doi.org/10.1142/s0129054107005169,,Tseren-Onolt Ishdorj and Ion Petre and Vladimir Rogojin,International Journal of Foundations of Computer Science,0.0,0,0,0,0,0,0,0,False,True,doaj,False,Open Access,False,False,https://doi.org/10.1142/s0129054107005169
Tseren-Onolt Ishdorj,Dual-clamped one-pot SERS-based biosensors for rapid and sensitive detection of SARS-CoV-2 using portable Raman spectrometer,2023,13,https://doi.org/10.1016/j.snb.2023.134172,37363301,Kiran Kaladharan and Kuan-Hung Chen and Pin-Han Chen and Venkanagouda S Goudar and Tseren-Onolt Ishdorj and Tuhin Subhra Santra and Fan-Gang Tseng,Sensors and Actuators B: Chemical,10.25,2,0,1,0,0,0,0,True,True,doaj,False,Open Access,False,False,https://doi.org/10.1016/j.snb.2023.134172
Tseren-Onolt Ishdorj,Boolean circuits and a DNA algorithm in membrane computing,2006,11,https://doi.org/10.1007/11603047_19,,Mihai Ionescu and Tseren-Onolt Ishdorj,N/A,0.0,0,0,0,0,0,0,0,False,True,doaj,False,Open Access,False,False,https://doi.org/10.1007/11603047_19
Tseren-Onolt Ishdorj,"Membrane computing, neural inspirations, gene assembly in ciliates",2007,9,https://doi.org/10.1142/9789812810168_0006,,Tseren-Onolt Ishdorj,N/A,0.0,0,0,0,0,0,0,0,False,True,doaj,False,Open Access,False,False,https://doi.org/10.1142/9789812810168_0006
Tseren-Onolt Ishdorj,"Pérez Jiménez, MdJ Spiking neural P systems with extended rules",2006,8,https://doi.org/10.1142/s0129065720500495,,H Chen and TO Ishdorj and G Paun,"Proceedings of the 4th Brainstorming Week on Membrane Computing (BWMC), Sevilla, Spain",0.0,0,0,0,0,0,0,0,False,True,doaj,False,Open Access,False,False,https://doi.org/10.1142/s0129065720500495
Tseren-Onolt Ishdorj,Computing along the axon,2007,7,https://doi.org/10.1080/10020070708541018,40438624,Chen Haiming and Tseren-Onolt Ishdorj and Gheorghe Paun,Progress in Natural Science,0.0,0,0,0,0,0,0,0,False,True,doaj,False,Open Access,False,False,https://doi.org/10.1080/10020070708541018
Tseren-Onolt Ishdorj,Minimal parallelism for polarizationless P systems,2006,7,https://doi.org/10.1007/11925903_2,40369547,Tseren-Onolt Ishdorj,N/A,1.0,2,0,0,0,0,0,0,False,True,doaj,False,Open Access,False,False,https://doi.org/10.1007/11925903_2
Tseren-Onolt Ishdorj,Computing through gene assembly,2007,6,https://doi.org/10.1007/978-3-540-73554-0_10,40444959,Tseren-Onolt Ishdorj and Ion Petre,N/A,0.0,0,0,0,0,0,0,0,False,True,doaj,False,Open Access,False,False,https://doi.org/10.1007/978-3-540-73554-0_10
Tseren-Onolt Ishdorj,"Paun Gh., Pérez-Jiménez MJ",2008,5,https://doi.org/10.4135/9781608717613.n690,,H Chen and M Ionescu and TO Ishdorj,Spiking neural P systems with extended rules: universality and languages,0.0,0,0,0,0,0,0,0,False,True,doaj,False,Open Access,False,False,https://doi.org/10.4135/9781608717613.n690
Tseren-Onolt Ishdorj,On the eﬃciency of spiking neural P systems,2006,5,https://doi.org/10.3233/fi-2011-571,40333960,H Chen and M Ionescu and TO Ishdorj,"Proc. 8th Intern. Conf. on Electronics, Information, and Communication, Ulanbator, Mongolia",0.0,0,0,0,0,0,0,0,False,True,doaj,False,Open Access,False,False,https://doi.org/10.3233/fi-2011-571
Tseren-Onolt Ishdorj,Gene assembly models and boolean circuits,2008,4,https://doi.org/10.1142/s0129054108006182,30692218,Tseren-Onolt Ishdorj and Ion Petre,International Journal of Foundations of Computer Science,19.53,24,0,0,1,1,0,0,True,True,doaj,False,Open Access,False,False,https://doi.org/10.1142/s0129054108006182
Tseren-Onolt Ishdorj,Computational efficiency of intermolecular gene assembly,2008,4,https://doi.org/10.3233/fun-2008-843-405,22147430,Tseren-Onolt Ishdorj and Remco Loos and Ion Petre,Fundamenta Informaticae,0.75,2,0,0,0,0,0,0,False,True,doaj,False,Open Access,False,False,https://doi.org/10.3233/fun-2008-843-405
Tseren-Onolt Ishdorj,A petri-net formalization of heat shock response model,2008,4,https://doi.org/10.2478/forma-2014-0004,,Ralph-Johan Back and Tseren-Onolt Ishdorj and Ion Petre,Workshop on Computational Models for Cell Processes,0.0,0,0,0,0,0,0,0,False,True,doaj,False,Open Access,False,False,https://doi.org/10.2478/forma-2014-0004
Tseren-Onolt Ishdorj,Inhibiting/de-inhibiting P systems with active membranes,2005,3,https://doi.org/10.1007/978-3-540-31837-8_13,,Matteo Cavaliere and Mihai Ionescu and Tseren-Onolt Ishdorj,N/A,0.0,0,0,0,0,0,0,0,False,True,doaj,False,Open Access,False,False,https://doi.org/10.1007/978-3-540-31837-8_13
Tseren-Onolt Ishdorj,BIJE: a joint extraction model for biomedical information extraction,2023,2,https://doi.org/10.1007/978-981-99-4749-2_11,,Yansen Su and Pengpeng Wang and Shuna Cui and Fei Xu and Tseren-Onolt Ishdorj,N/A,0.0,0,0,0,0,0,0,0,False,True,doaj,False,Open Access,False,False,https://doi.org/10.1007/978-981-99-4749-2_11
Tseren-Onolt Ishdorj,Extraction of Relationship Between Esophageal Cancer and Biomolecules Based on BioBERT,2023,1,https://doi.org/10.1007/978-981-99-4749-2_10,,Dayu Tan and Yang Yang and Minglu Wang and Pengpeng Wang and Lejun Zhang and Tseren-Onolt Ishdorj and Yansen Su,N/A,0.0,0,0,0,0,0,0,0,False,True,doaj,False,Open Access,False,False,https://doi.org/10.1007/978-981-99-4749-2_10
Tseren-Onolt Ishdorj,Bio-inspired Membrane Operations in P Systems with Active Membranes,2011,1,https://doi.org/10.17345/triangle6.19-28,,Artiom Alhazov and Tseren-Onolt Ishdorj,Triangle,0.0,0,0,0,0,0,0,0,False,True,doaj,False,Open Access,False,False,https://doi.org/10.17345/triangle6.19-28
Tseren-Onolt Ishdorj,Spiking neural P systems with extended rules,2006,1,https://doi.org/10.1142/s0129065720500495,40304102,Cheng Haiming and Tseren-Onolt Ishdorj and Gheorge Paun,N/A,0.0,0,0,0,0,0,0,0,False,True,doaj,False,Open Access,False,False,https://doi.org/10.1142/s0129065720500495
Tseren-Onolt Ishdorj,Modeling neural processes in lindenmayer systems,2005,1,https://doi.org/10.1007/11494669_19,,Carlos Martín-Vide and Tseren-Onolt Ishdorj,N/A,0.0,0,0,0,0,0,0,0,False,True,doaj,False,Open Access,False,False,https://doi.org/10.1007/11494669_19
Tseren-Onolt Ishdorj,Optimal approximate computation of Euclidean distance in spiking neural P systems framework,2025,0,https://doi.org/10.1038/s41598-025-02793-3,40410383,Otgonbayar Agvaan and Gordon Cichon and Uuganbaatar Dulamragchaa and Hyun-chul Kim and Seonuck Paek and Tseren-Onolt Ishdorj,Scientific Reports,0.0,0,0,0,0,0,0,0,False,True,doaj,False,Open Access,False,False,https://doi.org/10.1038/s41598-025-02793-3
Tseren-Onolt Ishdorj,DeepATsers: a deep learning framework for one-pot SERS biosensor to detect SARS-CoV-2 virus,2025,0,https://doi.org/10.1038/s41598-025-96557-8,40210912,Ankhbayar Nyamdavaa and Kiran Kaladharan and Erdene-Ochir Ganbold and Seungdo Jeong and Seonuck Paek and Yansen Su and Fan-Gang Tseng and Tseren-Onolt Ishdorj,Scientific Reports,10.85,3,0,1,0,0,0,0,True,True,doaj,False,Open Access,False,False,https://doi.org/10.1038/s41598-025-96557-8
Tseren-Onolt Ishdorj,An Entity Alignment Model for Echinococcosis Knowledge Graph,2024,0,https://doi.org/10.1007/978-981-97-5678-0_6,,Yuan Gao and Lejun Zhang and Fei Xu and Tseren-Onolt Ishdorj and YanSen Su,N/A,0.0,0,0,0,0,0,0,0,False,True,doaj,False,Open Access,False,False,https://doi.org/10.1007/978-981-97-5678-0_6
Tseren-Onolt Ishdorj,MDNNSyn: A Multi-Modal Deep Learning Framework for Drug Synergy Prediction,2024,0,https://doi.org/10.1109/jbhi.2024.3421916,38954565,Lei Li and Haitao Li and Tseren-Onolt Ishdorj and Chunhou Zheng and Yansen Su,IEEE Journal of Biomedical and Health Informatics,0.0,0,0,0,0,0,0,0,False,True,doaj,False,Open Access,False,False,https://doi.org/10.1109/jbhi.2024.3421916
Tseren-Onolt Ishdorj,Biomolecular Network-based Study of a Parasitic Disease and Therapeutic Drugs,2022,0,https://doi.org/10.58873/sict.v1i1.31,,Altankhuyag Avirmed and Uranchimeg Erdenedalai and Selenge Erdenechimeg and Yansen Su and Tseren-Onolt Ishdorj,ICT Focus,0.0,0,0,0,0,0,0,0,False,True,doaj,False,Open Access,False,False,https://doi.org/10.58873/sict.v1i1.31
Tseren-Onolt Ishdorj,Solving NP Hard Problems in the Framework of Gene Assembly in Ciliates,2018,0,https://doi.org/10.1007/978-981-13-2826-8_10,,Ganbat Ganbaatar and Khuder Altangerel and Tseren-Onolt Ishdorj,N/A,1.0,1,0,0,0,0,0,0,False,True,doaj,False,Open Access,False,False,https://doi.org/10.1007/978-981-13-2826-8_10
Tseren-Onolt Ishdorj,Bio-inspired Membrane Operations in P Systems with Active Membranes,2011,0,https://doi.org/10.17345/triangle6.19-28,,Tseren-Onolt Ishdorj and Artiom Alhazov,2013-939X,0.0,0,0,0,0,0,0,0,False,True,doaj,False,Open Access,False,False,https://doi.org/10.17345/triangle6.19-28
Tseren-Onolt Ishdorj,About the Efficiency of Spiking Neural P Systems,2009,0,https://doi.org/10.1007/978-3-540-73053-8_16,40333960,Wang Jun and Tseren-Onolt Ishdorj and Pan Linqiang,N/A,0.0,0,0,0,0,0,0,0,False,True,doaj,False,Open Access,False,False,https://doi.org/10.1007/978-3-540-73053-8_16
Tseren-Onolt Ishdorj,About the Efficiency of Spiking Neural P Systems,2009,0,https://doi.org/10.1007/978-3-540-73053-8_16,40333960,Jun Wang and Tseren-Onolt Ishdorj and Linqiang Pan,Seventh Brainstorming Week on Membrane Computing,0.0,0,0,0,0,0,0,0,False,True,doaj,False,Open Access,False,False,https://doi.org/10.1007/978-3-540-73053-8_16
Tseren-Onolt Ishdorj,On the Efficiency of Spiking Neural P Systems,2006,0,https://doi.org/10.1007/978-3-540-73053-8_16,40333960,Cheng Haiming and Mihai Ionescu and Tseren-Onolt Ishdorj,N/A,0.0,0,0,0,0,0,0,0,False,True,doaj,False,Open Access,False,False,https://doi.org/10.1007/978-3-540-73053-8_16
Tseren-Onolt Ishdorj,"Further Remarks on P Systems with Active Membranes, Separation, Merging, and Release Rules",2004,0,https://doi.org/10.1007/s00500-004-0399-y,,Pan Linqiang and Artiom Alhazov and Tseren-Onolt Ishdorj,N/A,0.0,0,0,0,0,0,0,0,False,True,doaj,False,Open Access,False,False,https://doi.org/10.1007/s00500-004-0399-y
Tseren-Onolt Ishdorj,Membrane Systems with Carriers,2003,0,https://doi.org/10.1016/s0304-3975(01)00117-7,40446212,Rodica Ceterchi and Dragos Sburlan and Rudolf Freund and Marion Oswald and Artiom Alhazov and Tseren-Onolt Ishdorj and Gabriel Ciobanu and Gabriel Ciobanu and Rahul Desai and Akash Kumar and Vladimir Rogozhin and Elena Boian and Ion Petre and Luigia Petre and Ion Petre and Luigia Petre and Luca Cardelli and Jose M Sempere and Luca Cardelli,Theoretical Computer Science,0.0,0,0,0,0,0,0,0,False,True,doaj,False,Open Access,False,False,https://doi.org/10.1016/s0304-3975(01)00117-7
Tseren-Onolt Ishdorj,An Error-Tolerant Serial Binary Full-Adder via a Spiking Neural P System using HP/LP Basic Neurons,N/A,0,https://doi.org/10.1007/s41965-020-00033-3,,Gordon Cichon and Tseren-Onolt Ishdorj and Otgonnaran Ochirbat and Khuder Altangerel,N/A,0.0,0,0,0,0,0,0,0,False,True,doaj,False,Open Access,False,False,https://doi.org/10.1007/s41965-020-00033-3
Tseren-Onolt Ishdorj,Massively parallel concept for cryptanalysis of RSA in a bio-computation framework,N/A,0,https://doi.org/10.3233/978-1-61499-621-7-3,,Gordon Cichon and Galbadrakh Battsogt and Tseren-Onolt Ishdorj,N/A,0.0,0,0,0,0,0,0,0,False,True,doaj,False,Open Access,False,False,https://doi.org/10.3233/978-1-61499-621-7-3
Tseren-Onolt Ishdorj,DATA AUGMENTATION TECHNIQUE WITH SMILES OF DRUGS FOR MASHINE LEARNING,N/A,0,https://doi.org/10.1109/pimrc50174.2021.9569265,,Ariunaa Uuriintsetseg and Dolgorsuren Batjargal and Tseren-Onolt Ishdorj,"Institute of Mathematics and Digital Technology Mongolian Academy of Sciences, Mongolia",0.0,0,0,0,0,0,0,0,False,True,doaj,False,Open Access,False,False,https://doi.org/10.1109/pimrc50174.2021.9569265
Tseren-Onolt Ishdorj,LNCS 12687 Membrane Computing,N/A,0,https://doi.org/10.1351/goldbook.12687,,Rudolf Freund and Tseren-Onolt Ishdorj and Grzegorz Rozenberg and Arto Salomaa and Claudio Zandron,N/A,0.0,0,0,0,0,0,0,0,False,True,doaj,False,Open Access,False,False,https://doi.org/10.1351/goldbook.12687
Tseren-Onolt Ishdorj,Petri net based cluster and reachability analysis of the heat shock response in eukaryotes,N/A,0,https://doi.org/10.3724/sp.j.1087.2013.01128,,Tseren-Onolt Ishdorj and Baatarkhuu Enkhtuya,N/A,0.0,0,0,0,0,0,0,0,False,True,doaj,False,Open Access,False,False,https://doi.org/10.3724/sp.j.1087.2013.01128
Tseren-Onolt Ishdorj,Inhibiting/De-inhibiting P Systems with Active Membranes,N/A,0,https://doi.org/10.1007/978-3-540-31837-8_13,,Mihai Ionescu and Tseren-Onolt Ishdorj,N/A,0.0,0,0,0,0,0,0,0,False,True,doaj,False,Open Access,False,False,https://doi.org/10.1007/978-3-540-31837-8_13
Tseren-Onolt Ishdorj,"Rule-Based Modelling Framework: Cellucidate Beta Exercises, 19 March, 2008",N/A,0,https://doi.org/10.1177/01457217080340030601,,R Back and I Petre and TO Ishdorj and V Preoteasa,N/A,0.0,0,0,0,0,0,0,0,False,True,doaj,False,Open Access,False,False,https://doi.org/10.1177/01457217080340030601
Tseren-Onolt Ishdorj,"Leporati, Alberto 344 Lucanu, Dorel 126 Manca, Vincenzo 63 Margenstern, Maurice 1, 161",N/A,0,https://doi.org/10.1007/s11047-010-9202-4,,Giancarlo Mauri and Luca Bianco and Matteo Cavaliere and Rodica Ceterchi and Gabriel Ciobanu and Loıc Colson and Andrés Cordón-Franco and Erzsébet Csuhaj-Varjú and Federico Fontana and Rudolf Freund and Marian Gheorghe and Miguel A Gutiérrez-Naranjo and Mihai Ionescu and Tseren-Onolt Ishdorj and Nataša Jonoska and Norio Kato and Petros Kefalas and Marion Oswald and Andrei Paun and Mario J Pérez-Jiménez and Agustın Riscos-Núnez and Vladimir Rogozhin and Yurii Rogozhin and Francisco José Romero-Campero and Fernando Sancho-Caparrini and Dragos Sburlan and Ioanna Stamatopoulou and Kazunori Ueda and György Vaszil and Sergey Verlan,N/A,0.0,0,0,0,0,0,0,0,False,True,doaj,False,Open Access,False,False,https://doi.org/10.1007/s11047-010-9202-4
