Author,Paper Title,Year,Citations,DOI,PMID,Authors,Journal,Altmetric Score,Twitter Mentions,Reddit Mentions,News Mentions,Blog Mentions,Facebook Mentions,Wikipedia Mentions,Policy Mentions,Media Mentioned,Open Access,OA Status,Preprint,Publication Type,Public Health Impact,Capacity Building,Paper Link
Vincent Duclos,Care in trouble: Ecologies of support from below and beyond,2020,120,https://doi.org/10.1111/maq.12540,31403216,Vincent Duclos and Tomás Sánchez Criado,Medical anthropology quarterly,18.55,12,0,0,1,0,0,0,True,True,doaj,False,Open Access,False,False,https://doi.org/10.1111/maq.12540
Vincent Duclos,"Situating mobile health: a qualitative study of mHealth expectations in the rural health district of Nouna, Burkina Faso",2017,68,https://doi.org/10.1186/s12961-017-0211-y,28722558,Vincent Duclos and Maurice Yé and Kagoné Moubassira and Hamidou Sanou and N Hélène Sawadogo and Gilles Bibeau and Ali Sié,Health research policy and systems,1.5,4,0,0,0,0,0,0,False,True,doaj,False,Open Access,False,False,https://doi.org/10.1186/s12961-017-0211-y
Vincent Duclos,SPEED: An Introduction,2017,52,https://doi.org/10.1038/232207b0,40445923,Vincent Duclos and Tomas Sanchez Criado and VINH‐KIM NGUYEN,Cultural Anthropology,0.0,0,0,0,0,0,0,0,False,True,doaj,False,Open Access,False,False,https://doi.org/10.1038/232207b0
Vincent Duclos,The map and the territory: an ethnographic study of the low utilisation of a global eHealth network,2016,27,https://doi.org/10.1057/jit.2016.3,,Vincent Duclos,Journal of Information Technology,4.85,5,0,0,0,0,0,0,False,True,doaj,False,Open Access,False,False,https://doi.org/10.1057/jit.2016.3
Vincent Duclos,"Promoting access equity and improving health care for women, children and people living with HIV/AIDS in Burkina Faso through mHealth",2018,22,https://doi.org/10.1093/pubmed/fdy196,,M Yé and M Kagoné and A Sié and C Bagagnan and H Sanou and O Millogo and V Duclos and I Tinto and Gilles Bibeau,Journal of Public Health,0.0,0,0,0,0,0,0,0,False,True,doaj,False,Open Access,False,False,https://doi.org/10.1093/pubmed/fdy196
Vincent Duclos,Building capacities: The resurgence of Indo-African technoeconomic cooperation,2012,21,https://doi.org/10.1080/14736489.2012.731906,,Vincent Duclos,India Review,0.0,0,0,0,0,0,0,0,False,True,doaj,False,Open Access,False,False,https://doi.org/10.1080/14736489.2012.731906
Vincent Duclos,Promises and perils of mobile health in Burkina Faso,2021,19,https://doi.org/10.1016/s0140-6736(21)01001-1,,N Hélène Sawadogo and Hamidou Sanou and Jeremy A Greene and Vincent Duclos,The Lancet,14.53,11,0,0,1,1,0,0,True,True,doaj,False,Open Access,False,False,https://doi.org/10.1016/s0140-6736(21)01001-1
Vincent Duclos,Inhabiting media: An anthropology of life in digital speed,2017,18,https://doi.org/10.14506/ca32.1.03,,Vincent Duclos,Cultural Anthropology,12.0,2,0,0,1,0,0,0,True,True,doaj,False,Open Access,False,False,https://doi.org/10.14506/ca32.1.03
Vincent Duclos,Toutes les familles ont-elles une même voix en contexte de soins?,2011,17,https://doi.org/10.4000/books.pum.8898,,Sylvie Fortin and Michèle Rietmann and Vincent Duclos and AVEC LA COLLABORATION DE and Serge MAYNARD and Marie-Jeanne BLAIN and Marie-Ève CARLE,"Familles d’origine immigrante: polysémie des pratiques sociales. Enjeux sociaux, de santé et d’éducation. Montréal, Presses de l’Université de Montréal",0.0,0,0,0,0,0,0,0,False,True,doaj,False,Open Access,False,False,https://doi.org/10.4000/books.pum.8898
Vincent Duclos,Global eHealth: Designing spaces of care in the era of global connectivity,2015,16,https://doi.org/10.17157/mat.2.1.166,,Vincent Duclos,Medicine Anthropology Theory,0.0,0,0,0,0,0,0,0,False,True,doaj,False,Open Access,False,False,https://doi.org/10.17157/mat.2.1.166
Vincent Duclos,India's Development Diplomacy & Soft Power in Africa,2021,12,https://doi.org/10.2307/j.ctv1jpf1tn,,Kenneth King and Meera Venkatachalam and Gerard McCann and Chambi Chachage and Jacqueline Halima Mgumia and Emma Mawdsley and Supriya Roychoudhury and Vincent Duclos and Simona Vittorini and Jagannath Panda and Mrittika Guha Sarkar and Muhidin J Shangwe,N/A,0.0,0,0,0,0,0,0,0,False,True,doaj,False,Open Access,False,False,https://doi.org/10.2307/j.ctv1jpf1tn
Vincent Duclos,"Falling Into Things: Peter Sloterdijk, Ontological Anthropology in the Monstrous",2018,12,https://doi.org/10.3898/newf:95.03.2018,,Vincent Duclos,New Formations,0.0,0,0,0,0,0,0,0,False,True,doaj,False,Open Access,False,False,https://doi.org/10.3898/newf:95.03.2018
Vincent Duclos,Use of mobile phone to promote governance and equity within the health system: experience of rural health district in Burkina Faso,2016,12,https://doi.org/10.4172/2472-1654.100017,,Duclos Vincent and Bibeau Gilles,Journal of Healthcare Communications,3.0,0,0,0,0,0,0,0,False,True,doaj,False,Open Access,False,False,https://doi.org/10.4172/2472-1654.100017
Vincent Duclos,"The empire of speculation: medicine, markets, and nation in India’s Pan-African e-Network",2021,10,https://doi.org/10.1057/s41292-020-00198-1,,Vincent Duclos,BioSocieties,12.5,2,0,0,1,0,0,0,True,True,doaj,False,Open Access,False,False,https://doi.org/10.1057/s41292-020-00198-1
Vincent Duclos,"Of doctors and wires ICTs, healthcare, and India’s telemedicine venture into Africa",2014,10,https://doi.org/10.1126/science.331.6017.532-b,,Vincent Duclos,Journal of Critical Southern Studies,0.0,0,0,0,0,0,0,0,False,True,doaj,False,Open Access,False,False,https://doi.org/10.1126/science.331.6017.532-b
Vincent Duclos,Le soin du monde: Incursions anthropologiques dans le Pan-African e-Network Project,2014,8,https://doi.org/10.4414/bms.2016.04849,,Vincent Duclos,N/A,0.0,0,0,0,0,0,0,0,False,True,doaj,False,Open Access,False,False,https://doi.org/10.4414/bms.2016.04849
Vincent Duclos,"The rise of China and India in Africa: challenges, opportunities and critical interventions",2011,8,https://doi.org/10.1080/03056244.2011.598649,,Vincent Duclos,N/A,0.0,0,0,0,0,0,0,0,False,True,doaj,False,Open Access,True,False,https://doi.org/10.1080/03056244.2011.598649
Vincent Duclos,Algorithmic futures,2019,6,https://doi.org/10.2307/jj.11895528.15,40450249,Vincent Duclos,Medicine Anthropology Theory,0.0,0,0,0,0,0,0,0,False,True,doaj,False,Open Access,False,False,https://doi.org/10.2307/jj.11895528.15
Vincent Duclos,When anthropology meets science: An interview with Allan young,2013,6,https://doi.org/10.5301/gtnd.2014.12879,,Vincent Duclos,N/A,0.0,0,0,0,0,0,0,0,False,True,doaj,False,Open Access,False,False,https://doi.org/10.5301/gtnd.2014.12879
Vincent Duclos,L’envers de l’imaginé: la détresse dans le corps social chez les immigrants indiens de Montréal,2009,6,https://doi.org/10.1017/s0829320100005214,,Vincent Duclos,N/A,0.0,0,0,0,0,0,0,0,False,True,doaj,False,Open Access,False,False,https://doi.org/10.1017/s0829320100005214
Vincent Duclos,L'envers de l'imaginé: la détresse comme discours socioculturel chez les migrants indiens de Montréal,2008,6,https://doi.org/10.1037/cbs0000351,,Vincent Duclos,N/A,1.0,2,0,0,0,0,0,0,False,True,doaj,False,Open Access,False,False,https://doi.org/10.1037/cbs0000351
Vincent Duclos,Anthropotechnics: On the Relationship between Technology and Humanity according to Peter Sloterdijk,2016,5,https://doi.org/10.28995/2073-6401-2022-1-36-51,,Duclos,Sociétés,0.0,0,0,0,0,0,0,0,False,True,doaj,False,Open Access,False,False,https://doi.org/10.28995/2073-6401-2022-1-36-51
Vincent Duclos,"Le design du monde. De McLuhan à Sloterdijk, vers une anthropologie de l'espace en devenir",2015,4,https://doi.org/10.4000/books.enseditions.13497,,Vincent Duclos,N/A,0.0,0,0,0,0,0,0,0,False,True,doaj,False,Open Access,False,False,https://doi.org/10.4000/books.enseditions.13497
Vincent Duclos,Demanding Mobile Health,2017,3,https://doi.org/10.1136/bmj.2.5349.121-b,40448898,Vincent Duclos,limn,0.0,0,0,0,0,0,0,0,False,True,doaj,False,Open Access,False,False,https://doi.org/10.1136/bmj.2.5349.121-b
Vincent Duclos,Big data,2023,2,https://doi.org/10.46672/zsl.7.7.4,40450253,Vincent Duclos,Anthropen,0.0,0,0,0,0,0,0,0,False,True,doaj,False,Open Access,False,False,https://doi.org/10.46672/zsl.7.7.4
Vincent Duclos,A Shining Example: Modelling Growth in India’s Pan-African e-Network,2021,2,https://doi.org/10.1515/9781800102835-011,,Vincent Duclos,India’s development diplomacy and soft power in Africa,0.0,0,0,0,0,0,0,0,False,True,doaj,False,Open Access,False,False,https://doi.org/10.1515/9781800102835-011
Vincent Duclos,Santé numérique. Transformations sociotechniques du soin et des pratiques de santé dans un monde connecté,2024,1,https://doi.org/10.3917/spub.hs1.2024.0191,,Marine Al Dahdah and Vincent Duclos,Anthropologie & Santé. Revue internationale francophone d'anthropologie de la santé,0.0,0,0,0,0,0,0,0,False,True,doaj,False,Open Access,False,False,https://doi.org/10.3917/spub.hs1.2024.0191
Vincent Duclos,Magic Words: A Numbered List,2016,1,https://doi.org/10.5951/mt.82.2.0139,,Vincent Duclos and Judith Farquhar and Volker Scheid and Suzanne Cochrane,N/A,0.0,0,0,0,0,0,0,0,False,True,doaj,False,Open Access,False,False,https://doi.org/10.5951/mt.82.2.0139
Vincent Duclos,Global eHealth,2015,1,https://doi.org/10.17157/mat.2.1.166,40448938,Vincent Duclos,Med Anthropol Theory,0.0,0,0,0,0,0,0,0,False,True,doaj,False,Open Access,False,False,https://doi.org/10.17157/mat.2.1.166
Vincent Duclos,"Science, marché, subjectivité: considérations critiques sur l’action normative des discours scientifiques",2008,1,https://doi.org/10.1163/ej.9789028610224.001-085.2,,Vincent Duclos,N/A,0.0,0,0,0,0,0,0,0,False,True,doaj,False,Open Access,False,False,https://doi.org/10.1163/ej.9789028610224.001-085.2
Vincent Duclos,chapitre 1 Toutes les familles ont-elles une même voix en contexte de soins?,N/A,1,https://doi.org/10.4000/books.pum.8898,,Sylvie Fortin and Michèle Rietmann and Vincent Duclos,N/A,0.0,0,0,0,0,0,0,0,False,True,doaj,False,Open Access,False,False,https://doi.org/10.4000/books.pum.8898
Vincent Duclos,LIFE AT A DISTANCE: Medicine and Nationalism in India's Pan-african E-network,2025,0,https://doi.org/10.1057/9781137448583.0016,,Vincent Duclos,N/A,0.0,0,0,0,0,0,0,0,False,True,doaj,False,Open Access,False,False,https://doi.org/10.1057/9781137448583.0016
Vincent Duclos,Care in Fragments: Ecologies of Support Beyond Repair,2025,0,https://doi.org/10.7551/mitpress/14227.003.0012,,Tomás Sánchez Criado and Vincent Duclos,N/A,0.0,0,0,0,0,0,0,0,False,True,doaj,False,Open Access,False,False,https://doi.org/10.7551/mitpress/14227.003.0012
Vincent Duclos,Care in fragments: Ecologies of Support beyond Repair,2025,0,https://doi.org/10.7551/mitpress/14227.003.0012,,Tomás Sánchez Criado and Vincent Duclos,N/A,0.0,0,0,0,0,0,0,0,False,True,doaj,False,Open Access,False,False,https://doi.org/10.7551/mitpress/14227.003.0012
Vincent Duclos,‘We are not done’: reclaiming care after mobile health in Burkina Faso,2024,0,https://doi.org/10.1080/13648470.2024.2378735,,Vincent Duclos and N Hélène Sawadogo and Hamidou Sanou,Anthropology & Medicine,0.0,0,0,0,0,0,0,0,False,True,doaj,False,Open Access,False,False,https://doi.org/10.1080/13648470.2024.2378735
Vincent Duclos,"At the Limits of Cure Bharat Jayram Venkat Durham, NC: Duke University Press, 2021. 304 pp.",2022,0,https://doi.org/10.1111/maq.12715,,Vincent Duclos,N/A,0.85,1,0,0,0,0,0,0,False,True,doaj,False,Open Access,False,False,https://doi.org/10.1111/maq.12715
Vincent Duclos,Beyond COVID-19: scaling up and sustaining mobile health in Africa–Authors' reply,2021,0,https://doi.org/10.1016/s0140-6736(21)02643-x,,N Hélène Sawadogo and Hamidou Sanou and Jeremy A Greene and Vincent Duclos,The Lancet,0.0,0,0,0,0,0,0,0,False,True,doaj,False,Open Access,False,False,https://doi.org/10.1016/s0140-6736(21)02643-x
Vincent Duclos,Markbooks,2021,0,N/A,272792,Carla Nappi and Joshua Berson and Christie Brown and Vincent Duclos and Judith Farquhar and Dianna Frid and Angelika Messner and Todd Ochoa and Barry Saunders and Leander Schwazer and Clare Twomey and Felipe Mancheno,N/A,0.0,0,0,0,0,0,0,0,False,True,doaj,False,Unknown,False,False,N/A
Vincent Duclos,"Caduff, Carlo. 2015. The pandemic perhaps: dramatic events in a public culture of danger. Oakland, CA: University of California Press. 270 pp. Pb.: US $29.95. ISBN: 9780520284098.",2018,0,https://doi.org/10.1111/1469-8676.12468,,Vincent Duclos,N/A,0.0,0,0,0,0,0,0,0,False,True,doaj,False,Open Access,True,False,https://doi.org/10.1111/1469-8676.12468
Vincent Duclos,Speed: An Introduction,2017,0,https://doi.org/10.1038/232207b0,40445923,Tomás Sánchez Criado and Vincent Duclos and Vinh-Kim Nguyen,"Cultural Anthropology, 2017, 32 (1)",0.0,0,0,0,0,0,0,0,False,True,doaj,False,Open Access,False,False,https://doi.org/10.1038/232207b0
Vincent Duclos,"Designing the World: from McLuhan to Sloterdijk, towards an anthropology of space in becoming",2015,0,https://doi.org/10.1068/d13607,,Vincent Duclos,N/A,0.0,0,0,0,0,0,0,0,False,True,doaj,False,Open Access,False,False,https://doi.org/10.1068/d13607
Vincent Duclos,Le médicament qui devait sauver l’Afrique: un scandale pharmaceutique aux colonies,2015,0,https://doi.org/10.1684/mst.2014.0424,,Vincent Duclos,Critique internationale,0.0,0,0,0,0,0,0,0,False,True,doaj,False,Open Access,False,False,https://doi.org/10.1684/mst.2014.0424
Vincent Duclos,Vers une commune humanité? Perspectives croisées sur l’émergence de la cybersanté mondiale,2013,0,https://doi.org/10.3917/rn.252.0097,,Vincent DUCLOS,Face à face. Regards sur la santé,0.0,0,0,0,0,0,0,0,False,True,doaj,False,Open Access,False,False,https://doi.org/10.3917/rn.252.0097
Vincent Duclos,"Designs for an Anthropology of the Contemporary by Paul Rabinow, George E. Marcus, James D. Faubion, Tobias Rees",2010,0,https://doi.org/10.30676/jfas.127526,,Vincent Duclos,Anthropologica,0.0,0,0,0,0,0,0,0,False,True,doaj,False,Open Access,False,False,https://doi.org/10.30676/jfas.127526
Vincent Duclos,La voie de l’intérieur: L’action thérapeutique chez les migrants indiens de Montréal,2009,0,https://doi.org/10.7202/039387ar,,Vincent Duclos,Diversité urbaine,0.0,0,0,0,0,0,0,0,False,True,doaj,False,Open Access,False,False,https://doi.org/10.7202/039387ar
Vincent Duclos,28| 2024 Santé numérique,N/A,0,https://doi.org/10.4000/11r33,40235719,Marine Al Dahdah and Vincent Duclos,N/A,0.0,0,0,0,0,0,0,0,False,True,doaj,False,Open Access,False,False,https://doi.org/10.4000/11r33
Vincent Duclos,Présentation: une anthropologie médicale en mouvement,N/A,0,https://doi.org/10.4000/etudesafricaines.14851,,Vincent Duclos and Marie-Ève Carle,N/A,0.0,0,0,0,0,0,0,0,False,True,doaj,False,Open Access,False,False,https://doi.org/10.4000/etudesafricaines.14851
Vincent Duclos,Présentation: Penser les frontières du social et du médical,N/A,0,https://doi.org/10.3917/rhiz.072.0018,,Vincent Duclos and Marie-Ève Carle,N/A,0.0,0,0,0,0,0,0,0,False,True,doaj,False,Open Access,False,False,https://doi.org/10.3917/rhiz.072.0018
