Author,Paper Title,Year,Citations,DOI,PMID,Authors,Journal,Altmetric Score,Twitter Mentions,Reddit Mentions,News Mentions,Blog Mentions,Facebook Mentions,Wikipedia Mentions,Policy Mentions,Media Mentioned,Open Access,OA Status,Preprint,Publication Type,Public Health Impact,Capacity Building,Paper Link
Adesina Sodiya,Packets’ Congestion Management with Fuzzy Admission Control Policy for Differentiated Service Networks,2024,0,https://doi.org/10.9734/ajrcos/2024/v17i2418,,Adio T Akinwale and Adesina S Sodiya and Simeon A Akinleye and Adegbuyi D Gbadebo,Asian J. Res. Com. Sci,0.0,0,0,0,0,0,0,0,False,True,doaj,False,Open Access,False,False,https://doi.org/10.9734/ajrcos/2024/v17i2418
Adesina Sodiya,A Fuzzy-Based Servers’ Management Technique for M/M/m Queue Network,2023,0,https://doi.org/10.21203/rs.3.rs-3308384/v1,,Adegbuyi David Gbadebo and Adio Taofiki Akinwale and Adesina Simon Sodiya,N/A,0.0,0,0,0,0,0,0,0,False,True,doaj,False,Open Access,False,False,https://doi.org/10.21203/rs.3.rs-3308384/v1
Adesina Sodiya,Evaluation of Current IoT Approaches in Cereal Crop Pests and Diseases Management,2023,0,https://doi.org/10.1079/9781845938086.0092,,WF Tobun Badru and AS Sodiya and F Shittu,Journal of Computer Science and Its Application,0.0,0,0,0,0,0,0,0,False,True,doaj,False,Open Access,False,False,https://doi.org/10.1079/9781845938086.0092
Adesina Sodiya,Computer and Information Sciences,2022,0,https://doi.org/10.1007/978-3-030-00840-6,40447737,Olorunjube James Falana and Adesina Simon Sodiya and Saidat Adebukola Onashoga and Biodun Surajudeen Badmus,N/A,0.0,0,0,0,0,0,0,0,False,True,doaj,False,Open Access,False,False,https://doi.org/10.1007/978-3-030-00840-6
Adesina Sodiya,A Proposed Distributed Anti-Phishing Framework for mitigating Cyber-attacks in Smart Environments,2021,0,https://doi.org/10.4018/ijcwt.2021100103,,AA Adebesin and AS Sodiya and AA Orunsolu and OA Lawal and SO Kareem,"International Journal of Information Security, Privacy and Digital Forensics",0.0,0,0,0,0,0,0,0,False,True,doaj,False,Open Access,False,False,https://doi.org/10.4018/ijcwt.2021100103
Adesina Sodiya,Modelling Attendees' Participation in Virtual Events,2021,0,https://doi.org/10.4314/jcsia.v28i2.8,40046957,Oreoluwa C Tinubu and Olorunjube J Falana and Adesina S Sodiya,Journal of Computer Science and Its Application,0.0,0,0,0,0,0,0,0,False,True,doaj,False,Open Access,False,False,https://doi.org/10.4314/jcsia.v28i2.8
Adesina Sodiya,Towards a UMLsec-Based Proctored Examination Model,2019,0,https://doi.org/10.4018/ijsssp.2019070103,30877314,Ibukun Fadahunsi and Adesina S Sodiya and Bakai Olajuwon,International Journal of Systems and Software Security and Protection (IJSSSP),0.25,1,0,0,0,0,0,0,False,True,doaj,False,Open Access,False,False,https://doi.org/10.4018/ijsssp.2019070103
Adesina Sodiya,Privacy Preserving Location-Based Client-Server Service Using Standard Cryptosystem,2019,0,https://doi.org/10.20532/cit.2019.1004606,,Adebukola Onashoga and Adesina Sodiya and Idowu Osinuga,Journal of computing and information technology,0.0,0,0,0,0,0,0,0,False,True,doaj,False,Open Access,False,False,https://doi.org/10.20532/cit.2019.1004606
Adesina Sodiya,Computer and Information Sciences,2019,0,https://doi.org/10.1007/978-3-030-00840-6,40447737,AA Orunsolu and AS Sodiya and AT Akinwale,N/A,0.0,0,0,0,0,0,0,0,False,True,doaj,False,Open Access,False,False,https://doi.org/10.1007/978-3-030-00840-6
Adesina Sodiya,A Mathematical Model for Resolving Minimum Password Length Controversy,2018,0,https://doi.org/10.17781/p002310,,S Agholor and AS Sodiya and DO Aborisade,Outlook,0.0,0,0,0,0,0,0,0,False,True,doaj,False,Open Access,False,False,https://doi.org/10.17781/p002310
Adesina Sodiya,An empirical evaluation of security tips in phishing prevention: A case study of nigerian banks,2017,0,https://doi.org/10.35912/jakman.v4i1.1527,,Abdul Abiodun Orunsolu and AS Sodiya and AT Akinwale and BI Olajuwon and MA Alaran and Oluwaseun Bamgboye and OA Afolabi,N/A,0.0,0,0,0,0,0,0,0,False,True,doaj,False,Open Access,False,False,https://doi.org/10.35912/jakman.v4i1.1527
Adesina Sodiya,A DISTRIBUTED PASSWORD AUTHENTICATED KEY EXCHANGE PROTOCOL USING A HYBRID APPROACH,2016,0,https://doi.org/10.14445/22312803/ijctt-v9p158,,AA Orunsolu and AS Sodiya and OO Folorunso and AAA Agboola,Annals. Computer Science Series,0.0,0,0,0,0,0,0,0,False,True,doaj,False,Open Access,False,False,https://doi.org/10.14445/22312803/ijctt-v9p158
Adesina Sodiya,Call Response Rate as Baseline for Detecting DRDoS Attack in Cloud Database Service,2016,0,https://doi.org/10.1515/9783110482522-008,,Dada O Aborisade and Christoph Reich and Adesina S Sodiya and Adio T Akinwale,N/A,0.0,0,0,0,0,0,0,0,False,True,doaj,False,Open Access,False,False,https://doi.org/10.1515/9783110482522-008
Adesina Sodiya,A SURVIVABLE DISTRIBUTED DATABASE AGAINST BYZANTINE FAILURE,2016,0,https://doi.org/10.51406/jnset.v15i2.1684,,DO ABORISADE and AS SODIYA and AA ODUMOSU and OY ALOWOSILE and AA ADEDEJI,Journal of Natural Sciences Engineering and Technology,0.0,0,0,0,0,0,0,0,False,True,doaj,False,Open Access,False,False,https://doi.org/10.51406/jnset.v15i2.1684
Adesina Sodiya,A SURVEY OF DETECTION TECHNIQUES FOR PACKET DROPPING ATTACK IN MOBILE AD HOC NETWORK,2015,0,https://doi.org/10.5121/ijci.2016.5213,,AS Sodiya and OO Folorunso and OC Akinola,AIT 2015,0.0,0,0,0,0,0,0,0,False,True,doaj,False,Open Access,False,False,https://doi.org/10.5121/ijci.2016.5213
Adesina Sodiya,A hybrid approach to masquerade detection,2015,0,https://doi.org/10.1109/icctet.2014.6966354,,AS Sodiya and SA Onashoga and T Solarin-sodara and OJ Falana,Journal of Computer Science and Its Application,0.0,0,0,0,0,0,0,0,False,True,doaj,False,Open Access,False,False,https://doi.org/10.1109/icctet.2014.6966354
Adesina Sodiya,An ontology-based intrusion patterns classification system,2014,0,https://doi.org/10.1007/978-3-540-30141-7_59,31039430,AJ Shonubi and AF Adekoya and AS Sodiya and OT Mewomo,Journal of Computer Science and Its Application,47.522,30,0,1,2,1,1,0,True,True,doaj,False,Open Access,False,False,https://doi.org/10.1007/978-3-540-30141-7_59
Adesina Sodiya,An Efficient Broadcast Encryption for Secure Group Communication.,2013,0,https://doi.org/10.1016/j.jnca.2012.09.007,36662805,Saidat Adebukola Onashoga and Adesina Simon Sodiya and Oluwatosin Tope Mewomo and Ismail Mayowa Fadeyi,INFOCOMP: Journal of Computer Science,0.0,0,0,0,0,0,0,0,False,True,doaj,False,Open Access,False,False,https://doi.org/10.1016/j.jnca.2012.09.007
Adesina Sodiya,Destructible Password Functionality Authentication Protocol,2012,0,https://doi.org/10.1007/978-981-10-5041-1_1,,AA Orunsolu and AS Sodiya and DF Oyenekan,African Journal of Computing & ICT,0.0,0,0,0,0,0,0,0,False,True,doaj,False,Open Access,False,False,https://doi.org/10.1007/978-981-10-5041-1_1
Adesina Sodiya,A knowledge-based visual analytics query system,2010,0,https://doi.org/10.1109/dante.1999.844986,26504853,Olusegun Folorunso and Adesina Temitayo Bello and Adesina S Sodiya and Lateef O Yusuf,Oriental Journal of Computer Science and Technology,0.0,0,0,0,0,0,0,0,False,True,doaj,False,Open Access,False,False,https://doi.org/10.1109/dante.1999.844986
Adesina Sodiya,A natural language architecture,2007,0,https://doi.org/10.2498/cit.1000755,40442232,Adesina Simon Sodiya,Journal of computing and information technology,0.0,0,0,0,0,0,0,0,False,True,doaj,False,Open Access,False,False,https://doi.org/10.2498/cit.1000755
Adesina Sodiya,"Intrusion detection systems: the fundamentals, problems and the way forward",2004,0,https://doi.org/10.1007/978-981-16-6597-4_6,,AS Sodiya and HOD Longe,Journal of Applied Computer Science,0.0,0,0,0,0,0,0,0,False,True,doaj,False,Open Access,False,False,https://doi.org/10.1007/978-981-16-6597-4_6
Adesina Sodiya,CIT 811 User Interface Design and Ergonomics Module 2,N/A,0,https://doi.org/10.1201/9781003302933-7,,AS Sodiya and AA Afolorunso and MoniOluwa Olaniyi,N/A,0.0,0,0,0,0,0,0,0,False,True,doaj,False,Open Access,False,False,https://doi.org/10.1201/9781003302933-7
Adesina Sodiya,THE STATE OF INFORMATION SECURITY IN SOUTH-WESTERN NIGERIAN EDUCATIONAL INSTITUTIONS,N/A,0,https://doi.org/10.4018/ijrcm.303103,,AS Sodiya and SA Ibrahim and OB Ajayi,N/A,0.0,0,0,0,0,0,0,0,False,True,doaj,False,Open Access,False,True,https://doi.org/10.4018/ijrcm.303103
Adesina Sodiya,An Intelligent Incidence Reporting System For Online Attacks,N/A,0,https://doi.org/10.35940/ijrte.d7734.118419,35198765,Monsuru O Abdullahi and Adesina S Sodiya and Adebukola S Onashoga and CO Tinubu,N/A,1.25,2,0,0,0,0,0,0,False,True,doaj,False,Open Access,False,False,https://doi.org/10.35940/ijrte.d7734.118419
Adesina Sodiya,for National Safety & Security,N/A,0,https://doi.org/10.4324/9780203995853-18,40443395,Adesola ADEROUNMU and Adesina SODIYA,N/A,0.0,0,0,0,0,0,0,0,False,True,doaj,False,Open Access,False,False,https://doi.org/10.4324/9780203995853-18
Adesina Sodiya,National Security &,N/A,0,https://doi.org/10.31733/2078-3566-2021-3-166-173,40448235,Charles O UWADIA and Adesola ADEROUNMU and Adesina SODIYA,N/A,0.0,0,0,0,0,0,0,0,False,True,doaj,False,Open Access,False,False,https://doi.org/10.31733/2078-3566-2021-3-166-173
Adesina Sodiya,IT4InDev 2015,N/A,0,https://doi.org/10.15581/024.39829,40448207,Charles UWADIA and Adesola ADEROUNMU and Adesina SODIYA,N/A,0.0,0,0,0,0,0,0,0,False,True,doaj,False,Open Access,False,False,https://doi.org/10.15581/024.39829
Adesina Sodiya,A GAME ONTOLOGY MODEL FOR ACQUIRING BUSINESS SKILLS,N/A,0,https://doi.org/10.7748/phc.20.4.7.s9,,UR Okoro and AS Sodiya and O Awodele and SO Kuyoro,N/A,0.0,0,0,0,0,0,0,0,False,True,doaj,False,Open Access,False,False,https://doi.org/10.7748/phc.20.4.7.s9
Adesina Sodiya,AN ADAPTIVE HIERARCHICAL ACCESS CONTROL ARCHITECTURE FOR ENTERPRISE NETWORK USING COMPLIANCE VARIANCE,N/A,0,https://doi.org/10.1109/pedes.2016.7914532,,AS Sodiya and AA Orunsolu,N/A,0.0,0,0,0,0,0,0,0,False,True,doaj,False,Open Access,False,False,https://doi.org/10.1109/pedes.2016.7914532
Adesina Sodiya,Phishing E-mail Detection Mechanism Based on Middleware Technology,N/A,0,https://doi.org/10.1007/978-1-4842-7744-7_9,,AA Orunsolu and AS Sodiya and AT Akinwale,Economy in Nigeria,0.0,0,0,0,0,0,0,0,False,True,doaj,False,Open Access,False,False,https://doi.org/10.1007/978-1-4842-7744-7_9
