Author,Paper Title,Year,Citations,DOI,PMID,Authors,Journal,Altmetric Score,Twitter Mentions,Reddit Mentions,News Mentions,Blog Mentions,Facebook Mentions,Wikipedia Mentions,Policy Mentions,Media Mentioned,Open Access,OA Status,Preprint,Publication Type,Public Health Impact,Capacity Building,Paper Link
Adesina Sodiya,A predictive model for phishing detection,2022,125,https://doi.org/10.1016/j.jksuci.2019.12.005,40374830,Abdul A Orunsolu and Adesina S Sodiya and Adio Taofeek Akinwale,Journal of King Saud University-Computer and Information Sciences,0.0,0,0,0,0,0,0,0,False,True,doaj,False,Open Access,False,False,https://doi.org/10.1016/j.jksuci.2019.12.005
Adesina Sodiya,Threat modeling using fuzzy logic paradigm,2007,75,https://doi.org/10.28945/3057,,Adesina S Sodiya and S Adebukola Onashoga and BA Oladunjoye,Informing Science: International Journal of an Emerging Transdiscipline,0.0,0,0,0,0,0,0,0,False,True,doaj,False,Open Access,False,False,https://doi.org/10.28945/3057
Adesina Sodiya,An improved assessment of personality traits in software engineering,2007,66,https://doi.org/10.28945/3164,40441544,Adesina S Sodiya and Olumide Babatope Longe and S Adebukola Onashoga and Oludele Awodele and LO Omotosho,"Interdisciplinary Journal of Information, Knowledge, and Management",0.0,0,0,0,0,0,0,0,False,True,doaj,False,Open Access,False,False,https://doi.org/10.28945/3164
Adesina Sodiya,Towards building secure software systems.,2006,66,https://doi.org/10.28945/2957,40346451,Adesina S Sodiya and S Adebukola Onashoga and OB Ajayĩ,Issues in Informing Science & Information Technology,1.0,1,0,0,0,0,0,0,False,True,doaj,False,Open Access,False,False,https://doi.org/10.28945/2957
Adesina Sodiya,A Strategic Review of Existing Mobile Agent-Based Intrusion Detection Systems.,2009,65,https://doi.org/10.28945/3372,,Saidat Adebukola Onashoga and Adebayo D Akinde and Adesina Simon Sodiya,N/A,0.0,0,0,0,0,0,0,0,False,True,doaj,False,Open Access,False,False,https://doi.org/10.28945/3372
Adesina Sodiya,Mal-Detect: An intelligent visualization approach for malware detection,2022,57,https://doi.org/10.1016/j.jksuci.2022.02.026,40435333,Olorunjube James Falana and Adesina Simon Sodiya and Saidat Adebukola Onashoga and Biodun Surajudeen Badmus,Journal of King Saud University-Computer and Information Sciences,3.0,0,0,0,0,0,0,0,False,True,doaj,False,Open Access,False,False,https://doi.org/10.1016/j.jksuci.2022.02.026
Adesina Sodiya,A new two‐tiered strategy to intrusion detection,2004,33,https://doi.org/10.1108/09685220410518810,,Adesina S Sodiya and HOD Longe and Adio T Akinwale,Information Management & Computer Security,0.0,0,0,0,0,0,0,0,False,True,doaj,False,Open Access,False,False,https://doi.org/10.1108/09685220410518810
Adesina Sodiya,A receipt-free multi-authority e-voting system,2017,31,https://doi.org/10.1007/978-3-031-73344-4_1,,P Adewole and Babatunde Odunayo Ojo,N/A,0.0,0,0,0,0,0,0,0,False,True,doaj,False,Open Access,False,False,https://doi.org/10.1007/978-3-031-73344-4_1
Adesina Sodiya,Multi-level and secured agent-based intrusion detection system,2006,23,https://doi.org/10.2498/cit.1000754,,Adesina Simon Sodiya,Journal of Computing and Information Technology,0.0,0,0,0,0,0,0,0,False,True,doaj,False,Open Access,False,False,https://doi.org/10.2498/cit.1000754
Adesina Sodiya,A mobile phone-based antenatal care support system,2011,22,https://doi.org/10.1109/icseng.2011.81,31395034,SA Onashoga and Adesina S Sodiya and TO Omilani and HO Ajisegiri,N/A,0.0,0,0,0,0,0,0,0,False,True,doaj,False,Open Access,False,False,https://doi.org/10.1109/icseng.2011.81
Adesina Sodiya,An integrated decision support system for intercropping,2012,20,https://doi.org/10.4018/978-1-4666-1746-9.ch015,39421373,Adesina S Sodiya and Adio T Akinwale and KA Okeleye and JA Emmanuel,N/A,3.0,0,0,0,0,0,0,0,False,True,doaj,False,Open Access,False,False,https://doi.org/10.4018/978-1-4666-1746-9.ch015
Adesina Sodiya,Improved cost models for agent-based association rule mining in distributed databases,2011,20,https://doi.org/10.1109/iccci.2013.6466112,,AO Ogunde and O Folorunso and AS Sodiya and JA Oguntuase and GO Ogunleye,Anale. SeriaInformatica,0.0,0,0,0,0,0,0,0,False,True,doaj,False,Open Access,False,False,https://doi.org/10.1109/iccci.2013.6466112
Adesina Sodiya,A partition enhanced mining algorithm for distributed association rule mining systems,2015,19,https://doi.org/10.1016/j.eij.2015.06.006,,AO Ogunde and O Folorunso and AS Sodiya,Egyptian Informatics Journal,0.0,0,0,0,0,0,0,0,False,True,doaj,False,Open Access,False,False,https://doi.org/10.1016/j.eij.2015.06.006
Adesina Sodiya,A Review of Some Issues and Challenges in Current Agent-Based Distributed Association Rule Mining,2011,18,https://doi.org/10.3923/ajit.2011.84.95,,AO Ogunde and O Folorunso and AS Sodiya and GO Ogunleye,Asian Journal of Information Technology,0.0,0,0,0,0,0,0,0,False,True,doaj,False,Open Access,False,False,https://doi.org/10.3923/ajit.2011.84.95
Adesina Sodiya,Neural network based intrusion detection systems,2014,17,https://doi.org/10.5120/18705-9636,40432000,AS Sodiya and OA Ojesanmi and OC Akinola and O Aborisade,International Journal of computer applications,0.0,0,0,0,0,0,0,0,False,True,doaj,False,Open Access,False,False,https://doi.org/10.5120/18705-9636
Adesina Sodiya,A Users' Awareness Study and Influence of Socio-Demography Perception of Anti-Phishing Security Tips.,2018,16,https://doi.org/10.18267/j.aip.119,,Abdul A Orunsolu and Omorinola Afolabi and Adesina Simon Sodiya and Adio T Akinwale,Acta Informatica Pragensia,0.0,0,0,0,0,0,0,0,False,True,doaj,False,Open Access,True,False,https://doi.org/10.18267/j.aip.119
Adesina Sodiya,An adaptive and collaborative server-side SMS spam filtering scheme using artificial immune system,2015,16,https://doi.org/10.1080/19393555.2015.1078017,,Adebukola S Onashoga and Olusola O Abayomi-Alli and Adesina S Sodiya and David A Ojo,Information Security Journal: A Global Perspective,0.0,0,0,0,0,0,0,0,False,True,doaj,False,Open Access,False,False,https://doi.org/10.1080/19393555.2015.1078017
Adesina Sodiya,An Improved Semi-Global Alignment Algorithm for Masquerade Detection.,2011,16,https://doi.org/10.15623/ijret.2016.0516029,,Adesina S Sodiya and Olusegun Folorunso and Saidat Adebukola Onashoga and Omoniyi Paul Ogunderu,Int. J. Netw. Secur.,0.25,0,0,0,0,1,0,0,True,True,doaj,False,Open Access,False,False,https://doi.org/10.15623/ijret.2016.0516029
Adesina Sodiya,A secure e-voting architecture,2011,16,https://doi.org/10.1109/itng.2011.67,,Adesina S Sodiya and SA Onashoga and DI Adelani,N/A,0.0,0,0,0,0,0,0,0,False,True,doaj,False,Open Access,False,False,https://doi.org/10.1109/itng.2011.67
Adesina Sodiya,DT-Model: a classification model for distributed denial of service attacks and flash events,2022,15,https://doi.org/10.1007/s41870-022-00946-5,,CO Tinubu and AS Sodiya and OA Ojesanmi and EO Adeleke and AO Adebowale,International Journal of Information Technology,0.0,0,0,0,0,0,0,0,False,True,doaj,False,Open Access,False,False,https://doi.org/10.1007/s41870-022-00946-5
Adesina Sodiya,An Anti-Phishing Kit Scheme for Secure Web Transactions.,2017,15,https://doi.org/10.5220/0006074900150024,,Abdul A Orunsolu and Adesina S Sodiya and AT Akinwale and BI Olajuwon,N/A,0.0,0,0,0,0,0,0,0,False,True,doaj,False,Open Access,False,False,https://doi.org/10.5220/0006074900150024
Adesina Sodiya,A credible cost-sensitive model for intrusion response selection,2012,13,https://doi.org/10.1109/cason.2012.6412406,,Aderonke Justina Ikuomola and Adesina Simon Sodiya,N/A,0.0,0,0,0,0,0,0,0,False,True,doaj,False,Open Access,False,False,https://doi.org/10.1109/cason.2012.6412406
Adesina Sodiya,Linkcalculator–an efficient link-based phishing detection tool,2020,12,https://doi.org/10.26480/aim.02.2020.37.44,,Orunsolu Abiodun and AS Sodiya and SO Kareem,Acta Informatica Malaysia,0.0,0,0,0,0,0,0,0,False,True,doaj,False,Open Access,False,False,https://doi.org/10.26480/aim.02.2020.37.44
Adesina Sodiya,An empirical evaluation of security tips in phishing prevention: A case study of nigerian banks,2017,12,https://doi.org/10.35912/jakman.v4i1.1527,,Abdul Abiodun Orunsolu and AS Sodiya and AT Akinwale and BI Olajuwon and MA Alaran and OO Bamgboye and OA Afolabi,International Journal of Electronics and Information Engineering,0.0,0,0,0,0,0,0,0,False,True,doaj,False,Open Access,False,False,https://doi.org/10.35912/jakman.v4i1.1527
Adesina Sodiya,Components-Based Access Control Architecture.,2009,11,https://doi.org/10.28945/3374,,Adesina S Sodiya and Adebukola S Onashoga,Issues in Informing Science & Information Technology,0.0,0,0,0,0,0,0,0,False,True,doaj,False,Open Access,False,False,https://doi.org/10.28945/3374
Adesina Sodiya,Software security risk analysis using fuzzy expert system,2008,11,https://doi.org/10.1109/wac.2002.1049581,32948169,AS Sodiya and HOD Longe and OM Fasan,INFOCOMP Journal of Computer Science,0.0,0,0,0,0,0,0,0,False,True,doaj,False,Open Access,False,False,https://doi.org/10.1109/wac.2002.1049581
Adesina Sodiya,The design of an adaptive incremental association rule mining system,2015,10,https://doi.org/10.1002/widm.1086,,Adewale O Ogunde and Olusegun Folorunso and Adesina S Sodiya,Proceedings of the World Congress on Engineering,0.0,0,0,0,0,0,0,0,False,True,doaj,False,Open Access,False,False,https://doi.org/10.1002/widm.1086
Adesina Sodiya,An assessment of knowledge management capabilities of Nigerian banking institutions,2006,9,https://doi.org/10.12688/f1000research.18223.1,,A Sodiya and SA Onashoga and BM Dansu and BA Adeleye,College of Natural Sciences Proceedings,0.0,0,0,0,0,0,0,0,False,True,doaj,False,Open Access,False,False,https://doi.org/10.12688/f1000research.18223.1
Adesina Sodiya,A dynamic intrusion detection system for critical information infrastructure,2023,8,https://doi.org/10.1016/j.sciaf.2023.e01817,40082461,AO Adejimi and AS Sodiya and OA Ojesanmi and OJ Falana and CO Tinubu,N/A,0.0,0,0,0,0,0,0,0,False,True,doaj,False,Open Access,False,False,https://doi.org/10.1016/j.sciaf.2023.e01817
Adesina Sodiya,PHISHGEM: a mobile game-based learning for phishing awareness,2023,8,https://doi.org/10.1080/23742917.2023.2167276,,Carolyn Oreoluwa Tinubu and Olorunjube James Falana and Enoch Okikijesu Oluwumi and Adesina Simon Sodiya and Sodiq Ademola Rufai,Journal of Cyber Security Technology,0.0,0,0,0,0,0,0,0,False,True,doaj,False,Open Access,True,False,https://doi.org/10.1080/23742917.2023.2167276
Adesina Sodiya,"A framework for collaborative, adaptive and cost sensitive intrusion response system",2010,8,https://doi.org/10.1109/ceec.2010.5606485,,Aderonke J Ikuomola and Adesina S Sodiya and Joshua O Nehinbe,N/A,0.0,0,0,0,0,0,0,0,False,True,doaj,False,Open Access,False,False,https://doi.org/10.1109/ceec.2010.5606485
Adesina Sodiya,A Cognitive Rail Track Breakage Detection System Using Artificial Neural Network.,2021,6,https://doi.org/10.2478/acss-2021-0010,,Olufunke Rebecca Vincent and Yetunde Ebunoluwa Babalola and Adesina Simon Sodiya and Olusola John Adeniran,Appl. Comput. Syst.,0.0,0,0,0,0,0,0,0,False,True,doaj,False,Open Access,False,False,https://doi.org/10.2478/acss-2021-0010
Adesina Sodiya,A survivability model for object-oriented software systems,2012,6,https://doi.org/10.1109/cason.2012.6412416,,Adesina S Sodiya and Dada O Aborisade and Aderonke J Ikuomola,N/A,0.0,0,0,0,0,0,0,0,False,True,doaj,False,Open Access,False,False,https://doi.org/10.1109/cason.2012.6412416
Adesina Sodiya,An expert system-based site security officer,2007,6,https://doi.org/10.2498/cit.1000961,,Olusola Adeniran and Ronke Ikuomola and Adesina Simon Sodiya,Journal of computing and information technology,0.0,0,0,0,0,0,0,0,False,True,doaj,False,Open Access,False,False,https://doi.org/10.2498/cit.1000961
Adesina Sodiya,An efficient and secured graphical authentication system,2016,5,https://doi.org/10.26480/aim.01.2022.17.21,37097723,OJ Elugbadebo and AS Sodiya and O Folorunso,2nd International conference on nintelligent Computing and Emerging Technology (ICET),2.0,4,0,0,0,1,0,0,True,True,doaj,False,Open Access,False,False,https://doi.org/10.26480/aim.01.2022.17.21
Adesina Sodiya,Adaptive neuro-fuzzy system for malware detection,2014,5,https://doi.org/10.46481/jnsps.2025.2172,27611312,AS Sodiya and OJ Falana and SA Onashoga and BS Badmus,Journal of Computer Science and Its Application,7.949999999999999,8,0,0,0,1,0,0,True,True,doaj,False,Open Access,False,False,https://doi.org/10.46481/jnsps.2025.2172
Adesina Sodiya,Preventing authentication systems from keylogging attack,2011,5,https://doi.org/10.1080/15536548.2011.10855909,,A Sf Sodiya and O Folorunso and PB Komolafe and OP Ogunderu,Journal of Information Privacy and Security,0.0,0,0,0,0,0,0,0,False,True,doaj,False,Open Access,False,False,https://doi.org/10.1080/15536548.2011.10855909
Adesina Sodiya,A behavioral model for characterizing flooding distributed denial of service attacks,2023,4,https://doi.org/10.1007/s41870-022-01097-3,,Oreoluwa Tinubu and Adesina Sodiya and Olusegun Ojesanmi,International Journal of Information Technology,0.0,0,0,0,0,0,0,0,False,True,doaj,False,Open Access,False,False,https://doi.org/10.1007/s41870-022-01097-3
Adesina Sodiya,A secured mobile-based password manager,2016,4,https://doi.org/10.1109/icdipc.2016.7470800,,S Agholor and AS Sodiya and AT Akinwale and OJ Adeniran,N/A,0.0,0,0,0,0,0,0,0,False,True,doaj,False,Open Access,False,False,https://doi.org/10.1109/icdipc.2016.7470800
Adesina Sodiya,"User Interface Design, And Ergonomics",2016,4,https://doi.org/10.1201/9781003302933-7,40431832,AS Sodiya and AA Afolorunso,The National Open University of Nigeria,0.0,0,0,0,0,0,0,0,False,True,doaj,False,Open Access,False,False,https://doi.org/10.1201/9781003302933-7
Adesina Sodiya,A Critical Analysis Of Existing Sms Spam Filtering Approaches,2015,4,https://doi.org/10.31142/ijtsrd12850,,OO Abayomi-Alli and SA Onashoga and AS Sodiya and DA Ojo,AIT 2015,0.0,0,0,0,0,0,0,0,False,True,doaj,False,Open Access,False,False,https://doi.org/10.31142/ijtsrd12850
Adesina Sodiya,USERS’PASSWORD SELECTION AND MANAGEMENT METHODS: IMPLICATIONS FOR NIGERIA’S CASHLESS SOCIETY,2012,4,https://doi.org/10.1109/mc.1973.6540214,,AS Sodiya and S Agholor,Professor Sola ADEROUNMU,3.0,0,0,0,0,0,0,0,False,True,doaj,False,Open Access,False,False,https://doi.org/10.1109/mc.1973.6540214
Adesina Sodiya,Towards an adaptive multi-agent architecture for association rule mining in distributed databases,2011,4,https://doi.org/10.1109/icastech.2011.6145155,,Adewale Opeoluwa Ogunde and Olusegun Folorunso and Adesina Simon Sodiya and James Adedayo Oguntuase,N/A,0.0,0,0,0,0,0,0,0,False,True,doaj,False,Open Access,False,False,https://doi.org/10.1109/icastech.2011.6145155
Adesina Sodiya,Mining of prevalent ailments in a health database using FP-growth algorithm.,2009,4,https://doi.org/10.14419/ijet.v7i1.7.9573,,Saidat Adebukola Onashoga and Adesina S Sodiya and AT Akinwale and OE Falola,N/A,0.0,0,0,0,0,0,0,0,False,True,doaj,False,Open Access,False,False,https://doi.org/10.14419/ijet.v7i1.7.9573
Adesina Sodiya,Maintaining privacy in anomaly‐based intrusion detection systems,2005,4,https://doi.org/10.1108/09685220510582683,,Adesina S Sodiya and HOD Longe and Adio T Akinwale,Information management & computer security,0.0,0,0,0,0,0,0,0,False,True,doaj,False,Open Access,False,False,https://doi.org/10.1108/09685220510582683
Adesina Sodiya,Performance Assessment of some Phishing predictive models based on Minimal Feature corpus,2021,3,https://doi.org/10.58940/1558-7223.1692,,Orunsolu Abdul Abiodun and Sodiya AS and Kareem SO,"Journal of Digital Forensics, Security and Law",0.0,0,0,0,0,0,0,0,False,True,doaj,False,Open Access,False,False,https://doi.org/10.58940/1558-7223.1692
Adesina Sodiya,A Framework for Protecting Users' Privacy in Cloud,2019,3,https://doi.org/10.4018/978-1-5225-8897-9.ch023,39864592,Adesina S Sodiya and B Adegbuyi,N/A,84.66,1,0,11,2,0,0,0,True,True,doaj,False,Open Access,False,False,https://doi.org/10.4018/978-1-5225-8897-9.ch023
Adesina Sodiya,Resolving drdos attack in cloud database service using common source ip and incremental replacement strategy,2018,3,https://doi.org/10.1007/978-3-319-56991-8_52,,Aborisade Dada Olaniyi and Reich Christoph and Sodiya Adesina Simon and Akinwale Adio Taofeek and Biodun S Badmus,N/A,0.0,0,0,0,0,0,0,0,False,True,doaj,False,Open Access,False,False,https://doi.org/10.1007/978-3-319-56991-8_52
Adesina Sodiya,A User's Awareness Study of Anti-Phishing Security Tips,2016,3,https://doi.org/10.1016/j.cose.2006.10.009,,AA Orunsolu and MA Alaran and OO Bamgboye and AS Sodiya and AO Omorinola,Proceedings of the 2nd International Conference on Intelligent Computing and Emerging Technologies,3.0,0,0,0,0,0,0,0,False,True,doaj,False,Open Access,True,False,https://doi.org/10.1016/j.cose.2006.10.009
Adesina Sodiya,Data mining-based intelligent equipment maintenance system in telecommunication network,2005,3,https://doi.org/10.17580/gzh.2017.12.13,,AS Sodiya and HOD Longe and SA Ibrahim,Journal of Applied Computer Science,0.0,0,0,0,0,0,0,0,False,True,doaj,False,Open Access,False,False,https://doi.org/10.17580/gzh.2017.12.13
Adesina Sodiya,A structured model for identification and classification of critical information infrastructure,2024,2,https://doi.org/10.1504/ijcis.2024.137407,,Alaba O Adejimi and Adesina Simon Sodiya and Olusegun A Ojesanmi and Olusola J Adeniran,International Journal of Critical Infrastructures,0.0,0,0,0,0,0,0,0,False,True,doaj,False,Open Access,False,False,https://doi.org/10.1504/ijcis.2024.137407
Adesina Sodiya,A Preferential Analysis of Existing Password Managers from End-Users’ View Point,2016,2,https://doi.org/10.17781/p002216,,S Agholor and AS Sodiya and AT Akinwale and OJ Adeniran and DO Aborisade,International Journal of Cyber-Security and Digital Forensics,0.0,0,0,0,0,0,0,0,False,True,doaj,False,Open Access,False,False,https://doi.org/10.17781/p002216
Adesina Sodiya,A Middleware based Anti-Phishing Architecture,2016,2,https://doi.org/10.1007/s10586-013-0320-5,,AA Orunsolu and AS Sodiya and AT Akinwale,"Cyber Security Trends, Abeokuta",0.0,0,0,0,0,0,0,0,False,True,doaj,False,Open Access,False,False,https://doi.org/10.1007/s10586-013-0320-5
Adesina Sodiya,GENERIC PREDICTION OF MALARIA TREATMENT OUTCOMES USING BIG DATA ANALYTICS,2016,2,https://doi.org/10.1007/978-3-031-69986-3_22,,AS Sodiya,for National Safety & Security,0.0,0,0,0,0,0,0,0,False,True,doaj,False,Open Access,True,False,https://doi.org/10.1007/978-3-031-69986-3_22
Adesina Sodiya,An Improved Cost-Sensitive Intrusion Response Model.,2013,2,https://doi.org/10.1007/978-1-4419-8849-2_118,,Aderonke J Ikuomola and Adesina S Sodiya and Adio T Akinwale and Dada O Aborisade,Journal of Information Assurance & Security,0.0,0,0,0,0,0,0,0,False,True,doaj,False,Open Access,False,False,https://doi.org/10.1007/978-1-4419-8849-2_118
Adesina Sodiya,AN ASSESSMENT OF FEEDBACK MECHANISM OF SOME SELECTED WEBSITES TOWARDS IMPROVED END-USERS’PASSWORD,2013,2,https://doi.org/10.35784/jcsi.2462,,S Agholor and AS Sodiya,National Security &,0.0,0,0,0,0,0,0,0,False,True,doaj,False,Open Access,False,False,https://doi.org/10.35784/jcsi.2462
Adesina Sodiya,A one-time server-specific password authentication scheme,2012,2,https://doi.org/10.2498/cit.1001983,,Adebukola Onashoga and Adesina Sodiya and A Afolorunso,Journal of computing and information technology,0.0,0,0,0,0,0,0,0,False,True,doaj,False,Open Access,False,False,https://doi.org/10.2498/cit.1001983
Adesina Sodiya,Networking and communication technology,2012,2,https://doi.org/10.2493/jjspe.53.1337,40448208,AS Sodiya,N/A,0.0,0,0,0,0,0,0,0,False,True,doaj,False,Open Access,False,False,https://doi.org/10.2493/jjspe.53.1337
Adesina Sodiya,On the Adaptivity of Distributed Association Rule Mining Agents,2012,2,https://doi.org/10.4018/978-1-59140-557-3.ch077,,Adewale Opeoluwa Ogunde and Olusegun Folorunso and Adesina Simon Sodiya,"The Fourth International Conference on Adaptive and Self-Adaptive Systems and Applications, Adaptive 2012 Conference, IARIA July 22nd–27th, Nice, France, www. iaria. org/conferences",0.0,0,0,0,0,0,0,0,False,True,doaj,False,Open Access,False,False,https://doi.org/10.4018/978-1-59140-557-3.ch077
Adesina Sodiya,Towards An Intelligent Multi-Agent Architecture for Association Rule Mining in Distributed Databases.,2011,2,https://doi.org/10.1109/icastech.2011.6145155,,AO Ogunde and O Folorunso and AS Sodiya and JA Oguntuase,Computing & Information Systems,0.0,0,0,0,0,0,0,0,False,True,doaj,False,Open Access,False,False,https://doi.org/10.1109/icastech.2011.6145155
Adesina Sodiya,The state of information security in south-western nigerian educational institutions,2011,2,https://doi.org/10.4018/ijrcm.303103,,AS Sodiya and SA Ibrahim and OB Ajayi,College of Natural Sciences Proceedings,0.0,0,0,0,0,0,0,0,False,True,doaj,False,Open Access,False,True,https://doi.org/10.4018/ijrcm.303103
Adesina Sodiya,An improved two‐tiered strategy to intrusion detection,2005,2,https://doi.org/10.1108/09685220510602040,,Adesina S Sodiya and HOD Longe,Information management & computer security,0.0,0,0,0,0,0,0,0,False,True,doaj,False,Open Access,False,False,https://doi.org/10.1108/09685220510602040
Adesina Sodiya,An Intelligent Model for DDoS Attack Detection and Flash Event Management,2022,1,https://doi.org/10.4018/ijdai.301212,,Oreoluwa Carolyn Tinubu and Adesina Simon Sodiya and Olusegun Ayodeji Ojesanmi and Emmanuel Oyeyemi Adeleke and Ahmad Alfawwaz Timehin,International Journal of Distributed Artificial Intelligence (IJDAI),0.0,0,0,0,0,0,0,0,False,True,doaj,False,Open Access,False,False,https://doi.org/10.4018/ijdai.301212
Adesina Sodiya,PEDAM: Priority execution based approach for detecting android malware,2020,1,https://doi.org/10.1007/978-3-030-80216-5_12,,Olorunjube James Falana and Adesina Simon Sodiya and Saidat Adebukola Onashoga and Anas Teju Oyewole,N/A,0.0,0,0,0,0,0,0,0,False,True,doaj,False,Open Access,False,False,https://doi.org/10.1007/978-3-030-80216-5_12
Adesina Sodiya,Towards detecting credit card frauds using Hidden Markov Model,2019,1,https://doi.org/10.4314/jcsia.v26i2.6,,CO Tinubu and DO Aborisade and AS Sodiya and SA Onashoga and MA Ganiyu,Journal of Computer Science and Its Application,0.0,0,0,0,0,0,0,0,False,True,doaj,False,Open Access,False,False,https://doi.org/10.4314/jcsia.v26i2.6
Adesina Sodiya,Ontology of input validation attack patterns on web applications,2013,1,https://doi.org/10.3923/jse.2014.116.126,,Adio Akinwale and Joseph Shonubi and Adebayo Adekoya and Adesina Sodiya and Tosin Mewomo,Informatyka Ekonomiczna,0.0,0,0,0,0,0,0,0,False,True,doaj,False,Open Access,False,False,https://doi.org/10.3923/jse.2014.116.126
Adesina Sodiya,A Confidential Electronic Result Transfer Using a Hybrid XML Security Scheme,2011,1,https://doi.org/10.1109/itng.2011.77,,SA Onashoga and Adesina S Sodiya,N/A,0.0,0,0,0,0,0,0,0,False,True,doaj,False,Open Access,False,False,https://doi.org/10.1109/itng.2011.77
Adesina Sodiya,Derivation of Database Keys’ Operations,2011,1,https://doi.org/10.28945/1418,36991730,Adio Taofiki Akinwale and Olusegun Folorunso and Adesina S Sodiya,Issues in Informing Science and Information Technology,0.0,0,0,0,0,0,0,0,False,True,doaj,False,Open Access,False,False,https://doi.org/10.28945/1418
Adesina Sodiya,A countermeasure algorithm for password guessing attacks,2011,1,https://doi.org/10.1504/ijics.2011.044824,23887085,Adesina S Sodiya and AA Afolorunso and Omoniyi P Ogunderu,International Journal of Information and Computer Security,3.5,1,0,0,0,0,0,0,False,True,doaj,False,Open Access,False,False,https://doi.org/10.1504/ijics.2011.044824
Adesina Sodiya,MANAGING ICT INFRASTRUCTURE IN HIGHER EDUCATIONAL INSTITUTIONS,2010,1,https://doi.org/10.21922/srjhsel.v10i53.11646,38642570,AS Sodiya and SA Onashoga and OD Rosanwo and BH Lawal,College of Natural Sciences Proceedings,301.06000000000006,97,0,30,2,3,1,0,True,True,doaj,False,Open Access,False,True,https://doi.org/10.21922/srjhsel.v10i53.11646
Adesina Sodiya,An Agent-based framework for secure e-voting,2010,1,https://doi.org/10.14257/ijunesst.2015.8.1.21,,AA Orunsolu and AS Sodiya and SA Onashoga and AA Afolorunso,MI I S IINSINIS1 ill,0.0,0,0,0,0,0,0,0,False,True,doaj,False,Open Access,False,False,https://doi.org/10.14257/ijunesst.2015.8.1.21
Adesina Sodiya,Programming and algorithms,2008,1,https://doi.org/10.1007/978-1-4842-3721-2_2,40448208,AS Sodiya,N/A,0.0,0,0,0,0,0,0,0,False,True,doaj,False,Open Access,False,False,https://doi.org/10.1007/978-1-4842-3721-2_2
Adesina Sodiya,A new combined strategy to intrusion detection,2004,1,https://doi.org/10.1108/09685220410518810,39937819,AS Sodiya and HOD Longe,Journal of Applied Computer Science,0.0,0,0,0,0,0,0,0,False,True,doaj,False,Open Access,False,False,https://doi.org/10.1108/09685220410518810
Adesina Sodiya,An Optimal Jobs’ Admission Control System for Priority-Based Queue Network,2024,0,https://doi.org/10.1007/s42979-024-03393-0,,Adegbuyi David Gbadebo and Adio Taofiki Akinwale and Adesina Simon Sodiya and Simeon Ayoola Akinleye,SN Computer Science,0.0,0,0,0,0,0,0,0,False,True,doaj,False,Open Access,False,False,https://doi.org/10.1007/s42979-024-03393-0
Adesina Sodiya,A Super Learner Ensemble-based Intrusion Detection System to Mitigate Network Attacks,2024,0,https://doi.org/10.1109/icdabi63787.2024.10800423,,Ojo John Ajayi and Adesina Simon Sodiya and Mustapha Aminu Bagiwa and Toluwase Ayobami Olowookere,N/A,0.0,0,0,0,0,0,0,0,False,True,doaj,False,Open Access,False,False,https://doi.org/10.1109/icdabi63787.2024.10800423
Adesina Sodiya,Towards Building a Smart Water Management System (SWAMS) in Nigeria,2024,0,https://doi.org/10.1109/melecon56669.2024.10608754,,Oluwaseun Bamgboye and Christos Chrysoulas and Xiaodong Liu and Tess Watt and Adesina Sodiya and Mathew Oyeleye and Sampath Kalutharage,N/A,0.0,0,0,0,0,0,0,0,False,True,doaj,False,Open Access,False,False,https://doi.org/10.1109/melecon56669.2024.10608754
