Author,Paper Title,Year,Citations,DOI,PMID,Authors,Journal,Altmetric Score,Twitter Mentions,Reddit Mentions,News Mentions,Blog Mentions,Facebook Mentions,Wikipedia Mentions,Policy Mentions,Media Mentioned,Open Access,OA Status,Preprint,Publication Type,Public Health Impact,Capacity Building,Paper Link
Saranath Lawpoolsri,"Knowledge, attitude, and practices toward COVID-19 among the international travelers in Thailand",2021,20,https://doi.org/10.1186/s40794-021-00155-1,34776014,Suttiporn Prapaso and Viravarn Luvira and Saranath Lawpoolsri and Archin Songthap and Watcharapong Piyaphanee and Wiwat Chancharoenthana and Sant Muangnoicharoen and Punnee Pitisuttithum and Pornthep Chanthavanich,"Tropical diseases, travel medicine and vaccines",1.5,4,0,0,0,0,0,0,False,True,doaj,False,Open Access,False,False,https://doi.org/10.1186/s40794-021-00155-1
Saranath Lawpoolsri,Health problems among Thai tourists returning from India,2017,20,https://doi.org/10.1093/jtm/tax013,28426113,Jutarmas Olanwijitwong and Watcharapong Piyaphanee and Kittiyod Poovorawan and Saranath Lawpoolsri and Pornthep Chanthavanich and Pongdej Wichainprasast and Terapong Tantawichien,Journal of travel medicine,0.0,0,0,0,0,0,0,0,False,True,doaj,False,Open Access,False,False,https://doi.org/10.1093/jtm/tax013
Saranath Lawpoolsri,Diagnostic performance of Dengue NS1 and antibodies by serum concentration technique,2023,19,https://doi.org/10.3390/tropicalmed8020117,39528965,Viravarn Luvira and Charin Thawornkuno and Saranath Lawpoolsri and Narin Thippornchai and Chatnapa Duangdee and Thundon Ngamprasertchai and Pornsawan Leaungwutiwong,Tropical Medicine and Infectious Disease,0.75,2,0,0,0,0,0,0,False,True,doaj,False,Open Access,False,False,https://doi.org/10.3390/tropicalmed8020117
Saranath Lawpoolsri,Evaluation of immunization Services for Children of migrant workers along Thailand–Myanmar border: compliance with global vaccine action plan (2011–2020),2020,19,https://doi.org/10.3390/vaccines8010068,32033393,Chamnan Pinna and Jaranit Kaewkungwal and Weerawan Hattasingh and Witaya Swaddiwudhipong and Rakdaw Methakulchart and Aree Moungsookjareoun and Saranath Lawpoolsri,Vaccines,7.75,3,0,0,0,0,0,0,False,True,doaj,False,Open Access,False,False,https://doi.org/10.3390/vaccines8010068
Saranath Lawpoolsri,Women’s perceptions of using mobile phones for maternal and child health support in Afghanistan: cross-sectional survey,2018,19,https://doi.org/10.2196/mhealth.9504,29636317,Fazal Yamin and Jaranit Kaewkungwal and Pratap Singhasivanon and Saranath Lawpoolsri,JMIR mHealth and uHealth,5.6,4,0,0,0,2,0,0,True,True,doaj,False,Open Access,False,False,https://doi.org/10.2196/mhealth.9504
Saranath Lawpoolsri,Clinical manifestations and treatment outcomes of scrub typhus in a rural health care facility on the Thailand-Myanmar border,2017,19,https://doi.org/10.3855/jidc.8912,,Tobias Brummaier and Chatporn Kittitrakul and Vorada Choovichian and Saranath Lawpoolsri and Chayadol Namaik-Larp and Yupaporn Wattanagoon,Journal of infection in developing countries,0.0,0,0,0,0,0,0,0,False,True,doaj,False,Open Access,False,False,https://doi.org/10.3855/jidc.8912
Saranath Lawpoolsri,Incidence and spectrum of health problems among travelers to Laos,2014,19,https://doi.org/10.1111/jtm.12107,24612354,Watcharapong Piyaphanee and Chatporn Kittitrakul and Saranath Lawpoolsri and Waraluk Tangkanakul and Nattakrit Sa‐Ngiamsak and Piyapong Nasok and Sirasit Wongchai and Thitiya Ponam and Pongdej Wichianprasat and Weerapong Phumratanaprapin,Journal of Travel Medicine,0.25,0,0,0,0,1,0,0,True,True,doaj,False,Open Access,False,False,https://doi.org/10.1111/jtm.12107
Saranath Lawpoolsri,Accuracy of childhood asthma control test among Thai childhood asthma patients,2018,18,https://doi.org/10.12932/ap-300517-0094,29223149,Sirasuda Sommanus and Chalerat Direkwattanachai and Saranath Lawpoolsri and Raweerat Sitcharungsi,Asian Pacific Journal of Allergy and Immunology,0.25,1,0,0,0,0,0,0,False,True,doaj,False,Open Access,False,False,https://doi.org/10.12932/ap-300517-0094
Saranath Lawpoolsri,"Effectiveness of dengue training programmes on prevention and control among high school students in the Yangon region, Myanmar",2023,17,https://doi.org/10.2139/ssrn.4128782,37292340,Soe Htet Aung and Suparat Phuanukoonnon and Aye Mon Mon Kyaw and Saranath Lawpoolsri and Patchara Sriwichai and Ngamphol Soonthornworasiri and Podjanee Jittamala,Heliyon,0.0,0,0,0,0,0,0,0,False,True,doaj,False,Open Access,False,True,https://doi.org/10.2139/ssrn.4128782
Saranath Lawpoolsri,Antimicrobial stewardship in tropical infectious diseases: focusing on dengue and malaria,2022,17,https://doi.org/10.3390/tropicalmed7080159,36006251,Ashley Siribhadra and Thundon Ngamprasertchai and Pinyo Rattanaumpawan and Saranath Lawpoolsri and Viravarn Luvira and Punnee Pitisuttithum,N/A,11.5,3,0,1,0,0,0,0,True,True,doaj,False,Open Access,True,False,https://doi.org/10.3390/tropicalmed7080159
Saranath Lawpoolsri,"User acceptance of electronic medical record system: implementation at Marie Stopes International, Myanmar",2020,17,https://doi.org/10.4258/hir.2020.26.3.185,,Win Min Thit and Sai Wai Yan Myint Thu and Jaranit Kaewkungwal and Ngamphol Soonthornworasiri and Nawanan Theera-Ampornpunt and Boonchai Kijsanayotin and Saranath Lawpoolsri and Sid Naing and Wirichada Pan-Ngum,Healthcare Informatics Research,0.0,0,0,0,0,0,0,0,False,True,doaj,False,Open Access,False,False,https://doi.org/10.4258/hir.2020.26.3.185
Saranath Lawpoolsri,Effectiveness of using mobile phone image capture for collecting secondary data: a case study on immunization history data among children in remote areas of Thailand,2015,17,https://doi.org/10.2196/mhealth.4183,,Kasemsak Jandee and Jaranit Kaewkungwal and Amnat Khamsiriwatchara and Saranath Lawpoolsri and Waranya Wongwit and Peerawat Wansatid,JMIR mHealth and uHealth,0.75,1,0,0,0,2,0,0,True,True,doaj,False,Open Access,False,False,https://doi.org/10.2196/mhealth.4183
Saranath Lawpoolsri,Health literacy toward zoonotic diseases among livestock farmers in Vietnam,2020,16,https://doi.org/10.1177/1178630220932540,32733124,Khuong Cao Ba and Jaranit Kaewkungwal and Oranut Pacheun and Uyen Nguyen Thi To and Saranath Lawpoolsri,Environmental health insights,0.75,1,0,0,0,1,0,0,True,True,doaj,False,Open Access,False,False,https://doi.org/10.1177/1178630220932540
Saranath Lawpoolsri,"Addressing challenges faced by insecticide spraying for the control of dengue fever in Bangkok, Thailand: a qualitative approach",2018,16,https://doi.org/10.1093/inthealth/ihy038,29912451,Peeradone Srichan and Saranath Lawpoolsri Niyom and Oranut Pacheun and Sopon Iamsirithawon and Supawat Chatchen and Caroline Jones and Lisa J White and Wirichada Pan-Ngum,International Health,10.18,6,0,0,1,0,0,0,True,True,doaj,False,Open Access,False,False,https://doi.org/10.1093/inthealth/ihy038
Saranath Lawpoolsri,Persuasion and licensure: a randomized controlled intervention trial to increase licensure rates among Maryland motorcycle owners,2007,16,https://doi.org/10.1080/15389580600944235,17366335,Elisa R Braver and Joseph A Kufera and Karen D Volpini and Saranath Lawpoolsri and John J Joyce and Melvin T Alexander and Patricia Ellison-Potter,Traffic injury prevention,3.0,0,0,0,0,0,0,0,False,True,doaj,False,Open Access,True,False,https://doi.org/10.1080/15389580600944235
Saranath Lawpoolsri,Evaluation of the use of GeneXpert MTB/RIF in a zone with high burden of tuberculosis in Thailand,2022,15,https://doi.org/10.1371/journal.pone.0271130,,Nathakorn Pongpeeradech and Yuthichai Kasetchareo and Charoen Chuchottaworn and Saranath Lawpoolsri and Udomsak Silachamroon and Jaranit Kaewkungwal,Plos one,14.25,2,0,1,0,0,0,0,True,True,doaj,False,Open Access,False,False,https://doi.org/10.1371/journal.pone.0271130
Saranath Lawpoolsri,Effects of edutainment on knowledge and perceptions of Lisu mothers about the immunisation of their children,2016,15,https://doi.org/10.1177/0017896915569086,,Ngwa Sar Dway and Ngamphol Soonthornworasiri and Kasemsak Jandee and Saranath Lawpoolsri and Wirichada Pan-Ngum and Daorirk Sinthuvanich and Jaranit Kaewkungwal,Health Education Journal,0.0,0,0,0,0,0,0,0,False,True,doaj,False,Open Access,False,False,https://doi.org/10.1177/0017896915569086
Saranath Lawpoolsri,Assessing the impacts of short-course multidrug-resistant tuberculosis treatment in the Southeast Asia Region using a mathematical modeling approach,2021,14,https://doi.org/10.1371/journal.pone.0248846,33770104,Win Min Han and Wiriya Mahikul and Thomas Pouplin and Saranath Lawpoolsri and Lisa J White and Wirichada Pan-Ngum,PloS one,2.95,4,0,0,0,0,0,0,False,True,doaj,False,Open Access,True,False,https://doi.org/10.1371/journal.pone.0248846
Saranath Lawpoolsri,Immunogenicity of a fractional or full third dose of AZD1222 vaccine or BNT162b2 messenger RNA vaccine after two doses of CoronaVac vaccines against the Delta and Omicron variants,2023,13,https://doi.org/10.1016/j.ijid.2023.01.022,40371954,Suvimol Niyomnaitham and Anan Jongkaewwattana and Atibordee Meesing and Nawamin Pinpathomrat and Sira Nanthapisal and Nattiya Hirankarn and Sarawut Siwamogsatham and Suppachok Kirdlarp and Romanee Chaiwarith and Saranath Lawpoolsri and Supranee Phanthanawiboon and Arunee Thitithanyanont and Pokrath Hansasuta and Sansanee Chaiyaroj and Punnee Pitisuttithum,International Journal of Infectious Diseases,0.0,0,0,0,0,0,0,0,False,True,doaj,False,Open Access,False,False,https://doi.org/10.1016/j.ijid.2023.01.022
Saranath Lawpoolsri,Characteristics of drug-induced liver injury in chronic liver disease: results from the Thai Association for the Study of the Liver (THASL) DILI Registry,2022,13,https://doi.org/10.14218/jcth.2021.00479,,Sakkarin Chirapongsathorn and Wattana Sukeepaisarnjaroen and Sombat Treeprasertsuk and Roonguedee Chaiteerakij and Pichaporn Surawongsin and Chanunta Hongthanakorn and Sith Siramolpiwat and Naichaya Chamroonkul and Chalermrat Bunchorntavakul and Watcharasak Chotiyaputta and Kittiyod Poovorawan and Rattana Boonsirichan and Saranath Lawpoolsri and Chinnavat Sutivana and Abhasnee Sobhonslidsuk,Journal of Clinical and Translational Hepatology,10.746,1,0,0,1,0,0,0,True,True,doaj,False,Open Access,False,False,https://doi.org/10.14218/jcth.2021.00479
Saranath Lawpoolsri,Malaria research for tailored control and elimination strategies in the Greater Mekong Subregion,2022,12,https://doi.org/10.4269/ajtmh.21-1268,36228914,Jetsumon Sattabongkot and Liwang Cui and Sirasate Bantuchai and Sadudee Chotirat and Jaranit Kaewkungwal and Amnat Khamsiriwatchara and Kirakorn Kiattibutr and Myat Phone Kyaw and Saranath Lawpoolsri and Nay Yi Yi Linn and Lynette Menezes and Jun Miao and Wang Nguitragool and Daniel Parker and Pathomporn Prikchoo and Wanlapa Roobsoong and Patiwat Sa-Angchai and Yudthana Samung and Jeeraphat Sirichaisinthop and Patchara Sriwichai and Kritsana Suk-Uam and Suwich Thammapalo and Baomin Wang and Daibin Zhong,The American Journal of Tropical Medicine and Hygiene,0.5,2,0,0,0,0,0,0,False,True,doaj,False,Open Access,True,False,https://doi.org/10.4269/ajtmh.21-1268
Saranath Lawpoolsri,Dynamics of Plasmodium vivax populations in border areas of the Greater Mekong sub-region during malaria elimination,2020,12,https://doi.org/10.1186/s12936-020-03221-9,32268906,Yuling Li and Yubing Hu and Yan Zhao and Qinghui Wang and Huguette Gaelle Ngassa Mbenda and Veerayuth Kittichai and Saranath Lawpoolsri and Jetsumon Sattabongkot and Lynette Menezes and Xiaoming Liu and Liwang Cui and Yaming Cao,Malaria Journal,0.0,0,0,0,0,0,0,0,False,True,doaj,False,Open Access,True,False,https://doi.org/10.1186/s12936-020-03221-9
Saranath Lawpoolsri,Spatiotemporal Epidemiology of Tuberculosis in Thailand from 2011 to 2020,2022,11,https://doi.org/10.3390/biology11050755,35625483,Kawin Chinpong and Kaewklao Thavornwattana and Peerawich Armatrmontree and Peerut Chienwichai and Saranath Lawpoolsri and Udomsak Silachamroon and Richard J Maude and Chawarat Rotejanaprasert,Biology,1.85,2,0,0,0,0,0,0,False,True,doaj,False,Open Access,True,False,https://doi.org/10.3390/biology11050755
Saranath Lawpoolsri,Customized-language voice survey on mobile devices for text and image data collection among ethnic groups in Thailand: a proof-of-concept study,2014,11,https://doi.org/10.2196/mhealth.3058,25098776,Kasemsak Jandee and Saranath Lawpoolsri and Pimsurang Taechaboonsermsak and Amnat Khamsiriwatchara and Peerawat Wansatid and Jaranit Kaewkungwal,JMIR mHealth and uHealth,2.25,3,0,0,0,0,0,0,False,True,doaj,False,Open Access,False,False,https://doi.org/10.2196/mhealth.3058
Saranath Lawpoolsri,Assessment of malaria risk in Southeast Asia: a systematic review,2023,10,https://doi.org/10.1186/s12936-023-04772-3,38740597,Chaitawat Sa-Ngamuang and Saranath Lawpoolsri and Myat Su Yin and Thomas Barkowsky and Liwang Cui and Jetsumon Prachumsri and Peter Haddawy,N/A,1.0,3,0,0,0,0,0,0,False,True,doaj,False,Open Access,True,False,https://doi.org/10.1186/s12936-023-04772-3
Saranath Lawpoolsri,Multidisciplinary investigations of sustained malaria transmission in the Greater Mekong Subregion,2022,10,https://doi.org/10.4269/ajtmh.21-1267,36228909,Liwang Cui and Jetsumon Sattabongkot and Pyae Linn Aung and Awtum Brashear and Yaming Cao and Jaranit Kaewkungwal and Amnat Khamsiriwatchara and Myat Phone Kyaw and Saranath Lawpoolsri and Lynette Menezes and Jun Miao and Wang Nguitragool and Daniel Parker and Suparat Phuanukoonnon and Wanlapa Roobsoong and Faiza Siddiqui and Myat Thu Soe and Patchara Sriwichai and Zhaoqing Yang and Yan Zhao and Daibin Zhong,The American journal of tropical medicine and hygiene,1.0,3,0,0,0,0,0,0,False,True,doaj,False,Open Access,True,False,https://doi.org/10.4269/ajtmh.21-1267
Saranath Lawpoolsri,Space–time clustering characteristics of malaria in Bhutan at the end stages of elimination,2021,10,https://doi.org/10.3390/ijerph18115553,34067393,Kinley Wangdi and Kinley Penjor and Tobgyal and Saranath Lawpoolsri and Ric N Price and Peter W Gething and Darren J Gray and Elivelton Da Silva Fonseca and Archie CA Clements,International Journal of Environmental Research and Public Health,1.75,3,0,0,0,0,0,0,False,True,doaj,False,Open Access,True,False,https://doi.org/10.3390/ijerph18115553
Saranath Lawpoolsri,Incidence and spectrum of health problems among travellers to Myanmar,2018,10,https://doi.org/10.1093/jtm/tax077,29232462,Jutarmas Olanwijitwong and Saranath Lawpoolsri and Thitiya Ponam and Preechapol Puengpholpool and Chollasap Sharma and Lapakorn Chatapat and Vichan Pawan and Chatporn Kittitrakul and Watcharapong Piyaphanee,Journal of Travel Medicine,0.0,0,0,0,0,0,0,0,False,True,doaj,False,Open Access,False,False,https://doi.org/10.1093/jtm/tax077
Saranath Lawpoolsri,Electronic medical records in Myanmar: user perceptions at Marie Stopes International Clinics in Myanmar,2016,10,https://doi.org/10.4258/hir.2020.26.3.185,,Win Min Thit and Jaranit Kaewkungwal and Ngamphol Soonthornworasiri and Nawanan Theera-Ampornpunt and Boonchai Kijsanayotin and Saranath Lawpoolsri and Sid Naing and Wirichada Pan-Ngum,Southeast Asian J Trop Med Public Health,0.0,0,0,0,0,0,0,0,False,True,doaj,False,Open Access,False,False,https://doi.org/10.4258/hir.2020.26.3.185
Saranath Lawpoolsri,Temporal trend of COVID-19 vaccine acceptance and factors influencing international travellers,2022,9,https://doi.org/10.3390/tropicalmed7090223,36136634,Manasvin Onwan and Wasin Matsee and Saranath Lawpoolsri and Phimphan Pisutsan and Tanaya Siripoon and Suda Punrin and Watcharapong Piyaphanee,Tropical Medicine and Infectious Disease,1.0,1,0,0,0,0,0,0,False,True,doaj,False,Open Access,False,False,https://doi.org/10.3390/tropicalmed7090223
Saranath Lawpoolsri,Effects of an asthma education camp program on quality of life and asthma control among Thai children with asthma: a quasi-experimental study,2022,9,https://doi.org/10.3390/healthcare10081561,36011217,Sirasuda Sommanus and Raweerat Sitcharungsi and Saranath Lawpoolsri,Healthcare,1.0,1,0,0,0,0,0,0,False,True,doaj,False,Open Access,False,True,https://doi.org/10.3390/healthcare10081561
Saranath Lawpoolsri,"Treatment-seeking behaviors and knowledge, attitude and practices among suspected dengue adult patients at the hospital for tropical diseases, Bangkok, Thailand",2022,9,https://doi.org/10.3390/ijerph19116657,35682240,Pittaya Piroonamornpun and Panita Looareesuwan and Viravarn Luvira and Nantawan Wongchidwon and Piyanan Pakdeewut and Saranath Lawpoolsri and Benjaluck Phonrat,International journal of environmental research and public health,1.0,3,0,0,0,0,0,0,False,True,doaj,False,Open Access,False,False,https://doi.org/10.3390/ijerph19116657
Saranath Lawpoolsri,Long-term effectiveness of human papillomavirus vaccines among adult women: A real-world scenario,2022,9,https://doi.org/10.1016/j.vaccine.2022.02.042,35190207,Ga Young Lee and Perapong Inthasorn and Piyawat Laowahutanont and Saranath Lawpoolsri and Supitcha Kamolratanakul and Palita Lungchukiet and Juhwan Oh and Wichai Termrungruanglert and Nimit Taechakraichana and Punnee Pitisuttithum,Vaccine,3.0,4,0,0,0,0,0,0,False,True,doaj,False,Open Access,False,False,https://doi.org/10.1016/j.vaccine.2022.02.042
Saranath Lawpoolsri,The Factors associated with the unsuccessful tuberculosis treatment of hill tribe patients in Thailand,2020,9,https://doi.org/10.3855/jidc.12029,32088683,Siriyaporn Khunthason and Jaranit Kaewkungwal and C Okascharoen and T Apidechkul and S Lawpoolsri,Journal of infection in developing countries,0.0,0,0,0,0,0,0,0,False,True,doaj,False,Open Access,False,False,https://doi.org/10.3855/jidc.12029
Saranath Lawpoolsri,Interventions for promoting patients’ adherence to 14-day primaquine treatment in a highly malaria-endemic township in Myanmar: a qualitative study among key stakeholders,2023,8,https://doi.org/10.21203/rs.3.rs-3312278/v1,,Kyawt Mon Win and Pyae Linn Aung and Zau Ring and Nay Yi Yi Linn and Myat Phone Kyaw and Wang Nguitragool and Liwang Cui and Jetsumon Sattabongkot and Saranath Lawpoolsri,Malaria Journal,0.5,2,0,0,0,0,0,0,False,True,doaj,False,Open Access,True,False,https://doi.org/10.21203/rs.3.rs-3312278/v1
Saranath Lawpoolsri,Hepatitis B among pregnant women attending health care facilities in rural Bangladesh,2011,8,https://doi.org/10.1186/s40001-024-02090-1,22299410,Md Shamsuzzaman and P Singhasivanon and J Kaewkungwal and S Lawpoolsri and P Tangkijvanich and Robert V Gibbons and M Rahman and ASM Alamgir and MA Mahtab,Southeast Asian J Trop Med Public Health,0.0,0,0,0,0,0,0,0,False,True,doaj,False,Open Access,False,False,https://doi.org/10.1186/s40001-024-02090-1
Saranath Lawpoolsri,Single Ad26. COV2. S booster dose following two doses of BBIBP-CorV vaccine against SARS-CoV-2 infection in adults: Day 28 results of a phase 1/2 open-label trial,2023,7,https://doi.org/10.1016/j.vaccine.2023.06.043,37344265,Sant Muangnoicharoen and Rakpong Wiangcharoen and Sira Nanthapisal and Supitcha Kamolratakul and Saranath Lawpoolsri and Anan Jongkaewwattana and Arunee Thitithanyanont and Viravarn Luvira and Pailinrut Chinwangso and Narumon Thanthamnu and Narisara Chantratita and Jacqueline Kyungah Lim and T Anh Wartel and Jean-Louis Excler and Martin F Ryser and Chloe Leong and Tippi K Mak and Punnee Pitisuttithum,Vaccine,1.5,2,0,0,0,0,0,0,False,True,doaj,False,Open Access,False,False,https://doi.org/10.1016/j.vaccine.2023.06.043
Saranath Lawpoolsri,Complexity-based spatial hierarchical clustering for malaria prediction,2018,7,https://doi.org/10.1007/s41666-018-0031-z,35415412,Peter Haddawy and Myat Su Yin and Tanawan Wisanrakkit and Rootrada Limsupavanich and Promporn Promrat and Saranath Lawpoolsri and Patiwat Sa-Angchai,Journal of healthcare informatics research,0.0,0,0,0,0,0,0,0,False,True,doaj,False,Open Access,True,False,https://doi.org/10.1007/s41666-018-0031-z
Saranath Lawpoolsri,A cost-effectiveness analysis of the 13-valent pneumococcal conjugated vaccine and the 23-valent pneumococcal polysaccharide vaccine among Thai older adult,2023,6,https://doi.org/10.3389/fpubh.2023.1071117,37457251,Thundon Ngamprasertchai and Chayanis Kositamongkol and Saranath Lawpoolsri and Pinyo Rattanaumpawan and Viravarn Luvira and Piriyaporn Chongtrakool and Jaranit Kaewkungwal and Kulkanya Chokephaibulkit and Pochamana Phisalprapa,Frontiers in Public Health,0.5,1,0,0,0,0,0,0,False,True,doaj,False,Open Access,False,False,https://doi.org/10.3389/fpubh.2023.1071117
Saranath Lawpoolsri,Projecting malaria elimination in Thailand using Bayesian hierarchical spatiotemporal models,2023,6,https://doi.org/10.1038/s41598-023-35007-9,37179429,Chawarat Rotejanaprasert and Saranath Lawpoolsri and Patiwat Sa-Angchai and Amnat Khamsiriwatchara and Chantana Padungtod and Rungrawee Tipmontree and Lynette Menezes and Jetsumon Sattabongkot and Liwang Cui and Jaranit Kaewkungwal,Scientific Reports,1.0,3,0,0,0,0,0,0,False,True,doaj,False,Open Access,True,False,https://doi.org/10.1038/s41598-023-35007-9
Saranath Lawpoolsri,"Community acceptability, participation, and adherence to mass drug administration with primaquine for Plasmodium vivax elimination in Southern Thailand: a mixed methods approach",2023,6,https://doi.org/10.1186/s12936-023-04443-3,38922648,Sayambhu Saita and Wanlapa Roobsoong and Patthanasak Khammaneechan and Phnom Sukchan and Saranath Lawpoolsri and Jetsumon Sattabongkot and Liwang Cui and Kamolnetr Okanurak and Suparat Phuanukoonnon and Daniel M Parker,Malaria journal,5.55,10,0,0,0,0,0,0,False,True,doaj,False,Open Access,False,False,https://doi.org/10.1186/s12936-023-04443-3
Saranath Lawpoolsri,Treatment outcomes among diabetic patients with tuberculosis in Thailand,2016,6,https://doi.org/10.1111/j.1440-172x.2007.00650.x,38503513,Jareonsri Satung and Jaranit Kaewkungwal and Udomsak Silachamroon and Pattana Pokaew and Srisongchai Rattanajiamrangsree and Yuthichai Kasetjareon and Saranath Lawpoolsri,Southeast Asian J Trop Med Public Health,3.0,0,0,0,0,0,0,0,False,True,doaj,False,Open Access,False,False,https://doi.org/10.1111/j.1440-172x.2007.00650.x
Saranath Lawpoolsri,Cross-platform mobile app development for disseminating public health information to travelers in Thailand: development and usability,2022,5,https://doi.org/10.1186/s40794-022-00174-6,35836261,Pongthep Meankaew and Saranath Lawpoolsri and Watcharapong Piyaphanee and Peerawat Wansatid and Pimwadee Chaovalit and Siam Lawawirojwong and Jaranit Kaewkungwal,"Tropical Diseases, Travel Medicine and Vaccines",0.5,2,0,0,0,0,0,0,False,True,doaj,False,Open Access,True,False,https://doi.org/10.1186/s40794-022-00174-6
Saranath Lawpoolsri,"Effects of large volume, isotonic nasal saline irrigation for acute rhinosinusitis: a randomized controlled study",2021,5,https://doi.org/10.1002/alr.22807,35720767,Wirach Chitsuthipakorn and Angsuthorn Thanaphiphatsatja and Peeravuit Doungbuppha and Saranath Lawpoolsri and Kachorn Seresirikachorn and Kornkiat Snidvongs,International Forum of Allergy & Rhinology,9.25,1,0,1,0,0,0,0,True,True,doaj,False,Open Access,False,False,https://doi.org/10.1002/alr.22807
Saranath Lawpoolsri,"Assessment of adherence to a three day course of artemether-lumefantrine treatment in rakhine state, Myanmar",2014,5,https://doi.org/10.1007/s40278-018-46694-3,,Wai Yan Aung and Arjen M Dondorp and Myo Min and Thar Tun Kyaw and Saranath Lawpoolsri and Srivicha Krudsood and Pratap Singhasivanon,N/A,0.0,0,0,0,0,0,0,0,False,True,doaj,False,Open Access,False,False,https://doi.org/10.1007/s40278-018-46694-3
Saranath Lawpoolsri,Heterologous Ad26. COV2. S booster after primary BBIBP-CorV vaccination against SARS-CoV-2 infection: 1-year follow-up of a phase 1/2 open-label trial,2024,4,https://doi.org/10.2139/ssrn.4693337,38744598,Sant Muangnoicharoen and Rakpong Wiangcharoen and Saranath Lawpoolsri and Sira Nanthapisal and Anan Jongkaewwattana and Chatnapa Duangdee and Supitcha Kamolratanakul and Viravarn Luvira and Narumon Thanthamnu and Narisara Chantratita and Arunee Thitithanyanont and T Anh Wartel and Jean-Louis Excler and Martin F Ryser and Chloe Leong and Tippi K Mak and Punnee Pitisuttithum,Vaccine,1.0,1,0,0,0,0,0,0,False,True,doaj,False,Open Access,True,False,https://doi.org/10.2139/ssrn.4693337
Saranath Lawpoolsri,Molecular markers of dihydroartemisinin-piperaquine resistance in northwestern Thailand,2022,4,https://doi.org/10.1186/s12936-022-04382-5,36437462,Khine Nwe Win and Khajohnpong Manopwisedjaroen and Kanit Phumchuea and Chayanut Suansomjit and Kesinee Chotivanich and Saranath Lawpoolsri and Liwang Cui and Jetsumon Sattabongkot and Wang Nguitragool,Malaria Journal,1.85,4,0,0,0,0,0,0,False,True,doaj,False,Open Access,False,False,https://doi.org/10.1186/s12936-022-04382-5
Saranath Lawpoolsri,Treatment outcomes for elderly patients in Thailand with pulmonary tuberculosis,2018,4,https://doi.org/10.1515/abm-2019-0004,40352231,Wilawan Somsong and Saranath Lawpoolsri and Yuthichai Kasetjaroen and Weerawat Manosuthi and Jaranit Kaewkungwal,Asian Biomed (Res Rev News),0.0,0,0,0,0,0,0,0,False,True,doaj,False,Open Access,False,False,https://doi.org/10.1515/abm-2019-0004
Saranath Lawpoolsri,A Comparative Analysis of Bayesian Network and ARIMA Approaches to Malaria Outbreak Prediction,2018,4,https://doi.org/10.1007/978-3-319-60663-7_10,,AHM Imrul Hasan and Peter Haddawy and Saranath Lawpoolsri,N/A,0.0,0,0,0,0,0,0,0,False,True,doaj,False,Open Access,True,False,https://doi.org/10.1007/978-3-319-60663-7_10
