Author,Paper Title,Year,Citations,DOI,PMID,Authors,Journal,Altmetric Score,Twitter Mentions,Reddit Mentions,News Mentions,Blog Mentions,Facebook Mentions,Wikipedia Mentions,Policy Mentions,Media Mentioned,Open Access,OA Status,Preprint,Publication Type,Public Health Impact,Capacity Building,Paper Link
Saranath Lawpoolsri,Advantages of using voiced questionnaire and image capture application for data collection from a minority group in rural areas along the Thailand–Myanmar border,2014,4,https://doi.org/10.14236/jhi.v21i4.84,25479348,Siriporn Monyarit and Wirichada Pan-Ngum and Saranath Lawpoolsri and Surapon Yimsamran and Suporn Pongnumkul and Jaranit Kaewkungwal and Pratap Singhasivanon,Journal of Innovation in Health Informatics,0.0,0,0,0,0,0,0,0,False,True,doaj,False,Open Access,False,False,https://doi.org/10.14236/jhi.v21i4.84
Saranath Lawpoolsri,"Gametocyte prevalence and risk factors of P. falciparum malaria patients admitted at the Hospital for Tropical Diseases, Thailand: a 20-year retrospective study",2023,3,https://doi.org/10.1186/s12936-023-04728-7,37872594,Panita Looareesuwan and Srivicha Krudsood and Saranath Lawpoolsri and Noppadon Tangpukdee and Wasin Matsee and Wang Nguitragool and Polrat Wilairatana,Malaria Journal,2.5,6,0,0,0,0,0,0,False,True,doaj,False,Open Access,True,False,https://doi.org/10.1186/s12936-023-04728-7
Saranath Lawpoolsri,Unveiling immunity gaps and determining a suitable age for a third dose of the measles-containing vaccine: a strategic approach to accelerating measles elimination,2025,2,https://doi.org/10.1016/j.lansea.2024.100523,39811540,Somya Mehra and Sajikapon Kludkleeb and Chutikarn Chaimayo and Pornsawan Leaungwutiwong and Saranath Lawpoolsri and Wirichada Pan-Ngum and Kulkanya Chokephaibulkit and Thundon Ngamprasertchai,The Lancet Regional Health-Southeast Asia,1.25,2,0,0,0,0,0,0,False,True,doaj,False,Open Access,False,False,https://doi.org/10.1016/j.lansea.2024.100523
Saranath Lawpoolsri,"Effectiveness, Safety, and Acceptability of Primaquine Mass Drug Administration in Low-Endemicity Areas in Southern Thailand: Proof-of-Concept Study",2024,2,https://doi.org/10.2196/51993,38922648,Jaranit Kaewkungwal and Wanlapa Roobsoong and Saranath Lawpoolsri and Wang Nguitragool and Suwich Thammapalo and Pathomporn Prikchoo and Amnat Khamsiriwatchara and Rungrawee Pawarana and Pawinee Jarujareet and Daniel M Parker and Piyarat Sripoorote and Mondha Kengganpanich and Chetta Ngamjarus and Jetsumon Sattabongkot and Liwang Cui,JMIR Public Health and Surveillance,0.0,0,0,0,0,0,0,0,False,True,doaj,False,Open Access,False,False,https://doi.org/10.2196/51993
Saranath Lawpoolsri,Health utility score in Thai patients with chronic rhinosinusitis: pre‐and postoperative analyses,2024,2,https://doi.org/10.1002/lary.31108,37819654,Melissa Sangubol and Kornkiat Snidvongs and Saranath Lawpoolsri and Kittichai Mongkolkul and Patlada Kowatanamongkon and Wirach Chitsuthipakorn,The Laryngoscope,0.0,0,0,0,0,0,0,0,False,True,doaj,False,Open Access,False,False,https://doi.org/10.1002/lary.31108
Saranath Lawpoolsri,User’s acceptance to the adoption of Health Information Technology (HIT) in Bangabandhu Sheikh Mujib Medical University: Premier Medical University in Bangladesh,2015,2,https://doi.org/10.5005/jp-journals-10018-1053,,Maruf Haque Khan and Boonchai Kijsanayotin and Daorirk Sinthuvanich and Ngamphol Soonthornworasiri and Saranath Lawpoolsri,Journal of the Thai Medical Informatics Association,3.0,0,0,0,0,0,0,0,False,True,doaj,False,Open Access,False,False,https://doi.org/10.5005/jp-journals-10018-1053
Saranath Lawpoolsri,Fluctuation of tissue eosinophils in chronic rhinosinusitis with nasal polyp,2025,1,https://doi.org/10.1002/alr.23494,40265744,Kunjira Sombutpiboonphon and Kornkiat Snidvongs and Saranath Lawpoolsri and Nutpacha Chotikawichean and Patlada Kowatanamongkon and Kittichai Mongkolkul and Wirach Chitsuthipakorn,International Forum of Allergy & Rhinology,14.25,1,0,1,1,0,0,0,True,True,doaj,False,Open Access,False,False,https://doi.org/10.1002/alr.23494
Saranath Lawpoolsri,Evaluating Antibiotic Misuse and Cost Analysis Among Hospitalized Dengue Virus–Infected Adults: Insights From a Retrospective Cohort Study,2024,1,https://doi.org/10.1093/ofid/ofae520,39347438,Thundon Ngamprasertchai and Ashley Siribhadra and Chayanis Kositamongkol and Pittaya Piroonamornpun and Piyanan Pakdeewut and Viravarn Luvira and Saranath Lawpoolsri and Pinyo Rattanaumpawan,Open Forum Infectious Diseases,4.25,2,0,0,0,1,0,0,True,True,doaj,False,Open Access,False,False,https://doi.org/10.1093/ofid/ofae520
Saranath Lawpoolsri,Pneumococcal carriage among high-risk adults in a country with nonmandatory pneumococcal vaccination during the coronavirus disease 2019 pandemic,2023,1,https://doi.org/10.1016/j.jiph.2023.05.007,,Thundon Ngamprasertchai and Pinyo Rattanaumpawan and Jaranit Kaewkungwal and Pochamana Phisalprapa and Piriyaporn Chongtrakool and Anusak Kerdsin and Viravarn Luvira and Janjira Thaipadungpanit and Rattagan Kajeekul and Jintana Srisompong and Picha Yincharoen and Kulkanya Chokephaibulkit and Saranath Lawpoolsri,Journal of Infection and Public Health,0.25,1,0,0,0,0,0,0,False,True,doaj,False,Open Access,True,False,https://doi.org/10.1016/j.jiph.2023.05.007
Saranath Lawpoolsri,"Efficacy of household Aedes larval control practices in a peri-urban township, Yangon, Myanmar: Implication for entomological surveillance",2023,1,https://doi.org/10.1016/j.heliyon.2023.e18083,,Soe Htet Aung and Aye Mon Mon Kyaw and Podjanee Jittamala and Saranath Lawpoolsri and Ngamphol Soonthornworasiri and Patchara Sriwichai and Suparat Phuanukoonnon,Heliyon,0.0,0,0,0,0,0,0,0,False,True,doaj,False,Open Access,True,False,https://doi.org/10.1016/j.heliyon.2023.e18083
Saranath Lawpoolsri,Adherence and health problems in Thai Travellers Living with HIV,2022,1,https://doi.org/10.3390/tropicalmed7070128,35878140,Krit Madsalae and Thundon Ngamprasertchai and Saranath Lawpoolsri and Rujipas Sirijatuphat and Winai Ratanasuwan and Watcharapong Piyaphanee and Punnee Pitisuttithum,Tropical Medicine and Infectious Disease,0.0,0,0,0,0,0,0,0,False,True,doaj,False,Open Access,False,False,https://doi.org/10.3390/tropicalmed7070128
Saranath Lawpoolsri,A Collaborative Platform Supporting Distributed Teams in Visualization and Analysis of Infectious Disease Data,2022,1,https://doi.org/10.1109/ichi54592.2022.00042,,Florian Vögtle and Peter Haddawy and Myat Su Yin and Thomas Barkowsky and Dominique Bicout and Mores Prachyabrued and Saranath Lawpoolsri,N/A,3.0,0,0,0,0,0,0,0,False,True,doaj,False,Open Access,True,False,https://doi.org/10.1109/ichi54592.2022.00042
Saranath Lawpoolsri,A study of individual human mobility patterns related to malaria transmission along the Thai-Myanmar Border,2020,1,https://doi.org/10.1145/3418094.3418136,,Chaitawat Sa-Ngamuang and Peter Haddawy and Saranath Lawpoolsri and Thomas Barkowsky and Patiwat Sa-Angchai,N/A,0.0,0,0,0,0,0,0,0,False,True,doaj,False,Open Access,True,False,https://doi.org/10.1145/3418094.3418136
Saranath Lawpoolsri,"Patterns of school absenteeism among primary school students in bangkok, thailand",2018,1,https://doi.org/10.52965/001c.120045,34457820,Komchaluch Taweeseneepitch and Jaranit Kaewkungwal and Pratap Singhasivanon and Wongwat Liulark and Podjanee Jittamala and Amnat Khamsiriwatchara and Aumnuyphan Sangvichian and Sirinya Krongrungroj and Saranath Lawpoolsri,Southest Asian J Trop Med Public Heal,0.0,0,0,0,0,0,0,0,False,True,doaj,False,Open Access,False,False,https://doi.org/10.52965/001c.120045
Saranath Lawpoolsri,AIC-driven spatial hierarchical clustering: case study for malaria prediction in Northern Thailand,2017,1,https://doi.org/10.1007/978-3-319-69456-6_9,,Peter Haddawy and Myat Su Yin and Tanawan Wisanrakkit and Rootrada Limsupavanich and Promporn Promrat and Saranath Lawpoolsri,N/A,0.0,0,0,0,0,0,0,0,False,True,doaj,False,Open Access,True,False,https://doi.org/10.1007/978-3-319-69456-6_9
Saranath Lawpoolsri,Research The impact of human reservoir of malaria at a community-level on individual malaria occurrence in a low malaria transmission setting along the Thai-Myanmar border,2010,1,https://doi.org/10.1186/1475-2875-9-143,,Saranath Lawpoolsri and Irwin F Chavez and Surapon Yimsamran and Supalap Puangsa-art and Nipon Thanyavanich and Wanchai Maneeboonyang and Wuthichai Chaimungkun and Pratap Singhasivanon and James H Maguire and Laura L Hungerford,N/A,3.0,0,0,0,0,0,0,0,False,True,doaj,False,Open Access,True,False,https://doi.org/10.1186/1475-2875-9-143
Saranath Lawpoolsri,Speeding Tickets: Effective Deterrents for Future Violations or Not?,2006,1,https://doi.org/10.1007/978-1-4899-6036-8_8,40450383,Jingyi Li and Saranath Lawpoolsri and Elisa R Braver,N/A,0.0,0,0,0,0,0,0,0,False,True,doaj,False,Open Access,False,False,https://doi.org/10.1007/978-1-4899-6036-8_8
Saranath Lawpoolsri,Unveiling the complexity of vaccine hesitancy: A narrative review focusing on dengue vaccination,2025,0,https://doi.org/10.1080/21645515.2025.2491994,40260512,Rachata Charoenwisedsil and Saranath Lawpoolsri and Pinyo Rattanaumpawan and Daniel YT Goh and Gerard T Flaherty and Thundon Ngamprasertchai,N/A,0.0,0,0,0,0,0,0,0,False,True,doaj,False,Open Access,True,False,https://doi.org/10.1080/21645515.2025.2491994
Saranath Lawpoolsri,Enhancing Primaquine Adherence for Plasmodium vivax Malaria: A Cluster-Randomized Controlled Trial in Myanmar,2025,0,https://doi.org/10.4269/ajtmh.24-0814,40328242,Kyawt Mon Win and Pyae Linn Aung and Nay Yi Yi Linn and Zau Ring and Myat Phone Kyaw and Wang Nguitragool and Liwang Cui and Jetsumon Sattabongkot and Saranath Lawpoolsri,The American journal of tropical medicine and hygiene,0.0,0,0,0,0,0,0,0,False,True,doaj,False,Open Access,True,False,https://doi.org/10.4269/ajtmh.24-0814
Saranath Lawpoolsri,Boosting effects of additional mRNA COVID-19 vaccine given after one year in adults previously received two doses inactivated COVID-19 vaccines with third dose of any COVID-19 vaccine during Omicron XBB. 1.5,2025,0,https://doi.org/10.1016/j.ijid.2024.107506,,Sant Muangnoicharoen and Saranath Lawpoolsri and Anan Jongkaewwattana and Sira Nanthapisal and Chatnapa Duangdee and Supitcha Kamolratanakul and Viravarn Luvira and Narumon Thanthamnu and Punnee Pitisuttithum,International Journal of Infectious Diseases,0.0,0,0,0,0,0,0,0,False,True,doaj,False,Open Access,False,False,https://doi.org/10.1016/j.ijid.2024.107506
Saranath Lawpoolsri,Immune response of bivalent mRNA booster in adults who had received a primary series of an inactivated recombinant Newcastle disease virus vaccine expressing SARS-CoV-2 spike (NDV-HXP-S),2025,0,https://doi.org/10.1016/j.ijid.2024.107623,,Viravarn Luvira and Weerapong Phumratanaprapin and Saranath Lawpoolsri and Anan Jongkaewwattana and Sira Nanthapisal and Assist Prof Sant Muangnoicharoen and Assist Prof Supitcha Kamolratanakul and Miss Yupa Sabmee and Miss Chatnapa Duangdee and Benjaluck Phonrat and Punnee Pitisuttithum,International Journal of Infectious Diseases,0.0,0,0,0,0,0,0,0,False,True,doaj,False,Open Access,False,False,https://doi.org/10.1016/j.ijid.2024.107623
Saranath Lawpoolsri,373 Pathologic dural invasion is associated with regional recurrence in olfactory neuroblastoma: A multi-institutional study,2025,0,https://doi.org/10.1002/alr.23489,39535364,Saawan D Patel and Isha K Thapar and Alan D Workman and Dana F Lopez and Benjamin F Bitner and Hannah B Bukzin and David K Lerner and Jadyn Wilensky and Jennifer E Douglas and James N Palmer and Nithin D Adappa and Charles CL Tong and Edward C Kuan and Michael A Kohanski and Kunjira Sombutpiboonphon and Kornkiat Snidvongs and Saranath Lawpoolsri and Nutpacha Chotikawichean and Patlada Kowatanamongkon and Kittichai Mongkolkul and Wirach Chitsuthipakorn and Alejandra Rodas and Leonardo Tariciotti and Youssef M Zohdy and Roberto M Soriano and Gustavo Pradilla and C Arturo Solares and John M DelGaudio and Nikita Chapurin and Zachary M Soler and Sofia Khan and Jennifer K Mulligan and Vijay R Ramakrishnan and Jess C Mace and Timothy L Smith and Jeremiah A Alt and Jose L Mattos and Vinay K Rathi and Rodney J Schlosser and Maxime Fieux and Bruna R Castro and Sophie S Jang and Carol H Yan and Zara M Patel,N/A,1.75,2,0,0,0,0,0,0,False,True,doaj,False,Open Access,False,False,https://doi.org/10.1002/alr.23489
Saranath Lawpoolsri,Diagnostics for optimised dengue surveillance: a qualitative focus group study to investigate user experience and requirements in Thailand,2024,0,https://doi.org/10.1136/bmjopen-2024-085946,39572102,Paul Arkell and Sanhapon Ketklao and Adisak Songjaeng and Dumrong Mairiang and Jesus Rodriguez-Manzano and Pantelis Georgiou and Alison Holmes and Raheelah Ahmad and Prida Malasit and Panisadee Avirutnan and Saranath Lawpoolsri,BMJ open,0.0,0,0,0,0,0,0,0,False,True,doaj,False,Open Access,True,False,https://doi.org/10.1136/bmjopen-2024-085946
Saranath Lawpoolsri,FACTORS ASSOCIATED WITH SEVERE PLASMODIUM VIVAX MALARIA: A 15-YEAR RETROSPECTIVE STUDY,2024,0,https://doi.org/10.4103/0972-9062.310872,17172391,Pattaratida Singhasenee and Noppadon Tangpukdee and Srivicha Krudsood and Saranath Lawpoolsri Niyom and Wiwat Chancharoenthana and Wasin Matsee and Polrat Wilairatana,The Southeast Asian Journal of Tropical Medicine and Public Health,0.0,0,0,0,0,0,0,0,False,True,doaj,False,Open Access,True,False,https://doi.org/10.4103/0972-9062.310872
Saranath Lawpoolsri,Prevalence of hypertension among travelers and stability of blood pressure control during travel: a cross-sectional descriptive study and prospective cohort study,2023,0,https://doi.org/10.1186/s40794-023-00199-5,,Watsapol Gultawatvichai and Wasin Matsee and Phimphan Pisutsan and Teera Kusolsuk and Udomsak Silachamroon and Chayasin Mansanguan and Saranath Lawpoolsri and Gerard T Flaherty and Watcharapong Piyaphanee,"Tropical Diseases, Travel Medicine and Vaccines",0.0,0,0,0,0,0,0,0,False,True,doaj,False,Open Access,False,False,https://doi.org/10.1186/s40794-023-00199-5
Saranath Lawpoolsri,"International University Students’ Pre-Travel Preparation, Knowledge and Practices towards Travel Health in Thailand: A Nationwide Cross-Sectional Study",2023,0,https://doi.org/10.3390/tropicalmed8060322,37368740,Sawettachai Jaita and Phimphan Pisutsan and Saranath Lawpoolsri and Amornphat Kitro and Chatporn Kittitrakul and Teera Kusolsuk and Supitcha Kamolratanakul and Poom Chompoosri and Gerard T Flaherty and Jittima Dhitavat,Tropical Medicine and Infectious Disease,4.85,2,0,0,0,0,0,0,False,True,doaj,False,Open Access,False,False,https://doi.org/10.3390/tropicalmed8060322
Saranath Lawpoolsri,Molecular surveillance of dihydroartemisinin-piperaquine resistance in northwestern Thailand,2022,0,https://doi.org/10.21203/rs.3.rs-1948361/v1,36437462,Khine Nwe Win and Khajohnpong Manopwisedjaroen and Kanit Phumchuea and Chayanut Suansomjit and Kesinee Chotivanich and Saranath Lawpoolsri and Liwang Cui and Jetsumon Sattabongkot and Wang Nguitragool,N/A,1.85,4,0,0,0,0,0,0,False,True,doaj,False,Open Access,True,False,https://doi.org/10.21203/rs.3.rs-1948361/v1
Saranath Lawpoolsri,Tu1287: CHARACTERISTICS OF DRUG-INDUCED LIVER INJURY IN CHRONIC LIVER DISEASE: RESULTS FROM THE THAI ASSOCIATION FOR THE STUDY OF THE LIVER (THASL) DILI REGISTRY,2022,0,https://doi.org/10.1016/s0016-5085(22)63708-9,,Sakkarin Chirapongsathorn and Wattana Sukeepaisarnjaroen and Sombat Treeprasertsuk and Roongruedee Chaiteerakij and Pichaporn Surawongsin and Chanunta Hongthanakorn and Sith Siramolpiwat and Naichaya Chamroonkul and Chalermrat Bunchorntavakul and Watcharasak Chotiyaputta and Kittiyod Poovorawan and Rattana Boonsirichan and Saranath Lawpoolsri and Chinnavat Sutthivana and Abhasnee Sobhonslidsuk,Gastroenterology,0.0,0,0,0,0,0,0,0,False,True,doaj,False,Open Access,False,False,https://doi.org/10.1016/s0016-5085(22)63708-9
Saranath Lawpoolsri,"Ownership, utilization, and motivations for use or non-use of bed nets among community members at risk of malaria along the Thai-Myanmar border",2021,0,https://doi.org/10.21203/rs.3.rs-418488/v1,40402334,Kasama Pooseesod and Daniel M Parker and Natthani Meemon and Saranath Lawpoolsri and Pratap Singhasivanon and Jetsumon Sattabongkot and Liwang Cui and SUPARAT PHUANUKOONNON,N/A,0.0,0,0,0,0,0,0,0,False,True,doaj,False,Open Access,True,False,https://doi.org/10.21203/rs.3.rs-418488/v1
Saranath Lawpoolsri,1407 Multidisciplinary consensus on management of chronic rhinosinusitis with nasal polyps,2021,0,https://doi.org/10.1002/alr.22851,34057824,Joseph K Han and John V Bosso and Seong H Cho and Christine Franzese and Kent Lam and Andrew P Lane and Stella E Lee and James Palmer and Anju Peters and Zachary M Soler and Jivianne T Lee and Chadi A Makary and Jeffrey Falco and Sarah Sussman and Lindsey Ryan and Camilo Reyes and Hassan Ramadan and Stilianos E Kountakis and Wirach Chitsuthipakorn and Angsuthorn Thanaphiphatsatja and Peeravuit Doungbuppha and Saranath Lawpoolsri and Kachorn Seresirikachorn and Kornkiat Snidvongs and Jose L Mattos and Todd E Bodner and Jess C Mace and Rodney J Schlosser and Daniel M Beswick and Vijay R Ramakrishnan and Jeremiah A Alt and Spencer C Payne and Timothy L Smith and Onyekachi Ezinna Nnabue and Steven D Pletcher and Jose G Gurrola II and Andrew N Goldberg and Kristiana M Jordan and Sarah M Knox and Alison J May and Pauline Van Bulck and Leen Cools and Mysore S Soumya and Dieudonné T Nyembue and Patricia Kabobo and Luo Zhang and Glenis K Scadding and Elina Toskala and Wytske J Fokkens and Brecht Steelant and Peter W Hellings,N/A,106.0,4,0,15,0,1,0,0,True,True,doaj,False,Open Access,False,False,https://doi.org/10.1002/alr.22851
Saranath Lawpoolsri,Characteristics of Asthma Patients and Risk Factors of Uncontrolled Asthma in Children.,2020,0,https://doi.org/10.35755/jmedassocthai.2020.10.10860,40071339,Sirasuda Sommanus and Raweerat Sitcharungsi and Saranath Lawpoolsri,Journal of the Medical Association of Thailand,1.5,1,0,0,0,0,0,0,False,True,doaj,False,Open Access,False,False,https://doi.org/10.35755/jmedassocthai.2020.10.10860
Saranath Lawpoolsri,Factors associated with the unsuccessful tuberculosis treatment of hill tribe patients in Thailand.,2020,0,https://doi.org/10.3855/jidc.12029,32088683,Saranath Lawpoolsri and Siriyaporn Khunthason and Jaranit Kaewkungwal and Wirichada Pan-Ngum and Chusak Okascharoen and Tawatchai Apidechkul,N/A,0.0,0,0,0,0,0,0,0,False,True,doaj,False,Open Access,False,False,https://doi.org/10.3855/jidc.12029
Saranath Lawpoolsri,Evolution of Plasmodium vivax populations in border areas of the Greater Mekong Subregion during malaria elimination,2019,0,https://doi.org/10.21203/rs.2.19786/v1,32745103,Yuling Li and Yubing Hu and Yan Zhao and Qinghui Wang and Huguette Gaelle Ngassa Mbenda and Veerayuth Kittichai and Saranath Lawpoolsri and Jetsumon Sattabongkot and Lynette Menezes and Xiaoming Liu and Liwang Cui and Yaming Cao,N/A,7.0,0,0,1,0,0,0,0,True,True,doaj,False,Open Access,True,False,https://doi.org/10.21203/rs.2.19786/v1
Saranath Lawpoolsri,INCIDENCE AND SPECTRUM OF HEALTH PROBLEMS AMONG TRAVELERS TO MYANMAR,2017,0,https://doi.org/10.1111/jtm.12107,29232462,Watcharapong Piyaphanee and Jutarmas Olanwijitwong and Saranath Lawpoolsri and Chatporn Kittitrakul and Thitiya Ponam and Prechapol Puengpholpool and Chollasap Sharma and Monjira Thamangraksat and Lapakorn Chatapat and Vichan Pawan,N/A,0.25,0,0,0,0,1,0,0,True,True,doaj,False,Open Access,False,False,https://doi.org/10.1111/jtm.12107
Saranath Lawpoolsri,Village malaria worker performance key to the elimination of artemisinin-resistant malaria: a western Cambodia health system assessment,2017,0,https://doi.org/10.1186/s12936-016-1322-6,,Sara E Canavati and Saranath Lawpoolsri and Cesia E Quintero and Po Ly and Chea Nguon and Sasithon Pukrittayakamee and David Sintasath and Pratap Singhasivanon and Koen Peeters Grietens and Maxine Anne Whittaker,American Journal of Tropical Medicine and Hygiene,5.35,7,0,0,0,1,0,0,True,True,doaj,False,Open Access,True,False,https://doi.org/10.1186/s12936-016-1322-6
Saranath Lawpoolsri,Practices in security and confidentiality of HIV/AIDS patients' information: a national survey among staff at HIV outpatient clinics in Vietnam.,2017,0,https://doi.org/10.1371/journal.pone.0188160,29136017,Nguyen Khac Hai Nguyen Khac Hai and S Lawpoolsri and P Jittamala and Phan Thi Thu Huong Phan Thi Thu Huong and J Kaewkungwal,N/A,0.5,1,0,0,0,0,0,0,False,True,doaj,False,Open Access,False,False,https://doi.org/10.1371/journal.pone.0188160
Saranath Lawpoolsri,"OUTBREAK OF MALARIA IN UBON RATCHATHANI, THAILAND (2012-2015)",2017,0,https://doi.org/10.2987/17-6715.1,,Chris Erwin G Mercado and Saranath Lawpoolsri and Jeeraphat Sirichaisinthop and Prayuth Sudathip and Jaranit Kaewkungwal and Amnat Khamsiriwatchara and Nattwut Ekapirat and Vilasinee Yuwaree and Nicholas P Day and Arjen M Dondorp and Chatree Rasribut and Richard J Maude,N/A,0.25,1,0,0,0,0,0,0,False,True,doaj,False,Open Access,True,False,https://doi.org/10.2987/17-6715.1
Saranath Lawpoolsri,Electronic medical records in Myanmar: user perceptions at Marie Stopes International Clinics in Myanmar.,2016,0,https://doi.org/10.4258/hir.2020.26.3.185,,Win Min Thit Win Min Thit and J Kaewkungwal and N Soonthornworasiri and N Theera-Ampornpunt and B Kijsanayotin and S Lawpoolsri and Sid Naing Sid Naing and W Pan-Ngum,N/A,0.0,0,0,0,0,0,0,0,False,True,doaj,False,Open Access,False,False,https://doi.org/10.4258/hir.2020.26.3.185
Saranath Lawpoolsri,"Prevalence and impa ct of intestinal pa rasitic infections in pregnant women in 3 health centers along the Thai-Myanmar border, Saun Phung district, Ratchaburi province: Field base study",2015,0,https://doi.org/10.3390/ijerph20010204,,Nipon Thanyavanich and Saranath Lawpoolsri and Surapon Yimsamram and Supalarp Puangsa-art and Wanchai Maneeboonyang and Irwin F Chavez and Pitak Wuthisen and Chotima Charusabha and Pasert Rukmanee and Suthiporn Prommongkol and Natefa Rukmanee and Wutthichai Chaimungkun,N/A,0.0,0,0,0,0,0,0,0,False,True,doaj,False,Open Access,False,False,https://doi.org/10.3390/ijerph20010204
Saranath Lawpoolsri,"Clinical manifestations and treatment outcomes of scrub typhus in Umphang Hospital, Thailand",2015,0,https://doi.org/10.1093/trstmh/trx017,30943177,T Brummaier and Y Wattanagoon and C Kittitrakul and V Choovichian and S Lawpoolsri and C Namaik-Larp,N/A,3.25,1,0,0,0,0,1,0,True,True,doaj,False,Open Access,False,False,https://doi.org/10.1093/trstmh/trx017
Saranath Lawpoolsri,"Causes of acute febrile illness among school children in ladkrabang district, Bangkok: cohort study",2014,0,https://doi.org/10.4269/ajtmh.18-0407,,Komchaluch Taweeseneepitch and Jaranit Kaewkungwal and Pratap Singhasivanon and Wongwat Liulark and Amnat Khamsiriwatchara and Sarinya Krongrungroj and Saranath Lawpoolsri,N/A,0.5,1,0,0,0,0,0,0,False,True,doaj,False,Open Access,False,False,https://doi.org/10.4269/ajtmh.18-0407
Saranath Lawpoolsri,The epidemiology and control of malaria in a low malaria transmission setting along the Thai-Myanmar border,2009,0,https://doi.org/10.1186/1475-2875-9-143,,Saranath Lawpoolsri,N/A,3.0,0,0,0,0,0,0,0,False,True,doaj,False,Open Access,True,False,https://doi.org/10.1186/1475-2875-9-143
Saranath Lawpoolsri,Persuasion and Licensure: a Randomized Controlled Trial to Increase Licensure Rates among Motorcyclists,2006,0,https://doi.org/10.1093/aje/163.suppl_11.s204-d,17366335,* E Braver and J Kufera and K Volpini and M Alexander and J Joyce and S Lawpoolsri and P Ellison-Potter,N/A,3.0,0,0,0,0,0,0,0,False,True,doaj,False,Open Access,False,False,https://doi.org/10.1093/aje/163.suppl_11.s204-d
Saranath Lawpoolsri,"Effectiveness of Dengue Training Programmes on Prevention and Control Among High School Students in the Yangon Region, Myanmar",N/A,0,https://doi.org/10.2139/ssrn.4128782,37292340,Podjanee Jittamala and Soe Htet Aung and Suparat Phuanukoonnon and Aye Mon Mon Kyaw and Saranath Lawpoolsri and Patchara Sriwichai and Ngamphol Soonthornworasiri,N/A,0.0,0,0,0,0,0,0,0,False,True,doaj,False,Open Access,False,True,https://doi.org/10.2139/ssrn.4128782
Saranath Lawpoolsri,DERMATOLOGICAL CONDITIONS AMONG THAI TRAVELERS RETURNING FROM INTERNATIONAL TRAVEL: A PRELIMINARY REPORT,N/A,0,https://doi.org/10.1016/j.ijid.2018.04.3559,,Sutthijate Sommanus and Supitcha Kamolratanakul and Saranath Lawpoolsri and Chayasin Mansanguan and Wasin Matsee and Jittima Dhitavat,N/A,0.0,0,0,0,0,0,0,0,False,True,doaj,False,Open Access,False,False,https://doi.org/10.1016/j.ijid.2018.04.3559
Saranath Lawpoolsri,11. Teaching Methods,N/A,0,https://doi.org/10.1515/9780748626458-014,40449993,Saranath Lawpoolsri,N/A,0.0,0,0,0,0,0,0,0,False,True,doaj,False,Open Access,False,False,https://doi.org/10.1515/9780748626458-014
Saranath Lawpoolsri,THE SOUTHEAST ASIAN JOURNAL OF TROPICAL MEDICINE AND PUBLIC HEALTH,N/A,0,https://doi.org/10.1016/j.parint.2005.11.044,35065014,A Samie and S Makuwa and S Mtshali and N Potgieter and O Thekisoe and P Mbati and PO Bessong and KV Jomon and TT Valamparampil and U Jotekratok and K Boonnak and A Suttitheptumrong and S Pattanakitsakul and S Kasempimolporn and B Lumlertdacha and P Chulasugandha and S Boonchang and V Sitprija and L Kittigul and T Swangsri and K Pombubpa and N Howteerakul and P Diraphat and C Hirunpetcharat and N Rukmanee and S Yimsamran and P Rukmanee and N Thanyavanich and W Maneeboonyang and S Puangsa-art and P Wuthisen and S Lawpoolsri and S Prommongkol and W Chaimoongkun and W Pan-ngum,N/A,2.2,3,0,0,0,0,0,0,False,True,doaj,False,Open Access,True,False,https://doi.org/10.1016/j.parint.2005.11.044
