Author,Paper Title,Year,Citations,DOI,PMID,Authors,Journal,Altmetric Score,Twitter Mentions,Reddit Mentions,News Mentions,Blog Mentions,Facebook Mentions,Wikipedia Mentions,Policy Mentions,Media Mentioned,Open Access,OA Status,Preprint,Publication Type,Public Health Impact,Capacity Building,Paper Link
Saranath Lawpoolsri,Development of temporal modelling for forecasting and prediction of malaria infections using time-series and ARIMAX analyses: a case study in endemic districts of Bhutan,2010,203,https://doi.org/10.1186/1475-2875-9-251,20813066,Kinley Wangdi and Pratap Singhasivanon and Tassanee Silawan and Saranath Lawpoolsri and Nicholas J White and Jaranit Kaewkungwal,Malaria Journal,3.0,0,0,0,0,0,0,0,False,True,doaj,False,Open Access,True,False,https://doi.org/10.1186/1475-2875-9-251
Saranath Lawpoolsri,Pharmacokinetic interactions between primaquine and chloroquine,2014,100,https://doi.org/10.1128/aac.02794-13,39458619,Sasithon Pukrittayakamee and Joel Tarning and Podjanee Jittamala and Prakaykaew Charunwatthana and Saranath Lawpoolsri and Sue J Lee and Warunee Hanpithakpong and Borimas Hanboonkunupakarn and Nicholas PJ Day and Elizabeth A Ashley and Nicholas J White,Antimicrobial agents and chemotherapy,8.25,5,0,0,0,0,1,0,True,True,doaj,False,Open Access,False,False,https://doi.org/10.1128/aac.02794-13
Saranath Lawpoolsri,Directly-observed therapy (DOT) for the radical 14-day primaquine treatment of Plasmodium vivax malaria on the Thai-Myanmar border,2010,93,https://doi.org/10.1186/1475-2875-9-308,21040545,Rie Takeuchi and Saranath Lawpoolsri and Mallika Imwong and Jun Kobayashi and Jaranit Kaewkungwal and Sasithon Pukrittayakamee and Supalap Puangsa-Art and Nipon Thanyavanich and Wanchai Maneeboonyang and Nicholas PJ Day and Pratap Singhasivanon,Malaria journal,23.0,0,0,3,0,0,0,0,True,True,doaj,False,Open Access,True,False,https://doi.org/10.1186/1475-2875-9-308
Saranath Lawpoolsri,Do speeding tickets reduce the likelihood of receiving subsequent speeding tickets? A longitudinal study of speeding violators in Maryland,2007,92,https://doi.org/10.1080/15389580601009764,17366333,Saranath Lawpoolsri and Jingyi Li and Elisa R Braver,Traffic injury prevention,38.0,15,0,3,0,0,0,0,True,True,doaj,False,Open Access,False,False,https://doi.org/10.1080/15389580601009764
Saranath Lawpoolsri,Health inequalities in Thailand: geographic distribution of medical supplies in the provinces,2004,74,https://doi.org/10.1007/978-1-4614-9512-3_16,23241450,Hiroshi Nishiura and Sujan Barua and Saranath Lawpoolsri and Chatporn Kittitrakul and Martinus Martin Leman and Masri Sembiring Maha and Sant Muangnoicharoen,Southeast Asian journal of tropical medicine and public health,0.75,1,0,0,0,1,0,0,True,True,doaj,False,Open Access,False,False,https://doi.org/10.1007/978-1-4614-9512-3_16
Saranath Lawpoolsri,"Etiologies of acute undifferentiated febrile illness in Bangkok, Thailand",2019,71,https://doi.org/10.4269/ajtmh.18-0407,40073309,Viravarn Luvira and Udomsak Silachamroon and Watcharapong Piyaphanee and Saranath Lawpoolsri and Wirongrong Chierakul and Pornsawan Leaungwutiwong and Charin Thawornkuno and Yupaporn Wattanagoon,The American journal of tropical medicine and hygiene,0.5,1,0,0,0,0,0,0,False,True,doaj,False,Open Access,False,False,https://doi.org/10.4269/ajtmh.18-0407
Saranath Lawpoolsri,Village malaria worker performance key to the elimination of artemisinin-resistant malaria: a Western Cambodia health system assessment,2016,68,https://doi.org/10.1186/s12936-016-1322-6,,Sara E Canavati and Saranath Lawpoolsri and Cesia E Quintero and Chea Nguon and Po Ly and Sasithon Pukrittayakamee and David Sintasath and Pratap Singhasivanon and Koen Peeters Grietens and Maxine Anne Whittaker,Malaria Journal,5.35,7,0,0,0,1,0,0,True,True,doaj,False,Open Access,True,False,https://doi.org/10.1186/s12936-016-1322-6
Saranath Lawpoolsri,Optimally timing primaquine treatment to reduce Plasmodium falciparum transmission in low endemicity Thai-Myanmar border populations,2009,68,https://doi.org/10.1186/1475-2875-8-159,19604346,Saranath Lawpoolsri and Eili Y Klein and Pratap Singhasivanon and Surapon Yimsamran and Nipon Thanyavanich and Wanchai Maneeboonyang and Laura L Hungerford and James H Maguire and David L Smith,Malaria Journal,3.0,0,0,0,0,0,0,0,False,True,doaj,False,Open Access,False,False,https://doi.org/10.1186/1475-2875-8-159
Saranath Lawpoolsri,Spatiotemporal Bayesian networks for malaria prediction,2018,60,https://doi.org/10.1016/j.artmed.2017.12.002,38626207,Peter Haddawy and AHM Imrul Hasan and Rangwan Kasantikul and Saranath Lawpoolsri and Patiwat Sa-Angchai and Jaranit Kaewkungwal and Pratap Singhasivanon,Artificial intelligence in medicine,7.0,0,0,1,0,0,0,0,True,True,doaj,False,Open Access,True,False,https://doi.org/10.1016/j.artmed.2017.12.002
Saranath Lawpoolsri,Artemisinin resistance containment project in Thailand. II: Responses to mefloquine-artesunate combination therapy among falciparum malaria patients in provinces bordering Cambodia,2012,58,https://doi.org/10.1186/1475-2875-11-300,22929621,Wichai Satimai and Prayuth Sudathip and Saowanit Vijaykadga and Amnat Khamsiriwatchara and Surasak Sawang and Thanapon Potithavoranan and Aumnuyphan Sangvichean and Charles Delacollette and Pratap Singhasivanon and Jaranit Kaewkungwal and Saranath Lawpoolsri,Malaria Journal,3.0,0,0,0,0,0,0,0,False,True,doaj,False,Open Access,True,False,https://doi.org/10.1186/1475-2875-11-300
Saranath Lawpoolsri,Epidemiological profiles of recurrent malaria episodes in an endemic area along the Thailand-Myanmar border: a prospective cohort study,2019,56,https://doi.org/10.1186/s12936-019-2763-5,,Saranath Lawpoolsri and Jetsumon Sattabongkot and Jeeraphat Sirichaisinthop and Liwang Cui and Kirakorn Kiattibutr and Nattawan Rachaphaew and Kritsana Suk-Uam and Amnat Khamsiriwatchara and Jaranit Kaewkungwal,Malaria Journal,2.1,4,0,0,0,0,0,0,False,True,doaj,False,Open Access,True,False,https://doi.org/10.1186/s12936-019-2763-5
Saranath Lawpoolsri,Spatio-temporal patterns of malaria infection in Bhutan: a country embarking on malaria elimination,2011,55,https://doi.org/10.1186/1475-2875-10-89,21496285,Kinley Wangdi and Jaranit Kaewkungwal and Pratap Singhasivanon and Tassanee Silawan and Saranath Lawpoolsri and Nicholas J White,Malaria journal,3.0,0,0,0,0,0,0,0,False,True,doaj,False,Open Access,True,False,https://doi.org/10.1186/1475-2875-10-89
Saranath Lawpoolsri,"Safety and immunogenicity of an inactivated recombinant Newcastle disease virus vaccine expressing SARS-CoV-2 spike: Interim results of a randomised, placebo-controlled, phase 1 trial",2022,50,https://doi.org/10.1016/j.eclinm.2022.101323,35284808,Punnee Pitisuttithum and Viravarn Luvira and Saranath Lawpoolsri and Sant Muangnoicharoen and Supitcha Kamolratanakul and Chaisith Sivakorn and Piengthong Narakorn and Somchaiya Surichan and Sumalee Prangpratanporn and Suttida Puksuriwong and Steven Lamola and Laina D Mercer and Rama Raghunandan and Weina Sun and Yonghong Liu and Juan Manuel Carreño and Rami Scharf and Weerapong Phumratanaprapin and Fatima Amanat and Luc Gagnon and Ching-Lin Hsieh and Ruangchai Kaweepornpoj and Sarwat Khan and Manjari Lal and Stephen McCroskery and Jason McLellan and Ignacio Mena and Marcia Meseck and Benjaluck Phonrat and Yupa Sabmee and Ratsamikorn Singchareon and Stefan Slamanig and Nava Suthepakul and Johnstone Tcheou and Narumon Thantamnu and Sompone Theerasurakarn and Steven Tran and Thanakrit Vilasmongkolchai and Jessica A White and Nina Bhardwaj and Adolfo Garcia-Sastre and Peter Palese and Florian Krammer and Kittisak Poopipatpol and Ponthip Wirachwong and Richard Hjorth and Bruce L Innis,EClinicalMedicine,60.5,2,0,8,0,0,0,0,True,True,doaj,False,Open Access,False,False,https://doi.org/10.1016/j.eclinm.2022.101323
Saranath Lawpoolsri,Data quality and timeliness of outbreak reporting system among countries in Greater Mekong subregion: Challenges for international data sharing,2018,50,https://doi.org/10.1371/journal.pntd.0006425,29694372,Saranath Lawpoolsri and Jaranit Kaewkungwal and Amnat Khamsiriwatchara and Ly Sovann and Bun Sreng and Bounlay Phommasack and Viengsavanh Kitthiphong and Soe Lwin Nyein and Nyan Win Myint and Nguyen Dang Vung and Pham Hung and Mark S. Smolinski and Adam W. Crawley and Moe Ko Oo,PLoS Neglected Tropical Diseases,1.75,3,0,0,0,1,0,0,True,True,doaj,False,Open Access,True,False,https://doi.org/10.1371/journal.pntd.0006425
Saranath Lawpoolsri,Risk of potentially rabid animal exposure among foreign travelers in Southeast Asia,2012,50,https://doi.org/10.1371/journal.pntd.0001852,23029598,Watcharapong Piyaphanee and Chatporn Kittitrakul and Saranath Lawpoolsri and Philippe Gautret and Wataru Kashino and Waraluk Tangkanakul and Prangthip Charoenpong and Thitiya Ponam and Suda Sibunruang and Weerapong Phumratanaprapin and Terapong Tantawichien,N/A,0.75,1,0,0,0,1,0,0,True,True,doaj,False,Open Access,False,False,https://doi.org/10.1371/journal.pntd.0001852
Saranath Lawpoolsri,Accuracy of dengue clinical diagnosis with and without NS1 antigen rapid test: Comparison between human and Bayesian network model decision,2018,48,https://doi.org/10.1371/journal.pntd.0006573,29912875,Chaitawat Sa-Ngamuang and Peter Haddawy and Viravarn Luvira and Watcharapong Piyaphanee and Sopon Iamsirithaworn and Saranath Lawpoolsri,PLoS neglected tropical diseases,0.0,0,0,0,0,0,0,0,False,True,doaj,False,Open Access,False,False,https://doi.org/10.1371/journal.pntd.0006573
Saranath Lawpoolsri,Long-term impact of childhood malaria infection on school performance among school children in a malaria endemic area along the Thai–Myanmar border,2015,46,https://doi.org/10.1186/s12936-015-0917-7,,Nutchavadee Vorasan and Wirichada Pan-Ngum and Podjanee Jittamala and Wanchai Maneeboonyang and Prasert Rukmanee and Saranath Lawpoolsri,Malaria journal,0.5,2,0,0,0,0,0,0,False,True,doaj,False,Open Access,True,False,https://doi.org/10.1186/s12936-015-0917-7
Saranath Lawpoolsri,Ownership and utilization of bed nets and reasons for use or non-use of bed nets among community members at risk of malaria along the Thai-Myanmar border,2021,44,https://doi.org/10.1186/s12936-021-03837-5,34229653,Kasama Pooseesod and Daniel M Parker and Natthani Meemon and Saranath Lawpoolsri and Pratap Singhasivanon and Jetsumon Sattabongkot and Liwang Cui and Suparat Phuanukoonnon,Malaria journal,3.1,7,0,0,0,0,0,0,False,True,doaj,False,Open Access,True,False,https://doi.org/10.1186/s12936-021-03837-5
Saranath Lawpoolsri,"Traveler's diarrhea in foreign travelers in Southeast Asia: a cross-sectional survey study in Bangkok, Thailand",2015,41,https://doi.org/10.4269/ajtmh.15-0157,29232462,Chatporn Kittitrakul and Saranath Lawpoolsri and Teera Kusolsuk and Jutarmas Olanwijitwong and Waraluk Tangkanakul and Watcharapong Piyaphanee,The American Journal of Tropical Medicine and Hygiene,5.8999999999999995,9,0,0,0,0,0,0,False,True,doaj,False,Open Access,False,False,https://doi.org/10.4269/ajtmh.15-0157
Saranath Lawpoolsri,Artemisinin resistance containment project in Thailand.(I): Implementation of electronic-based malaria information system for early case detection and individual case management in provinces along the Thai-Cambodian border,2012,39,https://doi.org/10.1186/1475-2875-11-247,,Amnat Khamsiriwatchara and Prayuth Sudathip and Surasak Sawang and Saowanit Vijakadge and Thanapon Potithavoranan and Aumnuyphan Sangvichean and Wichai Satimai and Charles Delacollette and Pratap Singhasivanon and Saranath Lawpoolsri and Jaranit Kaewkungwal,Malaria Journal,3.85,1,0,0,0,0,0,0,False,True,doaj,False,Open Access,True,False,https://doi.org/10.1186/1475-2875-11-247
Saranath Lawpoolsri,Directly observed therapy with primaquine to reduce the recurrence rate of Plasmodium vivax infection along the Thai-Myanmar border,2011,39,https://doi.org/10.1186/1475-2875-9-308,21323159,Wanchai Maneeboonyang and Saranath Lawpoolsri and Supalarp Puangsa-Art and Surapon Yimsamran and Nipon Thanyavanich and Pitak Wuthisen and Sutthiporn Prommongkol and Wuthichai Chaimongkul and Prasert Rukmanee and Natefa Rukmanee and Irwin F Chavez and S Krudsood,Southeast Asian journal of tropical medicine and public health,23.0,0,0,3,0,0,0,0,True,True,doaj,False,Open Access,False,False,https://doi.org/10.1186/1475-2875-9-308
Saranath Lawpoolsri,"Safety and immunogenicity of a live attenuated influenza H5 candidate vaccine strain A/17/turkey/Turkey/05/133 H5N2 and its priming effects for potential pre-pandemic use: a randomised, double-blind, placebo-controlled trial",2017,37,https://doi.org/10.1016/s1473-3099(17)30240-2,,Punnee Pitisuttithum and Kobporn Boonnak and Supat Chamnanchanunt and Pilaipan Puthavathana and Viravarn Luvira and Hatairat Lerdsamran and Jaranit Kaewkungwal and Saranath Lawpoolsri and Vipa Thanachartwet and Udomsak Silachamroon and Wanibtisam Masamae and Alexandra Schuetz and Ponthip Wirachwong and Sit Thirapakpoomanunt and Larisa Rudenko and Erin Sparrow and Martin Friede and Marie-Paule Kieny,The Lancet Infectious Diseases,8.85,16,0,0,0,0,0,0,False,True,doaj,False,Open Access,True,False,https://doi.org/10.1016/s1473-3099(17)30240-2
Saranath Lawpoolsri,Application of mobile technology for improving expanded program on immunization among highland minority and stateless populations in northern Thailand border,2015,37,https://doi.org/10.2196/mhealth.3704,25589367,Jaranit Kaewkungwal and Tawatchai Apidechkul and Kasemsak Jandee and Amnat Khamsiriwatchara and Saranath Lawpoolsri and Surasak Sawang and Aumnuyphan Sangvichean and Peerawat Wansatid and Sarinya Krongrungroj,JMIR mHealth and uHealth,2.85,4,0,0,0,3,0,0,True,True,doaj,False,Open Access,False,False,https://doi.org/10.2196/mhealth.3704
Saranath Lawpoolsri,Exposure to heavy metals in electronic waste recycling in Thailand,2020,36,https://doi.org/10.3390/ijerph17092996,34682326,Chalermkhwan Kuntawee and Kraichat Tantrakarnapa and Yanin Limpanont and Saranath Lawpoolsri and Athit Phetrak and Rachaneekorn Mingkhwan and Suwalee Worakhunpiset,International Journal of Environmental Research and Public Health,0.0,0,0,0,0,0,0,0,False,True,doaj,False,Open Access,False,False,https://doi.org/10.3390/ijerph17092996
Saranath Lawpoolsri,Practices in security and confidentiality of HIV/AIDS patients’ information: a national survey among staff at HIV outpatient clinics in Vietnam,2017,36,https://doi.org/10.1371/journal.pone.0188160,29136017,Nguyen Khac Hai and Saranath Lawpoolsri and Podjanee Jittamala and Phan Thi Thu Huong and Jaranit Kaewkungwal,PLoS One,0.5,1,0,0,0,0,0,0,False,True,doaj,False,Open Access,False,False,https://doi.org/10.1371/journal.pone.0188160
Saranath Lawpoolsri,Pharmacokinetics of orally administered oseltamivir in healthy obese and nonobese Thai subjects,2014,36,https://doi.org/10.1128/aac.01786-13,24366750,Podjanee Jittamala and Sasithon Pukrittayakamee and Joel Tarning and Niklas Lindegardh and Warunee Hanpithakpong and Walter Robert John Taylor and Saranath Lawpoolsri and Prakaykaew Charunwattana and Salwaluk Panapipat and Nicholas J White and Nicholas PJ Day,Antimicrobial agents and chemotherapy,0.0,0,0,0,0,0,0,0,False,True,doaj,False,Open Access,False,False,https://doi.org/10.1128/aac.01786-13
Saranath Lawpoolsri,The impact of human reservoir of malaria at a community-level on individual malaria occurrence in a low malaria transmission setting along the Thai-Myanmar border,2010,36,https://doi.org/10.1186/1475-2875-9-143,,Saranath Lawpoolsri and Irwin F Chavez and Surapon Yimsamran and Supalap Puangsa-Art and Nipon Thanyavanich and Wanchai Maneeboonyang and Wuthichai Chaimungkun and Pratap Singhasivanon and James H Maguire and Laura L Hungerford,Malaria Journal,3.0,0,0,0,0,0,0,0,False,True,doaj,False,Open Access,True,False,https://doi.org/10.1186/1475-2875-9-143
Saranath Lawpoolsri,"Safety and immunogenicity of an egg-based inactivated Newcastle disease virus vaccine expressing SARS-CoV-2 spike: Interim results of a randomized, placebo-controlled, phase 1/2 trial in Vietnam",2022,35,https://doi.org/10.1101/2022.02.01.22270253,35577631,Anh Duc Dang and Thiem Dinh Vu and Ha Hai Vu and Van Thanh Ta and Anh Thi Van Pham and Mai Thi Ngoc Dang and Be Van Le and Thai Huu Duong and Duoc Van Nguyen and Saranath Lawpoolsri and Pailinrut Chinwangso and Jason S McLellan and Ching-Lin Hsieh and Adolfo Garcia-Sastre and Peter Palese and Weina Sun and Jose L Martinez and Irene Gonzalez-Dominguez and Stefan Slamanig and Juan Manuel Carreño and Johnstone Tcheou and Florian Krammer and Ariel Raskin and Huong Minh Vu and Thang Cong Tran and Huong Mai Nguyen and Laina D Mercer and Rama Raghunandan and Manjari Lal and Jessica A White and Richard Hjorth and Bruce L Innis and Rami Scharf,Vaccine,30.900000000000016,51,0,0,0,0,0,0,False,True,doaj,False,Open Access,False,False,https://doi.org/10.1101/2022.02.01.22270253
Saranath Lawpoolsri,Effects of COVID-19 government travel restrictions on mobility in a rural border area of Northern Thailand: A mobile phone tracking study,2021,34,https://doi.org/10.1371/journal.pone.0245842,,Peter Haddawy and Saranath Lawpoolsri and Chaitawat Sa-Ngamuang and Myat Su Yin and Thomas Barkowsky and Anuwat Wiratsudakul and Jaranit Kaewkungwal and Amnat Khamsiriwatchara and Patiwat Sa-Angchai and Jetsumon Sattabongkot and Liwang Cui,PLoS One,0.0,0,0,0,0,0,0,0,False,True,doaj,False,Open Access,False,False,https://doi.org/10.1371/journal.pone.0245842
Saranath Lawpoolsri,Effectiveness of implementation of electronic malaria information system as the national malaria surveillance system in Thailand,2016,33,https://doi.org/10.2196/publichealth.5347,,Shaojin Ma and Saranath Lawpoolsri and Ngamphol Soonthornworasiri and Amnat Khamsiriwatchara and Kasemsak Jandee and Komchaluch Taweeseneepitch and Rungrawee Pawarana and Sukanya Jaiklaew and Boonchai Kijsanayotin and Jaranit Kaewkungwal,JMIR public health and surveillance,1.0,2,0,0,0,2,0,0,True,True,doaj,False,Open Access,True,False,https://doi.org/10.2196/publichealth.5347
Saranath Lawpoolsri,"Barriers to and motivations for the implementation of a treatment programme for latent tuberculosis infection using isoniazid for people living with HIV, in upper northern Thailand",2013,33,https://doi.org/10.5539/gjhs.v5n4p60,23777722,Saiyud Moolphate and Saranath Lawpoolsri and Petchawan Pungrassami and Natpatou Sanguanwongse and Norio Yamada and Jaranit Kaewkungwal,Global journal of health science,1.0,1,0,0,0,0,0,0,False,True,doaj,False,Open Access,False,False,https://doi.org/10.5539/gjhs.v5n4p60
Saranath Lawpoolsri,"Malaria cross-sectional surveys identified asymptomatic infections of Plasmodium falciparum, Plasmodium vivax and Plasmodium knowlesi in Surat Thani, a southern province of Thailand",2020,32,https://doi.org/10.1016/j.ijid.2020.05.022,,Shoichi Shimizu and Sadudee Chotirat and Nichakan Dokkulab and Isarachai Hongchad and Kessuda Khowsroy and Kirakorn Kiattibutr and Nongnuj Maneechai and Khajohnpong Manopwisedjaroen and Pattamaporn Petchvijit and Kanit Phumchuea and Nattawan Rachaphaew and Piyarat Sripoorote and Chayanut Suansomjit and Waraporn Thongyod and Amnat Khamsiriwatchara and Saranath Lawpoolsri and Borimas Hanboonkunupakarn and Jetsumon Sattabongkot and Wang Nguitragool,International Journal of Infectious Diseases,1.0,2,0,0,0,0,0,0,False,True,doaj,False,Open Access,True,False,https://doi.org/10.1016/j.ijid.2020.05.022
Saranath Lawpoolsri,Malaria elimination in the Greater Mekong Subregion: challenges and prospects,2018,30,https://doi.org/10.5772/intechopen.76337,39288113,Liwang Cui and Yaming Cao and Jaranit Kaewkungwal and Amnat Khamsiriwatchara and Saranath Lawpoolsri and Than Naing Soe and Myat Phone Kyaw and Jetsumon Sattabongkot,N/A,3.0,0,0,0,0,0,0,0,False,True,doaj,False,Open Access,True,False,https://doi.org/10.5772/intechopen.76337
Saranath Lawpoolsri,Real-time monitoring of school absenteeism to enhance disease surveillance: a pilot study of a mobile electronic reporting system,2014,30,https://doi.org/10.2196/mhealth.3114,25099501,Saranath Lawpoolsri and Amnat Khamsiriwatchara and Wongwat Liulark and Komchaluch Taweeseneepitch and Aumnuyphan Sangvichean and Wiraporn Thongprarong and Jaranit Kaewkungwal and Pratap Singhasivanon,JMIR mHealth and uHealth,5.85,4,0,0,0,0,0,0,False,True,doaj,False,Open Access,True,False,https://doi.org/10.2196/mhealth.3114
Saranath Lawpoolsri,Prevalence and alternative treatment of head-lice infestation in rural Thailand: a community-based study,2019,29,https://doi.org/10.3347/kjp.2019.57.5.499,31715690,On-uma Singhasivanon and Saranath Lawpoolsri and Mathirut Mungthin and Surapon Yimsamran and Ngamphol Soonthornworasiri and Srivicha Krudsood,The Korean journal of parasitology,0.0,0,0,0,0,0,0,0,False,True,doaj,False,Open Access,False,False,https://doi.org/10.3347/kjp.2019.57.5.499
Saranath Lawpoolsri,"Spatiotemporal epidemiology, environmental correlates, and demography of malaria in Tak Province, Thailand (2012–2015)",2019,27,https://doi.org/10.1186/s12936-019-2871-2,31311606,Chris Erwin G Mercado and Saranath Lawpoolsri and Prayuth Sudathip and Jaranit Kaewkungwal and Amnat Khamsiriwatchara and Wirichada Pan-Ngum and Surapon Yimsamran and Siam Lawawirojwong and Kevin Ho and Nattwut Ekapirat and Rapeephan R Maude and Jacher Wiladphaingern and Verena I Carrara and Nicholas PJ Day and Arjen M Dondorp and Richard J Maude,Malaria Journal,24.799999999999997,24,0,1,0,0,0,0,True,True,doaj,False,Open Access,True,False,https://doi.org/10.1186/s12936-019-2871-2
Saranath Lawpoolsri,"Knowledge, attitudes and practices (kap) regarding influenza A (H1N1) among a population living along Thai-Myanmar border, Ratchaburi Province, Thailand",2014,27,https://doi.org/10.58837/chula.the.2010.2303,25427350,Natefa Rukmanee and Surapon Yimsamran and Prasert Rukmanee and Nipon Thanyavanich and Wanchai Maneeboonyang and Supalarp Puangsa-art and Pitak Wuthisen and Saranath Lawpoolsri and Sutthiporn Prommongkol and Wuthichai Chaimoongkun and Wirichada Pan-ngum,Southeast Asian Journal of Tropical Medicine and Public Health,0.0,0,0,0,0,0,0,0,False,True,doaj,False,Open Access,False,False,https://doi.org/10.58837/chula.the.2010.2303
Saranath Lawpoolsri,Incidence of potential rabies exposure among Japanese expatriates and travelers in Thailand,2014,25,https://doi.org/10.1111/jtm.12124,24845015,Wataru Kashino and Watcharapong Piyaphanee and Chatporn Kittitrakul and Noppadon Tangpukdee and Suda Sibunruang and Saranath Lawpoolsri and Hiroaki Yamashita and Sant Muangnoicharoen and Udomsak Silachamroon and Terapong Tantawichien,Journal of Travel Medicine,2.0,2,0,0,0,0,0,0,False,True,doaj,False,Open Access,False,False,https://doi.org/10.1111/jtm.12124
Saranath Lawpoolsri,Confronting and coping with multidrug-resistant tuberculosis: Life experiences in Thailand,2022,24,https://doi.org/10.1177/10497323211049777,34845946,Samorn Numpong and Mondha Kengganpanich and Jaranit Kaewkungwal and Wirichada Pan-Ngum and Udomsak Silachamroon and Yuthichai Kasetjaroen and Saranath Lawpoolsri,Qualitative Health Research,1.35,2,0,0,0,0,0,0,False,True,doaj,False,Open Access,False,False,https://doi.org/10.1177/10497323211049777
Saranath Lawpoolsri,Preliminary estimation of temporal and spatiotemporal dynamic measures of COVID-19 transmission in Thailand,2020,24,https://doi.org/10.1371/journal.pone.0239645,32970773,Chawarat Rotejanaprasert and Saranath Lawpoolsri and Wirichada Pan-Ngum and Richard J Maude,PloS one,2.25,4,0,0,0,0,0,0,False,True,doaj,False,Open Access,False,False,https://doi.org/10.1371/journal.pone.0239645
Saranath Lawpoolsri,Temporal patterns and a disease forecasting model of dengue hemorrhagic fever in Jakarta based on 10 years of surveillance data,2013,23,https://doi.org/10.1016/j.arcmed.2018.01.003,,Monika S Sitepu and Jaranit Kaewkungwal and Nathanej Luplerdlop and Ngamphol Soonthornworasiri and Tassanee Silawan and Supawadee Poungsombat and Saranath Lawpoolsri,The Southeast Asian journal of tropical medicine and public health,3.6,7,0,0,0,1,0,0,True,True,doaj,False,Open Access,True,False,https://doi.org/10.1016/j.arcmed.2018.01.003
Saranath Lawpoolsri,Boosting teenagers with acellular pertussis vaccines containing recombinant or chemically inactivated pertussis toxin: a randomized clinical trial,2019,22,https://doi.org/10.1093/cid/ciy594,37330371,Geraldine Blanchard Rohner and Olga Chatzis and Pailinrut Chinwangso and Marie Rohr and Stéphane Grillet and Carole Salomon and Barbara Lemaître and Pitchaya Boonrak and Saranath Lawpoolsri and Elizabeth Clutterbuck and Indrajeet Kumar Poredi and Wassana Wijagkanalan and Jane Spiegel and Hong Thai Pham and Simonetta Viviani and Claire-Anne Siegrist,Clinical Infectious Diseases,3.0,6,0,0,0,0,0,0,False,True,doaj,False,Open Access,False,False,https://doi.org/10.1093/cid/ciy594
Saranath Lawpoolsri,"Oseltamivir and inhaled zanamivir as influenza prophylaxis in Thai health workers: a randomized, double-blind, placebo-controlled safety trial over 16 weeks",2013,22,https://doi.org/10.1093/jac/dkt194,23143901,T Anekthananon and S Pukritayakamee and W Ratanasuwan and P Jittamala and P Werarak and P Charunwatthana and S Suwanagool and S Lawpoolsri and K Stepniewska and P Sapchookul and P Puthavathana and C Fukuda and N Lindegardh and J Tarning and NJ White and N Day and WRJ Taylor,Journal of antimicrobial chemotherapy,6.0,3,0,0,0,0,0,0,False,True,doaj,False,Open Access,False,False,https://doi.org/10.1093/jac/dkt194
