Author,Paper Title,Year,Citations,DOI,PMID,Authors,Journal,Altmetric Score,Twitter Mentions,Reddit Mentions,News Mentions,Blog Mentions,Facebook Mentions,Wikipedia Mentions,Policy Mentions,Media Mentioned,Open Access,OA Status,Preprint,Publication Type,Public Health Impact,Capacity Building
Andrew Omame,"Analysis of a mathematical model for COVID-19 population dynamics in Lagos, Nigeria",2020,298,https://doi.org/10.1016/j.chaos.2020.110032,39304265,D Okuonghae and Andrew Omame,"Chaos, Solitons & Fractals",8.0,0,0,1,0,0,0,0,True,True,unpaywall:green,False,Open Access,False,False
Andrew Omame,A fractional-order model for COVID-19 and Tuberculosis Co-infection using Atangana-Baleanu derivative,2021,91,https://doi.org/10.1016/j.chaos.2021.111486,34658543,A Omame and M Abbas and CP Onyenegecha,"Chaos, Solitons & Fractals",0.0,0,0,0,0,0,0,0,False,True,unpaywall:green,False,Open Access,False,False
Andrew Omame,Analysis of COVID-19 and comorbidity co-infection Model with Optimal Control,2021,87,https://doi.org/10.1002/oca.2748,39399100,Andrew Omame and Ndolane Sene and Ikenna Nometa and Cosmas Ifeanyi Nwakanma and Emmanuel Ugochukwu Nwafor and Nneka Onyinyechi Iheonu and Daniel Okuonghae,Optimal Control Applications and Methods,1.0,1,0,0,0,0,0,0,False,True,unpaywall:green,False,Open Access,False,False
Andrew Omame,Entropy generation under the effect of suction/injection,2011,77,https://doi.org/10.1016/j.apm.2011.03.027,,Abiodun O Ajibade and Basant K Jha and Andrew Omame,Applied Mathematical Modelling,0.0,0,0,0,0,0,0,0,False,False,unpaywall:closed,False,Published,False,False
Andrew Omame,Modelling SARS-CoV-2 and HBV co-dynamics with optimal control,2023,71,N/A,36908694,Andrew Omame and Mujahid Abbas,Physica A: Statistical Mechanics and its Applications,0.0,0,0,0,0,0,0,0,False,True,doaj,False,Unknown,False,False
Andrew Omame,Backward bifurcation and optimal control in a co-infection model for SARS-CoV-2 and ZIKV,2022,71,https://doi.org/10.1016/j.rinp.2022.105481,,Andrew Omame and Mujahid Abbas and Chibueze P Onyenegecha,Results in Physics,0.25,1,0,0,0,0,0,0,False,True,unpaywall:gold,False,Open Access,False,False
Andrew Omame,A fractional order control model for Diabetes and COVID-19 co-dynamics with Mittag-Leffler function,2022,67,https://doi.org/10.1016/j.aej.2022.01.012,,Andrew Omame and Ugochukwu K Nwajeri and M Abbas and Chibueze P Onyenegecha,Alexandria Engineering Journal,0.0,0,0,0,0,0,0,0,False,True,unpaywall:gold,False,Open Access,False,False
Andrew Omame,COVID-19 and dengue co-infection in Brazil: optimal control and cost-effectiveness analysis,2021,63,https://doi.org/10.1140/epjp/s13360-021-02030-6,34729293,Andrew Omame and H Rwezaura and ML Diagne and SC Inyama and JM Tchuenche,The European Physical Journal Plus,0.0,0,0,0,0,0,0,0,False,True,unpaywall:green,False,Open Access,False,False
Andrew Omame,Analysis of a co-infection model for HPV-TB,2020,61,https://doi.org/10.1016/j.apm.2019.08.012,40388467,A Omame and D Okuonghae and RA Umana and SC Inyama,Applied Mathematical Modelling,0.0,0,0,0,0,0,0,0,False,True,unpaywall:bronze,False,Open Access,False,False
Andrew Omame,HIV and COVID-19 co-infection: A mathematical model and optimal control,2022,54,https://doi.org/10.1016/j.imu.2022.100978,37146033,N Ringa and ML Diagne and H Rwezaura and A Omame and SY Tchoumi and JM Tchuenche,Informatics in Medicine Unlocked,0.0,0,0,0,0,0,0,0,False,True,unpaywall:gold,False,Open Access,False,False
Andrew Omame,Fractional order vaccination model for COVID-19 incorporating environmental transmission: a case study using Nigerian data,2023,53,https://doi.org/10.59292/bulletinbiomath.2023005,,Anne Atede and Andrew Omame and Simeon C Inyama,Bulletin of Biomathematics,0.0,0,0,0,0,0,0,0,False,True,unpaywall:hybrid,False,Open Access,True,False
Andrew Omame,"An optimal control model for COVID‐19, zika, dengue, and chikungunya co‐dynamics with reinfection",2023,50,https://doi.org/10.1002/oca.2936,36248678,Andrew Omame and Mary Ele Isah and Mujahid Abbas,Optimal Control Applications and Methods,1.25,4,0,0,0,0,0,0,False,True,unpaywall:green,False,Open Access,False,False
Andrew Omame,Assessing the impact of SARS-CoV-2 infection on the dynamics of dengue and HIV via fractional derivatives,2022,49,https://doi.org/10.1016/j.chaos.2022.112427,35844899,Andrew Omame and Mujahid Abbas and Abdel-Haleem Abdel-Aty,"Chaos, Solitons & Fractals",0.0,0,0,0,0,0,0,0,False,True,unpaywall:green,False,Open Access,False,False
Andrew Omame,A fractional order model for Dual Variants of COVID-19 and HIV co-infection via Atangana-Baleanu derivative,2022,48,https://doi.org/10.1016/j.aej.2022.03.013,,Andrew Omame and Mary Ele Isah and Mujahid Abbas and Abdel-Haleem Abdel-Aty and Chibueze P Onyenegecha,Alexandria Engineering Journal,0.0,0,0,0,0,0,0,0,False,True,unpaywall:green,False,Open Access,False,False
Andrew Omame,"The stability analysis of a co-circulation model for COVID-19, dengue, and zika with nonlinear incidence rates and vaccination strategies",2023,46,https://doi.org/10.1016/j.health.2023.100151,36883137,Andrew Omame and Mujahid Abbas,Healthcare Analytics,0.0,0,0,0,0,0,0,0,False,True,unpaywall:gold,False,Open Access,True,False
Andrew Omame,Mathematical modeling and optimal control of SARS-CoV-2 and tuberculosis co-infection: a case study of Indonesia,2022,44,https://doi.org/10.1007/s40808-022-01430-6,35814616,H Rwezaura and ML Diagne and A Omame and AL de Espindola and JM Tchuenche,Modeling Earth Systems and Environment,0.0,0,0,0,0,0,0,0,False,True,unpaywall:bronze,False,Open Access,True,False
Andrew Omame,Mathematical analysis of a two-sex Human Papillomavirus (HPV) model,2018,44,https://doi.org/10.1142/s1793524518500924,35007512,A Omame and RA Umana and D Okuonghae and SC Inyama,International Journal of Biomathematics,0.5,1,0,0,0,0,0,0,False,False,unpaywall:closed,False,Published,False,False
Andrew Omame,A Co-infection model for HPV and Syphilis with Optimal Control and Cost-Effectiveness Analysis,2021,43,https://doi.org/10.1142/s1793524521500509,,Andrew Omame and Daniel Okuonghae and Ugochukwu Emmanuel Nwafor and Benedict Udoka Odionyenma,International Journal of Biomathematics,0.0,0,0,0,0,0,0,0,False,True,unpaywall:green,False,Open Access,False,False
Andrew Omame,Optimal Control and Cost-Effectiveness Analysis of an HPV–Chlamydia trachomatis Co-infection Model,2021,39,https://doi.org/10.1007/s10441-020-09401-z,33389266,Andrew Omame and Celestine Uchenna Nnanna and Simeon Chioma Inyama,Acta Biotheoretica,0.0,0,0,0,0,0,0,0,False,True,unpaywall:green,False,Open Access,False,False
Andrew Omame,A co‐infection model for oncogenic human papillomavirus and tuberculosis with optimal control and Cost‐Effectiveness Analysis,2021,39,https://doi.org/10.1002/oca.2717,,Andrew Omame and Daniel Okuonghae,Optimal Control Applications and Methods,0.0,0,0,0,0,0,0,0,False,False,unpaywall:closed,False,Published,False,False
Andrew Omame,"Global asymptotic stability, extinction and ergodic stationary distribution in a stochastic model for dual variants of SARS-CoV-2",2023,37,https://doi.org/10.1016/j.matcom.2022.08.012,,Andrew Omame and Mujahid Abbas and Anwarud Din,Mathematics and Computers in Simulation,0.25,1,0,0,0,0,0,0,False,True,unpaywall:green,False,Open Access,False,False
Andrew Omame,A fractional-order multi-vaccination model for COVID-19 with non-singular kernel,2022,36,https://doi.org/10.1016/j.aej.2021.11.037,,A Omame and D Okuonghae and Ugochukwu K Nwajeri and Chibueze P Onyenegecha,Alexandria Engineering Journal,0.0,0,0,0,0,0,0,0,False,True,unpaywall:gold,False,Open Access,True,False
Andrew Omame,A fractional order model for the co-interaction of COVID-19 and Hepatitis B virus,2022,33,https://doi.org/10.1016/j.rinp.2022.105498,36748094,Andrew Omame and Mujahid Abbas and Chibueze P Onyenegecha,Results in Physics,1.0,1,0,0,0,0,0,0,False,True,unpaywall:gold,False,Open Access,False,False
Andrew Omame,A stochastic Model of the Dynamics of Stock Price for Forecasting,2017,33,https://doi.org/10.9734/jamcs/2017/38014,39577197,AIO Ofomata and SC Inyama and RA Umana and AO Omame,Journal of Advances in Mathematics and Computer Science,5.272,0,0,0,1,0,0,0,True,False,unpaywall:closed,False,Published,False,False
Andrew Omame,Analysis of a fractional order model for HPV and CT co-infection,2021,31,https://doi.org/10.1016/j.rinp.2021.104643,,Ugochukwu K Nwajeri and Andrew Omame and Chibueze P Onyenegecha,Results in Physics,0.5,1,0,0,0,0,0,0,False,True,unpaywall:gold,False,Open Access,False,False
Andrew Omame,A mathematical model and analysis of an SVEIR model for streptococcus pneumonia with saturated incidence force of infection,2020,29,https://doi.org/10.11648/j.mma.20200501.13,,Z. C. Opara and R. N Uche-Iwe and S. C. Inyama and A. Omame,Mathematical Modelling and Applications,0.0,0,0,0,0,0,0,0,False,True,unpaywall:gold,False,Open Access,False,False
Andrew Omame,Analytic solution of a fractional order mathematical model for tumour with polyclonality and cell mutation,2023,28,https://doi.org/10.1016/j.padiff.2023.100545,,A Omame and FD Zaman,Partial Differential Equations in Applied Mathematics,0.0,0,0,0,0,0,0,0,False,True,unpaywall:gold,False,Open Access,False,False
Andrew Omame,"Adaptive changes in sexual behavior in the high‐risk population in response to human monkeypox transmission in Canada can help control the outbreak: Insights from a two‐group, two‐route epidemic model",2023,26,https://doi.org/10.1002/jmv.28575,36772860,Nicola Luigi Bragazzi and Qing Han and Sarafa Adewale Iyaniwura and Andrew Omame and Aminath Shausan and Xiaoying Wang and Woldegebriel Assefa Woldegerima and Jianhong Wu and Jude Dzevela Kong,Journal of medical virology,6.05,7,0,0,0,0,0,0,False,True,unpaywall:hybrid,False,Open Access,True,False
Andrew Omame,A mathematical study of a model for HPV with two high-risk strains,2020,26,https://doi.org/10.1007/978-981-15-2286-4_4,,A Omame and D Okuonghae and SC Inyama,N/A,0.0,0,0,0,0,0,0,0,False,False,unpaywall:closed,False,Published,False,False
Andrew Omame,Understanding the impact of HIV on mpox transmission in the MSM population: a mathematical modeling study,2024,25,https://doi.org/10.2139/ssrn.4762707,40083295,Andrew Omame and Qing Han and Sarafa A Iyaniwura and Adeniyi Ebenezer and Nicola L Bragazzi and Xiaoying Wang and Jude D Kong and Woldegebriel A Woldegerima,Infectious Disease Modelling,0.0,0,0,0,0,0,0,0,False,False,unpaywall:closed,False,Published,True,False
Andrew Omame,A co-infection model for Two-Strain Malaria and Cholera with Optimal Control,2021,25,https://doi.org/10.1007/s40435-020-00748-2,,Kenneth Uzoma Egeonu and Andrew Omame and Simeon Chioma Inyama,International Journal of Dynamics and Control,1.0,1,0,0,0,0,0,0,False,True,unpaywall:green,False,Open Access,True,False
Andrew Omame,Knowing the unknown: the underestimation of monkeypox cases. Insights and implications from an integrative review of the literature,2022,23,https://doi.org/10.3389/fmicb.2022.1011049,36246252,Nicola Luigi Bragazzi and Woldegebriel Assefa Woldegerima and Sarafa Adewale and Qing Han and Xiaoying Wang and Aminath Shausan and Kingsley Badu and Mbah Patrick Okwen and Cheryl Prescod and Michelle Westin and Andrew Omame and Manlio Converti and Bruce Mellado and Jianhong Wu and Jude Dzevela Kong,Frontiers in Microbiology,8.4,11,0,0,0,0,0,0,False,True,unpaywall:gold,False,Open Access,False,False
Andrew Omame,"The optimal strategies to be adopted in controlling the co-circulation of COVID-19, Dengue and HIV: Insight from a mathematical model",2023,22,https://doi.org/10.3390/axioms12080773,,Andrew Omame and Aeshah A Raezah and Uchenna H Diala and Chinyere Onuoha,Axioms,0.0,0,0,0,0,0,0,0,False,True,unpaywall:gold,False,Open Access,False,False
Andrew Omame,Optimal Control of Chlamydia Model with Vaccination,2022,21,https://doi.org/10.1007/s40435-021-00789-1,39852869,Udoka Benedict Odionyenma and Andrew Omame and Nneka Onyinyechi Ukanwoke and Ikenna Nometa,International Journal of Dynamics and Control,0.0,0,0,0,0,0,0,0,False,True,unpaywall:green,False,Open Access,True,False
Andrew Omame,Klein–Gordon equation and thermodynamic properties with the Hua plus modified Eckart potential (HPMEP),2021,21,https://doi.org/10.1140/epjp/s13360-021-02142-z,,CP Onyenegecha and EE Oguzie and IJ Njoku and A Omame and CJ Okereke and UM Ukewuihe,The European Physical Journal Plus,0.0,0,0,0,0,0,0,0,False,False,unpaywall:closed,False,Published,False,False
Andrew Omame,Dirac equation and thermodynamic properties with the Modified Kratzer potential,2021,21,https://doi.org/10.1016/j.heliyon.2021.e08023,34611561,Chibueze P Onyenegecha and Ifeanyi J Njoku and Andrew Omame and Chioma J Okereke and E Onyeocha,Heliyon,0.0,0,0,0,0,0,0,0,False,True,unpaywall:gold,False,Open Access,False,False
Andrew Omame,Analytical solutions of D-dimensional Klein–Gordon equation with modified Mobius squared potential,2021,21,https://doi.org/10.1016/j.rinp.2021.104144,,CP Onyenegecha and AI Opara and IJ Njoku and SC Udensi and UM Ukewuihe and CJ Okereke and A Omame,Results in Physics,0.0,0,0,0,0,0,0,0,False,True,unpaywall:gold,False,Open Access,False,False
Andrew Omame,A stochastic stability analysis of an HBV–COVID-19 co-infection model in resource limitation settings,2022,20,https://doi.org/10.1080/17455030.2022.2147598,,Anwarud Din and Yongjin Li and Andrew Omame,Waves in Random and Complex Media,0.0,0,0,0,0,0,0,0,False,False,unpaywall:closed,False,Published,False,False
Andrew Omame,Mathematical Model and Optimal Control of New-Castle Disease (ND),2020,17,https://doi.org/10.11648/j.acm.20200903.14,,J. I . Uwakwe and S. C. Inyama and A. Omame,Applied and Computational Mathematics,0.0,0,0,0,0,0,0,0,False,True,unpaywall:gold,False,Open Access,False,False
Andrew Omame,Deterministic and stochastic models of the dynamics of drug resistant tuberculosis,2016,17,https://doi.org/10.1080/07362994.2024.2413632,,RA Umana and A Omame and SC Inyama,FUTO Journals Series,0.0,0,0,0,0,0,0,0,False,False,unpaywall:closed,False,Published,False,False
Andrew Omame,Mathematical analysis of a novel fractional order vaccination model for Tuberculosis incorporating susceptible class with underlying ailment,2024,14,https://doi.org/10.1080/02286203.2024.2371684,,A El-Mesady and Olumuyiwa James Peter and Andrew Omame and Festus Abiodun Oguntolu,International Journal of Modelling and Simulation,0.0,0,0,0,0,0,0,0,False,False,unpaywall:closed,False,Published,True,False
Andrew Omame,A Stochastic Model to Assess the Epidemiological Impact of Vaccine Booster Doses on COVID-19 and Viral Hepatitis B Co-Dynamics with Real Data,2024,14,https://doi.org/10.32604/cmes.2023.029681,,Andrew Omame and Mujahid Abbas and Dumitru Baleanu,CMES - Computer Modeling in Engineering & Sciences,0.0,0,0,0,0,0,0,0,False,True,unpaywall:gold,False,Open Access,False,False
Andrew Omame,On the existence of a stochastic model of typhoid fever,2015,14,https://doi.org/10.4103/1755-6783.105163,28241011,Andrew Omame and Reuben Andrew Umana and Nneka Onyinyechi Iheonu and S Chioma,Mathematical Theory and Modeling,19.35,13,0,1,0,2,0,0,True,False,unpaywall:closed,False,Published,False,False
Andrew Omame,Analysis of mathematical model of diabetes and tuberculosis co-infection,2023,13,https://doi.org/10.1007/s40819-023-01515-5,39696533,Chukwuemeka O Agwu and Andrew Omame and Simeon C Inyama,International Journal of Applied and Computational Mathematics,0.75,2,0,0,0,0,0,0,False,False,unpaywall:closed,False,Published,False,False
Andrew Omame,Mathematical analysis of a time-fractional coupled tumour model using Laplace and finite Fourier transforms,2024,12,https://doi.org/10.1088/1402-4896/ad1cbc,,Sadia Munir and Andrew Omame and Fiazud Din Zaman,Physica Scripta,0.0,0,0,0,0,0,0,0,False,True,unpaywall:bronze,False,Open Access,False,False
Andrew Omame,Mathematical Analysis of a model for Chlamydia and Gonorrhea Codynamics with Optimal Control,2021,12,https://doi.org/10.1016/j.rinp.2021.104566,,Eziaku Chinomso Chukukere and Andrew Omame and Chibueze Paul Onyenegecha and Simeon Chioma Inyama,Results in Physics,0.25,1,0,0,0,0,0,0,False,True,unpaywall:gold,False,Open Access,False,False
Andrew Omame,Stochastic model and simulation of the prevalence of measles,2014,12,https://doi.org/10.4236/am.2021.123013,39972251,A Omame and SC Inyama,Int J Math Sci Eng,133.98000000000002,2,0,15,1,0,0,0,True,True,unpaywall:gold,False,Open Access,False,False
Andrew Omame,A new co-infection model for HBV and HIV with vaccination and asymptomatic transmission using actual data from Taiwan,2024,11,https://doi.org/10.1088/1402-4896/ad4b6c,,Muhammad Asad Ullah and Nauman Raza and Andrew Omame and MS Alqarni,Physica Scripta,0.0,0,0,0,0,0,0,0,False,False,unpaywall:closed,False,Published,True,False
Andrew Omame,Co-dynamics of COVID-19 and viral hepatitis B using a mathematical model of non-integer order: Impact of vaccination,2023,11,https://doi.org/10.3390/fractalfract7070544,,Andrew Omame and Ifeoma P Onyenegecha and Aeshah A Raezah and Fathalla A Rihan,Fractal and Fractional,0.0,0,0,0,0,0,0,0,False,True,unpaywall:gold,False,Open Access,True,False
Andrew Omame,Solution of the Modified Time Fractional Coupled Burgers Equations Using the Laplace Adomian Decomposition Method,2023,11,https://doi.org/10.2478/ama-2023-0014,,Andrew Omame and Fiazud Din Zaman,Acta Mechanica et Automatica,0.0,0,0,0,0,0,0,0,False,True,unpaywall:gold,False,Open Access,False,False
Andrew Omame,Modelling the transmission dynamics of Nipah virus with optimal control,2020,11,https://doi.org/10.28919/jmcs/6117,40239175,BI Omede and PO Ameh and A Omame and B Bolaji,arXiv preprint arXiv:2010.04111,1.0,0,0,0,0,0,0,0,False,True,unpaywall:gold,False,Open Access,False,False
Andrew Omame,Assessing the impact of intervention measures in a mathematical model for monkeypox and COVID-19 co-dynamics in a high-risk population,2024,10,https://doi.org/10.1007/s40808-024-02132-x,,Andrew Omame and Aeshah A Raezah and Godwin Amechi Okeke and Tayyaba Akram and Azhar Iqbal,Modeling Earth Systems and Environment,0.0,0,0,0,0,0,0,0,False,False,unpaywall:closed,False,Published,True,False
Andrew Omame,A non-integer order model for Zika and Dengue co-dynamics with cross-enhancement,2023,10,https://doi.org/10.1016/j.health.2023.100276,,NO Iheonu and UK Nwajeri and A Omame,Healthcare Analytics,0.0,0,0,0,0,0,0,0,False,True,unpaywall:gold,False,Open Access,False,False
Andrew Omame,Analysis of a fractional-order model for dengue transmission dynamics with quarantine and vaccination measures,2024,9,https://doi.org/10.1038/s41598-024-62767-9,38796642,Muhammad Usman and Mujahid Abbas and Safeer Hussain Khan and Andrew Omame,Scientific Reports,0.0,0,0,0,0,0,0,0,False,True,unpaywall:gold,False,Open Access,True,False
Andrew Omame,Analysis of a non-integer order compartmental model for cholera and COVID-19 incorporating human and environmental transmissions,2023,9,https://doi.org/10.1088/1402-4896/ad075b,,Muhammad Usman and Mujahid Abbas and Andrew Omame,Physica Scripta,0.0,0,0,0,0,0,0,0,False,False,unpaywall:closed,False,Published,True,False
Andrew Omame,Analysis of a non‑integer order mathematical model for double strains of dengue and COVID‑19 co‑circulation using an efficient finite‑difference method,2023,7,https://doi.org/10.1038/s41598-023-44825-w,37853028,Emeka F Obiajulu and Andrew Omame and Simeon C Inyama and Uchenna H Diala and Salman A AlQahtani and Mabrook S Al‑Rakhami and Abdulaziz M Alawwad and Abdullilah A Alotaibi,Scientific Reports,0.0,0,0,0,0,0,0,0,False,True,unpaywall:gold,False,Open Access,False,False
Andrew Omame,Comparative analysis of a fractional co-infection model using nonstandard finite difference and two-step Lagrange polynomial methods,2024,6,https://doi.org/10.1016/j.padiff.2024.100702,,Anum Aish Buhader and Mujahid Abbas and Mudassar Imran and Andrew Omame,Partial Differential Equations in Applied Mathematics,0.0,0,0,0,0,0,0,0,False,True,unpaywall:gold,False,Open Access,False,False
Andrew Omame,A fractional-order model of COVID-19 and Malaria co-infection,2024,6,https://doi.org/10.59292/bulletinbiomath.2024006,37361719,Livinus Loko Iwa and Andrew Omame and Simeon Chioma Inyama,Bulletin of Biomathematics,1.25,4,0,0,0,0,0,0,False,True,unpaywall:hybrid,False,Open Access,True,False
Andrew Omame,Analysis of the solution of a model of SARS-CoV-2 variants and its approximation using two-step lagrange polynomial and euler techniques,2023,6,https://doi.org/10.3390/axioms12050480,,Muhammad Usman and Mujahid Abbas and Andrew Omame,Axioms,0.0,0,0,0,0,0,0,0,False,True,unpaywall:gold,False,Open Access,False,False
Andrew Omame,Analysis of a Mathematical Vaccination Model of an Infectious Measles Disease,2019,6,https://doi.org/10.33292/amm.v2i2.18,38667531,EU Nwafor and CJ Okoro and SC Inyama and A Omame and HI Mbachu,FUTO Journal Series,3.85,5,0,0,0,0,0,0,False,False,unpaywall:closed,False,Published,True,False
Andrew Omame,Determining the Impact of Variation of Harvesting Effort on the Qualitative Behaviour of a Coexistence Steady State Solution and Its Stability in Prey-Predator Fishery Model,2018,6,https://doi.org/10.1088/1742-6596/1569/3/032003,,IA Agwu and SC Inyama and RA Umana and A Omame and N Ukanwoke and A Ofomata and HI Mbachu and ES Udofia and JI Uwakwe,Academic Journal of Applied Mathematical Sciences,0.0,0,0,0,0,0,0,0,False,True,unpaywall:gold,False,Open Access,False,False
Andrew Omame,Modelling of Marburg virus transmission dynamics: a deep learning-driven approach with the effect of quarantine and health awareness interventions,2024,5,https://doi.org/10.1007/s40808-024-02169-y,,Noreen Mustafa and Jamshaid Ul Rahman and Andrew Omame,Modeling earth systems and environment,0.0,0,0,0,0,0,0,0,False,False,unpaywall:closed,False,Published,True,False
Andrew Omame,Deterministic mathematical model of tuberculosis disease with treatment and recovered groups,2019,5,https://doi.org/10.20431/2347-3142.0401004,,FM Gilbert and I Ihejirika and SC Inyama and A Omame and HI Mbachu and JI Uwakwe,International Journal of Mathematics and Statistics Invention,0.0,0,0,0,0,0,0,0,False,True,unpaywall:bronze,False,Open Access,False,False
Andrew Omame,Dynamics of Mpox in an HIV endemic community: A mathematical modelling approach,2025,4,https://doi.org/10.3934/mbe.2025010,,Andrew Omame and Sarafa A Iyaniwura and Qing Han and Adeniyi Ebenezer and Nicola L Bragazzi and Xiaoying Wang and Woldegebriel A Woldegerima and Jude D Kong,Mathematical Biosciences and Engineering,0.0,0,0,0,0,0,0,0,False,True,unpaywall:gold,False,Open Access,False,False
Andrew Omame,Modelling transmission dynamics of measles: the effect of treatment failure in complicated cases,2024,4,https://doi.org/10.1007/s40808-024-02120-1,,Olumuyiwa James Peter and Carlo Cattani and Andrew Omame,Modeling Earth Systems and Environment,0.0,0,0,0,0,0,0,0,False,False,unpaywall:closed,False,Published,False,False
Andrew Omame,Analysis and interpretation of a novel malaria transmission mathematical model with socioeconomic structure,2025,2,https://doi.org/10.1007/s11071-024-10807-4,,Muhammad Asad Ullah and Nauman Raza and Mohammad Y Alshahrani and Andrew Omame,Nonlinear Dynamics,0.0,0,0,0,0,0,0,0,False,False,unpaywall:closed,False,Published,True,False
Andrew Omame,Closed-form solutions for a reaction-diffusion SIR model with different diffusion coefficients,2025,2,https://doi.org/10.3934/dcdss.2024103,,Rehana Naz and Andrew Gratien Johnpillai and Fazal Mahmood Mahomed and Andrew Omame,Discrete and Continuous Dynamical Systems-S,0.0,0,0,0,0,0,0,0,False,True,unpaywall:gold,False,Open Access,False,False
Andrew Omame,Cost-Effectiveness Analysis of COVID-19 Vaccination: A review of some Vaccination Models,2024,2,https://doi.org/10.1016/j.padiff.2024.100842,40035792,Rehana Naz and Andrew Omame and Mariano Torrisi,Partial Differential Equations in Applied Mathematics,0.0,0,0,0,0,0,0,0,False,True,unpaywall:gold,False,Open Access,True,False
Andrew Omame,Modelling the transmission of Mpox with case study in Nigeria and Democratic Republic of Congo (DRC),2024,2,https://doi.org/10.1007/3-540-29145-8_16,,Olumuyiwa James Peter and Oluwatosin Babasola and Mayowa M Ojo and Andrew Omame,Computational Methods for Differential Equations,0.0,0,0,0,0,0,0,0,False,False,unpaywall:closed,False,Published,False,False
Andrew Omame,Solution approximation of fractional boundary value problems and convergence analysis using AA-iterative scheme,2024,1,https://doi.org/10.3934/math.2024641,,Mujahid Abbas and Cristian Ciobanescu and Muhammad Waseem Asghar and Andrew Omame,AIMS Mathematics,0.0,0,0,0,0,0,0,0,False,True,unpaywall:gold,False,Open Access,False,False
Andrew Omame,Age-Infection Model and Control of Marek Disease,2020,1,https://doi.org/10.11648/j.acm.20200905.13,,Uwakwe Joy Ijeoma and Inyama Simeon Chioma and Omame Andrew,Applied and Computational Mathematics,0.0,0,0,0,0,0,0,0,False,True,unpaywall:gold,False,Open Access,False,False
Andrew Omame,Analysis of a novel mathematical model for HBV and HIV incorporating vertical transmission and intervention measures,2025,0,https://doi.org/10.1007/s40808-025-02408-w,,Atif Rasheed and Ali Raza and Andrew Omame,Modeling Earth Systems and Environment,0.0,0,0,0,0,0,0,0,False,False,unpaywall:closed,False,Published,True,False
Andrew Omame,A mathematical model for assessing the effectiveness of vaccination in controlling Mpox dynamics and mitigating disease burden in Nigeria and the Democratic Republic of Congo,2025,0,https://doi.org/10.1007/s12190-025-02455-7,,Olumuyiwa James Peter and Oluwatosin Babasola and Mayowa Micheal Ojo and Andrew Omame,Journal of Applied Mathematics and Computing,0.0,0,0,0,0,0,0,0,False,False,unpaywall:closed,False,Published,True,False
