Author,Paper Title,Year,Citations,DOI,PMID,Authors,Journal,Altmetric Score,Twitter Mentions,Reddit Mentions,News Mentions,Blog Mentions,Facebook Mentions,Wikipedia Mentions,Policy Mentions,Media Mentioned,Open Access,OA Status,Preprint,Publication Type,Public Health Impact,Capacity Building,Paper Link
Kingsley Badu,"Accuracy of diagnosis among clinical malaria patients: comparing microscopy, RDT and a highly sensitive quantitative PCR looking at the implications for submicroscopic infections",2023,69,https://doi.org/10.1186/s12936-023-04506-5,,Stephen Opoku Afriyie and Thomas Kwame Addison and Yilekal Gebre and Abdul-Hakim Mutala and Kwasi Baako Antwi and Dawood Ackom Abbas and Kofi Agyapong Addo and Austine Tweneboah and Nana Kwame Ayisi-Boateng and Cristian Koepfli and Kingsley Badu,Malaria Journal,23.449999999999996,22,0,1,0,0,0,0,True,True,doaj,False,Open Access,True,False,https://doi.org/10.1186/s12936-023-04506-5
Kingsley Badu,Climate drivers of malaria transmission seasonality and their relative importance in sub‐Saharan Africa,2023,32,https://doi.org/10.1029/2022gh000698,36743738,Edmund I Yamba and Andreas H Fink and Kingsley Badu and Ernest O Asare and Adrian M Tompkins and Leonard K Amekudzi,GeoHealth,104.45,10,0,13,0,1,0,0,True,True,doaj,False,Open Access,True,False,https://doi.org/10.1029/2022gh000698
Kingsley Badu,Decolonizing global AI governance: assessment of the state of decolonized AI governance in Sub-Saharan Africa,2024,22,https://doi.org/10.2139/ssrn.4652444,39113766,Gelan Ayana and Kokeb Dese and Hundessa Daba Nemomssa and Bontu Habtamu and Bruce Mellado and Kingsley Badu and Edmund Yamba and Sylvain Landry Faye and Moise Ondua and Dickson Nsagha and Denis Nkweteyim and Jude Dzevela Kong,Royal Society Open Science,4.1,5,0,0,0,0,0,0,False,True,doaj,False,Open Access,False,False,https://doi.org/10.2139/ssrn.4652444
Kingsley Badu,Reactive case detection strategy for malaria control and elimination: a 12 year systematic review and meta-analysis from 25 malaria-endemic countries,2023,9,https://doi.org/10.3390/tropicalmed8030180,36977181,Ebenezer Krampah Aidoo and Frank Twum Aboagye and Felix Abekah Botchway and George Osei-Adjei and Michael Appiah and Ruth Duku-Takyi and Samuel Asamoah Sakyi and Linda Amoah and Kingsley Badu and Richard Harry Asmah and Bernard Walter Lawson and Karen Angeliki Krogfelt,N/A,3.2,5,0,0,0,0,0,0,False,True,doaj,False,Open Access,True,False,https://doi.org/10.3390/tropicalmed8030180
Kingsley Badu,Comparison of three rapid diagnostic tests for Plasmodium falciparum diagnosis in Ghana,2024,8,https://doi.org/10.1186/s12936-024-05073-z,39215297,Tolulope Adeyemi Kayode and Agyapong Kofi Addo and Thomas Kwame Addison and Austine Tweneboah and Stephen Opoku Afriyie and Dawood Ackom Abbas and Ayesha Seth and Abraham K Badu-Tawiah and Kingsley Badu and Cristian Koepfli,Malaria Journal,3.6,5,0,0,0,0,0,0,False,True,doaj,False,Open Access,False,False,https://doi.org/10.1186/s12936-024-05073-z
Kingsley Badu,Diversity and antibiograms of bacteria isolated from cutaneous leishmaniasis wounds in the Nkwanta South District of Ghana,2023,6,https://doi.org/10.1007/s00203-023-03411-4,36707480,Comfort Yeboaa and Hayford Odoi and Rhoda Owusu Ntim and Yaw Duah Boakye and Godwin Kwakye-Nuako and Christian Agyare and Vivian Etsiapa Boamah and Kingsley Badu,Archives of Microbiology,0.0,0,0,0,0,0,0,0,False,True,doaj,False,Open Access,False,False,https://doi.org/10.1007/s00203-023-03411-4
Kingsley Badu,"A digital microscope for the diagnosis of Plasmodium falciparum and Plasmodium vivax, including P. falciparum with hrp2/hrp3 deletion",2024,4,https://doi.org/10.1371/journal.pgph.0003091,38768243,Yalemwork Ewnetu and Kingsley Badu and Lise Carlier and Claudia A Vera-Arias and Emma V Troth and Abdul-Hakim Mutala and Stephen Opoku Afriyie and Thomas Kwame Addison and Nega Berhane and Wossenseged Lemma and Cristian Koepfli,PLOS Global Public Health,23.35000000000001,30,0,0,0,0,0,0,False,True,doaj,False,Open Access,False,False,https://doi.org/10.1371/journal.pgph.0003091
Kingsley Badu,"Welcome to the next generation of Malaria Rapid Diagnostic Tests: Comparative Analysis of NxTek Eliminate Malaria Pf, Biocredit Malaria Ag Pf, and SD Bioline Malaria Ag Pf for Plasmodium falciparum Diagnosis in Ghana",2023,2,https://doi.org/10.21203/rs.3.rs-3459263/v1,,Tolulope A Kayode and Agyapong Kofi Addo Addo and Thomas Kwame Addison and Austine Tweneboah and Stephen Opoku Afriyie and Dawood Ackom Abass and Ayesha Seth and Abraham K Badu-Tawiah and Kingsley Badu and Cristian Koepfli,Research Square,1.35,3,0,0,0,0,0,0,False,True,doaj,False,Open Access,True,False,https://doi.org/10.21203/rs.3.rs-3459263/v1
Kingsley Badu,Regional variation and epidemiological insights in malaria underestimation in Cameroon,2025,1,https://doi.org/10.1101/2023.11.06.23298167,,Sarafa A Iyaniwura and Qing Han and Ngem Bede Yong and Ghislain Rutayisire and Agnes Adom-Konadu and Okwen Patrick Mbah and David Poumo Tchouassi and Kingsley Badu and Jude D Kong,Infectious Disease Modelling,2.75,4,0,0,0,0,0,0,False,True,doaj,False,Open Access,True,False,https://doi.org/10.1101/2023.11.06.23298167
Kingsley Badu,Transient Exposure of Humans to Animal Trypanosomes in Communities Highly Exposed to Tsetse Fly Bite,2024,1,https://doi.org/10.21203/rs.3.rs-4492148/v1,,Kofi Agyapong Addo and Austine Tweneboah and Thomas Kwame Addison and Ibrahim Alhadj Moussa Mahamat and Kwasi Baako Antwi and Stephen Opoku Afriyie and Kwadwo Boampong and Matthew Addo Glover and Petre Berger and Soerge Kelm and Kingsley Badu,N/A,0.0,0,0,0,0,0,0,0,False,True,doaj,False,Open Access,False,False,https://doi.org/10.21203/rs.3.rs-4492148/v1
Kingsley Badu,Prevalence of and challenges in diagnosing subclinical Plasmodium falciparum infections in Southern Ghana,2024,1,https://doi.org/10.21203/rs.3.rs-4462230/v1,40241053,Abdul-Hakim Mutala and Stephen Opoku Afriyie and Thomas Kwame Addison and Kwasi Baako Antwi and Emma V Troth and Claudia A Vera-Arias and Abraham Badu-Tawiah and Mathew Glover Addo and Cristian Koepfli and Kingsley Badu,N/A,8.45,10,0,0,0,0,0,0,False,True,doaj,False,Open Access,False,False,https://doi.org/10.21203/rs.3.rs-4462230/v1
Kingsley Badu,The transmission of Animal African Trypanosomiasis in Two Districts in the forest zone of Ghana,2024,1,https://doi.org/10.4269/ajtmh.23-0329,38697074,Austine Tweneboah and Jana Rosenau and Kofi Agyapong Addo and Thomas Kwame Addison and Mahamat Alhadj Moussa Ibrahim and Judith Sophie Weber and Soerge Kelm and Kingsley Badu,The American Journal of Tropical Medicine and Hygiene,3.0,0,0,0,0,0,1,0,True,True,doaj,False,Open Access,False,False,https://doi.org/10.4269/ajtmh.23-0329
Kingsley Badu,Two cases of COVID-19 presenting with severe malaria: a clinical challenge (case report),2023,1,https://doi.org/10.11604/pamj.2023.44.83.34453,37193108,Nana Kwame Ayisi-Boateng and Kwadwo Boampong and Betty Nkansah Osei Mensah and Eric Oduro and Kingsley Badu,Pan African Medical Journal,1.0,3,0,0,0,0,0,0,False,True,doaj,False,Open Access,True,False,https://doi.org/10.11604/pamj.2023.44.83.34453
Kingsley Badu,Estimating malaria transmission risk through surveillance of human–vector interactions in northern Ghana,2023,1,https://doi.org/10.1186/s13071-023-05793-2,37337221,Sylvester Coleman and Yemane Yihdego and Frank Gyamfi and Lena Kolyada and Jon Eric Tongren and Sixte Zigirumugabe and Dominic B Dery and Kingsley Badu and Kwasi Obiri-Danso and Daniel Boakye and Daniel Szumlas and Jennifer S Armistead and Samuel K Dadzie,Parasites & Vectors,19.599999999999998,15,0,1,0,0,0,0,True,True,doaj,False,Open Access,True,False,https://doi.org/10.1186/s13071-023-05793-2
Kingsley Badu,Trends and advances in image-based mosquito identification and classification using machine learning models: A systematic review,2025,0,https://doi.org/10.1016/j.compbiomed.2025.110373,40409030,Alice Bagyiereyele Lakyiere and Rose-Mary Owusuaa Gyening Mensah and Nutifafa Yao Agbenor-Efunam and Edmund Yamba and Kingsley Badu,N/A,0.0,0,0,0,0,0,0,0,False,True,doaj,False,Open Access,False,False,https://doi.org/10.1016/j.compbiomed.2025.110373
Kingsley Badu,Diagnosis On-Demand: Field Evaluation of Microfluidic Paper Device for the Detection of Asymptomatic Malaria,2025,0,https://doi.org/10.1021/acs.analchem.5c01324,40350582,Ayesha Seth and Suji Lee and Girish Muralikrishnan and Edgar Garcia and James Odei and Abdul-Hakim Mutala and Kingsley Badu and Abraham K Badu-Tawiah,Analytical Chemistry,79.25999999999999,2,0,9,2,0,0,0,True,True,doaj,False,Open Access,True,False,https://doi.org/10.1021/acs.analchem.5c01324
Kingsley Badu,Microbial Load and Chemical Composition of Tomato (Lycopersicon esculentum) During Market Storage,2025,0,https://doi.org/10.21203/rs.3.rs-5981887/v1,,Abigail Kowah Quaye and Mercy Badu and Sandra Boatemaa Kushitor and Kingsley Badu,N/A,0.0,0,0,0,0,0,0,0,False,True,doaj,False,Open Access,False,False,https://doi.org/10.21203/rs.3.rs-5981887/v1
Kingsley Badu,Shifting from Margins to Momentum of the Global South Leadership in Responsible Artificial Intelligence Solutions for Health: Lessons from the UNGA79 Science Summit,2025,0,https://doi.org/10.2139/ssrn.5222262,,Gelan Ayana and Hana Trigui and Romulo de Castro and Andre Carlos Ponce de Leon Ferreira de Carvalho and Dickson Nsagha and Kingsley Badu and Sylvain Landry Faye and Bruce Mellado and Lucita Lazo and Angela Lee and Manuel Colome and Patricia Espinoza-Lopez and Alvin Marcelo and Mohammed-Amine Koulali and Radwan Qasrawi and Chaitali Sinha and Hannah Chirgwin and Emmanuel Musa and Jude Dzevela Kong,N/A,2.7,3,0,0,0,0,0,0,False,True,doaj,False,Open Access,False,True,https://doi.org/10.2139/ssrn.5222262
Kingsley Badu,The burden and diagnostic challenges of subclinical Plasmodium falciparum infections in Southern Ghana,2025,0,https://doi.org/10.1186/s12879-025-10897-4,40241053,Abdul-Hakim Mutala and Stephen Opoku Afriyie and Thomas Kwame Addison and Kwasi Baako Antwi and Emma V Troth and Claudia A Vera-Arias and Abraham Badu-Tawiah and Matthew Glover Addo and Cristian Koepfli and Kingsley Badu,BMC Infectious Diseases,8.45,10,0,0,0,0,0,0,False,True,doaj,False,Open Access,False,False,https://doi.org/10.1186/s12879-025-10897-4
Kingsley Badu,Degradation of Preformed Gram-Positive and Gram-Negative Bacterial Biofilms Using Disintegrated and Intact Phages,2025,0,https://doi.org/10.1089/phage.2024.0029,40351404,Sahd Ali and Abdulkerim Karaynir and Hanife Salih Doğan and Ramesh Nachimuthu and Kingsley Badu and Bülent Bozdoğan,PHAGE,0.0,0,0,0,0,0,0,0,False,True,doaj,False,Open Access,False,False,https://doi.org/10.1089/phage.2024.0029
Kingsley Badu,AI-supported automated microscopy for malaria diagnosis,2025,0,https://doi.org/10.1101/2025.06.11.25329408,,Dawit Hawaria and Yalemwork Ewnetu and Henry Kamugisha and Abdul-Hakim Mutala and Birhanu Lulu and Colins O Oduma and Isaac Asenso Brobbey-Kyei and Tolulope Adeyemi Kayode and Wossenseged Lemma and Nega Berhane and Kingsley Badu and Cristian Koepfli,medRxiv,0.25,0,0,0,0,0,0,0,False,True,doaj,False,Open Access,True,False,https://doi.org/10.1101/2025.06.11.25329408
Kingsley Badu,"Socio-demographic factors, housing characteristics, and clinical symptoms associated with falciparum malaria in two rapidly urbanizing areas in the Ashanti region of Ghana",2024,0,https://doi.org/10.1186/s12936-024-05185-6,39574064,Stephen Opoku Afriyie and Kwasi Baako Antwi and Abdul-Hakim Mutala and Dawood Ackom Abbas and Kofi Agyapong Addo and Austine Tweneboah and Thomas Kwame Addison and Eric Osei and Cristian Koepfli and Kingsley Badu,Malaria Journal,9.449999999999998,12,0,0,0,0,0,0,False,True,doaj,False,Open Access,True,False,https://doi.org/10.1186/s12936-024-05185-6
Kingsley Badu,Challenges in diagnosis of clinical and subclinical Plasmodium falciparum infections in Ghana and feasibility of reactive interventions to shrink the subclinical reservoir,2024,0,https://doi.org/10.1186/s12936-024-05096-6,39256754,Madeline Reynders and Austine Tweneboah and Dawood Ackom Abbas and Stephen Opoku Afriyie and Stephen Nelly Nketsiah and Kingsley Badu and Cristian Koepfli,Malaria Journal,2.85,3,0,0,0,0,0,0,False,True,doaj,False,Open Access,True,False,https://doi.org/10.1186/s12936-024-05096-6
Kingsley Badu,A digital microscope for the diagnosis of,2024,0,https://doi.org/10.1088/0950-7671/39/10/438,40549094,Y Ewnetu and K Badu and L Carlier and CA Vera-Arias and EV Troth and AH Mutala,Plasmodium falciparum,0.0,0,0,0,0,0,0,0,False,True,doaj,False,Open Access,False,False,https://doi.org/10.1088/0950-7671/39/10/438
