Author,Paper Title,Year,Citations,DOI,PMID,Authors,Journal,Altmetric Score,Twitter Mentions,Reddit Mentions,News Mentions,Blog Mentions,Facebook Mentions,Wikipedia Mentions,Policy Mentions,Media Mentioned,Open Access,OA Status,Preprint,Publication Type,Public Health Impact,Capacity Building,Paper Link
Vongani Chabalala,Investigation into the evolution of char structure using Raman spectroscopy in conjunction with coal petrography; Part 1,2011,124,https://doi.org/10.1016/j.fuproc.2010.09.006,,VP Chabalala and N Wagner and S Potgieter-Vermaak,Fuel Processing Technology,0,0,0,0,0,0,0,0,False,True,doaj,False,Open Access,False,False,https://doi.org/10.1016/j.fuproc.2010.09.006
Vongani Chabalala,Testing reproducibility of vitrinite and solid bitumen reflectance measurements in North American unconventional source-rock reservoir petroleum systems,2020,42,https://doi.org/10.1016/j.marpetgeo.2019.104172,,Paul C Hackley and Carla V Araujo and Angeles G Borrego and Antonis Bouzinos and Brian J Cardott and Humberto Carvajal-Ortiz and Martha Rocio López Cely and Vongani Chabalala and Peter J Crosdale and Thomas D Demchuk and Cortland F Eble and Deolinda Flores and Agnieszka Furmann and Thomas Gentzis and Paula A Gonçalves and Carsten Guvad and Mária Hámor-Vidó and Iwona Jelonek and Michelle N Johnston and Tatiana Juliao-Lemus and Stavros Kalaitzidis and Wayne R Knowles and Jolanta Kus and Zhongsheng Li and Gordon Macleod and Maria Mastalerz and Taíssa R Menezes and Seare Ocubalidet and Richard Orban and Walter Pickel and Paddy Ranasinghe and Joana Ribeiro and Olga Patricia Gómez Rojas and Ricardo Ruiz-Monroy and Jaques S Schmidt and Abbas Seyedolali and Georgios Siavalas and Isabel Suarez-Ruiz and Carlos Vargas Vargas and Brett J Valentine and Nicola Wagner and Bree Wrolson and Julian Esteban Jaramillo Zapata,Marine and Petroleum Geology,0,0,0,0,0,0,0,0,False,True,doaj,False,Open Access,False,False,https://doi.org/10.1016/j.marpetgeo.2019.104172
Vongani Chabalala,"Geochemistry and organic petrology of the permian whitehill formation, Karoo Basin (RSA) and the Devonian/Carboniferous shale of the Appalachian Basin (USA)",2020,18,https://doi.org/10.1016/j.coal.2020.103612,,VP Chabalala and N Wagner and N Malumbazo and CF Eble,International Journal of Coal Geology,0,0,0,0,0,0,0,0,False,True,doaj,False,Open Access,False,False,https://doi.org/10.1016/j.coal.2020.103612
Vongani Chabalala,Cold-formed circular hollow sections under axial compression,2014,3,https://doi.org/10.3233/978-1-61499-466-4-1148,,Morgan Dundu and Vongani Chabalala,N/A,0,0,0,0,0,0,0,0,False,True,doaj,False,Open Access,False,False,https://doi.org/10.3233/978-1-61499-466-4-1148
Vongani Chabalala,Application of Organic Petrology and Raman Spectroscopy in Thermal Maturity Determination of the Karoo Basin (RSA) Shale Samples,2023,2,https://doi.org/10.3390/min13091199,,Vongani Chabalala and Nikki Wagner and Nandi Malumbazo,Minerals,0,0,0,0,0,0,0,0,False,True,doaj,False,Open Access,False,False,https://doi.org/10.3390/min13091199
Vongani Chabalala,"The Application of Organic Petrology, Raman Spectroscopy, and Geochemistry to Karoo Basin (South Africa) Shale Gas Samples",2022,0,https://doi.org/10.3390/min13091199,,Vongani Chabalala,N/A,0,0,0,0,0,0,0,0,False,True,doaj,False,Open Access,False,False,https://doi.org/10.3390/min13091199
Vongani Chabalala,Raman Spectroscopy and Petrographic Analysis for the Study of Char Structure,2010,0,https://doi.org/10.1063/1.3482614,,S Potgieter‐Vermaak and V Chabalala,AIP Conference Proceedings,0,0,0,0,0,0,0,0,False,True,doaj,False,Open Access,False,False,https://doi.org/10.1063/1.3482614
Vongani Chabalala,Investigation into Char Structure Using Raman and Petrographic Techniques to Assess Combustion Reactivity,2010,0,https://doi.org/10.1016/j.fuel.2007.01.029,,Vongani Chabalala,N/A,0,0,0,0,0,0,0,0,False,True,doaj,False,Open Access,False,False,https://doi.org/10.1016/j.fuel.2007.01.029
Vongani Chabalala,INVESTIGATION INTO CHAR STRUCTURE USING RAMAN AND PETROGRAPHIC TECHNIQUES TO ASSESS COMBUSTION REACTIVITY is my own work and has not been submitted at any other university.,N/A,0,https://doi.org/10.2307/j.ctvzpv6w2.12,,V Chabalala,N/A,0,0,0,0,0,0,0,0,False,True,doaj,False,Open Access,False,False,https://doi.org/10.2307/j.ctvzpv6w2.12
