Author,Paper Title,Year,Citations,DOI,PMID,Authors,Journal,Altmetric Score,Twitter Mentions,Reddit Mentions,News Mentions,Blog Mentions,Facebook Mentions,Wikipedia Mentions,Policy Mentions,Media Mentioned,Open Access,OA Status,Preprint,Publication Type,Public Health Impact,Capacity Building,Paper Link
Jerry Kponyoh,We need Afrocentric datasets for inclusive AI growth,2025,0,https://doi.org/10.1038/s41562-025-02140-6,40097803,Jerry John Kponyo and Francis Kemausuor and Eric Tutu Tchao and Henry Nunoo-Mensah and Rachel Yayra Adjoe,Nature Human Behaviour,4.0,4,0,0,0,0,0,0,False,True,doaj,False,Open Access,False,False,https://doi.org/10.1038/s41562-025-02140-6
Jerry Kponyoh,Predictive AI Maintenance of Distribution Oil‐Immersed Transformer via Multimodal Data Fusion: A New Dynamic Multiscale Attention CNN‐LSTM Anomaly Detection Model for Industrial Energy Management,2025,0,https://doi.org/10.1049/elp2.70011,,Elvis Tamakloe and Benjamin Kommey and Jerry John Kponyo and Eric Tutu Tchao and Andrew Selasi Agbemenu and Griffith Selorm Klogo,IET Electric Power Applications,0.0,0,0,0,0,0,0,0,False,True,doaj,False,Open Access,False,False,https://doi.org/10.1049/elp2.70011
Jerry Kponyoh,Ancient Cultural Models from Informal Learning Structures That Can Transform Developments in Africa: This Ndịgbo Discuss,2025,0,https://doi.org/10.1177/23939575241277709,,CV Ikpo and EK Akowuah and KO Boateng and JJ Kponyo and H Nunoo-Mensah and YS Appiah,Journal of Entrepreneurship and Innovation in Emerging Economies,0.0,0,0,0,0,0,0,0,False,True,doaj,False,Open Access,False,False,https://doi.org/10.1177/23939575241277709
Jerry Kponyoh,AfroPALM-Afrocentric palm oil adulteration learning models: An end-to-end deep learning approach for detection of palm oil adulteration,2024,0,https://doi.org/10.1016/j.lwt.2024.116904,,Andrew Selasi Agbemenu and Andrews Tang and Elton Modestus Gyabeng and Prince Odame and Eric Tutu Tchao and Eliel Keelson and John-Lewis Zinia Zaukuu and Jerry John Kponyo,LWT,0.0,0,0,0,0,0,0,0,False,True,doaj,False,Open Access,False,False,https://doi.org/10.1016/j.lwt.2024.116904
Jerry Kponyoh,Characteristic modal analysis in miniaturization and bandwidth‐enhancement of monopole antenna for WLAN/WiMAX/LTE applications,2024,0,https://doi.org/10.1002/mop.33921,,Mubarak S Ellis and Abdul‐Rahman Ahmed and Jerry J Kponyo and Isaac Acquah and Nouman Rasool,Microwave and Optical Technology Letters,0.0,0,0,0,0,0,0,0,False,True,doaj,False,Open Access,False,False,https://doi.org/10.1002/mop.33921
Jerry Kponyoh,Pilot Low-Cost Concentrating Solar Power Systems Deployment in Sub-Saharan Africa: A Case Study of Implementation Challenges,2020,0,https://doi.org/10.3390/su12156223,,Emmanuel Wendsongre Ramde and Eric Tutu Tchao and Yesuenyeagbe Atsu Kwabla Fiagbe and Jerry John Kponyo and Asakipaam Simon Atuah,N/A,0.0,0,0,0,0,0,0,0,False,True,doaj,False,Open Access,False,False,https://doi.org/10.3390/su12156223
Jerry Kponyoh,Design of A Minimal Control Traffic Overhead Topology Discovery and Data Forwarding Protocol for SDWSNS,2020,0,https://doi.org/10.22541/au.158456504.48145761,,Simon Asakipaam and Justice Agyemang and Fred Appiah-Twum and Jerry Kponyo,Authorea Preprints,0.0,0,0,0,0,0,0,0,False,True,doaj,False,Open Access,False,False,https://doi.org/10.22541/au.158456504.48145761
Jerry Kponyoh,Simple circularly polarized planar monopole inverted T-shaped antenna,2020,0,https://doi.org/10.1002/mop.32026,,Abdul-Rahman Ahmed and S Ellis Mubarak and Jerry John Kponyo,N/A,0.0,0,0,0,0,0,0,0,False,True,doaj,False,Open Access,False,False,https://doi.org/10.1002/mop.32026
Jerry Kponyoh,A Compact Wideband Circularly Polarized L-Slot Antenna Edge-Fed by a Microstrip Feedline for C-Band Applications,2017,0,https://doi.org/10.2528/pierl16111105,,Abdul-Rahman Ahmed and S Ellis Mubarak and Jerry J Kponyo,N/A,0.0,0,0,0,0,0,0,0,False,True,doaj,False,Open Access,False,False,https://doi.org/10.2528/pierl16111105
Jerry Kponyoh,A 6-port Network Technique for Extraction of 2-Port DUT Noise Correlation Matrix: A Theoretical Verification through Modeling and Simulation,2016,0,https://doi.org/10.5013/ijssst.a.17.35.11,,AR Ahmed and J Kponyo and A Opare and S Nwezege and HI Frank and H Hamdoun and S Alshehri and LO Akazua,"International Journal of Simulation--Systems, Science & Technology",0.0,0,0,0,0,0,0,0,False,True,doaj,False,Open Access,False,False,https://doi.org/10.5013/ijssst.a.17.35.11
Jerry Kponyoh,Temperature Calibration of a Passive Eight-Port Network for Noise Parameters Measurement,2015,0,https://doi.org/10.5515/kjkiees.2015.26.2.119,,Abdul-Rahman Ahmed and Jerry Kponyo and Kwasi Opare and Nwizege S Kenneth and Koudjo Koumadi,N/A,0.0,0,0,0,0,0,0,0,False,True,doaj,False,Open Access,False,False,https://doi.org/10.5515/kjkiees.2015.26.2.119
Jerry Kponyoh,Optimization of PHY Layer Protocol for Wireless and Mobile Networks,2014,0,https://doi.org/10.1109/ems.2014.56,,Kenneth Nwizege and Jerry Kponyo and Kwasi Opare and Mmeah Shedrack,N/A,0.0,0,0,0,0,0,0,0,False,True,doaj,False,Open Access,False,False,https://doi.org/10.1109/ems.2014.56
Jerry Kponyoh,A Routing Strategy with Distributed Location Service for VANETs,2014,0,https://doi.org/10.1016/j.jpdc.2013.10.004,,Kponyo Jerry Yang Xing and Kuang Yujun,Journal of Chongqing University of Post and Telecommunications(Natural Science Edition),0.0,0,0,0,0,0,0,0,False,True,doaj,False,Open Access,False,False,https://doi.org/10.1016/j.jpdc.2013.10.004
Jerry Kponyoh,A Three-Party Password Authenticated Key Exchange Protocol with Key Confirmation,2011,0,https://doi.org/10.5815/ijwmt.2011.05.03,,Gang Yao,N/A,0.0,0,0,0,0,0,0,0,False,True,doaj,False,Open Access,False,False,https://doi.org/10.5815/ijwmt.2011.05.03
Jerry Kponyoh,Intelligent Systems with Applications,N/A,0,https://doi.org/10.1108/lhtn.2001.23918bac.009,39206419,Albert Dede and Henry Nunoo-Mensah and Eric Tutu Tchao and Andrew Selasi Agbemenu and Prince Ebenezer Adjei and Francisca Adoma Acheampong and Jerry John Kponyo,N/A,2.35,3,0,0,0,0,0,0,False,True,doaj,False,Open Access,False,False,https://doi.org/10.1108/lhtn.2001.23918bac.009
Jerry Kponyoh,Miniature High Gain Monopole Antenna,N/A,0,https://doi.org/10.2139/ssrn.4541279,38912464,Sani Mubarak Ellis and A-R Ahmed and JJ Kponyo and KO Gyasi and KSO Kwakye,Available at SSRN 4541279,0.0,0,0,0,0,0,0,0,False,True,doaj,False,Open Access,False,False,https://doi.org/10.2139/ssrn.4541279
Jerry Kponyoh,Closed Loop Capacitive Accelerometer Model using Simple Regression Test for Linearity,N/A,0,https://doi.org/10.25046/aj0602118,,Mamudu Hamidu and Jerry John Kponyo,choice,0.0,0,0,0,0,0,0,0,False,True,doaj,False,Open Access,False,False,https://doi.org/10.25046/aj0602118
Jerry Kponyoh,Design of an Intelligent System to Selectively Block Mobile Phone Communication within a Mobile Phone Restricted Area,N/A,0,https://doi.org/10.1109/gcce62371.2024.10760667,,Michael Agyare and Jerry John Kponyo and Francis Kwabena Oduro-Gyimah,N/A,0.0,0,0,0,0,0,0,0,False,True,doaj,False,Open Access,False,False,https://doi.org/10.1109/gcce62371.2024.10760667
Jerry Kponyoh,Emergency Call Routing Schemes,N/A,0,https://doi.org/10.1287/msom.1060.0119,33834105,Jennifer Appiah-Kubi and Jerry John Kponyo and Kwasi Adu-Boahen Opare,N/A,3.0,0,0,0,0,0,0,0,False,True,doaj,False,Open Access,False,False,https://doi.org/10.1287/msom.1060.0119
Jerry Kponyoh,An Algorithm to Determine the Extent of an Epidemic Spread: A NetLogo Modeling Approach,N/A,0,https://doi.org/10.11648/j.eas.20190404.11,,Jerry John Kponyo and Kenneth Coker and Justice Owusu Agyemang and Joyce Der,N/A,0.0,0,0,0,0,0,0,0,False,True,doaj,False,Open Access,False,False,https://doi.org/10.11648/j.eas.20190404.11
