Author,Paper Title,Year,Citations,DOI,PMID,Authors,Journal,Altmetric Score,Twitter Mentions,Reddit Mentions,News Mentions,Blog Mentions,Facebook Mentions,Wikipedia Mentions,Policy Mentions,Media Mentioned,Open Access,OA Status,Preprint,Publication Type,Public Health Impact,Capacity Building,Paper Link
Jerry Kponyoh,Mode combination in an ideal wireless OAM-MIMO multiplexing system,2015,92,https://doi.org/10.1109/lwc.2015.2434375,,Kwasi A Opare and Yujun Kuang and Jerry J Kponyo,IEEE Wireless Communications Letters,9.0,0,0,0,0,0,0,0,False,True,doaj,False,Open Access,False,False,https://doi.org/10.1109/lwc.2015.2434375
Jerry Kponyoh,Performance analysis and comparison of ZF and MRT based downlink massive MIMO systems,2014,90,https://doi.org/10.1109/icufn.2014.6876818,,Tebe Parfait and Yujun Kuang and Kponyo Jerry,N/A,0.0,0,0,0,0,0,0,0,False,True,doaj,False,Open Access,False,False,https://doi.org/10.1109/icufn.2014.6876818
Jerry Kponyoh,Lightweight and host-based denial of service (DoS) detection and defense mechanism for resource-constrained IoT devices,2020,35,https://doi.org/10.1016/j.iot.2020.100319,,Jerry John Kponyo and Justice Owusu Agyemang and Griffith Selorm Klogo and Joshua Ofori Boateng,Internet of Things,0.0,0,0,0,0,0,0,0,False,True,doaj,False,Open Access,False,False,https://doi.org/10.1016/j.iot.2020.100319
Jerry Kponyoh,VANET cluster-on-demand minimum spanning tree (MST) prim clustering algorithm,2013,31,https://doi.org/10.1109/iccps.2013.6893585,,Jerry John Kponyo and Yujun Kuang and Enzhan Zhang and Kamenyi Domenic,N/A,0.0,0,0,0,0,0,0,0,False,True,doaj,False,Open Access,False,False,https://doi.org/10.1109/iccps.2013.6893585
Jerry Kponyoh,Asymmetric circularly polarized open‐slot antenna,2020,28,https://doi.org/10.1002/mmce.22141,,Mubarak Sani Ellis and Francis B Effah and Abdul‐Rahman Ahmed and Jerry J Kponyo and Javad Nourinia and Changiz Ghobadi and Bahman Mohammadi,International Journal of RF and Microwave Computer‐Aided Engineering,0.0,0,0,0,0,0,0,0,False,True,doaj,False,Open Access,False,False,https://doi.org/10.1002/mmce.22141
Jerry Kponyoh,Adaptive storage optimization scheme for blockchain-IIoT applications using deep reinforcement learning,2022,26,https://doi.org/10.1109/access.2022.3233474,,Nana Kwadwo Akrasi-Mensah and Andrew Selasi Agbemenu and Henry Nunoo-Mensah and Eric Tutu Tchao and Abdul-Rahman Ahmed and Eliel Keelson and Axel Sikora and Dominik Welte and Jerry John Kponyo,IEEE Access,0.0,0,0,0,0,0,0,0,False,True,doaj,False,Open Access,False,False,https://doi.org/10.1109/access.2022.3233474
Jerry Kponyoh,The degrees of freedom in wireless line-of-sight OAM multiplexing systems using a circular array of receiving antennas,2015,24,https://doi.org/10.1109/acct.2015.52,,Kwasi A Opare and Yujun Kuang and Jerry J Kponyo and Kenneth S Nwizege and Zhang Enzhan,N/A,0.0,0,0,0,0,0,0,0,False,True,doaj,False,Open Access,False,False,https://doi.org/10.1109/acct.2015.52
Jerry Kponyoh,Unidirectional planar monopole antenna using a quasi-radiator,2018,23,https://doi.org/10.1109/lawp.2018.2883579,,Mubarak Sani Ellis and Abdul-Rahman Ahmed and Jerry John Kponyo and Javad Nourinia and Changiz Ghobadi and Bahman Mohammadi,IEEE Antennas and Wireless Propagation Letters,0.0,0,0,0,0,0,0,0,False,True,doaj,False,Open Access,False,False,https://doi.org/10.1109/lawp.2018.2883579
Jerry Kponyoh,Dynamic travel path optimization system using ant colony optimization,2014,23,https://doi.org/10.1109/uksim.2014.44,30999688,Jerry Kponyo and Yujun Kung and Enzhan Zhang,N/A,0.0,0,0,0,0,0,0,0,False,True,doaj,False,Open Access,False,False,https://doi.org/10.1109/uksim.2014.44
Jerry Kponyoh,Lightweight rogue access point detection algorithm for WiFi-enabled Internet of Things (IoT) devices,2020,22,https://doi.org/10.1016/j.iot.2020.100200,,Justice Owusu Agyemang and Jerry John Kponyo and Griffith Selorm Klogo and Joshua Ofori Boateng,Internet of Things,0.0,0,0,0,0,0,0,0,False,True,doaj,False,Open Access,False,False,https://doi.org/10.1016/j.iot.2020.100200
Jerry Kponyoh,Real time status collection and dynamic vehicular traffic control using ant colony optimization,2012,22,https://doi.org/10.1109/iccps.2012.6384297,,Jerry John Kponyo and Yujun Kuang and Zejiao Li,N/A,0.0,0,0,0,0,0,0,0,False,True,doaj,False,Open Access,False,False,https://doi.org/10.1109/iccps.2012.6384297
Jerry Kponyoh,Detecting end-point (EP) man-in-the-middle (MITM) attack based on ARP analysis: A machine learning approach,2020,19,https://doi.org/10.17762/ijcnis.v12i3.4735,,Jerry John Kponyo and Justice Owusu Agyemang and Griffith Selorm Klogo,International Journal of Communication Networks and Information Security,0.0,0,0,0,0,0,0,0,False,True,doaj,False,Open Access,False,False,https://doi.org/10.17762/ijcnis.v12i3.4735
Jerry Kponyoh,Lightweight man-in-the-middle (MITM) detection and defense algorithm for WiFi-enabled Internet of Things (IoT) gateways,2019,19,https://doi.org/10.1016/j.iot.2020.100200,,Justice Owusu Agyemang and Jerry John Kponyo and Isaac Acquah,Information Security and Computer Fraud,0.0,0,0,0,0,0,0,0,False,True,doaj,False,Open Access,False,False,https://doi.org/10.1016/j.iot.2020.100200
Jerry Kponyoh,Light fidelity (LiFi) as an alternative data transmission medium in VANET,2017,19,https://doi.org/10.1109/ems.2017.44,,Justice Owusu Agyemang and Jerry John Kponyo and Joseph Mouzna,N/A,0.0,0,0,0,0,0,0,0,False,True,doaj,False,Open Access,False,False,https://doi.org/10.1109/ems.2017.44
Jerry Kponyoh,Miniaturised printed monopole antenna with a linked ground plane and radiator,2018,17,https://doi.org/10.1049/el.2018.0756,,MS Ellis and A‐R Ahmed and JJ Kponyo and J Nourinia and Ch Gbobadi and B Mohammadi,Electronics Letters,0.0,0,0,0,0,0,0,0,False,True,doaj,False,Open Access,False,False,https://doi.org/10.1049/el.2018.0756
Jerry Kponyoh,AI ethics in higher education: insights from Africa and beyond,2023,16,https://doi.org/10.1007/978-3-031-23035-6,,Caitlin C Corrigan and Simon Atuah Asakipaam and Jerry John Kponyo and Christoph Luetge,N/A,9.7,8,0,0,0,0,0,0,False,True,doaj,False,Open Access,False,True,https://doi.org/10.1007/978-3-031-23035-6
Jerry Kponyoh,Pilot low-cost concentrating solar power systems deployment in sub-Saharan Africa: a case study of implementation challenges,2020,16,https://doi.org/10.3390/su12156223,,Emmanuel Wendsongre Ramde and Eric Tutu Tchao and Yesuenyeagbe Atsu Kwabla Fiagbe and Jerry John Kponyo and Asakipaam Simon Atuah,N/A,0.0,0,0,0,0,0,0,0,False,True,doaj,False,Open Access,False,False,https://doi.org/10.3390/su12156223
Jerry Kponyoh,On telemedicine implementations in Ghana,2019,16,https://doi.org/10.14569/ijacsa.2019.0100325,40448074,ET Tchao and Isaac Acquah and SD Kotey and CS Aggor and JJ Kponyo,International Journal of Advanced Computer Science and Applications,0.0,0,0,0,0,0,0,0,False,True,doaj,False,Open Access,False,False,https://doi.org/10.14569/ijacsa.2019.0100325
Jerry Kponyoh,NetLogo implementation of an ant colony optimisation solution to the traffic problem,2015,16,https://doi.org/10.1049/iet-its.2014.0285,,Kponyo Jerry and Kuang Yujun and Opare Kwasi and Zhang Enzhan and Tebe Parfait,IET Intelligent Transport Systems,0.0,0,0,0,0,0,0,0,False,True,doaj,False,Open Access,False,False,https://doi.org/10.1049/iet-its.2014.0285
Jerry Kponyoh,Autonomic IoT: towards smart system components with cognitive IoT,2021,14,https://doi.org/10.1007/978-3-030-93314-2_16,,Justice Owusu Agyemang and Dantong Yu and Jerry John Kponyo,N/A,0.0,0,0,0,0,0,0,0,False,True,doaj,False,Open Access,False,False,https://doi.org/10.1007/978-3-030-93314-2_16
Jerry Kponyoh,Design of a minimal overhead control traffic topology discovery and data forwarding protocol for software-defined wireless sensor networks,2020,14,https://doi.org/10.17762/ijcnis.v12i3.4803,,Simon Atuah Asakipaam and Jerry John Kponyo and Justice Owusu Agyemang and Fredrick Appiah-Twum,Int. J. Commun. Netw. Inf. Secur,0.0,0,0,0,0,0,0,0,False,True,doaj,False,Open Access,False,False,https://doi.org/10.17762/ijcnis.v12i3.4803
Jerry Kponyoh,Assessing blockchain and IoT technologies for agricultural food supply chains in Africa: A feasibility analysis,2024,13,https://doi.org/10.1016/j.heliyon.2024.e34584,,Andrews Tang and Eric Tutu Tchao and Andrew Selasi Agbemenu and Eliel Keelson and Griffith Selorm Klogo and Jerry John Kponyo,N/A,3.0,0,0,0,0,0,0,0,False,True,doaj,False,Open Access,False,False,https://doi.org/10.1016/j.heliyon.2024.e34584
Jerry Kponyoh,Simple circularly polarized planar monopole inverted T‐shaped antenna,2020,13,https://doi.org/10.1002/mop.32026,,Mubarak S Ellis and Abdul Rahman Ahmed and Jerry John Kponyo and Javad Nourinia and Changiz Ghobadi and Bahman Mohammadi,Microwave and Optical Technology Letters,0.0,0,0,0,0,0,0,0,False,True,doaj,False,Open Access,False,False,https://doi.org/10.1002/mop.32026
Jerry Kponyoh,Compact broadband circularly polarized printed antenna with a shifted monopole and modified ground plane,2019,12,https://doi.org/10.1088/1748-0221/14/11/p11026,,MS Ellis and AR Ahmed and JJ Kponyo and FB Effah and J Nourinia and Ch Ghobadi and B Mohammadi,Journal of Instrumentation,0.0,0,0,0,0,0,0,0,False,True,doaj,False,Open Access,False,False,https://doi.org/10.1088/1748-0221/14/11/p11026
Jerry Kponyoh,Performance assessment and resilience of solar mini-grids for sustainable energy access in Ghana,2023,10,https://doi.org/10.1016/j.energy.2023.129431,,Akwasi Adu-Poku and God'sable Sitsofe Koku Aidam and Godfrey Atta Jackson and Kokouvi Edem N'tsoukpoe and Jerry John Kponyo and Adamah Messan and Ozioma Ikonne and Wofa Kwarteng and Francis Kemausuor,Energy,0.0,0,0,0,0,0,0,0,False,True,doaj,False,Open Access,False,False,https://doi.org/10.1016/j.energy.2023.129431
Jerry Kponyoh,A distributed intelligent traffic system using ant colony optimization: a NetLogo modeling approach,2016,10,https://doi.org/10.1109/sims.2016.32,,JJ Kponyo and KS Nwizege and KA Opare and AR Ahmed and H Hamdoun and LO Akazua and S Alshehri and H Frank,N/A,0.0,0,0,0,0,0,0,0,False,True,doaj,False,Open Access,False,False,https://doi.org/10.1109/sims.2016.32
Jerry Kponyoh,The effect of channel estimation errors on the energy efficiency of downlink massive MIMO systems,2015,10,https://doi.org/10.1109/icufn.2015.7182689,,Parfait I Tebe and Yujun Kuang and Kwasi A Opare and Jerry J Kponyo,N/A,0.0,0,0,0,0,0,0,0,False,True,doaj,False,Open Access,False,False,https://doi.org/10.1109/icufn.2015.7182689
Jerry Kponyoh,A new research agenda for African generative AI,2023,9,https://doi.org/10.1038/s41562-023-01735-1,37803130,Rachel Adams and Ayantola Alayande and Zameer Brey and Brantley Browning and Michael Gastrow and Jerry John Kponyo and Dona Mathew and Moremi Nkosi and Henry Nunoo-Mensah and Diana Nyakundi and Victor Odumuyiwa and Olubunmi Okunowo and Philipp Olbrich and Nawal Omar and Kemi Omotubora and Paul Plantinga and Gabriella Razzano and Zara Schroeder and Andrew Selasi Agbemenu and Araba Sey and Kristophina Shilongo and Shreya Shirude and Matthew Smith and Eric Tutu Tchao and Davy K Uwizera,N/A,27.549999999999997,24,0,1,0,0,0,0,True,True,doaj,False,Open Access,False,False,https://doi.org/10.1038/s41562-023-01735-1
Jerry Kponyoh,A lightweight messaging protocol for internet of things devices,2022,9,https://doi.org/10.3390/technologies10010021,40285158,Justice Owusu Agyemang and Jerry John Kponyo and James Dzisi Gadze and Henry Nunoo-Mensah and Dantong Yu,Technologies,0.5,1,0,0,0,0,0,0,False,True,doaj,False,Open Access,False,False,https://doi.org/10.3390/technologies10010021
Jerry Kponyoh,An intelligent irrigation system for rural agriculture,2019,9,https://doi.org/10.11648/j.ijaas.20190503.13,40438737,Jerry John Kponyo and Kwasi Adu-Boahen Opare and AA Rahman and Justice Owusu Agyemang,International Journal of Applied Agricultural Sciences,0.25,1,0,0,0,0,0,0,False,True,doaj,False,Open Access,False,False,https://doi.org/10.11648/j.ijaas.20190503.13
Jerry Kponyoh,Investigating the best radio propagation model for 4G-WiMAX networks deployment in 2530MHz Band in Sub-Saharan Africa,2017,9,https://doi.org/10.5120/cae2017652695,,Awal Halifa and Eric Tutu Tchao and Jerry John Kponyo,arXiv preprint arXiv:1711.08065,0.25,1,0,0,0,0,0,0,False,True,doaj,False,Open Access,False,False,https://doi.org/10.5120/cae2017652695
Jerry Kponyoh,An artificial intelligence‐based non‐intrusive load monitoring of energy consumption in an electrical energy system using a modified K‐Nearest Neighbour algorithm,2024,8,https://doi.org/10.1049/smc2.12075,,Benjamin Kommey and Elvis Tamakloe and Jerry John Kponyo and Eric Tutu Tchao and Andrew Selasi Agbemenu and Henry Nunoo‐Mensah,IET Smart Cities,0.0,0,0,0,0,0,0,0,False,True,doaj,False,Open Access,False,False,https://doi.org/10.1049/smc2.12075
Jerry Kponyoh,A web based system for easy and secured managing process of University Accreditation Information,2022,8,https://doi.org/10.35806/ijoced.v4i1.240,,Benjamin Kommey and Francis Gyimah and Jerry John Kponyo and Samuel Ato Andam-Akorful,"Indonesian Journal of Computing, Engineering, and Design (IJoCED)",0.0,0,0,0,0,0,0,0,False,True,doaj,False,Open Access,False,False,https://doi.org/10.35806/ijoced.v4i1.240
Jerry Kponyoh,Design and circuit analysis of a single and dual band-notched UWB antenna using vertical stubs embedded in feedline,2021,8,https://doi.org/10.1016/j.heliyon.2021.e08554,34917819,Mubarak Sani Ellis and Philip Arthur and Abdul Rahman Ahmed and Jerry John Kponyo and Benedicta Andoh-Mensah and Bob John,Heliyon,0.0,0,0,0,0,0,0,0,False,True,doaj,False,Open Access,False,False,https://doi.org/10.1016/j.heliyon.2021.e08554
Jerry Kponyoh,A compact wideband circularly polarized L-slot antenna edge-fed by a microstrip feedline for C-band applications,2017,8,https://doi.org/10.2528/pierl16111105,,Sani Mubarak Ellis and Jerry John Kponyo and Abdul-Rahman Ahmed,Progress In Electromagnetics Research Letters,0.0,0,0,0,0,0,0,0,False,True,doaj,False,Open Access,False,False,https://doi.org/10.2528/pierl16111105
Jerry Kponyoh,A wideband single fed circularly polarized slot antenna for multi-band applications,2013,8,https://doi.org/10.1109/imsna.2013.6743353,,Oteng Gyasi Kwame and Mubarak Sani Ellis and Kponyo Jerry John,N/A,0.0,0,0,0,0,0,0,0,False,True,doaj,False,Open Access,False,False,https://doi.org/10.1109/imsna.2013.6743353
Jerry Kponyoh,Improved bandwidth and F/B ratio of a CPW-fed planar monopole antenna,2022,7,https://doi.org/10.1016/j.heliyon.2022.e10037,,MS Ellis and A-R Ahmed and JJ Kponyo and KO Gyasi and KSO Kwakye and S Ameyaw,Heliyon,0.25,1,0,0,0,0,0,0,False,True,doaj,False,Open Access,False,False,https://doi.org/10.1016/j.heliyon.2022.e10037
Jerry Kponyoh,Artificial intelligence-based strategies for sustainable energy planning and electricity demand estimation: A systematic review,2025,6,https://doi.org/10.1016/j.rser.2024.115161,,Julius Adinkrah and Francis Kemausuor and Eric Tutu Tchao and Henry Nunoo-Mensah and Andrew Selasi Agbemenu and Akwasi Adu-Poku and Jerry John Kponyo,N/A,0.25,0,1,0,0,0,0,0,False,True,doaj,False,Open Access,False,False,https://doi.org/10.1016/j.rser.2024.115161
Jerry Kponyoh,Characteristic mode analysis of a compact circularly polarized rotated square slot antenna,2023,6,https://doi.org/10.1002/mop.33616,,Kwame Oteng Gyasi and Abdelheq Boukarkar and Kingsford Sarkodie Obeng Kwakye and Mubarak Sani Ellis and Abdul‐Rahman Ahmed and Jerry John Kponyo and Muhammad Abdul Basit and Nosherwan Shoaib,Microwave and Optical Technology Letters,0.0,0,0,0,0,0,0,0,False,True,doaj,False,Open Access,False,False,https://doi.org/10.1002/mop.33616
Jerry Kponyoh,A lightweight rogue access point detection algorithm for embedded internet of things (IOT) devices,2019,5,https://doi.org/10.12691/iscf-7-1-2,,J Owusu Agyemang and J John Kponyo and G Selorm Klogo,Information Security and Computer Fraud,0.0,0,0,0,0,0,0,0,False,True,doaj,False,Open Access,False,False,https://doi.org/10.12691/iscf-7-1-2
Jerry Kponyoh,Design and Analysis of a Low‐Profile Dual‐Band Circularly Polarized Monopole Antenna Based on Characteristic Mode Analysis,2023,4,https://doi.org/10.1155/2023/7855907,,Kingsford Sarkodie Obeng Kwakye and Nouman Rasool and Kwame Oteng Gyasi and Joseph Abroquah and Mubarak Sani Ellis and Ohemeng Lord Owusu and Abdul-Rahman Ahmed and Jerry John Kponyo,International Journal of RF and Microwave Computer‐Aided Engineering,0.0,0,0,0,0,0,0,0,False,True,doaj,False,Open Access,False,False,https://doi.org/10.1155/2023/7855907
Jerry Kponyoh,An Optimized Vertical Handover Decision Model for the Heterogeneous DSRC/LTE Vehicular Networks.,2023,3,https://doi.org/10.12720/jcm.18.8.489-503,,Michael Agyare and Jerry John Kponyo and Kwasi Adu-Boahen Opare and Kwame Oteng Gyasi,J. Commun.,0.0,0,0,0,0,0,0,0,False,True,doaj,False,Open Access,False,False,https://doi.org/10.12720/jcm.18.8.489-503
Jerry Kponyoh,Heterogeneous Architecture for DSRC/LTE Vehicular Communication Networks Based on the ITS Reference Architecture with Fuzzy Logic for Decision-Making.,2023,3,https://doi.org/10.12720/jcm.18.5.318-332,,Michael Agyare and Jerry John Kponyo and Kwasi Adu-Boahen Opare and Kwame Oteng Gyasi,J. Commun.,0.0,0,0,0,0,0,0,0,False,True,doaj,False,Open Access,False,False,https://doi.org/10.12720/jcm.18.5.318-332
Jerry Kponyoh,Ọdịgbo metaheuristic optimization algorithm for computation of real-parameters and engineering design optimization,2023,3,https://doi.org/10.14569/ijacsa.2023.0140130,,CV Ikpo and EK Akowuah and JJ Kponyo and KO Boateng,International Journal of Advanced Computer Science and Applications,0.0,0,0,0,0,0,0,0,False,True,doaj,False,Open Access,False,False,https://doi.org/10.14569/ijacsa.2023.0140130
Jerry Kponyoh,Design of pattern-reconfigurable circularly polarized unidirectional antenna based on quasi-radiator for ISM applications,2022,3,https://doi.org/10.1016/j.heliyon.2022.e11721,36439733,Philip Arthur and Mubarak Sani Ellis and Abdul-Rahman Ahmed and Jerry John Kponyo,Heliyon,0.0,0,0,0,0,0,0,0,False,True,doaj,False,Open Access,False,False,https://doi.org/10.1016/j.heliyon.2022.e11721
Jerry Kponyoh,Intelligent traffic management system based on historical data analysis,2019,3,https://doi.org/10.1109/fit.2011.33,37585709,Frederick Egyin Appiah-Twum and Jerry John Kponyo and Isaac Acquah,International Journal of Engineering and Advanced Technology,1.0,1,0,0,0,0,0,0,False,True,doaj,False,Open Access,False,False,https://doi.org/10.1109/fit.2011.33
Jerry Kponyoh,The effect of receiver-side circular antenna arrays on bit error probability in a wireless line-of-sight OAM communication system,2015,3,https://doi.org/10.1109/acct.2015.53,,Kwasi A Opare and Yujun Kuang and Jerry J Kponyo and Kenneth S Nwizege and Parfait I Tebe,N/A,3.0,0,0,0,0,0,0,0,False,True,doaj,False,Open Access,False,False,https://doi.org/10.1109/acct.2015.53
Jerry Kponyoh,Optimal coverage enhancement for multiple uavs using multi-agent learning technique,2023,2,https://doi.org/10.12785/ijcds/1301109,,Raymond Sabogu-Sumah and Kwasi A Opare and James D D Gadze and Jerry J Kponyo and Abdul-Rahman Ahmed and Edmund Fianko,International Journal of Computing and Digital Systems,0.0,0,0,0,0,0,0,0,False,True,doaj,False,Open Access,False,False,https://doi.org/10.12785/ijcds/1301109
Jerry Kponyoh,Innovative prediction of vehicle position based on closed loop modeling of capacitive accelerometer,2019,2,https://doi.org/10.1109/icsiot47925.2019.00017,,Mamudu Hamidu and Jerry John Kponyo and Amevi Acakpovi,N/A,0.0,0,0,0,0,0,0,0,False,True,doaj,False,Open Access,False,False,https://doi.org/10.1109/icsiot47925.2019.00017
Jerry Kponyoh,The optimum number of base station antennas in an energy efficient downlink massive MIMO system,2015,2,https://doi.org/10.1109/comnetsat.2015.7434291,,Parfait I Tebe and Yujun Kuang and Kwasi A Opare and Jerry J Kponyo,N/A,0.0,0,0,0,0,0,0,0,False,True,doaj,False,Open Access,False,False,https://doi.org/10.1109/comnetsat.2015.7434291
Jerry Kponyoh,Wavelet‐Based Feature Extraction for Efficient High‐Resolution Image Classification,2025,1,https://doi.org/10.1002/eng2.70027,,Albert Dede and Henry Nunoo‐Mensah and Emmanuel Kofi Akowuah and Kwame Osei Boateng and Prince Ebenezer Adjei and Francisca Adoma Acheampong and Isaac Acquah and Jerry John Kponyo,Engineering Reports,1.0,0,0,0,0,0,0,0,False,True,doaj,False,Open Access,False,False,https://doi.org/10.1002/eng2.70027
Jerry Kponyoh,Multi‐Wound Classification: Exploring Image Enhancement and Deep Learning Techniques,2025,1,https://doi.org/10.1002/eng2.70001,,Prince Odame and Maxwell Mawube Ahiamadzor and Nana Kwaku Baah Derkyi and Kofi Agyekum Boateng and Kelvin Sarfo‐Acheampong and Eric Tutu Tchao and Andrew Selasi Agbemenu and Henry Nunoo‐Mensah and Dorothy Araba Yakoba Agyapong and Jerry John Kponyo,Engineering Reports,0.0,0,0,0,0,0,0,0,False,True,doaj,False,Open Access,False,False,https://doi.org/10.1002/eng2.70001
Jerry Kponyoh,Techno-neocolonialism: an emerging risk in the artificial intelligence revolution,2024,1,https://doi.org/10.25965/trahs.6382,40270929,Jerry John KPONYO and Dickson Marfo FOSU and Frederica Efia Birago OWUSU and Musah Ibrahim ALI and Maxwell Mawube AHIAMADZOR,Trayectorias Humanas Trascontinentales,6.25,1,0,1,0,0,0,0,True,True,doaj,False,Open Access,False,False,https://doi.org/10.25965/trahs.6382
Jerry Kponyoh,"Resource Provisioning and Utilization in 5G Network Slicing: A Survey of Recent Advances, Challenges, and Open Issues",2023,1,https://doi.org/10.22247/ijcna/2023/220736,,Simon Atuah Asakipaam and Jerry John Kponyo and Kwame Oteng Gyasi,International Journal of Computer Networks and Applications,0.0,0,0,0,0,0,0,0,False,True,doaj,False,Open Access,False,False,https://doi.org/10.22247/ijcna/2023/220736
Jerry Kponyoh,Technical and financial analysis of grid-tied solar PV for sustainable irrigation in rural agro-based communities in developing countries: a case study in Ghana,2021,1,https://doi.org/10.1504/ijetp.2021.119851,,Benson Ahunu and Richard Opoku and Jerry J Kponyo and Eric K Antwi-Agyei,International Journal of Energy Technology and Policy,0.0,0,0,0,0,0,0,0,False,True,doaj,False,Open Access,False,False,https://doi.org/10.1504/ijetp.2021.119851
Jerry Kponyoh,A Critical Survey on Overhead Control Traffic Reduction Strategies in Software-Defined Wireless Sensor Networking,2021,1,https://doi.org/10.22247/ijcna/2021/207978,,Simon Atuah Asakipaam and Jerry John Kponyo and Justice Owusu Agyemang and Frederick Egyin Appiah-Twum,Int. J. Comput. Netw. Appl.(IJCNA),0.0,0,0,0,0,0,0,0,False,True,doaj,False,Open Access,False,False,https://doi.org/10.22247/ijcna/2021/207978
Jerry Kponyoh,An Orchestration Framework for IoT Devices based on Public Key Infrastructure (PKI),2019,1,https://doi.org/10.5013/ijssst.a.20.s1.04,,Justice Owusu Agyemang and Jerry John Kponyo,"International Journal of Simulation--Systems, Science & Technology",0.0,0,0,0,0,0,0,0,False,True,doaj,False,Open Access,False,False,https://doi.org/10.5013/ijssst.a.20.s1.04
Jerry Kponyoh,Miniaturized planar monopole UWB antenna with integrated RFID/GPS/GSM/WLAN bands using capactively loaded loop resonator (CLLRs),2018,1,https://doi.org/10.5815/ijwmt.2018.06.03,,Mubarak Sani Ellis and Ahmed Abdul-Rahman and Jerry John Kponyo,International Journal of Microwave and Wireless Technologies,0.0,0,0,0,0,0,0,0,False,True,doaj,False,Open Access,False,False,https://doi.org/10.5815/ijwmt.2018.06.03
Jerry Kponyoh,A Circularly Polarized Planar Monopole Antenna with Wide AR Bandwidth Using a Novel Radiator/Ground Structure,2017,1,https://doi.org/10.1016/j.aeue.2023.154627,,Mubarak Sani Ellis and Abdul-Rahman Ahmed and Jerry John Kponyo,Glob J Res Eng F Electr Electron Eng,0.0,0,0,0,0,0,0,0,False,True,doaj,False,Open Access,False,False,https://doi.org/10.1016/j.aeue.2023.154627
Jerry Kponyoh,Efficient RFID Modulation Scheme for Better Ubiquitous Network Performance,2016,1,https://doi.org/10.5013/ijssst.a.17.35.15,,Hilary Frank and Kenneth S Nwizege and Jerry Kponyo and Abdul-Rahman Ahmed and Nte N Isioto and Akazua L Ugochukwu and Salman Alshehri,"International Journal of Simulation--Systems, Science & Technology",0.0,0,0,0,0,0,0,0,False,True,doaj,False,Open Access,False,False,https://doi.org/10.5013/ijssst.a.17.35.15
Jerry Kponyoh,Analysis of Packets Reception Rate for One-Hop Broadcast in 2-D VANETs,2013,1,https://doi.org/10.6029/smartcr.2013.02.004,,Enzhan Zhang and Yujun Kuang and Jerry John Kponyo,SmartCR,0.0,0,0,0,0,0,0,0,False,True,doaj,False,Open Access,False,False,https://doi.org/10.6029/smartcr.2013.02.004
Jerry Kponyoh,A Time and Area Limited Epidemic Forwarding Method for Alleviating Vehicular Traffic Congestion,2012,1,https://doi.org/10.6029/smartcr.2012.03.005,,Enzhan Zhang and Yujun Kuang and Jerry John Kponyo,SmartCR,0.0,0,0,0,0,0,0,0,False,True,doaj,False,Open Access,False,False,https://doi.org/10.6029/smartcr.2012.03.005
Jerry Kponyoh,Promoting Transparency in Generative AI: A Focus on Africa,2025,0,https://doi.org/10.1093/oxfordhb/9780198940272.013.0015,,Jerry John Kponyo and Francis Kemausuor and Eric Tutu Tchao and Henry Nunoo Mensah and Rachel Yayra Adjoe,N/A,0.0,0,0,0,0,0,0,0,False,True,doaj,False,Open Access,False,False,https://doi.org/10.1093/oxfordhb/9780198940272.013.0015
Jerry Kponyoh,Deep learning for efficient high-resolution image processing: A systematic review,2025,0,https://doi.org/10.1016/j.iswa.2025.200505,39497049,Albert Dede and Henry Nunoo-Mensah and Eric Tutu Tchao and Andrew Selasi Agbemenu and Prince Ebenezer Adjei and Francisca Adoma Acheampong and Jerry John Kponyo,N/A,50.0,0,0,8,0,0,0,0,True,True,doaj,False,Open Access,False,False,https://doi.org/10.1016/j.iswa.2025.200505
