Author,Paper Title,Year,Citations,DOI,PMID,Authors,Journal,Altmetric Score,Twitter Mentions,Reddit Mentions,News Mentions,Blog Mentions,Facebook Mentions,Wikipedia Mentions,Policy Mentions,Media Mentioned,Open Access,OA Status,Preprint,Publication Type,Public Health Impact,Capacity Building,Paper Link
Simon George ANDERSON,"Social deprivation, diabetic foot ulceration and mortality: conclusions of a primary care based study",2016,1,https://doi.org/10.12968/pnur.1997.8.9.24,,SG Anderson and H Shoo and M Livingstone and S Saluja and G Dunn and AH Heald,N/A,0.0,0,0,0,0,0,0,0,False,True,doaj,False,Open Access,False,False,https://doi.org/10.12968/pnur.1997.8.9.24
Simon George ANDERSON,PE. 07. Usual blood pressure and risk of new onset diabetes: evidence from 4.1 million adults and a meta-analysis of prospective studies,2015,1,https://doi.org/10.3410/f.725826170.793510210,,Simon Anderson and Connor Emdin and Mark Woodward and Kazem Rahimi,Journal of Human Hypertension,0.0,0,0,0,0,0,0,0,False,True,doaj,False,Open Access,False,False,https://doi.org/10.3410/f.725826170.793510210
Simon George ANDERSON,Phosphodiesterase type-5 inhibitor use in type 2 diabetes is associated with a reduction in all cause mortality in patients with coronary artery disease,2015,1,https://doi.org/10.1136/heartjnl-2015-309223,,SG Anderson and DC Hutchings and K Rahimi and M Woodward and AH Heald,N/A,62.45,28,0,5,1,3,1,0,True,True,doaj,False,Open Access,False,False,https://doi.org/10.1136/heartjnl-2015-309223
Simon George ANDERSON,Arterial access site practice and bleeding risk in relation to procedural outcomes after percutaneous coronary intervention,2014,1,https://doi.org/10.1016/s0140-6736(14)60283-x,29493512,Simon George Anderson and Karim Ratib and Douglas Fraser and Ludwig Neyses and David Hildick-Smith and Mark de Belder and Peter Ludman and Jim Nolan and Mamas Mamas,The Lancet,1.25,1,0,0,0,1,0,0,True,True,doaj,False,Open Access,True,False,https://doi.org/10.1016/s0140-6736(14)60283-x
Simon George ANDERSON,Vitamin B12 is lower in metformin treated patients but haemoglobin is unaffected,2012,1,https://doi.org/10.23937/2469-5793/1510057,,RP Narayanan and SG Anderson and E Onyekwelu and AH Heald,Diabetic Medicine,0.0,0,0,0,0,0,0,0,False,True,doaj,False,Open Access,False,False,https://doi.org/10.23937/2469-5793/1510057
Simon George ANDERSON,Screening of cardiometabolic risk factors in patients with severe enduring mental illness: results and potential,2009,1,https://doi.org/10.1093/med/9780198807292.003.0045,,SG Anderson and P Narayanan and Z Qureshi and S Bujawansa and H Knapman and AH Heald,N/A,0.0,0,0,0,0,0,0,0,False,True,doaj,False,Open Access,False,False,https://doi.org/10.1093/med/9780198807292.003.0045
Simon George ANDERSON,Waist-hip ratio most closely predicts raised blood glucose in individuals with Clozapine treated schizophrenia,2008,1,https://doi.org/10.1016/s0140-6736(05)65830-8,,A Heald and SG Anderson and L Hanssens and Marc De Hert,Diabetic medicine,0.0,0,0,0,0,0,0,0,False,True,doaj,False,Open Access,False,False,https://doi.org/10.1016/s0140-6736(05)65830-8
Simon George ANDERSON,Chemokine receptor expression patterns on activated CD8 (+) T lymphocytes correlate with survival in melanoma patients receiving peptide-based immunotherapy,2004,1,https://doi.org/10.1158/0008-5472.can-04-2059,,DW Mullins and SG Anderson and ME Mayer and CL Slingluff and JK Lee and WA Knaus and IM Mullins,N/A,0.0,0,0,0,0,0,0,0,False,True,doaj,False,Open Access,False,False,https://doi.org/10.1158/0008-5472.can-04-2059
Simon George ANDERSON,"Novel links between CRP, the IGF system and macrovascular disease in type 2 diabetes",2003,1,https://doi.org/10.1093/med/9780198870197.003.0280,,K Kaushal and S Anderson and K Siddals and A Heald and J Gibson,N/A,0.0,0,0,0,0,0,0,0,False,True,doaj,False,Open Access,False,False,https://doi.org/10.1093/med/9780198870197.003.0280
Simon George ANDERSON,"Silicate Weathering of Marine Terraces North of Santa Cruz, California",2002,1,https://doi.org/10.1201/noe0415451369.ch96,,MS Schulz and AF White and J Harden and D Stonestrom and S Anderson and D Vivit,AGU Fall Meeting Abstracts,0.0,0,0,0,0,0,0,0,False,True,doaj,False,Open Access,False,False,https://doi.org/10.1201/noe0415451369.ch96
Simon George ANDERSON,"EXAMINING THE ROLE OF RARE WHOLE-GENOME SEQUENCING VARIANTS IN ARTERIAL STIFFNESS TO ADDRESS MISSING HERITABILITY: A GWAS STUDY OF 70, 279 PARTICIPANTS IN THE UK BIOBANK",2025,0,https://doi.org/10.1097/01.hjh.0001116700.15548.3a,,Sushant Saluja and Simon Anderson and Simon Williams and Heather Cordell and Rachel Lennon and Mohammed Alawami and Bernard Keavney,Journal of Hypertension,0.0,0,0,0,0,0,0,0,False,True,doaj,False,Open Access,False,False,https://doi.org/10.1097/01.hjh.0001116700.15548.3a
Simon George ANDERSON,Using data systems to conduct health research in the Caribbean: challenges during the COVID-19 pandemic,2025,0,https://doi.org/10.26633/rpsp.2025.29,40341010,Marshall Kerr Tulloch-Reid and Jacqueline Duncan and Keri-Ann Facey and Akil Williams and Marsha Ivey and Shelly-Ann Hunte and Eden Agustus and Simon Anderson and Maria Jackson,Revista Panamericana de Salud Pública,0.5,1,0,0,0,0,0,0,False,True,doaj,False,Open Access,True,False,https://doi.org/10.26633/rpsp.2025.29
Simon George ANDERSON,Exploring the impact of the Index of Multiple Deprivation on percutaneous coronary intervention outcomes: Insights from the British Cardiovascular Intervention Society database,2025,0,https://doi.org/10.21542/gcsp.2025.4,40390998,Sushant Saluja and Bernard D Keavney and Mohammed Alawami and Magdi El-Omar and Freidoon Keshavarzi and Maaham Saleem and Scott Garg and Simon G Anderson,Global Cardiology Science & Practice,0.0,0,0,0,0,0,0,0,False,True,doaj,False,Open Access,True,False,https://doi.org/10.21542/gcsp.2025.4
Simon George ANDERSON,Opportunities for promoting open data in the Caribbean through biobanks,2025,0,https://doi.org/10.26633/rpsp.2025.11,39936098,Sushant Saluja and Simon G Anderson,Revista Panamericana de Salud Pública,2.6,5,0,0,0,0,0,0,False,True,doaj,False,Open Access,False,False,https://doi.org/10.26633/rpsp.2025.11
Simon George ANDERSON,Using data systems to conduct health research in the Caribbean: challenges during the COVID-19 pandemic,2025,0,https://doi.org/10.26633/rpsp.2025.29,40341010,Marshall K Tulloch Reid and Jacqueline Duncan and Keri Ann Facey and Akil Williams and Marsha A Ivey and Shelly Ann Hunte and Eden Agustus and Simon G Anderson and Maria Jackson,Revista Panamericana de Salud Pública= Pan American Journal of Public Health,0.5,1,0,0,0,0,0,0,False,True,doaj,False,Open Access,True,False,https://doi.org/10.26633/rpsp.2025.29
Simon George ANDERSON,"Not just a ballistic affair: firearms trafficking, crime, and violence in the Caribbean",2025,0,https://doi.org/10.18572/1812-3929-2017-24-42-46,,Nicolas Florquin and Simon Anderson and Anne-Séverine Fabre and Joseph Callixtus and Joy St John,N/A,0.0,0,0,0,0,0,0,0,False,True,doaj,False,Open Access,False,False,https://doi.org/10.18572/1812-3929-2017-24-42-46
Simon George ANDERSON,Clinical assessment of patient outcomes post percutaneous pulmonary valve implantation: Insights from a single tertiary centre,2024,0,https://doi.org/10.21542/gcsp.2024.47,39931449,Sushant Saluja and Daniel Myers and Bernard D Keavney and Freidoon Keshavarzi and Simon G Anderson,Global Cardiology Science & Practice,0.0,0,0,0,0,0,0,0,False,True,doaj,False,Open Access,False,False,https://doi.org/10.21542/gcsp.2024.47
Simon George ANDERSON,1309-P: Diagnosing Glucose Intolerance in Patients Attending ER in an Acute Hospital in England,2024,0,https://doi.org/10.2337/db24-1309-p,,EDWARD B JUDE and ADRIAN H HEALD and SIMON G ANDERSON,Diabetes,0.0,0,0,0,0,0,0,0,False,True,doaj,False,Open Access,False,False,https://doi.org/10.2337/db24-1309-p
Simon George ANDERSON,Gender Differences in Trends in Incidence and Mortality of Acute Myocardial Infarction in the Small Island Developing State of Barbados,2024,0,https://doi.org/10.7759/cureus.56729,38646357,Arianne Harvey and Christina Howitt and Jacqueline M Campbell and Shelly-Ann A Forde and Ian Hambleton and Ivanna Bascombe and Simon G Anderson and Dawn Scantlebury and Rudolph Delice and Natasha P Sobers and Arianne M Harvey and Shelly-Ann Forde and Dawn C Scantlebury,Cureus,0.0,0,0,0,0,0,0,0,False,True,doaj,False,Open Access,False,False,https://doi.org/10.7759/cureus.56729
Simon George ANDERSON,Diagnosing diabetes and assessing its prevalence in individuals attending A&E in an acute hospital in England,2023,0,https://doi.org/10.2337/db24-1309-p,,E Jude and S Anderson and A Heald,N/A,0.0,0,0,0,0,0,0,0,False,True,doaj,False,Open Access,False,False,https://doi.org/10.2337/db24-1309-p
Simon George ANDERSON,OP51 Changes in food security and diet indicators following an intervention to support the recovery of backyard garden food production post a major volcanic eruption,2023,0,https://doi.org/10.1136/jech-2023-ssmabstracts.51,,Eden Augustus and Madhuvanti Murphy and Cornelia Guell and Christina Howitt and Dan Ramdath and Simon Anderson and Nigel Unwin,N/A,0.0,0,0,0,0,0,0,0,False,True,doaj,False,Open Access,True,False,https://doi.org/10.1136/jech-2023-ssmabstracts.51
Simon George ANDERSON,IDF2022-0972 Type 2 Diabetes Mellitus shows greater adverse effect on mortality in females than males results of 10-Year Cohort Study,2023,0,https://doi.org/10.1016/j.diabres.2023.110360,40281435,M Stedman and M Whyte and I Laing and S Anderson and G Rayman and A Paisley and A Robinson and A Heald,Diabetes research and clinical practice,0.0,0,0,0,0,0,0,0,False,True,doaj,False,Open Access,False,False,https://doi.org/10.1016/j.diabres.2023.110360
Simon George ANDERSON,Engaging faith communities in improving blood pressure through self-management and medication adherence tools: An implementation study from Barbados,2022,0,https://doi.org/10.1111/jocn.15803,,Natasha Sobers and Saria Hassan and Katrina Norville and Ian Hambleton and Lisa Brathwaite-Graham and Keira Inniss and Simon G Anderson and Kia Lewis and Trevor S Ferguson,APHA 2022 Annual Meeting and Expo,4.05,6,0,0,0,0,0,0,False,True,doaj,False,Open Access,False,False,https://doi.org/10.1111/jocn.15803
Simon George ANDERSON,Indirect costs of non‐healing diabetic foot wounds in an African origin population in Barbados,2022,0,https://doi.org/10.1111/dme.14888,,André R Greenidge and Simon Naitram and Kim R Quimby and Simon G Anderson and R Clive Landis,Diabetic Medicine,0.0,0,0,0,0,0,0,0,False,True,doaj,False,Open Access,False,False,https://doi.org/10.1111/dme.14888
Simon George ANDERSON,OP32 The impact of COVID-19 on local food production and food security in a small island developing state: a mixed method study,2022,0,https://doi.org/10.1136/jech-2022-ssmabstracts.32,,Eden Augustus and Madhuvanti Murphy and Cornelia Guell and Simon Anderson and Nigel Unwin,N/A,0.0,0,0,0,0,0,0,0,False,True,doaj,False,Open Access,False,False,https://doi.org/10.1136/jech-2022-ssmabstracts.32
Simon George ANDERSON,OP42 The impact of interventions aimed at improving nutritional status and metabolic health in small island developing states: a systematic review,2022,0,https://doi.org/10.1136/jech-2022-ssmabstracts.42,,Eden Augustus and Stephanie Whiteman and Emily Haynes and Cornelia Guell and Cassandra Ash and Lili Jia and Karyn Morrissey and Viliamu Iese and Madhuvanti Murphy and Simon Anderson and Nigel Unwin,N/A,0.0,0,0,0,0,0,0,0,False,True,doaj,False,Open Access,True,False,https://doi.org/10.1136/jech-2022-ssmabstracts.42
Simon George ANDERSON,"The Jamaica salt consumption, Knowledge, Attitudes and Practices (Salt-KAP) study: A research protocol",2022,0,https://doi.org/10.12688/f1000research.122619.1,38264475,TS Ferguson and K Webster-Kerr and MK Tulloch-Reid and NR Bennett and J Ho and T Davidson and A Grant and K Gordon-Johnson and I Govia and S Soares-Wynter and N Younger-Coleman and J McKenzie and E Walker and S Anderson and S Edwards and S Spence,N/A,1.0,1,0,0,0,0,0,0,False,True,doaj,False,Open Access,False,False,https://doi.org/10.12688/f1000research.122619.1
Simon George ANDERSON,Risk of death in people with type 2 diabetes following SARS-CoV-2 infection: A population level analysis of potential risk factors,2022,0,https://doi.org/10.1007/s13300-022-01259-3,35416588,DA Jenkins and N Chaudry and R Williams and M Sperrin and N Peek and W Ollier and K Bowden Davies and SG Anderson and JM Gibson and AH Heald,N/A,3.95,6,0,0,0,0,0,0,False,True,doaj,False,Open Access,False,False,https://doi.org/10.1007/s13300-022-01259-3
Simon George ANDERSON,"The risk factors potentially influencing hospital admission in people with type 1 diabetes and type 2 diabetes, following SARS-CoV-2 infection: A population level analysis",2022,0,https://doi.org/10.1007/s13300-022-01230-2,35325361,D Jenkins and R Williams and M Sperrin and R Mudaliar and A Syed and A Naseem and JM Gibsom and KA Davies and SG Anderson and AH Heald,N/A,8.149999999999999,12,0,0,0,0,0,0,False,True,doaj,False,Open Access,False,False,https://doi.org/10.1007/s13300-022-01230-2
Simon George ANDERSON,"SARS-CoV-2, diabetes and mortality",2022,0,https://doi.org/10.4103/2221-6189.299178,40444308,Adrian H Heald and David A Jenkins and Nadia Chaudhury and Richard Williams and Matthew Sperrin and Niels Peek and William Ollier and Kelly Bowden-Davies and Gayathri Delanerolle and Simon Anderson,N/A,0.0,0,0,0,0,0,0,0,False,True,doaj,False,Open Access,False,False,https://doi.org/10.4103/2221-6189.299178
Simon George ANDERSON,Application of a city wide digital population database for outcome analysis in diabetes,2022,0,https://doi.org/10.1097/xce.0000000000000257,35128337,Adrian H Heald and David A Jenkins and Nadia Chaudhury and Richard Williams and Matthew Sperrin and Niels Peek and William Ollier and Kelly Bowden-Davies and Gayathri Delanerolle and Simon Anderson,N/A,0.75,2,0,0,0,0,0,0,False,True,doaj,False,Open Access,False,False,https://doi.org/10.1097/xce.0000000000000257
Simon George ANDERSON,Ethnic differences in arterial stiffness and central aortic hemodynamics,2022,0,https://doi.org/10.1016/b978-0-323-91391-1.00028-5,39996445,JK Cruickshank and SG Anderson and M Strauss-Kruger and L Gafane-Matemane and R Kruger and Y Breet and AE Schutte,N/A,62.0,0,0,9,0,0,0,0,True,True,doaj,False,Open Access,False,False,https://doi.org/10.1016/b978-0-323-91391-1.00028-5
Simon George ANDERSON,ALBUMIN CREATININE RATIO IN TYPE 2 DIABETES MELLITUS IN BARBADOS: ALBUMIN CREATININE RATIO AS AN INDICATOR OF NON-HEALING FOOT WOUND FORMATION IN DIABETES,2021,0,https://doi.org/10.1101/2021.10.01.21264433,,André R Greenidge and Kim R Quimby and Amy P Speede and Ian R Hambleton and Simon G Anderson and R Clive Landis,medRxiv,1.25,2,0,0,0,0,0,0,False,True,doaj,False,Open Access,False,False,https://doi.org/10.1101/2021.10.01.21264433
Simon George ANDERSON,ALBUMIN CREATININE RATIO AS AN INDICATOR OF NON-HEALING FOOT WOUND FORMATION IN DIABETES,2021,0,https://doi.org/10.1101/2021.10.01.21264433,,A Greenidge and KR Quimby and AP Speede and IR Hambleton and SG Anderson and RC Landis,N/A,1.25,2,0,0,0,0,0,0,False,True,doaj,False,Open Access,False,False,https://doi.org/10.1101/2021.10.01.21264433
Simon George ANDERSON,Visual estimate of coronary artery calcium predicts prevalent coronary artery disease in patients with respiratory disease,2021,0,https://doi.org/10.1093/eurheartj/ehab724.0185,29890123,S Saluja and S Anderson and S Ali and N Abidin and N Hussain and L Tin and N Manocha and S Saluja and H Contractor,European Heart Journal,5.35,8,0,0,0,1,0,0,True,True,doaj,False,Open Access,False,False,https://doi.org/10.1093/eurheartj/ehab724.0185
Simon George ANDERSON,An evaluation of patient outcomes following transcatheter pulmonary valve implantation: a meta-analysis,2021,0,https://doi.org/10.1093/eurheartj/ehab724.2228,39355923,S Saluja and H Contractor and R Wiltshire and F Mannan and N Hussain and N Abidin and L Tin and S Ali and S Saluja and K Khan and J Sobolewska and P Sood and S Anderson,European Heart Journal,28.629999999999995,29,0,1,1,0,0,0,True,True,doaj,False,Open Access,False,False,https://doi.org/10.1093/eurheartj/ehab724.2228
Simon George ANDERSON,"5 Comparison of next generation P2Y12 inhibitors to clopidogrel in patients with acute coronary syndrome: an analysis from the British cardiovascular intervention society database of 382,361 ‘real-world’patients",2021,0,https://doi.org/10.1136/heartjnl-2021-ics.5,,S Saluja and H Contractor and F Mannan and J Sarma and S Garg and S Anderson,N/A,0.0,0,0,0,0,0,0,0,False,True,doaj,False,Open Access,True,False,https://doi.org/10.1136/heartjnl-2021-ics.5
Simon George ANDERSON,446-P: Mortality in 98 Type 1 Diabetes Mellitus and Type 2 Diabetes Mellitus (DM): Foot Ulcer Location Is an Independent Risk Determinant,2021,0,https://doi.org/10.2337/db21-446-p,,Adrian H Heald and Michael E Edmonds and Simon G Anderson and Adam Robinson,Diabetes,0.0,0,0,0,0,0,0,0,False,True,doaj,False,Open Access,False,False,https://doi.org/10.2337/db21-446-p
Simon George ANDERSON,EPIDEMIOLOGY AND PREDICTORS OF CARDIAC BYPASS ASSOCIATED AKI IN A MIDDLE-INCOME CARIBBEAN COUNTRY,2021,0,https://doi.org/10.1093/ndt/gfab082.0029,,Lori-Ann Fisher and Sunil Stephenson and Marshall Tulloch-Reid and Simon Anderson,N/A,0.0,0,0,0,0,0,0,0,False,True,doaj,False,Open Access,True,False,https://doi.org/10.1093/ndt/gfab082.0029
Simon George ANDERSON,MO375 EPIDEMIOLOGY AND PREDICTORS OF CARDIAC BYPASS ASSOCIATED AKI IN A MIDDLE-INCOME CARIBBEAN COUNTRY,2021,0,https://doi.org/10.1093/ndt/gfab082.0029,,Lori-Ann Fisher and Sunil Stephenson and Marshall Tulloch-Reid and Simon Anderson,Nephrology Dialysis Transplantation,0.0,0,0,0,0,0,0,0,False,True,doaj,False,Open Access,True,False,https://doi.org/10.1093/ndt/gfab082.0029
Simon George ANDERSON,DISTRIBUTION OF SPOT URINARY ELECTROLYTES AND THEIR PREDICTED 24 HOUR LEVELS BY ETHNICITY ASSOCIATIONS WITH MORTALITY IN A LONGITUDNAL COHORT,2021,0,https://doi.org/10.1097/01.hjh.0000745648.85622.29,,Sushant Saluja and Leo-Paul Powell and Xiao Jiang and Adrian Heald and Kennedy Cruickshank and Simon Anderson,Journal of Hypertension,0.0,0,0,0,0,0,0,0,False,True,doaj,False,Open Access,False,False,https://doi.org/10.1097/01.hjh.0000745648.85622.29
Simon George ANDERSON,P. 22 Mortality in 98 Type 1 Diabetes Mellitus (T1DM) and Type 2 Diabetes Mellitus (T2DM) Individuals Presenting to a Specialist Podiatry Clinic: Foot Ulcer Location is an Independent Risk Determinant,2020,0,https://doi.org/10.2991/artres.k.201209.035,,Heather Schofield and Samantha Haycocks and Adam Robinson and Simon G Anderson and Adrian Heald,Artery Research,0.0,0,0,0,0,0,0,0,False,True,doaj,False,Open Access,False,False,https://doi.org/10.2991/artres.k.201209.035
Simon George ANDERSON,The utility of coronary artery calcium in non-gated high resolution CT thorax scans in predicting cardiac events as compared to the Framingham risk score: a retrospective study,2020,0,https://doi.org/10.1093/ehjci/ehaa946.0172,,S Saluja and H Contractor and M Daniells and J Sobolewska and K Khan and L Mitchell and S Saluja and X Jiang and SG Anderson,European Heart Journal,0.0,0,0,0,0,0,0,0,False,True,doaj,False,Open Access,False,False,https://doi.org/10.1093/ehjci/ehaa946.0172
Simon George ANDERSON,Low sex hormone binding globulin (SHBG) is predictive of the future development of dysglycaemia in women,2020,0,https://doi.org/10.1038/scibx.2009.1344,,M Livingston and S Anderson and I Laing and A Heald,N/A,0.0,0,0,0,0,0,0,0,False,True,doaj,False,Open Access,False,False,https://doi.org/10.1038/scibx.2009.1344
Simon George ANDERSON,Basic and clinical science posters: Immunology/autoimmunity,2020,0,https://doi.org/10.1111/dme.11_13048,,AK Wright and M Carr and T Huang and HS Dashti and AD Premdayal and S Saluja and S Redline and SG Anderson and MK Rutter,N/A,0.0,0,0,0,0,0,0,0,False,True,doaj,False,Open Access,False,False,https://doi.org/10.1111/dme.11_13048
Simon George ANDERSON,The treatment of erectile dysfunction in younger men with type 2 diabetes is up to 4 times higher than the equivalent non-diabetes population,2020,0,https://doi.org/10.22541/au.158705427.72998664,,M Albanese and AH Heald and M Whyte and M Lunt and M Livingston and R Gadsby and G Hackett and SG Anderson and M Stedman,N/A,0.0,0,0,0,0,0,0,0,False,True,doaj,False,Open Access,False,False,https://doi.org/10.22541/au.158705427.72998664
Simon George ANDERSON,The treatment rate of erectile dysfunction (ED) in younger men with Type 2 Diabetes is up to 4 times higher than the equivalent non-diabetes population.,2020,0,https://doi.org/10.22541/au.158705427.72998664,,Simon Anderson,International Journal of Clinical Practice,0.0,0,0,0,0,0,0,0,False,True,doaj,False,Open Access,False,False,https://doi.org/10.22541/au.158705427.72998664
Simon George ANDERSON,The Evolution of Sex-Specific Paternal Effects in Threespined Sticklebacks,2020,0,https://doi.org/10.1101/796995,33191518,JK Hellmann and M Bensky and C Zielinski and S Anderson and A Bell,N/A,9.684000000000001,4,0,0,1,0,0,0,True,True,doaj,False,Open Access,False,False,https://doi.org/10.1101/796995
Simon George ANDERSON,"Controlling antibiotic usage–analysis of nationally published data from GP practices including demography, geography, comorbidity and prescribing factors highlights opportunities to reduce overall prescribing through changes in discretionary prescribing choices",2020,0,https://doi.org/10.7861/fhj.7.1.s9,32455258,Adrian Heald and Mark Davies and Mark Lunt and Erin Fulton-McAlister and Hussain Abid and Tjeerd Van Staa and Simon Anderson and Michael Stedman,Future healthcare journal,0.0,0,0,0,0,0,0,0,False,True,doaj,False,Open Access,False,False,https://doi.org/10.7861/fhj.7.1.s9
Simon George ANDERSON,P142 Androgen Receptor Reduced Sensitivity is Associated with Cardiovascular Mortality in Men with Type 2 Diabetes-A 14-year Follow up Study,2019,0,https://doi.org/10.2991/artres.k.191224.163,,Adrian Heald and Ghasem Yadegarfar and Mark Livingston and Helene Fachim and Ram Prakash Narayanan and Mark Lunt and Kirk Siddals and Gabriela Cortes and Martin Gibson and Rachelle Donn and Simon Anderson and Geoff Hackett and Hugh Jones,Artery Research,0.0,0,0,0,0,0,0,0,False,True,doaj,False,Open Access,False,False,https://doi.org/10.2991/artres.k.191224.163
Simon George ANDERSON,TCT-840 Index of Multiple Deprivation and Percutaneous Coronary Intervention: An Analysis From the British Cardiovascular Intervention Society Database,2019,0,https://doi.org/10.1016/j.jacc.2019.08.990,,Simon Anderson and Scot Garg and Sushant Saluja and Reza Aghamohammadzadeh and Sharmaine Thiru and Peter Ludman,Journal of the American College of Cardiology,0.0,0,0,0,0,0,0,0,False,True,doaj,False,Open Access,True,False,https://doi.org/10.1016/j.jacc.2019.08.990
Simon George ANDERSON,Male hypogonadism and CAG repeat number: 14 year prospective outcome in up to 550 men with type 2 diabetes: CAG number modulates testosterone effects,2019,0,https://doi.org/10.1002/edm2.64,,RP Narayanan and G Yadegarfar and SG Anderson and H Fachim and K Siddals and N Malipatil and M Livingston and G Cortes and R Jones and G Hackett and H Jones and JM Gibson and A Heald,N/A,1.0,2,0,0,0,0,0,0,False,True,doaj,False,Open Access,False,False,https://doi.org/10.1002/edm2.64
Simon George ANDERSON,Demographic factor clustering at a GP practice level in England and its relation to glycaemic outcomes: What we can learn from this,2019,0,https://doi.org/10.1111/ijcp.13303,,Mike Stedman and Mark Lunt and Mark Livingston and Anthony Fryer and Gabriela Moreno and Simon Anderson and Roger Gadsby and Adrian Heald,International journal of clinical practice,0.0,0,0,0,0,0,0,0,False,True,doaj,False,Open Access,False,False,https://doi.org/10.1111/ijcp.13303
Simon George ANDERSON,Sequential window acquisition of all theoretical fragment ion spectra mass spectrometry identifies a cluster of circulating proteins that predict future weight loss with a diet and exercise programme,2019,0,https://doi.org/10.3390/jcm8020141,30691056,N Malipatil and HA Fachim and B Geary and K Siddals and N Porter and A Whetton and SG Anderson and R Donn and JM Gibson and AH Heald,N/A,2.6,5,0,0,0,0,0,0,False,True,doaj,False,Open Access,False,False,https://doi.org/10.3390/jcm8020141
Simon George ANDERSON,"The FreeStyle Libre blood glucose (BG) monitoring system: How this has improved glycaemic control for many people with Type 1 diabetes in Eastern Cheshire, UK",2019,0,https://doi.org/10.1097/xce.0000000000000216,,L Horne and Z Dulaimi and K Leivesley and T Steele and AH Heald and SG Anderson,N/A,0.0,0,0,0,0,0,0,0,False,True,doaj,False,Open Access,False,False,https://doi.org/10.1097/xce.0000000000000216
Simon George ANDERSON,Foot ulceration and its relation to death in diabetes: A meta-analysis,2019,0,https://doi.org/10.1111/dme.14151,40383028,SG Anderson and S Saluja and H Shoo and M Livingston and E Jude and M Lunt and G Dunn and AH Heald,N/A,66.25000000000003,94,0,1,0,0,0,0,True,True,doaj,False,Open Access,False,False,https://doi.org/10.1111/dme.14151
Simon George ANDERSON,Diabetes Prevalence Survey of Pakistan (DPS-PAK): Prevalence of Type 2 diabetes and pre-Type 2 diabetes using HbA1c across Pakistan: A population-based survey from Pakistan,2019,0,https://doi.org/10.1136/bmjopen-2018-025300,,AH Amir and SG Anderson and I Khan and AH Heald,N/A,32.45,18,0,2,0,0,0,0,True,True,doaj,False,Open Access,False,False,https://doi.org/10.1136/bmjopen-2018-025300
Simon George ANDERSON,Male hypogonadism and CAG repeat number: 14 year prospective outcome in up to 550 men with Type 2 diabetes: CAG number modulates testosterone effects,2019,0,https://doi.org/10.1002/edm2.64,,R Malipatil and AH Heald and H Fachim and M Livingston and SG Anderson and K Siddals and G Cortes and R Jones and G Hackett and H Jones,N/A,1.0,2,0,0,0,0,0,0,False,True,doaj,False,Open Access,False,False,https://doi.org/10.1002/edm2.64
