Author,Paper Title,Year,Citations,DOI,PMID,Authors,Journal,Altmetric Score,Twitter Mentions,Reddit Mentions,News Mentions,Blog Mentions,Facebook Mentions,Wikipedia Mentions,Policy Mentions,Media Mentioned,Open Access,OA Status,Preprint,Publication Type,Public Health Impact,Capacity Building,Paper Link
Simon George ANDERSON,"P5. 10: Dissociation of Cardiac Remodelling and Aortic Stiffness Indices as of Cardiac/Vascular Risk, and Their Relationship to Vitamin D3",2011,0,https://doi.org/10.1016/j.artres.2011.10.067,,R Rezai and S Anderson and N Sattar and JK Cruickshank,Artery Research,0.0,0,0,0,0,0,0,0,False,True,doaj,False,Open Access,False,False,https://doi.org/10.1016/j.artres.2011.10.067
Simon George ANDERSON,"The role of blood pressure, plasma vitamin D and aldosterone on LV geometry in ageing british men",2011,0,https://doi.org/10.1161/hypertensionaha.118.11149,,MR Rezai and SG Anderson and S Balakrishnannair and B Cowan and A Young and N Sherratt and N Sattar and J Finn and F Wu and JK Cruickshank,N/A,0.5,1,0,0,0,0,0,0,False,True,doaj,False,Open Access,False,False,https://doi.org/10.1161/hypertensionaha.118.11149
Simon George ANDERSON,Hypoglycaemia as a risk factor for mortality,2011,0,https://doi.org/10.2165/00128415-200912490-00008,40432529,A Shazli and E Jude and S Anderson,N/A,0.0,0,0,0,0,0,0,0,False,True,doaj,False,Open Access,False,False,https://doi.org/10.2165/00128415-200912490-00008
Simon George ANDERSON,Structured Implementation of Lifestyle Intervention in Primary Care Delivers Slimmer People and Glucose Reduction,2011,0,https://doi.org/10.1016/s0300-7073(08)71325-2,,Adrian Heald and Jehad Amlesh and Rebecca Walmsley and Jacqui Stocker and Mark Dickinson and Simon Anderson,N/A,0.0,0,0,0,0,0,0,0,False,True,doaj,False,Open Access,True,False,https://doi.org/10.1016/s0300-7073(08)71325-2
Simon George ANDERSON,Insulin Sensitivity May Predict Clinical Outcome with a GLP-1 Analogue,2011,0,https://doi.org/10.1186/bcr-2002-75350,39829337,Adrian H Heald and Ram P Narayanan and David Lowes and Elizabeth Jarman and M Zubair Qureshi and Ian Laing and Simon G Anderson,N/A,11.5,1,0,1,0,0,0,0,True,True,doaj,False,Open Access,False,False,https://doi.org/10.1186/bcr-2002-75350
Simon George ANDERSON,Type 1 Diabetes in Primary Care: Secular Trends in Cardiometabolic Risk Factors (2004-2009),2011,0,https://doi.org/10.1016/j.pcd.2011.10.007,,Simon G Anderson and Jehad Amlesh and Ram P Narayanan and M Zubair Qureshi and Adrian H Heald,N/A,0.0,0,0,0,0,0,0,0,False,True,doaj,False,Open Access,False,False,https://doi.org/10.1016/j.pcd.2011.10.007
Simon George ANDERSON,"Clinical care and other categories posters: beta cells, islets and stem cells",2011,0,https://doi.org/10.1111/dme.2_13883,,RP Narayanan and JA Amlesh and SG Anderson and MZ Qureshi and AH Heald,N/A,0.0,0,0,0,0,0,0,0,False,True,doaj,False,Open Access,False,False,https://doi.org/10.1111/dme.2_13883
Simon George ANDERSON,"Bavin, EL and T. Shopen 329–30 Bee, D. 796 Beider, H. and R. Matthews 220–1 Belich, J. 236, 237",2010,0,https://doi.org/10.5771/9783772832758-238,,A Bell and WS Allen and M Alleyne and B Alpher and D Nash and R Amery and J Amos and RW Andersen and BL Anderson and GDS Anderson and SR Anderson and D Lightfoot and LG Andersson and M Andronov and PS Angermeyer and E Annamalai and U Ansaldo and R Anttila and J Arends and S Ash and J Myhill and JO Askedal and QD Atkinson,The Handbook of Language Contact,0.0,0,0,0,0,0,0,0,False,True,doaj,False,Open Access,False,False,https://doi.org/10.5771/9783772832758-238
Simon George ANDERSON,P02-178-BMI directly relates to glycaemia in patients with severe enduring mental illness,2010,0,https://doi.org/10.1016/s0924-9338(10)70793-8,,S Anderson and RP Narayanan and R Hodgson and M de Hert and A Heald,European Psychiatry,0.0,0,0,0,0,0,0,0,False,True,doaj,False,Open Access,False,False,https://doi.org/10.1016/s0924-9338(10)70793-8
Simon George ANDERSON,P7. 02 Beyond Blood Pressure: Is Arterial Stiffness Measurement the Future for Primary Care? A Pilot Study,2009,0,https://doi.org/10.1016/j.artres.2009.10.095,,AH Heald and SG Anderson and S Macaleese and JK Cruickshank,Artery Research,0.0,0,0,0,0,0,0,0,False,True,doaj,False,Open Access,False,False,https://doi.org/10.1016/j.artres.2009.10.095
Simon George ANDERSON,Managing Blood Pressure and Type 2 Diabetes: The Real World,2009,0,https://doi.org/10.1002/(sici)1528-252x(200003/04)17:2<49::aid-pdi35>3.3.co;2-m,40273067,SG Anderson and Ram P Narayanan and H Knapman and Z Qureshi and Sumudu Bujawansa and Rebecca Lim and Dan Peake and Adrian Heald,N/A,3.7,6,0,0,0,0,0,0,False,True,doaj,False,Open Access,False,False,https://doi.org/10.1002/(sici)1528-252x(200003/04)17:2<49::aid-pdi35>3.3.co;2-m
Simon George ANDERSON,Radical Shift in HbA1c Distribution over Time: Can We Predict the Future?,2009,0,https://doi.org/10.1080/00221473.1955.10630268,,Ram P Narayanan and SG Anderson and H Knapman and Z Qureshi and Sumudu Bujawansa and Rebecca Lim and Dan Peake and Adrian Heald,N/A,0.0,0,0,0,0,0,0,0,False,True,doaj,False,Open Access,False,False,https://doi.org/10.1080/00221473.1955.10630268
Simon George ANDERSON,A Family Practitioner Register for Impaired Glucose Handling (IGH): Impact on Cardiometabolic Profile,2009,0,https://doi.org/10.1016/j.pcd.2012.02.002,,Adrian Heald and S Anderson and Zubair Qureshi and Ramprakash Narayanan and D Radford and T Rushton and T Chambers and H Knapman,N/A,0.0,0,0,0,0,0,0,0,False,True,doaj,False,Open Access,False,False,https://doi.org/10.1016/j.pcd.2012.02.002
Simon George ANDERSON,journal homepage: www. elsevier. com/locate/bone,2009,0,https://doi.org/10.1016/b978-0-08-044428-4.50051-8,,I Aarango-Hisijara and S Abdelmajid and N Abdul and Y Abe and JD Adachi and K Adachi and S Adami and J Adams and JE Adams and M Adams and J Afilalo and LA Ahmed and F Ahwal and A Aiba and M Aino and T Akazawa and H Akiyama and T Akiyama and M AL-Mushaiqri and N Alam and MB Alcausin and IE Alexander and KA Alexander and EH Allan and SJ Allison and T Alliston and K Amano and T Amano and R Ames and N Amizuka and M Amling and P Ammann and M Andersen and FA Anderson and FH Anderson and GP Anderson and S Anderson and G Andersson and N Ando and E Ang and I Angeles-Agdeppa and BF Antonio and E Aoyama and J Arbanas and CW Archer and C Ardeleanu and ME Arlot and TR Arnett and JA Arnott and A Arthur and S Asano and S Asoda and RA Aswad and NA Athanasou and L Aucott and J Ault and FF Ayhan and I Bab and K Bácsi and A Badiei and CA Bailey and A Bajayo and J Bala and Y Bala and AR Balanescu and PA Baldock and B Balla and S Banfield and J Banu and I Barbaric and ML Barron and MP Bartold and S Bartunkova and C Basilico and SL Bass and L Bastian and S Bastin and K Bate and J Bates and U Bauer and U Bava and A Bazarra-Fernandez and DE Beaton and BR Beck and S Beckers and A Behrens and RR Behringer and P Bejrachandra and JY Belcher and O Belfrage and G Beller and G Benecke,Bone,0.0,0,0,0,0,0,0,0,False,True,doaj,False,Open Access,False,False,https://doi.org/10.1016/b978-0-08-044428-4.50051-8
Simon George ANDERSON,P2. 30 Serum Fatty Acid Composition as Mediators of Aortic Pulse Wave Velocity’s Impact on Mortality,2008,0,https://doi.org/10.1016/j.artres.2008.08.396,,SG Anderson and TAB Sanders and JK Cruickshank,Artery Research,0.0,0,0,0,0,0,0,0,False,True,doaj,False,Open Access,False,False,https://doi.org/10.1016/j.artres.2008.08.396
Simon George ANDERSON,Adjustment for macroprolactin: an integral part of laboratory assessment of hyperprolactinaemia,2008,0,https://doi.org/10.1055/s-0032-1304618,22576261,Liz Blantern and Zubair Qureshi and Adrian Heald and Simon Anderson and Daniela Radford and Julian Waldron and Marten Davies and Alan McCulloch and John Kane,Endocrine Abstracts,0.0,0,0,0,0,0,0,0,False,True,doaj,False,Open Access,False,False,https://doi.org/10.1055/s-0032-1304618
Simon George ANDERSON,Is the relationship between pulse wave velocity or blood pressure and mortality modulated by serum fatty acid composition?,2008,0,https://doi.org/10.1530/eje.1.01842,29702499,SG Anderson and TAB Sanders and JK Cruickshank,Journal of Human Hypertension,1.0,2,0,0,0,0,0,0,False,True,doaj,False,Open Access,False,False,https://doi.org/10.1530/eje.1.01842
Simon George ANDERSON,"Effect of choline-stabilized orthosilicic acid as an adjunct to calcium/vitamin D3 on bone turnover and BMD in a randomized, placebo-controlled trial of osteopenic females",2007,0,https://doi.org/10.1186/1471-2474-9-85,,TD Spector and M Calomme and S Anderson and R Swaminathan and R Jugdaohsingh and D Vanden Berghe and JJ Powell,N/A,24.78,6,0,0,1,0,9,0,True,True,doaj,False,Open Access,False,False,https://doi.org/10.1186/1471-2474-9-85
Simon George ANDERSON,Migration to the UK results in significantly lower testosterone levels in South Asian men,2006,0,https://doi.org/10.1111/j.1365-2265.2007.02856.x,,JV Patel and N Panja and D Prabharakan and S Anderson and A Vyas and D Bhatnagar and P Durrington and JM Gibson and E Hughes and S Reddy and JK Cruickshank and AH Heald,Endocrine Abstracts,1.0,2,0,0,0,0,0,0,False,True,doaj,False,Open Access,False,False,https://doi.org/10.1111/j.1365-2265.2007.02856.x
Simon George ANDERSON,Impact of migration on circulating adipocytokines in an Asian Indian population,2006,0,https://doi.org/10.1371/journal.pone.0076902,,AH Heald and J Patel and D Prabharakan and S Anderson and E Hughes and A Vyas and D Bhatnagar and S Reddy and P Durrington and JK Cruickshank,Endocrine Abstracts,0.75,2,0,0,0,0,0,0,False,True,doaj,False,Open Access,False,False,https://doi.org/10.1371/journal.pone.0076902
Simon George ANDERSON,Lymphablation with cyclophosphamide enhances Ag-specific CD8 (+) T cell responses to peptide-pulsed dendritic cells,2006,0,https://doi.org/10.1016/j.cellimm.2004.12.007,,Katherine L McMillan and Sara G Anderson and David W Mullins,N/A,0.0,0,0,0,0,0,0,0,False,True,doaj,False,Open Access,False,False,https://doi.org/10.1016/j.cellimm.2004.12.007
Simon George ANDERSON,Cumulative author index to volumes 631–636,2006,0,https://doi.org/10.1016/s0370-2693(06)00525-9,,VM Abazov and B Abbott and J Abdallah and MNA Abdullah and M Abolins and H Abramowicz and P Abreu and I Abt and BS Acharya and HH Adam and W Adam and L Adamczyk and J Adams and M Adams and T Adams and M Adamus and N Adimi and V Adler and P Adzic and AV Afanasjev and VI Afonso and ES Ageev and M Agelou and MM Aggarwal and G Aghuzumtsyan and L Agostino and JL Agram and JEM Aguilar and JA Aguilar-Saavedra and JM Aguirregabiria and Z Ahammed and JK Ahn and SH Ahn and M Ahsan and Y Akaishi and MAR Akanda and M Akbar and A Aktas and N Alamanos and AT Alan and T Albrecht and T Alderweireld and IG Alekseev and R Alemany-Fernandez and B Alessandro and C Alexa and V Yu Alexakhin and Yu Alexandrov and GD Alexeev and E Algin and S Ali and AN Aliev and MA Aliev and G Alimonti and G Alkhazov and BC Allanach and PD Allfrey and T Allmendinger and PP Allport and A Alton and M Alvarez and G Alverson and GA Alves and U Amaldi and N Amapane and S Amato and P Amaudruz and L Amendola and M Amenomori and F Ames and HR Amir-Ahmadi and J Amonett and A Amoroso and M Anabitarte and B Ananthanarayan and E Anashkin and M Anastasoaie and T Andeen and BD Anderson and S Anderson and S Ando and A Andreazza and V Andreev and RP Andrews and B Andrieu and S Andringa and KA Aniol and JC Anjos and N Anjos and RM Anjos and T Anthonis and P Antilogus and I Antoniadis and P Antonioli,Physics Letters B,0.0,0,0,0,0,0,0,0,False,True,doaj,False,Open Access,False,False,https://doi.org/10.1016/s0370-2693(06)00525-9
Simon George ANDERSON,Cumulative author index to volumes 631–637,2006,0,https://doi.org/10.1016/s0370-2693(06)00650-2,,VM Abazov and B Abbott and E Abdalla and J Abdallah and MNA Abdullah and M Abolins and H Abramowicz and P Abreu and I Abt and BS Acharya and HH Adam and W Adam and L Adamczyk and J Adams and M Adams and T Adams and M Adamus and N Adimi and V Adler and P Adzic and AV Afanasjev and VI Afonso and ES Ageev and M Agelou and MM Aggarwal and G Aghuzumtsyan and JL Agram and JEM Aguilar and JA Aguilar-Saavedra and JM Aguirregabiria and Z Ahammed and JK Ahn and SH Ahn and M Ahsan and Y Akaishi and MAR Akanda and M Akbar and H Akimune and A Aktas and N Alamanos and AT Alan and T Albrecht and T Alderweireld and IG Alekseev and R Alemany-Fernandez and B Alessandro and C Alexa and V Yu Alexakhin and Yu Alexandrov and GD Alexeev and E Algin and S Ali and AN Aliev and MA Aliev and G Alkhazov and BC Allanach and PD Allfrey and T Allmendinger and PP Allport and A Alton and M Alvarez and G Alverson and GA Alves and U Amaldi and N Amapane and S Amato and P Amaudruz and L Amendola and M Amenomori and F Ames and HR Amir-Ahmadi and J Amonett and A Amoroso and M Anabitarte and MA Anacleto and B Ananthanarayan and E Anashkin and M Anastasoaie and T Andeen and BD Anderson and M Anderson and S Anderson and S Ando and A Andreazza and V Andreev and RP Andrews and B Andrieu and S Andringa and KA Aniol and N Anjos and RM Anjos and T Anthonis and P Antilogus,Physics Letters B,0.0,0,0,0,0,0,0,0,False,True,doaj,False,Open Access,False,False,https://doi.org/10.1016/s0370-2693(06)00650-2
Simon George ANDERSON,Cumulative author index to volumes 641–642,2006,0,https://doi.org/10.1016/s0370-2693(06)01362-1,,A Abada and VM Abazov and B Abbott and M Abolins and LM Abreu and BS Acharya and G Adams and M Adams and T Adams and R Adhikari and SK Agarwalla and K Agashe and M Agelou and JL Agram and S Ahmad and C Ahn and SH Ahn and M Ahsan and S Ajimura and ET Akhmedov and V Akhmedova and RR Akhmetshin and JS Al-Khalili and GD Alexeev and G Alkhazov and A Alton and G Alverson and GA Alves and JE Amaro and J Ambjørn and F Ambrosino and P Ambrozewicz and L Amendola and M Anastasoaie and T Andeen and S Anderson and B Andrieu and C Angelantonj and M Anghinolfi and A Antonelli and M Antonelli and MS Anzelc and K Aoki and D Areán and Y Arnoud and R Arnowitt and M Arov and F Arroja and A Askew and B Åsman and G Asryan and ACS Assis Jesus and F Atchison and O Atramentov and VM Aulchenko and C Autermann and H Avakian and C Avila and M Awramik and C Ay and C Bacci and F Badaud and A Baden and S Baek and H Baer and AP Baêta Scarpelli and L Bagby and H Bagdasaryan and N Baillie and BLG Bakker and B Baldin and JP Ball and P Ball and NA Baltzell and DV Bandurin and P Banerjee and S Banerjee and A Banu and V Sh Banzarov and E Barberis and R Barbieri and P Bargassa and V Barger and P Baringer and LM Barkov and C Barnes and J Barreto and S Barrow and S Bartalucci and JF Bartlett and NS Bashtovoy and U Bassler and V Batourine and M Battaglieri and D Bauer and A Bean and K Beard,Physics Letters B,0.0,0,0,0,0,0,0,0,False,True,doaj,False,Open Access,False,False,https://doi.org/10.1016/s0370-2693(06)01362-1
Simon George ANDERSON,Lithogenic vs Biogenic Stream Water Chemistry: Following the Solute Flush,2005,0,https://doi.org/10.1016/0043-1354(86)90169-7,,DJ Bain and S Anderson and T Bullen and J Fitzpatrick and M Schulz and D Vivit and A White,AGU Fall Meeting Abstracts,0.0,0,0,0,0,0,0,0,False,True,doaj,False,Open Access,False,False,https://doi.org/10.1016/0043-1354(86)90169-7
Simon George ANDERSON,The Critical Zone Exploration Network: A Tool For Understanding Earth's Weathering Engine,2005,0,https://doi.org/10.1016/j.ecz.2024.100001,,SL Brantley and AF White and L Derry and O Chadwick and S Anderson and D Richter and M Firestone and J Kirchner and J Chorover and R April and TS White,AGU Fall Meeting Abstracts,7.0,0,0,1,0,0,0,0,True,True,doaj,False,Open Access,False,False,https://doi.org/10.1016/j.ecz.2024.100001
Simon George ANDERSON,Migration is associated with a greater age-related decline in beta cell function but not insulin sensitivity in a South Asian population,2005,0,https://doi.org/10.2337/figshare.21108910,29851177,AP Yates and J Patel and AH Heald and A Rudenski and EA Hughes and S Anderson and M Mackness and I Laing,N/A,0.0,0,0,0,0,0,0,0,False,True,doaj,False,Open Access,False,False,https://doi.org/10.2337/figshare.21108910
Simon George ANDERSON,Comparison of long term psychological health in patients with treated Pituitary Cushing,2005,0,https://doi.org/10.1210/endo-meetings.2011.part3.or9.or28-6,29875286,S Ghosh and A Heald and C Gibson and S Bray and S Anderson and J Davis and H Buckler and H Fowler,Endocrine Abstracts,0.0,0,0,0,0,0,0,0,False,True,doaj,False,Open Access,False,False,https://doi.org/10.1210/endo-meetings.2011.part3.or9.or28-6
Simon George ANDERSON,The relationship of beta-cell function with age: effect of population migration,2005,0,https://doi.org/10.1111/j.1365-2265.2005.02213.x,29113467,A Heald and S Anderson and J Patel and A Rudenski and A Vyas and I Laing and E Hughes and D Prabharakan and P Durrington and J Gibson,Endocrine Abstracts,5.08,0,0,0,1,0,0,0,True,True,doaj,False,Open Access,False,False,https://doi.org/10.1111/j.1365-2265.2005.02213.x
Simon George ANDERSON,Low insulin-like growth factor-II (IGF-II) concentration predicts weight gain in normal weight subjects with type 2 diabetes,2005,0,https://doi.org/10.1016/j.amjmed.2005.08.001,16443426,A Heald and L Karvestedt and S Anderson and J McLaughlin and A Knowles and L Wong and A White and K Brismar and M Gibson,Endocrine Abstracts,0.0,0,0,0,0,0,0,0,False,True,doaj,False,Open Access,False,False,https://doi.org/10.1016/j.amjmed.2005.08.001
Simon George ANDERSON,Relationship of specific dietary patterns and nutrient intake with glucose intolerance and diabetes in populations of West African origin,2005,0,https://doi.org/10.1017/s0007114510003399,21214963,Simon Anderson and Kennedy Cruickshank,American Journal Of Clinical Nutrition,0.0,0,0,0,0,0,0,0,False,True,doaj,False,Open Access,False,False,https://doi.org/10.1017/s0007114510003399
Simon George ANDERSON,First measurement of sigma (p anti-p---> Z). Br (Z---> tau tau) at s**(1/2)= 1.96-TeV,2004,0,https://doi.org/10.1093/omo/9781561592630.013.3000000065,,VM Abazov and B Abbott and M Abolins and BS Acharya and M Adams and T Adams and M Agelou and J-L Agram and SH Ahn and M Ahsan and GD Alexeev and G Alkhazov and A Alton and G Alverson and GA Alves and M Anastasoaie and T Andeen and S Anderson and B Andrieu and Y Arnoud and A Askew,"Physical Review, D (Particles Fields)",0.0,0,0,0,0,0,0,0,False,True,doaj,False,Open Access,False,False,https://doi.org/10.1093/omo/9781561592630.013.3000000065
Simon George ANDERSON,The IGF system influences prevalence of the metabolic syndrome in a population with high rates of cardiovascular disease,2004,0,https://doi.org/10.1016/j.ejim.2010.12.011,,A Heald and S Anderson and A Vyas and J Patel and K Siddals and J Cruickshank and J Gibson,Endocrine Abstracts,0.0,0,0,0,0,0,0,0,False,True,doaj,False,Open Access,False,False,https://doi.org/10.1016/j.ejim.2010.12.011
Simon George ANDERSON,Dietary intake and the IGF-system: a study in two related populations with a markedly different dietary intake,2004,0,https://doi.org/10.1079/phn2005729,,S Anderson and A Heald and A Vyas and K Siddals and J Patel and I Laing and D Bhatnagar and P Durrington and J Gibson and J Cruickshank,Endocrine Abstracts,0.0,0,0,0,0,0,0,0,False,True,doaj,False,Open Access,False,False,https://doi.org/10.1079/phn2005729
Simon George ANDERSON,"Association of angiotensin I-converting enzyme polymorphisms with obesity in Nigerians, Jamaicans, and African Americans.",2003,0,https://doi.org/10.1038/sj.ejhg.5201166,15919834,Y Jiang and H Kramer and X Zhu and A Luke and N Bouzekri and C Mckenzie and T Forrester and A Adeyemo and M Farrall and S Anderson and R Cooper and R Ward,N/A,0.25,1,0,0,0,0,0,0,False,True,doaj,False,Open Access,False,False,https://doi.org/10.1038/sj.ejhg.5201166
Simon George ANDERSON,"A cross-sectional study of dietary patterns with glucose intolerance in populations of West African origin: Cameroon, Jamaica, and African-Caribbeans in the UK.",2003,0,https://doi.org/10.2337/diacare.22.3.434,,SG Anderson and AH Heald and L Riste and JC MBanya and JK Cruickshank,N/A,0.0,0,0,0,0,0,0,0,False,True,doaj,False,Open Access,False,False,https://doi.org/10.2337/diacare.22.3.434
Simon George ANDERSON,Biogeochemical Weathering Processes in a California Marine Chronosequence as Implicated by Pore-Water Major-Constituent Concentrations and Germanium-Silicon Fractionation,2002,0,https://doi.org/10.1016/s0016-7037(01)00869-9,,D Vivit and M Schulz and A White and S Anderson,AGU Fall Meeting Abstracts,0.0,0,0,0,0,0,0,0,False,True,doaj,False,Open Access,False,False,https://doi.org/10.1016/s0016-7037(01)00869-9
Simon George ANDERSON,"Significant interplay between inflammatory markers, the insulin-like growth factor (IGF) system and insulin sensitivity: A population-based study",2002,0,https://doi.org/10.1007/978-3-319-28140-7_25,,AH Heald and F Bethell and S Anderson and I Laing and K Cruickshank and M Gibson,N/A,0.0,0,0,0,0,0,0,0,False,True,doaj,False,Open Access,False,False,https://doi.org/10.1007/978-3-319-28140-7_25
Simon George ANDERSON,"IGF-1, IGFBP-3, phosphoisoforms of IGFBP-1, and postnatal growth in very low birth weight infants",2002,0,https://doi.org/10.1210/jc.87.5.2171,14671409,E Kajantic and L Dunkel and EM Rutanen and M Seppala and R Koistinen and A Sarnesto and S Anderson,N/A,0.0,0,0,0,0,0,0,0,False,True,doaj,False,Open Access,False,False,https://doi.org/10.1210/jc.87.5.2171
Simon George ANDERSON,OR-11: Aortic pulse wave velocity as an integrated index of vascular function: relationship to mortality and the effect of ethnicity,2002,0,https://doi.org/10.1016/s0895-7061(02)02291-4,,Kennedy Cruickshank and Ray G Gosling and Simon G Anderson and John S Wright and Lisa K Riste and Graham Dunn,American Journal of Hypertension,0.0,0,0,0,0,0,0,0,False,True,doaj,False,Open Access,False,False,https://doi.org/10.1016/s0895-7061(02)02291-4
Simon George ANDERSON,The utility of the HOMA model for identifying women with polycystic ovarian syndrome (PCOS) who are insulin resistant,2002,0,https://doi.org/10.30994/jnp.v7i1.359,40283113,A Heald and S Whitehead and S Anderson and I Laing and H Buckler,Endocrine Abstracts,0.0,0,0,0,0,0,0,0,False,True,doaj,False,Open Access,False,False,https://doi.org/10.30994/jnp.v7i1.359
Simon George ANDERSON,Significant ethnic variation in circulating total bound and free testosterone,2002,0,https://doi.org/10.1046/j.1365-2265.2003.01653.x,12608929,A Heald and F Bethell and S Anderson and D Owen and I Laing and J Gibson and J Cruickshank,Endocrine Abstracts,3.5,4,0,0,0,0,0,0,False,True,doaj,False,Open Access,False,False,https://doi.org/10.1046/j.1365-2265.2003.01653.x
Simon George ANDERSON,The life and times of airborne particles: a PM10 travel log,2002,0,https://doi.org/10.1016/s0021-8502(98)00239-0,,Kelly Berube and Keith John Sexton and Timothy Peter Jones and S Anderson and Roy J Richards,Experimental Lung Research,0.0,0,0,0,0,0,0,0,False,True,doaj,False,Open Access,False,False,https://doi.org/10.1016/s0021-8502(98)00239-0
Simon George ANDERSON,Clinical Investigation and Reports?-Aortic Pulse-Wave Velocity and Its Relationship to Mortality in Diabetes and Glucose Intolerance: An Integrated Index of Vascular Function?,2002,0,https://doi.org/10.1161/01.cir.0000033824.02722.f7,,Kennedy Cruickshank and Lisa Riste and Simon G Anderson and John S Wright and Graham Dunn and Ray G Gosling,Circulation-Hagertown,9.25,0,0,0,0,1,1,0,True,True,doaj,False,Open Access,False,False,https://doi.org/10.1161/01.cir.0000033824.02722.f7
Simon George ANDERSON,Factors associated with increased mortality in diabetic patients undergoing amputations,2001,0,https://doi.org/10.1590/1677-5449.20140049,40396336,S Dewan and EB Jude and SG Anderson and A Middleton and JP New and RJ Young,N/A,0.0,0,0,0,0,0,0,0,False,True,doaj,False,Open Access,False,False,https://doi.org/10.1590/1677-5449.20140049
Simon George ANDERSON,Predictors of overall mortality and sudden death in VEST,1999,0,https://doi.org/10.1016/s0735-1097(22)01091-9,32083365,PE Carson and S Anderson and F Xiroyin and JB Young and BE Jaski and RC Bourge and JN Cohn,N/A,19.049999999999997,11,0,1,0,0,2,0,True,True,doaj,False,Open Access,False,False,https://doi.org/10.1016/s0735-1097(22)01091-9
Simon George ANDERSON,Outcome of diabetic nephropathy in type 2 diabetes: Ethnic differences,1999,0,https://doi.org/10.1007/978-3-319-93521-8_3,39986337,A Srivatsa and EB Jude and SG Anderson and JK Cruikshank and R Gokal and AJM Boulton,N/A,0.0,0,0,0,0,0,0,0,False,True,doaj,False,Open Access,False,False,https://doi.org/10.1007/978-3-319-93521-8_3
Simon George ANDERSON,Hypertension and Current Evidence for Treatment of Type 2 Diabetes: Where Should the Emphasis be Now?,1999,0,https://doi.org/10.11648/j.sjcm.20120101.12,,J KENNEDY CRUICKSHANK and ANITA ROCHE and SIMON G ANDERSON,Diabetes,0.0,0,0,0,0,0,0,0,False,True,doaj,False,Open Access,False,False,https://doi.org/10.11648/j.sjcm.20120101.12
Simon George ANDERSON,Autophosphorylation of p110delta phosphoinositide 3-kinase: a new paradigm for the regulation of lipid kinases invitro and invivo,1999,0,https://doi.org/10.1093/emboj/18.5.1292,,Melanie J Welham and Michael D Waterfield and Simon G Anderson and Paul Brennan and Catherine Raven and Kyochiro Higashi and Bart Vanhaesebroeck and Stephen G Ward,The EMBO Journal,6.0,0,0,0,0,0,1,0,True,True,doaj,False,Open Access,False,False,https://doi.org/10.1093/emboj/18.5.1292
Simon George ANDERSON,"Hypothesis: Maladaptation to chronic excess dietary portal vein fatty acid flux, rather than genes determine ethnic differences in glucose tolerance.",1998,0,https://doi.org/10.1152/ajpendo.00306.2005,,K Cruickshank and S Anderson,N/A,0.25,1,0,0,0,0,0,0,False,True,doaj,False,Open Access,False,False,https://doi.org/10.1152/ajpendo.00306.2005
