Author,Paper Title,Year,Citations,DOI,PMID,Authors,Journal,Altmetric Score,Twitter Mentions,Reddit Mentions,News Mentions,Blog Mentions,Facebook Mentions,Wikipedia Mentions,Policy Mentions,Media Mentioned,Open Access,OA Status,Preprint,Publication Type,Public Health Impact,Capacity Building,Paper Link
Simon George ANDERSON,Changes in metabolic parameters in patients with severe mental illness over a 10-year period: a retrospective cohort study,2017,20,https://doi.org/10.1177/0004867415625817,,Adrian H Heald and Julie L Martin and Tony Payton and Luma Khalid and Simon G Anderson and R Prakash Narayanan and Marc De Hert and Alison Yung and Mark Livingston,Australian & New Zealand Journal of Psychiatry,8.55,9,0,0,0,0,0,0,False,True,doaj,False,Open Access,False,False,https://doi.org/10.1177/0004867415625817
Simon George ANDERSON,"GWAS in 446,118 European adults identifies 78 genetic loci for self-reported habitual sleep duration supported by accelerometer-derived estimates",2018,19,https://doi.org/10.1101/274977,30846698,Hassan S Dashti and Samuel E Jones and Andrew R Wood and Jacqueline M Lane and Vincent T van Hees and Heming Wang and Jessica A Rhodes and Yanwei Song and Krunal Patel and Simon G Anderson and Robin Beaumont and David A Bechtold and Jack Bowden and Brian E Cade and Marta Garaulet and Simon D Kyle and Max A Little and Andrew S Loudon and Annemarie I Luik and Frank AJL Scheer and Kai Spiegelhalder and Jessica Tyrrell and Daniel J Gottlieb and Henning Tiemeier and David W Ray and Shaun M Purcell and Timothy M Frayling and Susan Redline and Deborah A Lawlor and Martin K Rutter and Michael N Weedon and Richa Saxena,bioRxiv,12.85,24,0,0,0,0,0,0,False,True,doaj,False,Open Access,False,False,https://doi.org/10.1101/274977
Simon George ANDERSON,Nutrient intakes and dysglycaemia in populations of West African origin,2011,19,https://doi.org/10.1017/s0007114510003399,21214963,Simon G Anderson and Novie Younger and Adrian H Heald and Marshall K Tulloch-Reid and Wiyumile P Simukonda and Jean-Claude Mbanya and Maria D Jackson and Beverley Balkau and Sangita Sharma and Agatha Tanya and Terrence Forrester and Rainford Wilks and J Kennedy Cruickshank,British Journal of Nutrition,0.0,0,0,0,0,0,0,0,False,True,doaj,False,Open Access,False,False,https://doi.org/10.1017/s0007114510003399
Simon George ANDERSON,"The risk factors potentially influencing hospital admission in people with diabetes, following SARS-CoV-2 infection: a population-level analysis",2022,18,https://doi.org/10.1007/s13300-022-01230-2,35325361,Adrian H Heald and David A Jenkins and Richard Williams and Matthew Sperrin and Helene Fachim and Rajshekhar N Mudaliar and Akheel Syed and Asma Naseem and J Martin Gibson and Kelly A Bowden Davies and Niels Peek and Simon G Anderson and Yonghong Peng and William Ollier,Diabetes Therapy,8.149999999999999,12,0,0,0,0,0,0,False,True,doaj,False,Open Access,False,False,https://doi.org/10.1007/s13300-022-01230-2
Simon George ANDERSON,Analysis of continuous blood glucose data in people with type 1 diabetes (T1DM) after COVID-19 vaccination indicates a possible link between the immune and the metabolic response,2021,18,https://doi.org/10.1177/19322968211026291,34323111,Adrian H Heald and Mike Stedman and Linda Horne and Rustam Rea and Martin Whyte and J Martin Gibson and Mark Livingston and Simon G Anderson and William Ollier,Journal of diabetes science and technology,1.5,4,0,0,0,0,0,0,False,True,doaj,False,Open Access,True,False,https://doi.org/10.1177/19322968211026291
Simon George ANDERSON,Does the CHA2DS2-Vasc score predict procedural and short-term outcomes in patients undergoing transcatheter aortic valve implantation?,2015,18,https://doi.org/10.1136/openhrt-2014-000170,26512326,Tahir Hamid and Tawfiq R Choudhury and Simon G Anderson and Izhar Hashmi and Saqib Chowdhary and David Hesketh Roberts and Douglas G Fraser and Ragheb Hasan and Vaikom S Mahadevan and Richard Levy,Open Heart,0.0,0,0,0,0,0,0,0,False,True,doaj,False,Open Access,False,False,https://doi.org/10.1136/openhrt-2014-000170
Simon George ANDERSON,Adiponectin and lipid profiles compared with insulins in relation to early growth of British South Asian and European children: the Manchester children's growth and vascular health study,2011,18,https://doi.org/10.1210/jc.2011-0046,21632814,Narinder Bansal and Simon G Anderson and Avni Vyas and Isla Gemmell and Valentine Charlton-Menys and John Oldroyd and Philip Pemberton and Paul N Durrington and Peter E Clayton and J Kennedy Cruickshank,The Journal of Clinical Endocrinology & Metabolism,0.0,0,0,0,0,0,0,0,False,True,doaj,False,Open Access,False,False,https://doi.org/10.1210/jc.2011-0046
Simon George ANDERSON,Data Independent Acquisition Mass Spectrometry Can Identify Circulating Proteins That Predict Future Weight Loss with a Diet and Exercise Programme,2019,16,https://doi.org/10.3390/jcm8020141,30691056,Martin J. Gibson and Adrian Heald Nagaraj Malipatil and Helene A. Fachim and Kirk Siddals and Bethany Geary and Gwen Wark and Nick Porter and Simon Anderson and Rachelle Donn and Michelle Harvie and Anthony D. Whetton,J. Clin. Med.,2.6,5,0,0,0,0,0,0,False,True,doaj,False,Open Access,False,False,https://doi.org/10.3390/jcm8020141
Simon George ANDERSON,Socioeconomic deprivation independently predicts symptomatic painful diabetic neuropathy in type 1 diabetes,2014,16,https://doi.org/10.1016/j.pcd.2013.08.004,24211151,Simon G Anderson and Nagaraj S Malipatil and Hugh Roberts and George Dunn and Adrian H Heald,Primary care diabetes,0.5,1,0,0,0,0,0,0,False,True,doaj,False,Open Access,False,False,https://doi.org/10.1016/j.pcd.2013.08.004
Simon George ANDERSON,"Migration is associated with lower total, but not free testosterone levels in South Asian men",2007,16,https://doi.org/10.1111/j.1365-2265.2007.02856.x,40434725,AH Heald and J Patel and SG Anderson and A Vyas and A Rudenski and E Hughes and NC Panja and A Ullah and D Prabhakaran and S Reddy and P Durrington and JM Gibson and I Laing and D Bhatnagar and JK Cruickshank,Clinical endocrinology,1.0,2,0,0,0,0,0,0,False,True,doaj,False,Open Access,False,False,https://doi.org/10.1111/j.1365-2265.2007.02856.x
Simon George ANDERSON,"The FreeStyle Libre flash glucose monitoring system: how it has improved glycaemic control for people with type 1 diabetes in Eastern Cheshire, UK",2020,15,https://doi.org/10.1097/xce.0000000000000216,33225233,Ghasem Yadegarfar and Simon G Anderson and Zohaib Khawaja and Gabriela Cortes and Kathryn Leivesley and Ann Metters and Linda Horne and Tom Steele and Adrian H Heald,Cardiovascular Endocrinology & Metabolism,0.0,0,0,0,0,0,0,0,False,True,doaj,False,Open Access,False,False,https://doi.org/10.1097/xce.0000000000000216
Simon George ANDERSON,Hypoglycaemia in the over 75s: understanding the predisposing factors in type 2 diabetes (T2DM),2018,14,https://doi.org/10.1111/ijcp.12932,28941578,Adrian Hugh Heald and Simon George Anderson and Gabriela Janet Cortes and Videlina Cholokova and Marcos Narajos and Adnan Khan and Gemma Donnahey and Mark Livingston,Primary care diabetes,1.0,2,0,0,0,0,0,0,False,True,doaj,False,Open Access,False,False,https://doi.org/10.1111/ijcp.12932
Simon George ANDERSON,Burdens of type 2 diabetes and cardiovascular disease attributable to sugar-sweetened beverages in 184 countries,2025,13,https://doi.org/10.1038/s41591-024-03345-4,39870818,Laura Lara-Castor and Meghan O’Hearn and Frederick Cudhea and Victoria Miller and Peilin Shi and Jianyi Zhang and Julia R Sharib and Sean B Cash and Simon Barquera and Renata Micha and Dariush Mozaffarian,Nature medicine,2471.082000000001,511,5,275,9,7,0,0,True,True,doaj,False,Open Access,False,False,https://doi.org/10.1038/s41591-024-03345-4
Simon George ANDERSON,"Children’s and adolescents’ rising animal-source food intakes in 1990–2018 were impacted by age, region, parental education and urbanicity",2023,13,https://doi.org/10.1038/s43016-023-00731-y,37117550,Victoria Miller and Patrick Webb and Frederick Cudhea and Jianyi Zhang and Julia Reedy and Peilin Shi and Josh Erndt-Marino and Jennifer Coates and Renata Micha and Dariush Mozaffarian,Nature food,8.25,10,0,0,0,0,0,0,False,True,doaj,False,Open Access,False,True,https://doi.org/10.1038/s43016-023-00731-y
Simon George ANDERSON,Socioeconomic deprivation independently predicts painful diabetic neuropathy in type 2 diabetes,2015,13,https://doi.org/10.1055/s-0035-1549966,26069072,Simon G Anderson and Ram P Narayanan and Nagaraj S Malipatil and Hugh Roberts and George Dunn and Adrian H Heald,Experimental and Clinical Endocrinology & Diabetes,0.0,0,0,0,0,0,0,0,False,True,doaj,False,Open Access,False,False,https://doi.org/10.1055/s-0035-1549966
Simon George ANDERSON,"A substitution model of dietary manipulation is an effective means of optimising lipid profile, reducing C-reactive protein and increasing insulin-like growth factor-1",2004,13,https://doi.org/10.1079/bjn20041262,,Adrian H Heald and Cheryl Golding and Reena Sharma and Kirk Siddals and Sara Kirk and Clare Lawton and Simon Anderson and J Martin Gibson and Janet E Cade,British Journal of Nutrition,0.0,0,0,0,0,0,0,0,False,True,doaj,False,Open Access,False,False,https://doi.org/10.1079/bjn20041262
Simon George ANDERSON,Aortic pulse-wave velocity and its relationship to mortality in diabetes and glucose intolerance,2002,13,https://doi.org/10.1161/01.cir.0000033824.02722.f7,12379578,Lisa Riste Kennedy Cruickshank and Simon G Anderson and John S Wright and Graham Dunn and Ray G Gosling,Circulation,9.25,0,0,0,0,1,1,0,True,True,doaj,False,Open Access,False,False,https://doi.org/10.1161/01.cir.0000033824.02722.f7
Simon George ANDERSON,"Sodium‐glucose co‐transporter‐2 inhibitors, the latest residents on the block: Impact on glycaemic control at a general practice level in England",2018,12,https://doi.org/10.1111/dom.13281,,Adrian H Heald and Anthony A Fryer and Simon G Anderson and Mark Livingston and Mark Lunt and Mark Davies and Gabriela YC Moreno and Roger Gadsby and Robert J Young and Mike Stedman,"Diabetes, Obesity and Metabolism",1.5,2,0,0,0,0,0,0,False,True,doaj,False,Open Access,False,False,https://doi.org/10.1111/dom.13281
Simon George ANDERSON,Impact of age on the prognostic value of left ventricular function in relation to procedural outcomes following percutaneous coronary intervention: Insights from the B ritish cardiovascular intervention society,2015,12,https://doi.org/10.1002/ccd.25732,,Chun Shing Kwok and Simon G Anderson and Katherine SL McAllister and Matthew Sperrin and Peter D O'Kane and Bernard Keavney and James Nolan and Phyo Kyaw Myint and Azfar Zaman and Iain Buchan and Peter F Ludman and Mark A de Belder and Mamas A Mamas and British Cardiovascular Intervention Society and the National Institute for Cardiovascular Outcomes Research,Catheterization and Cardiovascular Interventions,0.0,0,0,0,0,0,0,0,False,True,doaj,False,Open Access,True,False,https://doi.org/10.1002/ccd.25732
Simon George ANDERSON,Type 1 diabetes in Cheshire: cardiometabolic risk factor trends (2004–2009),2012,12,https://doi.org/10.1016/j.pcd.2011.10.007,22137766,Simon G Anderson and Ram P Narayanan and Jehad Amlesh and Mohammad Z Qureshi and Adrian Hugh Heald,Primary care diabetes,0.0,0,0,0,0,0,0,0,False,True,doaj,False,Open Access,False,False,https://doi.org/10.1016/j.pcd.2011.10.007
Simon George ANDERSON,Change in pancreatic B‐cell function (HOMA‐B) varies in different populations with similar genetic backgrounds but different environments,2007,12,https://doi.org/10.1111/j.1464-5491.2007.02032.x,17257276,AH Heald and SG Anderson and J Patel and A Rudenski and A Vyas and A Yates and E Hughes and D Prabharakan and S Reddy and P Durrington and JM Gibson and D Bhatnagar and JK Cruickshank and I Laing,Diabetic medicine,0.0,0,0,0,0,0,0,0,False,True,doaj,False,Open Access,False,False,https://doi.org/10.1111/j.1464-5491.2007.02032.x
Simon George ANDERSON,Screening for insulin resistance in women with polycystic ovarian syndrome,2005,12,https://doi.org/10.1080/09513590400021045,40422608,Adrian H Heald and Sharon Whitehead and Simon Anderson and Kennedy Cruickshank and Lisa Riste and Ian Laing and Aram Rudenski and Helen Buckler,Gynecological endocrinology,0.0,0,0,0,0,0,0,0,False,True,doaj,False,Open Access,False,False,https://doi.org/10.1080/09513590400021045
Simon George ANDERSON,Central adiposity at diagnosis may reduce prostate cancer-specific mortality in African-Caribbean men with prostate cancer: 10-year follow-up of participants in a case–control study,2020,11,https://doi.org/10.1007/s10552-020-01306-z,,Maria D Jackson and Marshall K Tulloch-Reid and Affette M McCaw-Binns and William Aiken and Trevor S Ferguson and Nadia R Bennett and Leroy Harrison and Asha Badaloo and Donovan McGrowder and Annielle Grindley and Evelyn Walker and Simon G Anderson,Cancer Causes & Control,0.25,1,0,0,0,0,0,0,False,True,doaj,False,Open Access,False,False,https://doi.org/10.1007/s10552-020-01306-z
Simon George ANDERSON,British Cardiovascular Intervention S,2014,11,https://doi.org/10.15420/icr.2024.43,40445741,MA Mamas and SG Anderson and K Ratib and H Routledge and L Neyses and DG Fraser and I Buchan and MA de Belder and P Ludman and J Nolan,National Institute for Cardiovascular Outcomes R. Arterial access site utilization in cardiogenic shock in the United Kingdom: is radial access feasible,0.0,0,0,0,0,0,0,0,False,True,doaj,False,Open Access,True,False,https://doi.org/10.15420/icr.2024.43
Simon George ANDERSON,IRONMAN: A novel international registry of men with advanced prostate cancer,2022,10,https://doi.org/10.1200/go.22.00154,36332173,Lorelei A Mucci and Jacob Vinson and Theresa Gold and Travis Gerke and Julie Filipenko and Rebecca M Green and Simon G Anderson and Simone Badal and Anders Bjartell and Kim N Chi and Ian D Davis and Deborah Enting and André P Fay and John Lazarus and Joaquin Mateo and Ray McDermott and Folakemi T Odedina and David Olmos and Aurelius Omlin and Ademola A Popoola and Camille Ragin and Robin Roberts and Kjell M Russnes and Charles Waihenya and Konrad H Stopsack and Terry Hyslop and Paul Villanti and Philip W Kantoff and Daniel J George and IRONMAN Global Team,JCO Global Oncology,34.850000000000016,52,0,0,0,0,0,0,False,True,doaj,False,Open Access,False,False,https://doi.org/10.1200/go.22.00154
Simon George ANDERSON,Does rhythm matter in acute heart failure? An insight from the British Society for Heart Failure National Audit,2019,10,https://doi.org/10.1007/s00392-019-01463-5,,Simon G Anderson and Ahmad Shoaib and Phyo Kyaw Myint and John G Cleland and Suzanna M Hardman and Theresa A McDonagh and Henry Dargie and Bernard Keavney and Clifford J Garratt and Mamas A Mamas,Clinical Research in Cardiology,0.25,0,0,0,0,1,0,0,True,True,doaj,False,Open Access,False,False,https://doi.org/10.1007/s00392-019-01463-5
Simon George ANDERSON,Biological and clinical insights from genetics of insomnia symptoms,2018,10,https://doi.org/10.1101/257956,39875399,Jacqueline M Lane and Samuel Jones and Hassan S Dashti and Andrew R Wood and Krishna Aragam and Vincent T van Hees and Ben Brumpton and Bendik Winsvold and Heming Wang and Jack Bowden and Yanwei Song and Krunal Patel and Simon G Anderson and Robin Beaumont and David A Bechtold and Brian Cade and Sek Kathiresan and Max A Little and Annemarie I Luik and Andrew S Loudon and Shaun Purcell and Rebecca C Richmond and Frank AJL Scheer and Jessica Tyrrell and John Winkelman and HUNT All In Sleep and Linn B Strand and Jonas B Nielsen and Cristen J Willer and Susan Redline and Kai Spiegelhalder and Simon D Kyle and David W Ray and John-Anker Zwart and Kristian Hveem and Timothy M Frayling and Deborah Lawlor and Martin K Rutter and Michael N Weedon and Richa Saxena,bioRxiv,11.55,20,0,0,0,1,0,0,True,True,doaj,False,Open Access,False,False,https://doi.org/10.1101/257956
Simon George ANDERSON,"Marked differences in the IGF system that are associated with migration in comparable populations of Gujaratis living in Sandwell, UK, and Gujarat, India",2005,10,https://doi.org/10.1007/s00125-005-1871-7,16041536,AH Heald and SG Anderson and A Vyas and K Siddals and J Patel and AP Yates and D Bhatnagar and D Prabhakaran and E Hughes and A Rudenski and P Durrington and JM Gibson and JK Cruickshank,Diabetologia,0.0,0,0,0,0,0,0,0,False,True,doaj,False,Open Access,False,False,https://doi.org/10.1007/s00125-005-1871-7
Simon George ANDERSON,"35th annual meeting of the European Association for the Study of diabetes: Brussels, Belgium, 28 September–2 October 1999",1999,10,https://doi.org/10.1177/00220345010800040401,,A Melander and J Olsson and G Lindberg and A Salzman and T Howard and P Stang and E Lydick and A Emslie-Smith and DIR Boyle and JMM Evans and TM Macdonald and J Bain and F Sullivan and AD Morris for the DARTS/MEMO Collaboration and C Juhl and N Pørksen and J Sturis and M Hollingdal and S Pincus and J Veldhuis and A Dejgaard and O Schmitz and JS Kristensen and KB Frandsen and Th Bayer and P Müller and BE Dunning and S Paladini and C Gutierrez and R Deacon and M Valentin and G Grunberger and WM Weston and R Patwardhan and EB Rappaport and LA Sargeant and NJ Wareham and KT Khaw and Björn Zethelius and Hans Lithell and C Nicholas Hales and Christian Berne and H-M Lakka and L Oksanen and T-P Tuomainen and K Kontula and JT Salonen and JM Dekker and P de Boks and F de Vegt and CDA Stehouwer and G Nijpels and LM Bouter and RJ Heine and G Bruno and P Cavallo-Perin and G Bargero and N D’Errico and M Borra and G Macchia and G Pagano and RW Newton and DA Ruta and JP New and C Wallace and MA Roxburgh and RJ Young and NJA Vaughan and P Elliott and G Brennan and M Devers and R MacAlpine and D Steinke and DH Lawson and B Decallonne and K Casteels and C Gysemans and R Bouillon and C Mathieu and Thomas Linn and Christine Strate and Kerstin Schneider and DP Funda and M Jirsa and H Kozáková and A Kaas and O Kofronová and H Tlaskalová-Hogenová and K Buschard and H Wanka and A Hartmann and B Kuttler and SB Rasmussen and TS Sørensen and H Markholst and JS Petersen and D Karounos and T Dyrberg and JG Mabley and G Haskó and C Szabó and J Seissler and TBT Nguyen and H Steinbrenner and WA Scherbaum and R Cipriani and A Gabriele and M Sensi and L Guidobaldi and F Pantellini and MG Cerrito and S Scarpa and U Di Mario and S Morano and G Ceolotto and E Iori and E Baritono and S Del Prato and A Semplicini and R Trevisan and G Zerbini and G Meregalli and V Asnaghi and F Tentori and A Maestroni and R Mangili and C Marescotti and M Vedovato and A Tiengo and J Tadjieva and BN Mankovsky and S Van Aken and A Raes and J Vande Walle and D Matthys and M Craen and HP Hansen and SS Lund and P Rossing and T Jensen and H-H Parving and GENEDIAB Study Group and S Andersen and L Tarnow and BV Hansen and C Trautner and B Haastert and N Ennenbach and S Willich and Á Gy Tabák,Diabetologia,0.0,0,0,0,0,0,0,0,False,True,doaj,False,Open Access,False,False,https://doi.org/10.1177/00220345010800040401
Simon George ANDERSON,Vitamin D deficiency at diagnosis increases all-cause and prostate cancer-specific mortality in Jamaican men,2022,9,https://doi.org/10.1177/10732748221131225,36180132,Donovan McGrowder and Marshall K Tulloch-Reid and Kathleen CM Coard and Afette M McCaw-Binns and Trevor S Ferguson and William Aiken and Leroy Harrison and Simon G Anderson and Maria D Jackson,Cancer Control,9.1,17,0,0,0,0,0,0,False,True,doaj,False,Open Access,False,False,https://doi.org/10.1177/10732748221131225
Simon George ANDERSON,IGF2 gene polymorphisms and IGF-II concentration are determinants of longitudinal weight trends in type 2 diabetes,2013,9,https://doi.org/10.1055/s-0033-1345122,23757053,RP Narayanan and B Fu and A Payton and JE Hudson and RL Oliver and SG Anderson and KW Siddals and A White and WER Ollier and AH Heald and JM Gibson,Experimental and Clinical Endocrinology & Diabetes,0.0,0,0,0,0,0,0,0,False,True,doaj,False,Open Access,False,False,https://doi.org/10.1055/s-0033-1345122
Simon George ANDERSON,Quantitative adjustment for macroprolactin is an integral part of laboratory assessment of hyperprolactinaemia,2012,9,https://doi.org/10.1055/s-0032-1304618,,AH Heald and E Blantern and SG Anderson and D Radford and Z Qureshi and S Nair and J Waldron and M Davies and A McCulloch and J Kane,Experimental and clinical endocrinology & diabetes,0.0,0,0,0,0,0,0,0,False,True,doaj,False,Open Access,False,False,https://doi.org/10.1055/s-0032-1304618
Simon George ANDERSON,Acute kidney injury following cardiopulmonary bypass in Jamaica,2022,8,https://doi.org/10.1016/j.xjon.2022.05.012,36172431,Lori-Ann Fisher and Sunil Stephenson and Marshall Tulloch Reid and Simon G Anderson,JTCVS open,1.0,1,0,0,0,0,0,0,False,True,doaj,False,Open Access,False,False,https://doi.org/10.1016/j.xjon.2022.05.012
Simon George ANDERSON,The impact of nutrition-based interventions on nutritional status and metabolic health in small island developing states: a systematic review and narrative synthesis,2022,8,https://doi.org/10.3390/nu14173529,,Eden Augustus and Emily Haynes and Cornelia Guell and Karyn Morrissey and Madhuvanti M Murphy and Cassandra Halliday and Lili Jia and Viliamu Iese and Simon G Anderson and Nigel Unwin,N/A,12.0,4,0,1,0,0,0,0,True,True,doaj,False,Open Access,True,False,https://doi.org/10.3390/nu14173529
Simon George ANDERSON,Direct healthcare services cost of non-healing diabetic foot wounds in an African origin population in Barbados.,2021,8,https://doi.org/10.1111/dme.14773,,André R Greenidge and Kim R Quimby and Angela MC Rose and Amy Speede and Ian R Hambleton and Simon G Anderson and R Clive Landis,Diabetic Medicine: a Journal of the British Diabetic Association,0.0,0,0,0,0,0,0,0,False,True,doaj,False,Open Access,False,False,https://doi.org/10.1111/dme.14773
Simon George ANDERSON,"Controlling antibiotic usage—A national analysis of General Practitioner/Family Doctor practices links overall antibiotic levels to demography, geography, comorbidity factors with local discretionary prescribing choices",2020,8,https://doi.org/10.1111/ijcp.13515,32306458,Michael Stedman and Mark Lunt and Mark Davies and Erin Fulton‐McAlister and Abid Hussain and Tjeerd van Staa and Simon G Anderson and Adrian H Heald,International Journal of Clinical Practice,1.0,3,0,0,0,0,0,0,False,True,doaj,False,Open Access,False,False,https://doi.org/10.1111/ijcp.13515
Simon George ANDERSON,Real‐world practice level data analysis confirms link between variability within Blood Glucose Monitoring Strip (BGMS) and glycosylated haemoglobin (HbA1c) in Type 1 Diabetes,2018,8,https://doi.org/10.1111/ijcp.13252,30168887,Adrian H Heald and Mark Livingston and Anthony Fryer and Gabriela Cortes and Simon G Anderson and Roger Gadsby and Ian Laing and Mark Lunt and Robert J Young and Mike Stedman,International journal of clinical practice,3.35,5,0,0,0,0,0,0,False,True,doaj,False,Open Access,False,False,https://doi.org/10.1111/ijcp.13252
Simon George ANDERSON,Measuring vitamin D levels: surrogates are insufficient,2015,8,https://doi.org/10.1111/ijcp.12505,37836543,AH Heald and SG Anderson and JJ Scargill and AD Short and D Holland and M Livingston and AA Fryer and RP Donn,International journal of clinical practice,0.5,1,0,0,0,0,0,0,False,True,doaj,False,Open Access,False,False,https://doi.org/10.1111/ijcp.12505
Simon George ANDERSON,A rare case of polyarticular synovial osteochondromatosis,2002,8,https://doi.org/10.1046/j.1469-7580.2002.00047_5.x,1547295,J Seckley and SG Anderson and TM Snow and M Benjamin,Journal of Anatomy,0.0,0,0,0,0,0,0,0,False,True,doaj,False,Open Access,False,False,https://doi.org/10.1046/j.1469-7580.2002.00047_5.x
Simon George ANDERSON,"Small Island Developing States: addressing the intersecting challenges of non-communicable diseases, food insecurity, and climate change",2024,7,https://doi.org/10.1016/s2213-8587(24)00100-1,38782517,Cornelia Guell and Arlette Saint Ville and Simon G Anderson and Madhuvanti M Murphy and Viliamu Iese and Sashi Kiran and Gordon M Hickey and Nigel Unwin,N/A,0.5,2,0,0,0,0,0,0,False,True,doaj,False,Open Access,False,False,https://doi.org/10.1016/s2213-8587(24)00100-1
Simon George ANDERSON,"The FreeStyle Libre flash glucose monitoring system: How it has improved glycaemic control for people with type 1 diabetes in Eastern Cheshire, UK",2019,7,https://doi.org/10.1097/xce.0000000000000216,33225233,A Heald and Ghasem Yadegarfar and S Anderson and Gabriela Cortes and Luma Khalid and Ziad Dulaimi and T Steele,Diabetes Nursing,0.0,0,0,0,0,0,0,0,False,True,doaj,False,Open Access,False,False,https://doi.org/10.1097/xce.0000000000000216
Simon George ANDERSON,"Haemostatic factors, lipoproteins and long-term mortality in a multi-ethnic population of Gujarati, African-Caribbean and European origin",2014,7,https://doi.org/10.1016/j.atherosclerosis.2014.06.004,,SG Anderson and DC Hutchings and AH Heald and CD Anderson and TAB Sanders and JK Cruickshank,Atherosclerosis,0.0,0,0,0,0,0,0,0,False,True,doaj,False,Open Access,False,False,https://doi.org/10.1016/j.atherosclerosis.2014.06.004
Simon George ANDERSON,Exploratory empirical model of combined effects of COVID-19 and climate change on youth mental health,2024,6,https://doi.org/10.1038/s44220-023-00197-8,,Quinta Seon and Natalie Greaves and Michael Campbell and Simon Anderson and Paula Henry and Eden Augustus and Emanuel Cummings and Leann Kendall and Erica Wheeler and Ans Vercammen and Emma Lawrance and Donald Simeon and Terence Seemungal and Ian Gold and Sandeep B Maharaj,Nature Mental Health,8.65,11,0,0,0,0,0,0,False,True,doaj,False,Open Access,False,False,https://doi.org/10.1038/s44220-023-00197-8
