Author,Paper Title,Year,Citations,DOI,PMID,Authors,Journal,Altmetric Score,Twitter Mentions,Reddit Mentions,News Mentions,Blog Mentions,Facebook Mentions,Wikipedia Mentions,Policy Mentions,Media Mentioned,Open Access,OA Status,Preprint,Publication Type,Public Health Impact,Capacity Building,Paper Link
Simon George ANDERSON,Blood pressure lowering for prevention of cardiovascular disease and death: a systematic review and meta-analysis.,2016,4480,https://doi.org/10.1016/s0140-6736(15)01225-8,,D Ettehad and CA Emdin and A Kiran and SG Anderson and T Callender and J Emberson and J Chalmers and A Rodgers and K Rahimi,Lancet,907.6139999999996,449,0,64,13,17,8,0,True,True,doaj,False,Open Access,False,False,https://doi.org/10.1016/s0140-6736(15)01225-8
Simon George ANDERSON,"Aortic pulse wave velocity improves cardiovascular event prediction: an individual participant meta-analysis of prospective observational data from 17,635 subjects",2014,2164,https://doi.org/10.1016/j.jacc.2013.09.063,24239664,Yoav Ben-Shlomo and Melissa Spears and Chris Boustred and Margaret May and Simon G Anderson and Emelia J Benjamin and Pierre Boutouyrie and James Cameron and Chen-Huan Chen and J Kennedy Cruickshank and Shih-Jen Hwang and Edward G Lakatta and Stephane Laurent and João Maldonado and Gary F Mitchell and Samer S Najjar and Anne B Newman and Mitsuru Ohishi and Bruno Pannier and Telmo Pereira and Ramachandran S Vasan and Tomoki Shokawa and Kim Sutton-Tyrell and Francis Verbeke and Kang-Ling Wang and David J Webb and Tine Willum Hansen and Sophia Zoungas and Carmel M McEniery and John R Cockcroft and Ian B Wilkinson,N/A,34.1,15,0,0,0,0,2,0,True,True,doaj,False,Open Access,False,False,https://doi.org/10.1016/j.jacc.2013.09.063
Simon George ANDERSON,Aortic Pulse-Wave Velocity and Its Relationship to Mortality in Diabetes and Glucose Intolerance An Integrated Index of Vascular Function?,2002,2162,https://doi.org/10.1161/01.cir.0000033824.02722.f7,12379578,J Kennedy Cruickshank and Lisa Riste and Simon G Anderson and John S Wright and Graham Dunn and Ray G Gosling,Circulation,9.25,0,0,0,0,1,1,0,True,True,doaj,False,Open Access,False,False,https://doi.org/10.1161/01.cir.0000033824.02722.f7
Simon George ANDERSON,Determinants of pulse wave velocity in healthy people and in the presence of cardiovascular risk factors:‘establishing normal and reference values’,2010,1716,https://doi.org/10.1093/eurheartj/ehq165,20530030,Reference Values for Arterial Stiffness' Collaboration,European heart journal,30.0,5,0,1,0,0,1,0,True,True,doaj,False,Open Access,False,False,https://doi.org/10.1093/eurheartj/ehq165
Simon George ANDERSON,Complete mitochondrial genome sequences of two extinct moas clarify ratite evolution.,2001,553,https://doi.org/10.1038/35055536,11217857,Alan Cooper and Carles Lalueza-Fox and Simon Anderson and Andrew Rambaut and Jeremy Austin and Ryk Ward,Nature,25.056,2,0,0,3,0,12,0,True,True,doaj,False,Open Access,False,False,https://doi.org/10.1038/35055536
Simon George ANDERSON,Genome-wide association study identifies genetic loci for self-reported habitual sleep duration supported by accelerometer-derived estimates,2019,531,https://doi.org/10.1038/s41467-019-08917-4,30846698,Hassan S Dashti and Samuel E Jones and Andrew R Wood and Jacqueline M Lane and Vincent T Van Hees and Heming Wang and Jessica A Rhodes and Yanwei Song and Krunal Patel and Simon G Anderson and Robin N Beaumont and David A Bechtold and Jack Bowden and Brian E Cade and Marta Garaulet and Simon D Kyle and Max A Little and Andrew S Loudon and Annemarie I Luik and Frank AJL Scheer and Kai Spiegelhalder and Jessica Tyrrell and Daniel J Gottlieb and Henning Tiemeier and David W Ray and Shaun M Purcell and Timothy M Frayling and Susan Redline and Deborah A Lawlor and Martin K Rutter and Michael N Weedon and Richa Saxena,Nature communications,154.898,46,0,14,5,0,1,0,True,True,doaj,False,Open Access,False,False,https://doi.org/10.1038/s41467-019-08917-4
Simon George ANDERSON,"Night shift work, genetic risk, and type 2 diabetes in the UK biobank",2018,371,https://doi.org/10.2337/dc17-1933,39271386,Céline Vetter and Hassan S Dashti and Jacqueline M Lane and Simon G Anderson and Eva S Schernhammer and Martin K Rutter and Richa Saxena and Frank AJL Scheer,Diabetes care,301.71199999999993,156,0,24,5,10,0,0,True,True,doaj,False,Open Access,False,False,https://doi.org/10.2337/dc17-1933
Simon George ANDERSON,Genome-wide association analyses of sleep disturbance traits identify new loci and highlight shared genetics with neuropsychiatric and metabolic traits,2017,366,https://doi.org/10.1038/ng.3749,27992416,Jacqueline M Lane and Jingjing Liang and Irma Vlasac and Simon G Anderson and David A Bechtold and Jack Bowden and Richard Emsley and Shubhroz Gill and Max A Little and Annemarie I Luik and Andrew Loudon and Frank AJL Scheer and Shaun M Purcell and Simon D Kyle and Deborah A Lawlor and Xiaofeng Zhu and Susan Redline and David W Ray and Martin K Rutter and Richa Saxena,Nature genetics,321.264,88,0,32,5,1,0,0,True,True,doaj,False,Open Access,False,False,https://doi.org/10.1038/ng.3749
Simon George ANDERSON,Biological and clinical insights from genetics of insomnia symptoms,2019,352,https://doi.org/10.1101/257956,39875399,Jacqueline M Lane and Samuel E Jones and Hassan S Dashti and Andrew R Wood and Krishna G Aragam and Vincent T van Hees and Linn B Strand and Bendik S Winsvold and Heming Wang and Jack Bowden and Yanwei Song and Krunal Patel and Simon G Anderson and Robin N Beaumont and David A Bechtold and Brian E Cade and Mary Haas and Sekar Kathiresan and Max A Little and Annemarie I Luik and Andrew S Loudon and Shaun Purcell and Rebecca C Richmond and Frank AJL Scheer and Barbara Schormair and Jessica Tyrrell and John W Winkelman and Juliane Winkelmann and Kristian Hveem and Chen Zhao and Jonas B Nielsen and Cristen J Willer and Susan Redline and Kai Spiegelhalder and Simon D Kyle and David W Ray and John-Anker Zwart and Ben Brumpton and Timothy M Frayling and Deborah A Lawlor and Martin K Rutter and Michael N Weedon and Richa Saxena,Nature genetics,11.55,20,0,0,0,1,0,0,True,True,doaj,False,Open Access,False,False,https://doi.org/10.1101/257956
Simon George ANDERSON,"Genome-wide association analysis identifies novel loci for chronotype in 100,420 individuals from the UK Biobank",2016,331,https://doi.org/10.1038/ncomms10889,26955885,Jacqueline M Lane and Irma Vlasac and Simon G Anderson and Simon D Kyle and William G Dixon and David A Bechtold and Shubhroz Gill and Max A Little and Annemarie Luik and Andrew Loudon and Richard Emsley and Frank AJL Scheer and Deborah A Lawlor and Susan Redline and David W Ray and Martin K Rutter and Richa Saxena,Nature communications,95.98,63,0,7,1,0,0,0,True,True,doaj,False,Open Access,False,False,https://doi.org/10.1038/ncomms10889
Simon George ANDERSON,Bariatric surgery and its impact on cardiovascular disease and mortality: a systematic review and meta-analysis,2014,326,https://doi.org/10.1016/j.ijcard.2014.02.026,38938362,Chun Shing Kwok and Ashish Pradhan and Muhammad A Khan and Simon G Anderson and Bernard D Keavney and Phyo Kyaw Myint and Mamas A Mamas and Yoon K Loke,N/A,41.25,14,0,2,0,0,6,0,True,True,doaj,False,Open Access,False,False,https://doi.org/10.1016/j.ijcard.2014.02.026
Simon George ANDERSON,Long-term durability of transcatheter aortic valve prostheses,2019,280,https://doi.org/10.1016/j.jacc.2018.10.078,40375761,Daniel J Blackman and Smriti Saraf and Philip A MacCarthy and Aung Myat and Simon G Anderson and Christopher J Malkin and Michael S Cunnington and Kathryn Somers and Paul Brennan and Ganesh Manoharan and Jessica Parker and Omar Aldalati and Stephen J Brecker and Cameron Dowling and Stephen P Hoole and Stephen Dorman and Michael Mullen and Simon Kennon and Melanie Jerrum and Pavan Chandrala and David H Roberts and Justin Tay and Sagar N Doshi and Peter F Ludman and Timothy A Fairbairn and Joanne Crowe and Richard D Levy and Adrian P Banning and Neil Ruparelia and Mark S Spence and David Hildick-Smith,Journal of the American College of Cardiology,46.15,34,0,2,0,0,0,0,True,True,doaj,False,Open Access,False,False,https://doi.org/10.1016/j.jacc.2018.10.078
Simon George ANDERSON,Usual blood pressure and risk of new-onset diabetes: evidence from 4.1 million adults and a meta-analysis of prospective studies,2015,258,https://doi.org/10.3410/f.725826170.793510210,,Connor A Emdin and Simon G Anderson and Mark Woodward and Kazem Rahimi,Journal of the American College of Cardiology,0.0,0,0,0,0,0,0,0,False,True,doaj,False,Open Access,False,False,https://doi.org/10.3410/f.725826170.793510210
Simon George ANDERSON,"Usual blood pressure, peripheral arterial disease, and vascular risk: cohort study of 4.2 million adults",2015,244,https://doi.org/10.1136/bmj.h4865,26419648,Connor A Emdin and Simon G Anderson and Thomas Callender and Nathalie Conrad and Gholamreza Salimi-Khorshidi and Hamid Mohseni and Mark Woodward and Kazem Rahimi,Bmj,17.65,20,0,0,0,1,0,0,True,True,doaj,False,Open Access,False,False,https://doi.org/10.1136/bmj.h4865
Simon George ANDERSON,Close relation of fasting insulin-like growth factor binding protein-1 (IGFBP-1) with glucose tolerance and cardiovascular risk in two populations,2001,233,https://doi.org/10.1007/s001250051623,11317665,AH Heald and JK Cruickshank and LK Riste and JE Cade and S Anderson and A Greenhalgh and J Sampayo and W Taylor and W Fraser and A White and JM Gibson,Diabetologia,0.0,0,0,0,0,0,0,0,False,True,doaj,False,Open Access,False,False,https://doi.org/10.1007/s001250051623
Simon George ANDERSON,Genome-wide association analysis of self-reported daytime sleepiness identifies 42 loci that suggest biological subtypes,2019,206,https://doi.org/10.1038/s41467-019-11456-7,31409809,Heming Wang and Jacqueline M Lane and Samuel E Jones and Hassan S Dashti and Hanna M Ollila and Andrew R Wood and Vincent T Van Hees and Ben Brumpton and Bendik S Winsvold and Katri Kantojärvi and Teemu Palviainen and Brian E Cade and Tamar Sofer and Yanwei Song and Krunal Patel and Simon G Anderson and David A Bechtold and Jack Bowden and Richard Emsley and Simon D Kyle and Max A Little and Andrew S Loudon and Frank AJL Scheer and Shaun M Purcell and Rebecca C Richmond and Kai Spiegelhalder and Jessica Tyrrell and Xiaofeng Zhu and Christer Hublin and Jaakko A Kaprio and Kati Kristiansson and Sonja Sulkava and Tiina Paunio and Kristian Hveem and Jonas B Nielsen and Cristen J Willer and John-Anker Zwart and Linn B Strand and Timothy M Frayling and David Ray and Deborah A Lawlor and Martin K Rutter and Michael N Weedon and Susan Redline and Richa Saxena,Nature communications,90.39999999999999,132,0,1,0,0,4,0,True,True,doaj,False,Open Access,False,False,https://doi.org/10.1038/s41467-019-11456-7
Simon George ANDERSON,Total cardiovascular risk approach to improve efficiency of cardiovascular prevention in resource constrain settings,2011,189,https://doi.org/10.1016/j.jclinepi.2011.02.001,25924825,Shanthi Mendis and Lars H Lindholm and Simon G Anderson and Ala Alwan and Rajendra Koju and Basden JC Onwubere and Azhar Mahmood Kayani and Nihal Abeysinghe and Alfredo Duneas and Sergo Tabagari and Wu Fan and Nizal Sarraf-Zadegan and Porfirio Nordet and Judith Whitworth and Anthony Heagerty,Journal of clinical epidemiology,7.0,0,0,1,0,0,0,0,True,True,doaj,False,Open Access,False,False,https://doi.org/10.1016/j.jclinepi.2011.02.001
Simon George ANDERSON,"Global dietary quality in 185 countries from 1990 to 2018 show wide differences by nation, age, education, and urbanicity",2022,185,https://doi.org/10.1038/s43016-022-00594-9,37118151,Victoria Miller and Patrick Webb and Frederick Cudhea and Peilin Shi and Jianyi Zhang and Julia Reedy and Josh Erndt-Marino and Jennifer Coates and Dariush Mozaffarian,Nature Food,609.2800000000001,107,2,72,2,1,0,0,True,True,doaj,False,Open Access,False,True,https://doi.org/10.1038/s43016-022-00594-9
Simon George ANDERSON,The measurement of adult blood pressure and management of hypertension before elective surgery: Joint Guidelines from the Association of Anaesthetists of Great Britain and Ireland and the British Hypertension Society,2016,165,https://doi.org/10.1111/anae.13348,26776052,Andrew Hartle and T McCormack and J Carlisle and S Anderson and A Pichel and N Beckett and T Woodcock and Anthony Heagerty,Anaesthesia,192.52999999999972,247,0,2,1,7,0,0,True,True,doaj,False,Open Access,False,False,https://doi.org/10.1111/anae.13348
Simon George ANDERSON,"Global, regional, and national consumption of animal-source foods between 1990 and 2018: findings from the Global Dietary Database",2022,164,https://doi.org/10.1016/s2542-5196(21)00352-1,37117550,Victoria Miller and Julia Reedy and Frederick Cudhea and Jianyi Zhang and Peilin Shi and Josh Erndt-Marino and Jennifer Coates and Renata Micha and Patrick Webb and Dariush Mozaffarian and Pamela Abbott and Morteza Abdollahi and Parvin Abedi and Suhad Abumweis and Linda Adair and Mohannad Al Nsour and Nasser Al-Daghri and Nawal Al-Hamad and Suad Al-Hooti and Sameer Al-Zenki and Iftikhar Alam and Jemal H Ali and Eman Alissa and Simon Anderson and Karim Anzid and Carukshi Arambepola and Mustafa Arici and Joanne Arsenault and Renzo Asciak and Helene E Barbieri and Noël Barengo and Simon Barquera and Murat Bas and Wulf Becker and Sigrid Beer-Borst and Per Bergman and Lajos Biró and Sesikeran Boindala and Pascal Bovet and Debbie Bradshaw and Noriklil BI Bukhary and Kanitta Bundhamcharoen and Mauricio Caballero and Neville Calleja and Xia Cao and Mario Capanzana and Jan Carmikle and Katia Castetbon and Michelle Castro and Corazon Cerdena and Hsing-Yi Chang and Karen Charlton and Yu Chen and Mei F Chen and Shashi Chiplonkar and Yoonsu Cho and Khun-Aik Chuah and Simona Costanzo and Melanie Cowan and Albertino Damasceno and Saeed Dastgiri and Stefaan De Henauw and Karin DeRidder and Eric Ding and Rivera Dommarco and Rokiah Don and Charmaine Duante and Vesselka Duleva and Samuel Duran Aguero and Veena Ekbote and Jalila El Ati and Asmaa El Hamdouchi and Tatyana El-Kour and Alison Eldridge and Ibrahim Elmadfa and Alireza Esteghamati and Zohreh Etemad and Fariza Fadzil and Farshad Farzadfar and Anne Fernandez and Dulitha Fernando and Regina Fisberg and Simon Forsyth and Edna Gamboa-Delgado and Didier Garriguet and Jean-Michel Gaspoz and Dorothy Gauci and Marianne Geleijnse and Brahmam Ginnela and Giuseppe Grosso and Idris Guessous and Martin Gulliford and Ingibjorg Gunnarsdottir and Wilbur Hadden and Aida Hadziomeragic and Christian Haerpfer and Rubina Hakeem and Aminul Haque and Maryam Hashemian and Rajkumar Hemalatha and Sigrun Henjum and Hristo Hinkov and Zaiton Hjdaud and Daniel Hoffman and Beth Hopping and Anahita Houshiar-Rad and Yao-Te Hsieh and Shu-Yi Hung and Inge Huybrechts and Nahla C Hwalla and Hajah M Ibrahim and Nayu Ikeda and Daniel Illescas-Zarate and Manami Inoue and Chandrashekar Janakiram and Ranil Jayawardena and Rajesh Jeewon and Nattinee Jitnarin and Lars Johansson and Olof Jonsdottir and Ahvaz Jundishapur and Ola Kally and Mirnalini Kandiah and Tilakavati Karupaiah and Lital Keinan-Boker and Roya Kelishadi and Anuradha Khadilkar and Cho-il Kim and Eda Koksal and Jurgen Konig and Liisa Korkalo and Jeremy Koster and Irina Kovalskys and Anand Krishnan and Herculina Kruger and Rebecca Kuriyan-Raj and Sanghui Kweon and Carl Lachat and Yuen Lai and Pulani Lanerolle and Avula Laxmaiah and Catherine Leclercq and Meei-Shyuan Lee and Hae-Jeung Lee and Eva W Lemming and Yanping Li and Jaana Lindström and Annie Ling and Nur IL Liputo and Patricio Lopez-Jaramillo,The Lancet Planetary Health,142.24999999999983,177,0,2,0,0,1,0,True,True,doaj,False,Open Access,False,False,https://doi.org/10.1016/s2542-5196(21)00352-1
Simon George ANDERSON,Sleep and cognitive performance: cross-sectional associations in the UK Biobank,2017,163,https://doi.org/10.1016/j.sleep.2017.07.001,40018197,Simon D Kyle and Claire E Sexton and Bernd Feige and Annemarie I Luik and Jacqueline Lane and Richa Saxena and Simon G Anderson and David A Bechtold and William Dixon and Max A Little and David Ray and Dieter Riemann and Colin A Espie and Martin K Rutter and Kai Spiegelhalder,Sleep medicine,37.75,7,0,3,0,1,2,0,True,True,doaj,False,Open Access,False,False,https://doi.org/10.1016/j.sleep.2017.07.001
Simon George ANDERSON,Blood pressure and risk of vascular dementia: evidence from a primary care registry and a cohort study of transient ischemic attack and stroke,2016,156,https://doi.org/10.1016/j.accreview.2005.09.034,,Connor A Emdin and Peter M Rothwell and Gholamreza Salimi-Khorshidi and Amit Kiran and Nathalie Conrad and Thomas Callender and Ziyah Mehta and Sarah T Pendlebury and Simon G Anderson and Hamid Mohseni and Mark Woodward and Kazem Rahimi,Stroke,0.0,0,0,0,0,0,0,0,False,True,doaj,False,Open Access,False,False,https://doi.org/10.1016/j.accreview.2005.09.034
Simon George ANDERSON,Long‐term negative impact on quality of life in patients with successfully treated Cushing's disease,2004,151,https://doi.org/10.1111/j.1365-2265.2004.02118.x,15473878,Adrian H Heald and Sandip Ghosh and Stephanie Bray and Christine Gibson and Simon G Anderson and Helen Buckler and Helen L Fowler,Clinical Endocrinology,0.0,0,0,0,0,0,0,0,False,True,doaj,False,Open Access,False,False,https://doi.org/10.1111/j.1365-2265.2004.02118.x
Simon George ANDERSON,Insulin-like growth factor binding protein-2 (IGFBP-2) is a marker for the metabolic syndrome,2006,150,https://doi.org/10.1055/s-2006-924320,36970368,AH Heald and K Kaushal and KW Siddals and AS Rudenski and SG Anderson and JM Gibson,Experimental and Clinical Endocrinology & Diabetes,6.0,0,0,0,0,0,0,0,False,True,doaj,False,Open Access,False,False,https://doi.org/10.1055/s-2006-924320
Simon George ANDERSON,Incident type 2 diabetes attributable to suboptimal diet in 184 countries,2023,141,https://doi.org/10.1038/s41591-023-02278-8,37069363,Meghan O’hearn and Laura Lara-Castor and Frederick Cudhea and Victoria Miller and Julia Reedy and Peilin Shi and Jianyi Zhang and John B Wong and Christina D Economos and Renata Micha and Dariush Mozaffarian,Nature Medicine,2888.4220000000046,955,5,300,9,7,1,0,True,True,doaj,False,Open Access,False,False,https://doi.org/10.1038/s41591-023-02278-8
Simon George ANDERSON,"Hypertension in four African-origin populations: Current'Rule of Halves', quality of blood pressure control and attributable risk of cardiovascular disease",2001,141,https://doi.org/10.1097/00004872-200101000-00006,11204303,J Kennedy Cruickshank and Jean Claude Mbanya and Rainford Wilks and Beverley Balkau and Terrence Forrester and Simon G Anderson and Louise Mennen and Anne Forhan and Lisa Riste and Norma McFarlane-Anderson,Journal of Hypertension,3.0,0,0,0,0,0,0,0,False,True,doaj,False,Open Access,False,False,https://doi.org/10.1097/00004872-200101000-00006
Simon George ANDERSON,Lifestyle factors and the metabolic syndrome in Schizophrenia: a cross-sectional study,2017,136,https://doi.org/10.1186/s12991-017-0134-6,39669846,Adrian Heald and John Pendlebury and Simon Anderson and Vinesh Narayan and Mark Guy and Martin Gibson and Peter Haddad and Mark Livingston,Annals of general psychiatry,1.25,2,1,0,0,0,0,0,False,True,doaj,False,Open Access,False,False,https://doi.org/10.1186/s12991-017-0134-6
Simon George ANDERSON,Foot ulceration and its association with mortality in diabetes mellitus: a meta‐analysis,2020,130,https://doi.org/10.1111/dme.14151,39996539,S Saluja and SG Anderson and I Hambleton and H Shoo and M Livingston and EB Jude and M Lunt and G Dunn and AH Heald,N/A,66.25000000000003,94,0,1,0,0,0,0,True,True,doaj,False,Open Access,False,False,https://doi.org/10.1111/dme.14151
Simon George ANDERSON,"Access site practice and procedural outcomes in relation to clinical presentation in 439,947 patients undergoing percutaneous coronary intervention in the United Kingdom",2015,129,https://doi.org/10.1016/j.jcin.2014.06.026,25616814,Karim Ratib and Mamas A Mamas and Simon G Anderson and Gurbir Bhatia and Helen Routledge and Mark De Belder and Peter F Ludman and Douglas Fraser and James Nolan and British Cardiovascular Intervention Society and the National Institute for Cardiovascular Outcomes Research,JACC: Cardiovascular Interventions,7.7,8,0,0,0,0,0,0,False,True,doaj,False,Open Access,True,False,https://doi.org/10.1016/j.jcin.2014.06.026
Simon George ANDERSON,"Circulating cellular adhesion molecules ICAM-1, VCAM-1, P-and E-selectin in the prediction of cardiovascular disease in diabetes mellitus",2002,124,https://doi.org/10.1016/s0953-6205(02)00014-6,12020626,Edward B Jude and Jessica T Douglas and Simon G Anderson and Matthew J Young and Andrew JM Boulton,European journal of internal medicine,0.0,0,0,0,0,0,0,0,False,True,doaj,False,Open Access,False,False,https://doi.org/10.1016/s0953-6205(02)00014-6
Simon George ANDERSON,Plasma fatty acid composition as a predictor of arterial stiffness and mortality,2009,123,https://doi.org/10.1161/hypertensionaha.108.123885,19307467,Simon G Anderson and Thomas AB Sanders and J Kennedy Cruickshank,Hypertension,3.0,0,0,0,0,0,0,0,False,True,doaj,False,Open Access,False,False,https://doi.org/10.1161/hypertensionaha.108.123885
Simon George ANDERSON,"Diabetes in the Caribbean: results of a population survey from Spanish Town, Jamaica",1999,118,https://doi.org/10.1046/j.1464-5491.1999.00151.x,23240481,R Wilks and C Rotimi and F Bennett and N McFarlane‐Anderson and JS Kaufman and SG Anderson and RS Cooper and JK Cruickshank and Terrence Forrester,Diabetic Medicine,6.0,0,0,0,0,0,0,0,False,True,doaj,False,Open Access,False,False,https://doi.org/10.1046/j.1464-5491.1999.00151.x
Simon George ANDERSON,The potential role of cell adhesion molecules in the pathogenesis of diabetic neuropathy,1998,116,https://doi.org/10.1007/s001250050911,40420926,EB Jude and CA Abbott and MJ Young and SG Anderson and JT Douglas and AJM Boulton,Diabetologia,0.0,0,0,0,0,0,0,0,False,True,doaj,False,Open Access,False,False,https://doi.org/10.1007/s001250050911
Simon George ANDERSON,Physical activity and incidence of atrial fibrillation: a systematic review and meta-analysis,2014,110,https://doi.org/10.5935/2359-4802.20190055,40154976,Chun Shing Kwok and Simon G Anderson and Phyo K Myint and Mamas A Mamas and Yoon K Loke,N/A,2.35,4,0,0,0,0,0,0,False,True,doaj,False,Open Access,False,False,https://doi.org/10.5935/2359-4802.20190055
Simon George ANDERSON,BASELINE BLEEDING RISK AND ARTERIAL ACCESS SITE PRACTICE IN RELATION TO PROCEDURAL OUTCOMES FOLLOWING PERCUTANEOUS CORONARY INTERVENTION,2013,107,https://doi.org/10.1016/j.jacc.2013.08.771,25301457,Mamas Mamas and Simon G Anderson and Karim Ratib and Douglas G Fraser and Mark de Belder and Peter Ludman and James Nolan,Journal of the American College of Cardiology,12.85,13,0,0,0,0,0,0,False,True,doaj,False,Open Access,True,False,https://doi.org/10.1016/j.jacc.2013.08.771
Simon George ANDERSON,Phosphodiesterase-5 inhibitors and the heart: compound cardioprotection?,2018,105,https://doi.org/10.1136/heartjnl-2017-312865,29519873,David Charles Hutchings and Simon George Anderson and Jessica L Caldwell and Andrew W Trafford,N/A,80.25000000000003,88,0,3,0,4,1,0,True,True,doaj,False,Open Access,False,False,https://doi.org/10.1136/heartjnl-2017-312865
Simon George ANDERSON,"Usual blood pressure, atrial fibrillation and vascular risk: evidence from 4.3 million adults",2017,104,https://doi.org/10.1093/ije/dyw053,27143136,Connor A Emdin and Simon G Anderson and Gholamreza Salimi-Khorshidi and Mark Woodward and Stephen MacMahon and Terrence Dwyer and Kazem Rahimi,International journal of epidemiology,2.5,6,0,0,0,0,0,0,False,True,doaj,False,Open Access,False,False,https://doi.org/10.1093/ije/dyw053
Simon George ANDERSON,Phosphodiesterase type-5 inhibitor use in type 2 diabetes is associated with a reduction in all-cause mortality,2016,102,https://doi.org/10.1136/heartjnl-2015-309223,27465053,Simon G Anderson and David C Hutchings and Mark Woodward and Kazem Rahimi and Martin K Rutter and Mike Kirby and Geoff Hackett and Andrew W Trafford and Adrian H Heald,Heart,62.45,28,0,5,1,3,1,0,True,True,doaj,False,Open Access,False,False,https://doi.org/10.1136/heartjnl-2015-309223
Simon George ANDERSON,Impact of left ventricular function in relation to procedural outcomes following percutaneous coronary intervention: insights from the British Cardiovascular Intervention Society,2014,97,https://doi.org/10.1093/eurheartj/ehu303,25408308,Mamas A Mamas and Simon G Anderson and Peter D O'Kane and Bernard Keavney and James Nolan and Keith G Oldroyd and Divaka Perera and Simon Redwood and Azfar Zaman and Peter F Ludman and Mark A de Belder,European heart journal,0.5,1,0,0,0,0,0,0,False,True,doaj,False,Open Access,True,False,https://doi.org/10.1093/eurheartj/ehu303
Simon George ANDERSON,C-reactive protein and the insulin-like growth factor (IGF)-system in relation to risk of cardiovascular disease in different ethnic groups,2003,97,https://doi.org/10.1016/s0021-9150(03)00235-1,12957685,Adrian H Heald and Simon G Anderson and Fiona Ivison and Ian Laing and J Martin Gibson and Kennedy Cruickshank,Atherosclerosis,0.0,0,0,0,0,0,0,0,False,True,doaj,False,Open Access,False,False,https://doi.org/10.1016/s0021-9150(03)00235-1
